library/src/amd_detail/rocblaslt/src/Tensile/Logic/asm_full/gfx1201/GridBased/gfx1201_Cijk_Alik_Bljk_F8BS_BH_BiasSB_HAS_SABV_SAV_UserArgs.yaml
- {MinimumRequiredVersion: 4.33.0}
- gfx1201
- gfx1201
- [Device 73f0]
    SolutionIndex: 0
    SolutionNameMin: Cijk_Alik_Bljk_F8BS_BH_BiasSB_HAS_SABV_SAV_UserArgs_MT32x32x32_MI16x16x1_SN_GRVWA8_GRVWB8_GSU1_GSUC0_GSUWGMRR0_K1_MIWT1_1_SU4_SUM0_SUS256_WG32_4_1_WGM8_WGMXCC1_WGMXCCGn1
    SolutionIndex: 1
    SolutionNameMin: Cijk_Alik_Bljk_F8BS_BH_BiasSB_HAS_SABV_SAV_UserArgs_MT96x128x32_MI16x16x1_SN_GRVWA8_GRVWB8_GSU1_GSUC0_GSUWGMRR0_K1_MIWT6_2_SU4_SUM0_SUS256_WG16_8_1_WGM8_WGMXCC1_WGMXCCGn1
    SolutionIndex: 2
    SolutionNameMin: Cijk_Alik_Bljk_F8BS_BH_BiasSB_HAS_SABV_SAV_UserArgs_MT96x128x32_MI16x16x1_SN_GRVWA8_GRVWB8_GSU2_GSUC0_GSUWGMRR0_K1_MIWT3_4_SU4_SUM0_SUS256_WG32_4_1_WGM8_WGMXCC1_WGMXCCGn1
    SolutionIndex: 3
    SolutionNameMin: Cijk_Alik_Bljk_F8BS_BH_BiasSB_HAS_SABV_SAV_UserArgs_MT96x192x32_MI16x16x1_SN_GRVWA8_GRVWB8_GSU1_GSUC0_GSUWGMRR0_K1_MIWT3_6_SU4_SUM0_SUS256_WG32_4_1_WGM8_WGMXCC1_WGMXCCGn1
    SolutionIndex: 4
    SolutionNameMin: Cijk_Alik_Bljk_F8BS_BH_BiasSB_HAS_SABV_SAV_UserArgs_MT128x160x32_MI16x16x1_SN_GRVWA8_GRVWB8_GSU1_GSUC0_GSUWGMRR0_K1_MIWT4_5_SU4_SUM0_SUS256_WG32_4_1_WGM8_WGMXCC1_WGMXCCGn1
    SolutionIndex: 5
    SolutionNameMin: Cijk_Alik_Bljk_F8BS_BH_BiasSB_HAS_SABV_SAV_UserArgs_MT96x192x32_MI16x16x1_SN_GRVWA8_GRVWB8_GSU1_GSUC0_GSUWGMRR0_K1_MIWT6_3_SU4_SUM0_SUS256_WG16_8_1_WGM8_WGMXCC1_WGMXCCGn1
    SolutionIndex: 6
    SolutionNameMin: Cijk_Alik_Bljk_F8BS_BH_BiasSB_HAS_SABV_SAV_UserArgs_MT112x128x32_MI16x16x1_SN_GRVWA4_GRVWB8_GSU1_GSUC0_GSUWGMRR0_K1_MIWT7_2_SU4_SUM0_SUS256_WG16_8_1_WGM8_WGMXCC1_WGMXCCGn1
    SolutionIndex: 7
    SolutionNameMin: Cijk_Alik_Bljk_F8BS_BH_BiasSB_HAS_SABV_SAV_UserArgs_MT128x128x32_MI16x16x1_SN_GRVWA8_GRVWB8_GSU1_GSUC0_GSUWGMRR0_K1_MIWT8_2_SU4_SUM0_SUS256_WG16_8_1_WGM8_WGMXCC1_WGMXCCGn1
    SolutionIndex: 8
    SolutionNameMin: Cijk_Alik_Bljk_F8BS_BH_BiasSB_HAS_SABV_SAV_UserArgs_MT112x192x32_MI16x16x1_SN_GRVWA4_GRVWB8_GSU1_GSUC0_GSUWGMRR0_K1_MIWT7_3_SU4_SUM0_SUS256_WG16_8_1_WGM8_WGMXCC1_WGMXCCGn1
    SolutionIndex: 9
    SolutionNameMin: Cijk_Alik_Bljk_F8BS_BH_BiasSB_HAS_SABV_SAV_UserArgs_MT128x112x32_MI16x16x1_SN_GRVWA8_GRVWB4_GSU1_GSUC0_GSUWGMRR0_K1_MIWT2_7_SU4_SUM0_SUS256_WG64_2_1_WGM8_WGMXCC1_WGMXCCGn1
    SolutionIndex: 10
    SolutionNameMin: Cijk_Alik_Bljk_F8BS_BH_BiasSB_HAS_SABV_SAV_UserArgs_MT128x128x32_MI16x16x1_SN_GRVWA8_GRVWB8_GSU2_GSUC0_GSUWGMRR0_K1_MIWT2_8_SU4_SUM0_SUS256_WG64_2_1_WGM8_WGMXCC1_WGMXCCGn1
    SolutionIndex: 11
    SolutionNameMin: Cijk_Alik_Bljk_F8BS_BH_BiasSB_HAS_SABV_SAV_UserArgs_MT64x256x32_MI16x16x1_SN_GRVWA8_GRVWB8_GSU1_GSUC0_GSUWGMRR0_K1_MIWT1_16_SU4_SUM0_SUS256_WG64_2_1_WGM8_WGMXCC1_WGMXCCGn1
    SolutionIndex: 12
    SolutionNameMin: Cijk_Alik_Bljk_F8BS_BH_BiasSB_HAS_SABV_SAV_UserArgs_MT80x192x32_MI16x16x1_SN_GRVWA4_GRVWB8_GSU1_GSUC0_GSUWGMRR0_K1_MIWT5_3_SU4_SUM0_SUS256_WG16_8_1_WGM8_WGMXCC1_WGMXCCGn1
    SolutionIndex: 13
    SolutionNameMin: Cijk_Alik_Bljk_F8BS_BH_BiasSB_HAS_SABV_SAV_UserArgs_MT64x256x32_MI16x16x1_SN_GRVWA8_GRVWB8_GSU1_GSUC0_GSUWGMRR0_K1_MIWT4_4_SU4_SUM0_SUS256_WG16_8_1_WGM8_WGMXCC1_WGMXCCGn1
    SolutionIndex: 14
    SolutionNameMin: Cijk_Alik_Bljk_F8BS_BH_BiasSB_HAS_SABV_SAV_UserArgs_MT128x160x32_MI16x16x1_SN_GRVWA8_GRVWB8_GSU1_GSUC0_GSUWGMRR0_K1_MIWT2_10_SU4_SUM0_SUS256_WG64_2_1_WGM8_WGMXCC1_WGMXCCGn1
    SolutionIndex: 15
    SolutionNameMin: Cijk_Alik_Bljk_F8BS_BH_BiasSB_HAS_SABV_SAV_UserArgs_MT96x160x32_MI16x16x1_SN_GRVWA8_GRVWB8_GSU1_GSUC0_GSUWGMRR0_K1_MIWT3_5_SU4_SUM0_SUS256_WG32_4_1_WGM8_WGMXCC1_WGMXCCGn1
    SolutionIndex: 16
    SolutionNameMin: Cijk_Alik_Bljk_F8BS_BH_BiasSB_HAS_SABV_SAV_UserArgs_MT128x144x32_MI16x16x1_SN_GRVWA8_GRVWB4_GSU1_GSUC0_GSUWGMRR0_K1_MIWT2_9_SU4_SUM0_SUS256_WG64_2_1_WGM8_WGMXCC1_WGMXCCGn1
    SolutionIndex: 17
    SolutionNameMin: Cijk_Alik_Bljk_F8BS_BH_BiasSB_HAS_SABV_SAV_UserArgs_MT32x32x32_MI16x16x1_SN_GRVWA8_GRVWB8_GSU2_GSUC0_GSUWGMRR0_K1_MIWT1_1_SU4_SUM0_SUS256_WG32_4_1_WGM8_WGMXCC1_WGMXCCGn1
    SolutionIndex: 18
    SolutionNameMin: Cijk_Alik_Bljk_F8BS_BH_BiasSB_HAS_SABV_SAV_UserArgs_MT128x128x32_MI16x16x1_SN_GRVWA8_GRVWB8_GSU2_GSUC0_GSUWGMRR0_K1_MIWT8_2_SU4_SUM0_SUS256_WG16_8_1_WGM8_WGMXCC1_WGMXCCGn1
    SolutionIndex: 19
    SolutionNameMin: Cijk_Alik_Bljk_F8BS_BH_BiasSB_HAS_SABV_SAV_UserArgs_MT96x128x32_MI16x16x1_SN_GRVWA8_GRVWB8_GSU1_GSUC0_GSUWGMRR0_K1_MIWT3_4_SU4_SUM0_SUS256_WG32_4_1_WGM8_WGMXCC1_WGMXCCGn1
    SolutionIndex: 20
    SolutionNameMin: Cijk_Alik_Bljk_F8BS_BH_BiasSB_HAS_SABV_SAV_UserArgs_MT144x128x32_MI16x16x1_SN_GRVWA4_GRVWB8_GSU1_GSUC0_GSUWGMRR0_K1_MIWT9_2_SU4_SUM0_SUS256_WG16_8_1_WGM8_WGMXCC1_WGMXCCGn1
    SolutionIndex: 21
    SolutionNameMin: Cijk_Alik_Bljk_F8BS_BH_BiasSB_HAS_SABV_SAV_UserArgs_MT160x128x32_MI16x16x1_SN_GRVWA8_GRVWB8_GSU1_GSUC0_GSUWGMRR0_K1_MIWT5_4_SU4_SUM0_SUS256_WG32_4_1_WGM8_WGMXCC1_WGMXCCGn1
    SolutionIndex: 22
    SolutionNameMin: Cijk_Alik_Bljk_F8BS_BH_BiasSB_HAS_SABV_SAV_UserArgs_MT160x128x32_MI16x16x1_SN_GRVWA8_GRVWB8_GSU1_GSUC0_GSUWGMRR0_K1_MIWT10_2_SU4_SUM0_SUS256_WG16_8_1_WGM8_WGMXCC1_WGMXCCGn1
    SolutionIndex: 23
    SolutionNameMin: Cijk_Alik_Bljk_F8BS_BH_BiasSB_HAS_SABV_SAV_UserArgs_MT128x128x32_MI16x16x1_SN_GRVWA8_GRVWB8_GSU1_GSUC0_GSUWGMRR0_K1_MIWT2_8_SU4_SUM0_SUS256_WG64_2_1_WGM8_WGMXCC1_WGMXCCGn1
    SolutionIndex: 24
    SolutionNameMin: Cijk_Alik_Bljk_F8BS_BH_BiasSB_HAS_SABV_SAV_UserArgs_MT16x64x32_MI16x16x1_SN_GRVWA4_GRVWB8_GSU1_GSUC0_GSUWGMRR0_K1_MIWT1_1_SU4_SUM0_SUS256_WG16_8_1_WGM8_WGMXCC1_WGMXCCGn1
    SolutionIndex: 25
    SolutionNameMin: Cijk_Alik_Bljk_F8BS_BH_BiasSB_HAS_SABV_SAV_UserArgs_MT80x128x32_MI16x16x1_SN_GRVWA4_GRVWB8_GSU1_GSUC0_GSUWGMRR0_K1_MIWT5_2_SU4_SUM0_SUS256_WG16_8_1_WGM8_WGMXCC1_WGMXCCGn1
    SolutionIndex: 26
    SolutionNameMin: Cijk_Alik_Bljk_F8BS_BH_BiasSB_HAS_SABV_SAV_UserArgs_MT32x128x32_MI16x16x1_SN_GRVWA8_GRVWB8_GSU1_GSUC0_GSUWGMRR0_K1_MIWT2_2_SU4_SUM0_SUS256_WG16_8_1_WGM8_WGMXCC1_WGMXCCGn1
    SolutionIndex: 27
    SolutionNameMin: Cijk_Alik_Bljk_F8BS_BH_BiasSB_HAS_SABV_SAV_UserArgs_MT128x112x32_MI16x16x1_SN_GRVWA8_GRVWB4_GSU2_GSUC0_GSUWGMRR0_K1_MIWT2_7_SU4_SUM0_SUS256_WG64_2_1_WGM8_WGMXCC1_WGMXCCGn1
    SolutionIndex: 28
    SolutionNameMin: Cijk_Alik_Bljk_F8BS_BH_BiasSB_HAS_SABV_SAV_UserArgs_MT64x192x32_MI16x16x1_SN_GRVWA8_GRVWB8_GSU1_GSUC0_GSUWGMRR0_K1_MIWT1_12_SU4_SUM0_SUS256_WG64_2_1_WGM8_WGMXCC1_WGMXCCGn1
    SolutionIndex: 29
    SolutionNameMin: Cijk_Alik_Bljk_F8BS_BH_BiasSB_HAS_SABV_SAV_UserArgs_MT48x192x32_MI16x16x1_SN_GRVWA4_GRVWB8_GSU1_GSUC0_GSUWGMRR0_K1_MIWT3_3_SU4_SUM0_SUS256_WG16_8_1_WGM8_WGMXCC1_WGMXCCGn1
    SolutionIndex: 30
    SolutionNameMin: Cijk_Alik_Bljk_F8BS_BH_BiasSB_HAS_SABV_SAV_UserArgs_MT160x96x32_MI16x16x1_SN_GRVWA8_GRVWB8_GSU1_GSUC0_GSUWGMRR0_K1_MIWT5_3_SU4_SUM0_SUS256_WG32_4_1_WGM8_WGMXCC1_WGMXCCGn1
    SolutionIndex: 31
    SolutionNameMin: Cijk_Alik_Bljk_F8BS_BH_BiasSB_HAS_SABV_SAV_UserArgs_MT64x160x32_MI16x16x1_SN_GRVWA8_GRVWB8_GSU1_GSUC0_GSUWGMRR0_K1_MIWT2_5_SU4_SUM0_SUS256_WG32_4_1_WGM8_WGMXCC1_WGMXCCGn1
    SolutionIndex: 32
    SolutionNameMin: Cijk_Alik_Bljk_F8BS_BH_BiasSB_HAS_SABV_SAV_UserArgs_MT256x80x32_MI16x16x1_SN_GRVWA8_GRVWB4_GSU1_GSUC0_GSUWGMRR0_K1_MIWT4_5_SU4_SUM0_SUS256_WG64_2_1_WGM8_WGMXCC1_WGMXCCGn1
    SolutionIndex: 33
    SolutionNameMin: Cijk_Alik_Bljk_F8BS_BH_BiasSB_HAS_SABV_SAV_UserArgs_MT32x64x32_MI16x16x1_SN_GRVWA8_GRVWB8_GSU1_GSUC0_GSUWGMRR0_K1_MIWT2_1_SU4_SUM0_SUS256_WG16_8_1_WGM8_WGMXCC1_WGMXCCGn1
    SolutionIndex: 34
    SolutionNameMin: Cijk_Alik_Bljk_F8BS_BH_BiasSB_HAS_SABV_SAV_UserArgs_MT64x192x32_MI16x16x1_SN_GRVWA8_GRVWB8_GSU2_GSUC0_GSUWGMRR0_K1_MIWT4_3_SU4_SUM0_SUS256_WG16_8_1_WGM8_WGMXCC1_WGMXCCGn1
    SolutionIndex: 35
    SolutionNameMin: Cijk_Alik_Bljk_F8BS_BH_BiasSB_HAS_SABV_SAV_UserArgs_MT64x144x32_MI16x16x1_SN_GRVWA8_GRVWB4_GSU2_GSUC0_GSUWGMRR0_K1_MIWT1_9_SU4_SUM0_SUS256_WG64_2_1_WGM8_WGMXCC1_WGMXCCGn1
    SolutionIndex: 36
    SolutionNameMin: Cijk_Alik_Bljk_F8BS_BH_BiasSB_HAS_SABV_SAV_UserArgs_MT192x96x32_MI16x16x1_SN_GRVWA8_GRVWB8_GSU1_GSUC0_GSUWGMRR0_K1_MIWT6_3_SU4_SUM0_SUS256_WG32_4_1_WGM8_WGMXCC1_WGMXCCGn1
    SolutionIndex: 37
    SolutionNameMin: Cijk_Alik_Bljk_F8BS_BH_BiasSB_HAS_SABV_SAV_UserArgs_MT128x128x32_MI16x16x1_SN_GRVWA8_GRVWB8_GSU1_GSUC0_GSUWGMRR0_K1_MIWT4_4_SU4_SUM0_SUS256_WG32_4_1_WGM8_WGMXCC1_WGMXCCGn1
    SolutionIndex: 38
    SolutionNameMin: Cijk_Alik_Bljk_F8BS_BH_BiasSB_HAS_SABV_SAV_UserArgs_MT128x128x32_MI16x16x1_SN_GRVWA8_GRVWB8_GSU2_GSUC0_GSUWGMRR0_K1_MIWT4_4_SU4_SUM0_SUS256_WG32_4_1_WGM8_WGMXCC1_WGMXCCGn1
    SolutionIndex: 39
    SolutionNameMin: Cijk_Alik_Bljk_F8BS_BH_BiasSB_HAS_SABV_SAV_UserArgs_MT96x224x32_MI16x16x1_SN_GRVWA8_GRVWB8_GSU1_GSUC0_GSUWGMRR0_K1_MIWT3_7_SU4_SUM0_SUS256_WG32_4_1_WGM8_WGMXCC1_WGMXCCGn1
    SolutionIndex: 40
    SolutionNameMin: Cijk_Alik_Bljk_F8BS_BH_BiasSB_HAS_SABV_SAV_UserArgs_MT192x96x32_MI16x16x1_SN_GRVWA8_GRVWB8_GSU1_GSUC0_GSUWGMRR0_K1_MIWT3_6_SU4_SUM0_SUS256_WG64_2_1_WGM8_WGMXCC1_WGMXCCGn1
    SolutionIndex: 41
    SolutionNameMin: Cijk_Alik_Bljk_F8BS_BH_BiasSB_HAS_SABV_SAV_UserArgs_MT64x128x32_MI16x16x1_SN_GRVWA8_GRVWB8_GSU1_GSUC0_GSUWGMRR0_K1_MIWT4_2_SU4_SUM0_SUS256_WG16_8_1_WGM8_WGMXCC1_WGMXCCGn1
    SolutionIndex: 42
    SolutionNameMin: Cijk_Alik_Bljk_F8BS_BH_BiasSB_HAS_SABV_SAV_UserArgs_MT128x160x32_MI16x16x1_SN_GRVWA8_GRVWB8_GSU2_GSUC0_GSUWGMRR0_K1_MIWT4_5_SU4_SUM0_SUS256_WG32_4_1_WGM8_WGMXCC1_WGMXCCGn1
    SolutionIndex: 43
    SolutionNameMin: Cijk_Alik_Bljk_F8BS_BH_BiasSB_HAS_SABV_SAV_UserArgs_MT64x128x32_MI16x16x1_SN_GRVWA8_GRVWB8_GSU2_GSUC0_GSUWGMRR0_K1_MIWT2_4_SU4_SUM0_SUS256_WG32_4_1_WGM8_WGMXCC1_WGMXCCGn1
    SolutionIndex: 44
    SolutionNameMin: Cijk_Alik_Bljk_F8BS_BH_BiasSB_HAS_SABV_SAV_UserArgs_MT32x96x32_MI16x16x1_SN_GRVWA8_GRVWB8_GSU1_GSUC0_GSUWGMRR0_K1_MIWT1_3_SU4_SUM0_SUS256_WG32_4_1_WGM8_WGMXCC1_WGMXCCGn1
    SolutionIndex: 45
    SolutionNameMin: Cijk_Alik_Bljk_F8BS_BH_BiasSB_HAS_SABV_SAV_UserArgs_MT128x96x32_MI16x16x1_SN_GRVWA8_GRVWB8_GSU1_GSUC0_GSUWGMRR0_K1_MIWT2_6_SU4_SUM0_SUS256_WG64_2_1_WGM8_WGMXCC1_WGMXCCGn1
    SolutionIndex: 46
    SolutionNameMin: Cijk_Alik_Bljk_F8BS_BH_BiasSB_HAS_SABV_SAV_UserArgs_MT96x192x32_MI16x16x1_SN_GRVWA8_GRVWB8_GSU2_GSUC0_GSUWGMRR0_K1_MIWT3_6_SU4_SUM0_SUS256_WG32_4_1_WGM8_WGMXCC1_WGMXCCGn1
    SolutionIndex: 47
    SolutionNameMin: Cijk_Alik_Bljk_F8BS_BH_BiasSB_HAS_SABV_SAV_UserArgs_MT64x96x32_MI16x16x1_SN_GRVWA8_GRVWB8_GSU1_GSUC0_GSUWGMRR0_K1_MIWT2_3_SU4_SUM0_SUS256_WG32_4_1_WGM8_WGMXCC1_WGMXCCGn1
    SolutionIndex: 48
    SolutionNameMin: Cijk_Alik_Bljk_F8BS_BH_BiasSB_HAS_SABV_SAV_UserArgs_MT128x160x32_MI16x16x1_SN_GRVWA8_GRVWB8_GSU2_GSUC0_GSUWGMRR0_K1_MIWT2_10_SU4_SUM0_SUS256_WG64_2_1_WGM8_WGMXCC1_WGMXCCGn1
    SolutionIndex: 49
    SolutionNameMin: Cijk_Alik_Bljk_F8BS_BH_BiasSB_HAS_SABV_SAV_UserArgs_MT64x224x32_MI16x16x1_SN_GRVWA8_GRVWB8_GSU1_GSUC0_GSUWGMRR0_K1_MIWT2_7_SU4_SUM0_SUS256_WG32_4_1_WGM8_WGMXCC1_WGMXCCGn1
    SolutionIndex: 50
    SolutionNameMin: Cijk_Alik_Bljk_F8BS_BH_BiasSB_HAS_SABV_SAV_UserArgs_MT64x192x32_MI16x16x1_SN_GRVWA8_GRVWB8_GSU1_GSUC0_GSUWGMRR0_K1_MIWT2_6_SU4_SUM0_SUS256_WG32_4_1_WGM8_WGMXCC1_WGMXCCGn1
    SolutionIndex: 51
    SolutionNameMin: Cijk_Alik_Bljk_F8BS_BH_BiasSB_HAS_SABV_SAV_UserArgs_MT64x192x32_MI16x16x1_SN_GRVWA8_GRVWB8_GSU2_GSUC0_GSUWGMRR0_K1_MIWT2_6_SU4_SUM0_SUS256_WG32_4_1_WGM8_WGMXCC1_WGMXCCGn1
    SolutionIndex: 52
    SolutionNameMin: Cijk_Alik_Bljk_F8BS_BH_BiasSB_HAS_SABV_SAV_UserArgs_MT128x144x32_MI16x16x1_SN_GRVWA8_GRVWB4_GSU2_GSUC0_GSUWGMRR0_K1_MIWT2_9_SU4_SUM0_SUS256_WG64_2_1_WGM8_WGMXCC1_WGMXCCGn1
    SolutionIndex: 53
    SolutionNameMin: Cijk_Alik_Bljk_F8BS_BH_BiasSB_HAS_SABV_SAV_UserArgs_MT192x112x32_MI16x16x1_SN_GRVWA8_GRVWB4_GSU1_GSUC0_GSUWGMRR0_K1_MIWT3_7_SU4_SUM0_SUS256_WG64_2_1_WGM8_WGMXCC1_WGMXCCGn1
    SolutionIndex: 54
    SolutionNameMin: Cijk_Alik_Bljk_F8BS_BH_BiasSB_HAS_SABV_SAV_UserArgs_MT32x128x32_MI16x16x1_SN_GRVWA8_GRVWB8_GSU1_GSUC0_GSUWGMRR0_K1_MIWT1_4_SU4_SUM0_SUS256_WG32_4_1_WGM8_WGMXCC1_WGMXCCGn1
    SolutionIndex: 55
    SolutionNameMin: Cijk_Alik_Bljk_F8BS_BH_BiasSB_HAS_SABV_SAV_UserArgs_MT64x128x32_MI16x16x1_SN_GRVWA8_GRVWB8_GSU1_GSUC0_GSUWGMRR0_K1_MIWT1_8_SU4_SUM0_SUS256_WG64_2_1_WGM8_WGMXCC1_WGMXCCGn1
    SolutionIndex: 56
    SolutionNameMin: Cijk_Alik_Bljk_F8BS_BH_BiasSB_HAS_SABV_SAV_UserArgs_MT128x96x32_MI16x16x1_SN_GRVWA8_GRVWB8_GSU1_GSUC0_GSUWGMRR0_K1_MIWT4_3_SU4_SUM0_SUS256_WG32_4_1_WGM8_WGMXCC1_WGMXCCGn1
    SolutionIndex: 57
    SolutionNameMin: Cijk_Alik_Bljk_F8BS_BH_BiasSB_HAS_SABV_SAV_UserArgs_MT32x16x32_MI16x16x1_SN_GRVWA8_GRVWB8_GSU2_GSUC0_GSUWGMRR0_K1_MIWT1_1_SU4_SUM0_SUS256_WG32_2_1_WGM8_WGMXCC1_WGMXCCGn1
    SolutionIndex: 58
    SolutionNameMin: Cijk_Alik_Bljk_F8BS_BH_BiasSB_HAS_SABV_SAV_UserArgs_MT80x64x32_MI16x16x1_SN_GRVWA4_GRVWB8_GSU2_GSUC0_GSUWGMRR0_K1_MIWT5_1_SU4_SUM0_SUS256_WG16_8_1_WGM8_WGMXCC1_WGMXCCGn1
    SolutionIndex: 59
    SolutionNameMin: Cijk_Alik_Bljk_F8BS_BH_BiasSB_HAS_SABV_SAV_UserArgs_MT80x192x32_MI16x16x1_SN_GRVWA4_GRVWB8_GSU2_GSUC0_GSUWGMRR0_K1_MIWT5_3_SU4_SUM0_SUS256_WG16_8_1_WGM8_WGMXCC1_WGMXCCGn1
    SolutionIndex: 60
    SolutionNameMin: Cijk_Alik_Bljk_F8BS_BH_BiasSB_HAS_SABV_SAV_UserArgs_MT80x256x32_MI16x16x1_SN_GRVWA4_GRVWB8_GSU2_GSUC0_GSUWGMRR0_K1_MIWT5_4_SU4_SUM0_SUS256_WG16_8_1_WGM8_WGMXCC1_WGMXCCGn1
    SolutionIndex: 61
    SolutionNameMin: Cijk_Alik_Bljk_F8BS_BH_BiasSB_HAS_SABV_SAV_UserArgs_MT80x256x32_MI16x16x1_SN_GRVWA4_GRVWB8_GSU1_GSUC0_GSUWGMRR0_K1_MIWT5_4_SU4_SUM0_SUS256_WG16_8_1_WGM8_WGMXCC1_WGMXCCGn1
    SolutionIndex: 62
    SolutionNameMin: Cijk_Alik_Bljk_F8BS_BH_BiasSB_HAS_SABV_SAV_UserArgs_MT32x64x32_MI16x16x1_SN_GRVWA8_GRVWB8_GSU1_GSUC0_GSUWGMRR0_K1_MIWT1_2_SU4_SUM0_SUS256_WG32_4_1_WGM8_WGMXCC1_WGMXCCGn1
    SolutionIndex: 63
    SolutionNameMin: Cijk_Alik_Bljk_F8BS_BH_BiasSB_HAS_SABV_SAV_UserArgs_MT32x160x32_MI16x16x1_SN_GRVWA8_GRVWB8_GSU1_GSUC0_GSUWGMRR0_K1_MIWT1_5_SU4_SUM0_SUS256_WG32_4_1_WGM8_WGMXCC1_WGMXCCGn1
    SolutionIndex: 64
    SolutionNameMin: Cijk_Alik_Bljk_F8BS_BH_BiasSB_HAS_SABV_SAV_UserArgs_MT256x64x32_MI16x16x1_SN_GRVWA8_GRVWB8_GSU1_GSUC0_GSUWGMRR0_K1_MIWT8_2_SU4_SUM0_SUS256_WG32_4_1_WGM8_WGMXCC1_WGMXCCGn1
    SolutionIndex: 65
    SolutionNameMin: Cijk_Alik_Bljk_F8BS_BH_BiasSB_HAS_SABV_SAV_UserArgs_MT112x64x32_MI16x16x1_SN_GRVWA4_GRVWB8_GSU1_GSUC0_GSUWGMRR0_K1_MIWT7_1_SU4_SUM0_SUS256_WG16_8_1_WGM8_WGMXCC1_WGMXCCGn1
    SolutionIndex: 66
    SolutionNameMin: Cijk_Alik_Bljk_F8BS_BH_BiasSB_HAS_SABV_SAV_UserArgs_MT64x144x32_MI16x16x1_SN_GRVWA8_GRVWB4_GSU1_GSUC0_GSUWGMRR0_K1_MIWT1_9_SU4_SUM0_SUS256_WG64_2_1_WGM8_WGMXCC1_WGMXCCGn1
    SolutionIndex: 67
    SolutionNameMin: Cijk_Alik_Bljk_F8BS_BH_BiasSB_HAS_SABV_SAV_UserArgs_MT64x160x32_MI16x16x1_SN_GRVWA8_GRVWB8_GSU1_GSUC0_GSUWGMRR0_K1_MIWT1_10_SU4_SUM0_SUS256_WG64_2_1_WGM8_WGMXCC1_WGMXCCGn1
    SolutionIndex: 68
    SolutionNameMin: Cijk_Alik_Bljk_F8BS_BH_BiasSB_HAS_SABV_SAV_UserArgs_MT176x64x32_MI16x16x1_SN_GRVWA4_GRVWB8_GSU1_GSUC0_GSUWGMRR0_K1_MIWT11_1_SU4_SUM0_SUS256_WG16_8_1_WGM8_WGMXCC1_WGMXCCGn1
    SolutionIndex: 69
    SolutionNameMin: Cijk_Alik_Bljk_F8BS_BH_BiasSB_HAS_SABV_SAV_UserArgs_MT144x128x32_MI16x16x1_SN_GRVWA4_GRVWB8_GSU2_GSUC0_GSUWGMRR0_K1_MIWT9_2_SU4_SUM0_SUS256_WG16_8_1_WGM8_WGMXCC1_WGMXCCGn1
    SolutionIndex: 70
    SolutionNameMin: Cijk_Alik_Bljk_F8BS_BH_BiasSB_HAS_SABV_SAV_UserArgs_MT64x256x32_MI16x16x1_SN_GRVWA8_GRVWB8_GSU2_GSUC0_GSUWGMRR0_K1_MIWT4_4_SU4_SUM0_SUS256_WG16_8_1_WGM8_WGMXCC1_WGMXCCGn1
    SolutionIndex: 71
    SolutionNameMin: Cijk_Alik_Bljk_F8BS_BH_BiasSB_HAS_SABV_SAV_UserArgs_MT64x128x32_MI16x16x1_SN_GRVWA8_GRVWB8_GSU1_GSUC0_GSUWGMRR0_K1_MIWT2_4_SU4_SUM0_SUS256_WG32_4_1_WGM8_WGMXCC1_WGMXCCGn1
    SolutionIndex: 72
    SolutionNameMin: Cijk_Alik_Bljk_F8BS_BH_BiasSB_HAS_SABV_SAV_UserArgs_MT64x80x32_MI16x16x1_SN_GRVWA8_GRVWB4_GSU2_GSUC0_GSUWGMRR0_K1_MIWT1_5_SU4_SUM0_SUS256_WG64_2_1_WGM8_WGMXCC1_WGMXCCGn1
    SolutionIndex: 73
    SolutionNameMin: Cijk_Alik_Bljk_F8BS_BH_BiasSB_HAS_SABV_SAV_UserArgs_MT64x176x32_MI16x16x1_SN_GRVWA8_GRVWB4_GSU1_GSUC0_GSUWGMRR0_K1_MIWT1_11_SU4_SUM0_SUS256_WG64_2_1_WGM8_WGMXCC1_WGMXCCGn1
    SolutionIndex: 74
    SolutionNameMin: Cijk_Alik_Bljk_F8BS_BH_BiasSB_HAS_SABV_SAV_UserArgs_MT128x64x32_MI16x16x1_SN_GRVWA8_GRVWB8_GSU1_GSUC0_GSUWGMRR0_K1_MIWT2_4_SU4_SUM0_SUS256_WG64_2_1_WGM8_WGMXCC1_WGMXCCGn1
    SolutionIndex: 75
    SolutionNameMin: Cijk_Alik_Bljk_F8BS_BH_BiasSB_HAS_SABV_SAV_UserArgs_MT128x16x32_MI16x16x1_SN_GRVWA8_GRVWB4_GSU1_GSUC0_GSUWGMRR0_K1_MIWT2_1_SU4_SUM0_SUS256_WG64_2_1_WGM8_WGMXCC1_WGMXCCGn1
    SolutionIndex: 76
    SolutionNameMin: Cijk_Alik_Bljk_F8BS_BH_BiasSB_HAS_SABV_SAV_UserArgs_MT160x64x32_MI16x16x1_SN_GRVWA8_GRVWB8_GSU1_GSUC0_GSUWGMRR0_K1_MIWT5_2_SU4_SUM0_SUS256_WG32_4_1_WGM8_WGMXCC1_WGMXCCGn1
    SolutionIndex: 77
    SolutionNameMin: Cijk_Alik_Bljk_F8BS_BH_BiasSB_HAS_SABV_SAV_UserArgs_MT128x64x32_MI16x16x1_SN_GRVWA8_GRVWB8_GSU2_GSUC0_GSUWGMRR0_K1_MIWT8_1_SU4_SUM0_SUS256_WG16_8_1_WGM8_WGMXCC1_WGMXCCGn1
    SolutionIndex: 78
    SolutionNameMin: Cijk_Alik_Bljk_F8BS_BH_BiasSB_HAS_SABV_SAV_UserArgs_MT208x64x32_MI16x16x1_SN_GRVWA4_GRVWB8_GSU1_GSUC0_GSUWGMRR0_K1_MIWT13_1_SU4_SUM0_SUS256_WG16_8_1_WGM8_WGMXCC1_WGMXCCGn1
    SolutionIndex: 79
    SolutionNameMin: Cijk_Alik_Bljk_F8BS_BH_BiasSB_HAS_SABV_SAV_UserArgs_MT64x112x32_MI16x16x1_SN_GRVWA8_GRVWB4_GSU1_GSUC0_GSUWGMRR0_K1_MIWT1_7_SU4_SUM0_SUS256_WG64_2_1_WGM8_WGMXCC1_WGMXCCGn1
    SolutionIndex: 80
    SolutionNameMin: Cijk_Alik_Bljk_F8BS_BH_BiasSB_HAS_SABV_SAV_UserArgs_MT224x64x32_MI16x16x1_SN_GRVWA8_GRVWB8_GSU1_GSUC0_GSUWGMRR0_K1_MIWT7_2_SU4_SUM0_SUS256_WG32_4_1_WGM8_WGMXCC1_WGMXCCGn1
    SolutionIndex: 81
    SolutionNameMin: Cijk_Alik_Bljk_F8BS_BH_BiasSB_HAS_SABV_SAV_UserArgs_MT64x80x32_MI16x16x1_SN_GRVWA8_GRVWB4_GSU1_GSUC0_GSUWGMRR0_K1_MIWT1_5_SU4_SUM0_SUS256_WG64_2_1_WGM8_WGMXCC1_WGMXCCGn1
    SolutionIndex: 82
    SolutionNameMin: Cijk_Alik_Bljk_F8BS_BH_BiasSB_HAS_SABV_SAV_UserArgs_MT128x80x32_MI16x16x1_SN_GRVWA8_GRVWB4_GSU1_GSUC0_GSUWGMRR0_K1_MIWT2_5_SU4_SUM0_SUS256_WG64_2_1_WGM8_WGMXCC1_WGMXCCGn1
    SolutionIndex: 83
    SolutionNameMin: Cijk_Alik_Bljk_F8BS_BH_BiasSB_HAS_SABV_SAV_UserArgs_MT48x64x32_MI16x16x1_SN_GRVWA4_GRVWB8_GSU2_GSUC0_GSUWGMRR0_K1_MIWT3_1_SU4_SUM0_SUS256_WG16_8_1_WGM8_WGMXCC1_WGMXCCGn1
    SolutionIndex: 84
    SolutionNameMin: Cijk_Alik_Bljk_F8BS_BH_BiasSB_HAS_SABV_SAV_UserArgs_MT48x128x32_MI16x16x1_SN_GRVWA4_GRVWB8_GSU2_GSUC0_GSUWGMRR0_K1_MIWT3_2_SU4_SUM0_SUS256_WG16_8_1_WGM8_WGMXCC1_WGMXCCGn1
    SolutionIndex: 85
    SolutionNameMin: Cijk_Alik_Bljk_F8BS_BH_BiasSB_HAS_SABV_SAV_UserArgs_MT128x96x32_MI16x16x1_SN_GRVWA8_GRVWB8_GSU2_GSUC0_GSUWGMRR0_K1_MIWT4_3_SU4_SUM0_SUS256_WG32_4_1_WGM8_WGMXCC1_WGMXCCGn1
    SolutionIndex: 86
    SolutionNameMin: Cijk_Alik_Bljk_F8BS_BH_BiasSB_HAS_SABV_SAV_UserArgs_MT48x256x32_MI16x16x1_SN_GRVWA4_GRVWB8_GSU2_GSUC0_GSUWGMRR0_K1_MIWT3_4_SU4_SUM0_SUS256_WG16_8_1_WGM8_WGMXCC1_WGMXCCGn1
    SolutionIndex: 87
    SolutionNameMin: Cijk_Alik_Bljk_F8BS_BH_BiasSB_HAS_SABV_SAV_UserArgs_MT96x160x32_MI16x16x1_SN_GRVWA8_GRVWB8_GSU2_GSUC0_GSUWGMRR0_K1_MIWT3_5_SU4_SUM0_SUS256_WG32_4_1_WGM8_WGMXCC1_WGMXCCGn1
    SolutionIndex: 88
    SolutionNameMin: Cijk_Alik_Bljk_F8BS_BH_BiasSB_HAS_SABV_SAV_UserArgs_MT96x96x32_MI16x16x1_SN_GRVWA8_GRVWB8_GSU1_GSUC0_GSUWGMRR0_K1_MIWT3_3_SU4_SUM0_SUS256_WG32_4_1_WGM8_WGMXCC1_WGMXCCGn1
    SolutionIndex: 89
    SolutionNameMin: Cijk_Alik_Bljk_F8BS_BH_BiasSB_HAS_SABV_SAV_UserArgs_MT128x64x32_MI16x16x1_SN_GRVWA8_GRVWB8_GSU1_GSUC0_GSUWGMRR0_K1_MIWT8_1_SU4_SUM0_SUS256_WG16_8_1_WGM8_WGMXCC1_WGMXCCGn1
    SolutionIndex: 90
    SolutionNameMin: Cijk_Alik_Bljk_F8BS_BH_BiasSB_HAS_SABV_SAV_UserArgs_MT128x64x32_MI16x16x1_SN_GRVWA8_GRVWB8_GSU2_GSUC0_GSUWGMRR0_K1_MIWT4_2_SU4_SUM0_SUS256_WG32_4_1_WGM8_WGMXCC1_WGMXCCGn1
    SolutionIndex: 91
    SolutionNameMin: Cijk_Alik_Bljk_F8BS_BH_BiasSB_HAS_SABV_SAV_UserArgs_MT192x80x32_MI16x16x1_SN_GRVWA8_GRVWB4_GSU1_GSUC0_GSUWGMRR0_K1_MIWT3_5_SU4_SUM0_SUS256_WG64_2_1_WGM8_WGMXCC1_WGMXCCGn1
    SolutionIndex: 92
    SolutionNameMin: Cijk_Alik_Bljk_F8BS_BH_BiasSB_HAS_SABV_SAV_UserArgs_MT224x96x32_MI16x16x1_SN_GRVWA8_GRVWB8_GSU2_GSUC0_GSUWGMRR0_K1_MIWT7_3_SU4_SUM0_SUS256_WG32_4_1_WGM8_WGMXCC1_WGMXCCGn1
    SolutionIndex: 93
    SolutionNameMin: Cijk_Alik_Bljk_F8BS_BH_BiasSB_HAS_SABV_SAV_UserArgs_MT160x128x32_MI16x16x1_SN_GRVWA8_GRVWB8_GSU2_GSUC0_GSUWGMRR0_K1_MIWT5_4_SU4_SUM0_SUS256_WG32_4_1_WGM8_WGMXCC1_WGMXCCGn1
    SolutionIndex: 94
    SolutionNameMin: Cijk_Alik_Bljk_F8BS_BH_BiasSB_HAS_SABV_SAV_UserArgs_MT48x64x32_MI16x16x1_SN_GRVWA4_GRVWB8_GSU1_GSUC0_GSUWGMRR0_K1_MIWT3_1_SU4_SUM0_SUS256_WG16_8_1_WGM8_WGMXCC1_WGMXCCGn1
    SolutionIndex: 95
    SolutionNameMin: Cijk_Alik_Bljk_F8BS_BH_BiasSB_HAS_SABV_SAV_UserArgs_MT128x48x32_MI16x16x1_SN_GRVWA8_GRVWB4_GSU1_GSUC0_GSUWGMRR0_K1_MIWT2_3_SU4_SUM0_SUS256_WG64_2_1_WGM8_WGMXCC1_WGMXCCGn1
    SolutionIndex: 96
    SolutionNameMin: Cijk_Alik_Bljk_F8BS_BH_BiasSB_HAS_SABV_SAV_UserArgs_MT224x96x32_MI16x16x1_SN_GRVWA8_GRVWB8_GSU1_GSUC0_GSUWGMRR0_K1_MIWT7_3_SU4_SUM0_SUS256_WG32_4_1_WGM8_WGMXCC1_WGMXCCGn1
    SolutionIndex: 97
    SolutionNameMin: Cijk_Alik_Bljk_F8BS_BH_BiasSB_HAS_SABV_SAV_UserArgs_MT64x128x32_MI16x16x1_SN_GRVWA8_GRVWB8_GSU2_GSUC0_GSUWGMRR0_K1_MIWT4_2_SU4_SUM0_SUS256_WG16_8_1_WGM8_WGMXCC1_WGMXCCGn1
    SolutionIndex: 98
    SolutionNameMin: Cijk_Alik_Bljk_F8BS_BH_BiasSB_HAS_SABV_SAV_UserArgs_MT64x96x32_MI16x16x1_SN_GRVWA8_GRVWB8_GSU1_GSUC0_GSUWGMRR0_K1_MIWT1_6_SU4_SUM0_SUS256_WG64_2_1_WGM8_WGMXCC1_WGMXCCGn1
    SolutionIndex: 99
    SolutionNameMin: Cijk_Alik_Bljk_F8BS_BH_BiasSB_HAS_SABV_SAV_UserArgs_MT192x64x32_MI16x16x1_SN_GRVWA8_GRVWB8_GSU1_GSUC0_GSUWGMRR0_K1_MIWT3_4_SU4_SUM0_SUS256_WG64_2_1_WGM8_WGMXCC1_WGMXCCGn1
    SolutionIndex: 100
    SolutionNameMin: Cijk_Alik_Bljk_F8BS_BH_BiasSB_HAS_SABV_SAV_UserArgs_MT112x128x32_MI16x16x1_SN_GRVWA4_GRVWB8_GSU2_GSUC0_GSUWGMRR0_K1_MIWT7_2_SU4_SUM0_SUS256_WG16_8_1_WGM8_WGMXCC1_WGMXCCGn1
    SolutionIndex: 101
    SolutionNameMin: Cijk_Alik_Bljk_F8BS_BH_BiasSB_HAS_SABV_SAV_UserArgs_MT80x128x32_MI16x16x1_SN_GRVWA4_GRVWB8_GSU2_GSUC0_GSUWGMRR0_K1_MIWT5_2_SU4_SUM0_SUS256_WG16_8_1_WGM8_WGMXCC1_WGMXCCGn1
    SolutionIndex: 102
    SolutionNameMin: Cijk_Alik_Bljk_F8BS_BH_BiasSB_HAS_SABV_SAV_UserArgs_MT64x64x32_MI16x16x1_SN_GRVWA8_GRVWB8_GSU1_GSUC0_GSUWGMRR0_K1_MIWT2_2_SU4_SUM0_SUS256_WG32_4_1_WGM8_WGMXCC1_WGMXCCGn1
    SolutionIndex: 103
    SolutionNameMin: Cijk_Alik_Bljk_F8BS_BH_BiasSB_HAS_SABV_SAV_UserArgs_MT16x16x32_MI16x16x1_SN_GRVWA8_GRVWB8_GSU1_GSUC0_GSUWGMRR0_K1_MIWT1_1_SU4_SUM0_SUS256_WG16_2_1_WGM8_WGMXCC1_WGMXCCGn1
    SolutionIndex: 104
    SolutionNameMin: Cijk_Alik_Bljk_F8BS_BH_BiasSB_HAS_SABV_SAV_UserArgs_MT256x64x32_MI16x16x1_SN_GRVWA8_GRVWB8_GSU1_GSUC0_GSUWGMRR0_K1_MIWT4_4_SU4_SUM0_SUS256_WG64_2_1_WGM8_WGMXCC1_WGMXCCGn1
    SolutionIndex: 105
    SolutionNameMin: Cijk_Alik_Bljk_F8BS_BH_BiasSB_HAS_SABV_SAV_UserArgs_MT80x64x32_MI16x16x1_SN_GRVWA4_GRVWB8_GSU1_GSUC0_GSUWGMRR0_K1_MIWT5_1_SU4_SUM0_SUS256_WG16_8_1_WGM8_WGMXCC1_WGMXCCGn1
    SolutionIndex: 106
    SolutionNameMin: Cijk_Alik_Bljk_F8BS_BH_BiasSB_HAS_SABV_SAV_UserArgs_MT128x64x32_MI16x16x1_SN_GRVWA8_GRVWB8_GSU1_GSUC0_GSUWGMRR0_K1_MIWT4_2_SU4_SUM0_SUS256_WG32_4_1_WGM8_WGMXCC1_WGMXCCGn1
    SolutionIndex: 107
    SolutionNameMin: Cijk_Alik_Bljk_F8BS_BH_BiasSB_HAS_SABV_SAV_UserArgs_MT64x256x32_MI16x16x1_SN_GRVWA8_GRVWB8_GSU1_GSUC0_GSUWGMRR0_K1_MIWT2_8_SU4_SUM0_SUS256_WG32_4_1_WGM8_WGMXCC1_WGMXCCGn1
    SolutionIndex: 108
    SolutionNameMin: Cijk_Alik_Bljk_F8BS_BH_BiasSB_HAS_SABV_SAV_UserArgs_MT64x64x32_MI16x16x1_SN_GRVWA8_GRVWB8_GSU1_GSUC0_GSUWGMRR0_K1_MIWT4_1_SU4_SUM0_SUS256_WG16_8_1_WGM8_WGMXCC1_WGMXCCGn1
    SolutionIndex: 109
    SolutionNameMin: Cijk_Alik_Bljk_F8BS_BH_BiasSB_HAS_SABV_SAV_UserArgs_MT64x224x32_MI16x16x1_SN_GRVWA8_GRVWB8_GSU1_GSUC0_GSUWGMRR0_K1_MIWT1_14_SU4_SUM0_SUS256_WG64_2_1_WGM8_WGMXCC1_WGMXCCGn1
    SolutionIndex: 110
    SolutionNameMin: Cijk_Alik_Bljk_F8BS_BH_BiasSB_HAS_SABV_SAV_UserArgs_MT192x64x32_MI16x16x1_SN_GRVWA8_GRVWB8_GSU1_GSUC0_GSUWGMRR0_K1_MIWT12_1_SU4_SUM0_SUS256_WG16_8_1_WGM8_WGMXCC1_WGMXCCGn1
    SolutionIndex: 111
    SolutionNameMin: Cijk_Alik_Bljk_F8BS_BH_BiasSB_HAS_SABV_SAV_UserArgs_MT144x64x32_MI16x16x1_SN_GRVWA4_GRVWB8_GSU1_GSUC0_GSUWGMRR0_K1_MIWT9_1_SU4_SUM0_SUS256_WG16_8_1_WGM8_WGMXCC1_WGMXCCGn1
    SolutionIndex: 112
    SolutionNameMin: Cijk_Alik_Bljk_F8BS_BH_BiasSB_HAS_SABV_SAV_UserArgs_MT224x64x32_MI16x16x1_SN_GRVWA8_GRVWB8_GSU1_GSUC0_GSUWGMRR0_K1_MIWT14_1_SU4_SUM0_SUS256_WG16_8_1_WGM8_WGMXCC1_WGMXCCGn1
    SolutionIndex: 113
    SolutionNameMin: Cijk_Alik_Bljk_F8BS_BH_BiasSB_HAS_SABV_SAV_UserArgs_MT64x208x32_MI16x16x1_SN_GRVWA8_GRVWB4_GSU1_GSUC0_GSUWGMRR0_K1_MIWT1_13_SU4_SUM0_SUS256_WG64_2_1_WGM8_WGMXCC1_WGMXCCGn1
    SolutionIndex: 114
    SolutionNameMin: Cijk_Alik_Bljk_F8BS_BH_BiasSB_HAS_SABV_SAV_UserArgs_MT240x64x32_MI16x16x1_SN_GRVWA4_GRVWB8_GSU1_GSUC0_GSUWGMRR0_K1_MIWT15_1_SU4_SUM0_SUS256_WG16_8_1_WGM8_WGMXCC1_WGMXCCGn1
    SolutionIndex: 115
    SolutionNameMin: Cijk_Alik_Bljk_F8BS_BH_BiasSB_HAS_SABV_SAV_UserArgs_MT160x64x32_MI16x16x1_SN_GRVWA8_GRVWB8_GSU1_GSUC0_GSUWGMRR0_K1_MIWT10_1_SU4_SUM0_SUS256_WG16_8_1_WGM8_WGMXCC1_WGMXCCGn1
    SolutionIndex: 116
    SolutionNameMin: Cijk_Alik_Bljk_F8BS_BH_BiasSB_HAS_SABV_SAV_UserArgs_MT64x192x32_MI16x16x1_SN_GRVWA8_GRVWB8_GSU1_GSUC0_GSUWGMRR0_K1_MIWT4_3_SU4_SUM0_SUS256_WG16_8_1_WGM8_WGMXCC1_WGMXCCGn1
    SolutionIndex: 117
    SolutionNameMin: Cijk_Alik_Bljk_F8BS_BH_BiasSB_HAS_SABV_SAV_UserArgs_MT16x16x32_MI16x16x1_SN_GRVWA8_GRVWB8_GSU2_GSUC0_GSUWGMRR0_K1_MIWT1_1_SU4_SUM0_SUS256_WG16_2_1_WGM8_WGMXCC1_WGMXCCGn1
    SolutionIndex: 118
    SolutionNameMin: Cijk_Alik_Bljk_F8BS_BH_BiasSB_HAS_SABV_SAV_UserArgs_MT32x128x32_MI16x16x1_SN_GRVWA8_GRVWB8_GSU2_GSUC0_GSUWGMRR0_K1_MIWT2_2_SU4_SUM0_SUS256_WG16_8_1_WGM8_WGMXCC1_WGMXCCGn1
    SolutionIndex: 119
    SolutionNameMin: Cijk_Alik_Bljk_F8BS_BH_BiasSB_HAS_SABV_SAV_UserArgs_MT112x192x32_MI16x16x1_SN_GRVWA4_GRVWB8_GSU2_GSUC0_GSUWGMRR0_K1_MIWT7_3_SU4_SUM0_SUS256_WG16_8_1_WGM8_WGMXCC1_WGMXCCGn1
    SolutionIndex: 120
    SolutionNameMin: Cijk_Alik_Bljk_F8BS_BH_BiasSB_HAS_SABV_SAV_UserArgs_MT160x96x32_MI16x16x1_SN_GRVWA8_GRVWB8_GSU2_GSUC0_GSUWGMRR0_K1_MIWT5_3_SU4_SUM0_SUS256_WG32_4_1_WGM8_WGMXCC1_WGMXCCGn1
- - - [2048, 256, 1, 1536]
    - [62, 28.49]
  - - [2048, 1, 1, 1536]
    - [0, 0.19]
  - - [17920, 256, 1, 1536]
    - [7, 46.47]
  - - [17920, 1, 1, 1536]
    - [75, 0.9]
  - - [1536, 256, 1, 8960]
    - [84, 50.9]
  - - [1536, 1, 1, 8960]
    - [17, 0.39]
  - - [1536, 256, 1, 1536]
    - [33, 23.72]
  - - [1536, 1, 1, 1536]
    - [0, 0.15]
  - - [6144, 1, 1, 4096]
    - [0, 0.74]
  - - [6144, 256, 1, 4096]
    - [1, 57.04]
  - - [6144, 512, 1, 4096]
    - [2, 58.46]
  - - [6144, 768, 1, 4096]
    - [3, 65.92]
  - - [6144, 1024, 1, 4096]
    - [1, 61.05]
  - - [6144, 1280, 1, 4096]
    - [4, 65.73]
  - - [6144, 1536, 1, 4096]
    - [5, 63.23]
  - - [6144, 1792, 1, 4096]
    - [6, 65.47]
  - - [6144, 2048, 1, 4096]
    - [7, 64.87]
  - - [6144, 2304, 1, 4096]
    - [6, 65.55]
  - - [6144, 2560, 1, 4096]
    - [7, 64.46]
  - - [6144, 2816, 1, 4096]
    - [6, 66.39]
  - - [6144, 3072, 1, 4096]
    - [8, 64.9]
  - - [6144, 3328, 1, 4096]
    - [9, 65.6]
  - - [6144, 3584, 1, 4096]
    - [6, 66.45]
  - - [6144, 3840, 1, 4096]
    - [6, 66.7]
  - - [6144, 4096, 1, 4096]
    - [6, 68.42]
  - - [4096, 1, 1, 4096]
    - [0, 0.56]
  - - [4096, 256, 1, 4096]
    - [10, 57.44]
  - - [4096, 512, 1, 4096]
    - [11, 64.38]
  - - [4096, 768, 1, 4096]
    - [12, 59.69]
  - - [4096, 1024, 1, 4096]
    - [13, 63.85]
  - - [4096, 1280, 1, 4096]
    - [14, 64.69]
  - - [4096, 1536, 1, 4096]
    - [15, 62.15]
  - - [4096, 1792, 1, 4096]
    - [8, 65.72]
  - - [4096, 2048, 1, 4096]
    - [5, 62.0]
  - - [4096, 2304, 1, 4096]
    - [16, 62.5]
  - - [4096, 2560, 1, 4096]
    - [7, 64.18]
  - - [4096, 2816, 1, 4096]
    - [15, 64.44]
  - - [4096, 3072, 1, 4096]
    - [8, 64.39]
  - - [4096, 3328, 1, 4096]
    - [9, 64.35]
  - - [4096, 3584, 1, 4096]
    - [6, 64.44]
  - - [4096, 3840, 1, 4096]
    - [7, 65.85]
  - - [4096, 4096, 1, 4096]
    - [6, 64.17]
  - - [4096, 1, 1, 14336]
    - [17, 1.04]
  - - [4096, 256, 1, 14336]
    - [18, 73.56]
  - - [4096, 512, 1, 14336]
    - [19, 75.45]
  - - [4096, 768, 1, 14336]
    - [12, 71.13]
  - - [4096, 1024, 1, 14336]
    - [20, 76.95]
  - - [4096, 1280, 1, 14336]
    - [14, 74.27]
  - - [4096, 1536, 1, 14336]
    - [20, 73.89]
  - - [4096, 1792, 1, 14336]
    - [21, 74.88]
  - - [4096, 2048, 1, 14336]
    - [20, 73.77]
  - - [4096, 2304, 1, 14336]
    - [22, 74.68]
  - - [4096, 2560, 1, 14336]
    - [23, 75.04]
  - - [4096, 2816, 1, 14336]
    - [16, 74.48]
  - - [4096, 3072, 1, 14336]
    - [21, 77.33]
  - - [4096, 3328, 1, 14336]
    - [20, 76.03]
  - - [4096, 3584, 1, 14336]
    - [22, 76.69]
  - - [4096, 3840, 1, 14336]
    - [8, 75.01]
  - - [4096, 4096, 1, 14336]
    - [21, 70.25]
  - - [28672, 1, 1, 4096]
    - [24, 0.43]
  - - [28672, 256, 1, 4096]
    - [25, 52.66]
  - - [28672, 512, 1, 4096]
    - [6, 64.13]
  - - [28672, 768, 1, 4096]
    - [6, 66.12]
  - - [28672, 1024, 1, 4096]
    - [6, 66.24]
  - - [28672, 1280, 1, 4096]
    - [14, 37.48]
  - - [28672, 1536, 1, 4096]
    - [3, 41.37]
  - - [28672, 1792, 1, 4096]
    - [7, 44.28]
  - - [28672, 2048, 1, 4096]
    - [7, 44.01]
  - - [28672, 2304, 1, 4096]
    - [9, 45.7]
  - - [28672, 2560, 1, 4096]
    - [15, 46.15]
  - - [28672, 2816, 1, 4096]
    - [4, 47.97]
  - - [28672, 3072, 1, 4096]
    - [22, 48.49]
  - - [28672, 3328, 1, 4096]
    - [9, 49.33]
  - - [28672, 3584, 1, 4096]
    - [9, 50.1]
  - - [28672, 3840, 1, 4096]
    - [7, 51.93]
  - - [28672, 4096, 1, 4096]
    - [4, 52.21]
  - - [6144, 128, 1, 4096]
    - [26, 48.47]
  - - [6144, 384, 1, 4096]
    - [3, 56.97]
  - - [6144, 640, 1, 4096]
    - [27, 42.84]
  - - [6144, 896, 1, 4096]
    - [15, 49.31]
  - - [6144, 1152, 1, 4096]
    - [28, 45.61]
  - - [6144, 1408, 1, 4096]
    - [29, 42.91]
  - - [6144, 1664, 1, 4096]
    - [16, 42.8]
  - - [6144, 1920, 1, 4096]
    - [22, 48.97]
  - - [6144, 2176, 1, 4096]
    - [30, 56.19]
  - - [6144, 2432, 1, 4096]
    - [30, 56.16]
  - - [6144, 2688, 1, 4096]
    - [31, 51.42]
  - - [6144, 2944, 1, 4096]
    - [32, 47.14]
  - - [6144, 3200, 1, 4096]
    - [23, 49.71]
  - - [6144, 3456, 1, 4096]
    - [9, 58.95]
  - - [6144, 3712, 1, 4096]
    - [30, 48.25]
  - - [6144, 3968, 1, 4096]
    - [15, 47.18]
  - - [4096, 128, 1, 4096]
    - [33, 43.41]
  - - [4096, 384, 1, 4096]
    - [3, 49.54]
  - - [4096, 640, 1, 4096]
    - [34, 41.52]
  - - [4096, 896, 1, 4096]
    - [35, 42.82]
  - - [4096, 1152, 1, 4096]
    - [22, 52.01]
  - - [4096, 1408, 1, 4096]
    - [6, 50.96]
  - - [4096, 1664, 1, 4096]
    - [16, 58.15]
  - - [4096, 1920, 1, 4096]
    - [36, 50.25]
  - - [4096, 2176, 1, 4096]
    - [37, 38.84]
  - - [4096, 2432, 1, 4096]
    - [38, 38.94]
  - - [4096, 2688, 1, 4096]
    - [19, 44.61]
  - - [4096, 2944, 1, 4096]
    - [39, 48.05]
  - - [4096, 3200, 1, 4096]
    - [40, 47.83]
  - - [4096, 3456, 1, 4096]
    - [39, 55.96]
  - - [4096, 3712, 1, 4096]
    - [41, 49.27]
  - - [4096, 3968, 1, 4096]
    - [22, 51.7]
  - - [4096, 128, 1, 14336]
    - [26, 53.27]
  - - [4096, 384, 1, 14336]
    - [5, 58.42]
  - - [4096, 640, 1, 14336]
    - [42, 67.05]
  - - [4096, 896, 1, 14336]
    - [43, 46.67]
  - - [4096, 1152, 1, 14336]
    - [31, 54.03]
  - - [4096, 1408, 1, 14336]
    - [40, 51.89]
  - - [4096, 1664, 1, 14336]
    - [8, 64.41]
  - - [4096, 1920, 1, 14336]
    - [20, 60.69]
  - - [4096, 2176, 1, 14336]
    - [14, 60.37]
  - - [4096, 2432, 1, 14336]
    - [6, 59.56]
  - - [4096, 2688, 1, 14336]
    - [23, 58.83]
  - - [4096, 2944, 1, 14336]
    - [7, 57.86]
  - - [4096, 3200, 1, 14336]
    - [14, 60.12]
  - - [4096, 3456, 1, 14336]
    - [21, 59.82]
  - - [4096, 3712, 1, 14336]
    - [21, 63.5]
  - - [4096, 3968, 1, 14336]
    - [4, 59.71]
  - - [28672, 128, 1, 4096]
    - [44, 28.85]
  - - [28672, 384, 1, 4096]
    - [31, 46.44]
  - - [28672, 640, 1, 4096]
    - [21, 49.85]
  - - [28672, 896, 1, 4096]
    - [7, 49.67]
  - - [28672, 1152, 1, 4096]
    - [5, 45.56]
  - - [28672, 1408, 1, 4096]
    - [45, 48.77]
  - - [28672, 1664, 1, 4096]
    - [6, 38.28]
  - - [28672, 1920, 1, 4096]
    - [30, 40.21]
  - - [28672, 2176, 1, 4096]
    - [6, 39.94]
  - - [28672, 2432, 1, 4096]
    - [8, 40.22]
  - - [28672, 2688, 1, 4096]
    - [23, 42.96]
  - - [28672, 2944, 1, 4096]
    - [5, 43.65]
  - - [28672, 3200, 1, 4096]
    - [8, 45.1]
  - - [28672, 3456, 1, 4096]
    - [9, 46.65]
  - - [28672, 3712, 1, 4096]
    - [21, 48.04]
  - - [28672, 3968, 1, 4096]
    - [22, 47.0]
  - - [6144, 64, 1, 4096]
    - [24, 34.2]
  - - [6144, 192, 1, 4096]
    - [46, 56.21]
  - - [6144, 320, 1, 4096]
    - [31, 60.1]
  - - [6144, 448, 1, 4096]
    - [39, 62.34]
  - - [6144, 576, 1, 4096]
    - [46, 57.26]
  - - [6144, 704, 1, 4096]
    - [3, 62.59]
  - - [6144, 832, 1, 4096]
    - [39, 63.09]
  - - [6144, 960, 1, 4096]
    - [13, 60.02]
  - - [6144, 1088, 1, 4096]
    - [16, 61.4]
  - - [6144, 1216, 1, 4096]
    - [4, 63.31]
  - - [6144, 1344, 1, 4096]
    - [20, 61.14]
  - - [6144, 1472, 1, 4096]
    - [3, 63.43]
  - - [6144, 1600, 1, 4096]
    - [15, 63.45]
  - - [6144, 1728, 1, 4096]
    - [8, 65.3]
  - - [6144, 1856, 1, 4096]
    - [15, 63.65]
  - - [6144, 1984, 1, 4096]
    - [8, 62.82]
  - - [6144, 2112, 1, 4096]
    - [8, 64.43]
  - - [6144, 2240, 1, 4096]
    - [6, 65.08]
  - - [6144, 2368, 1, 4096]
    - [6, 63.94]
  - - [6144, 2496, 1, 4096]
    - [8, 65.35]
  - - [6144, 2624, 1, 4096]
    - [6, 63.8]
  - - [6144, 2752, 1, 4096]
    - [6, 64.86]
  - - [6144, 2880, 1, 4096]
    - [6, 66.07]
  - - [6144, 3008, 1, 4096]
    - [8, 65.32]
  - - [6144, 3136, 1, 4096]
    - [6, 65.03]
  - - [6144, 3264, 1, 4096]
    - [7, 66.86]
  - - [6144, 3392, 1, 4096]
    - [6, 66.36]
  - - [6144, 3520, 1, 4096]
    - [6, 65.87]
  - - [6144, 3648, 1, 4096]
    - [6, 66.92]
  - - [6144, 3776, 1, 4096]
    - [7, 66.52]
  - - [6144, 3904, 1, 4096]
    - [6, 66.91]
  - - [6144, 4032, 1, 4096]
    - [6, 69.36]
  - - [4096, 64, 1, 4096]
    - [0, 29.48]
  - - [4096, 192, 1, 4096]
    - [47, 50.32]
  - - [4096, 320, 1, 4096]
    - [48, 59.0]
  - - [4096, 448, 1, 4096]
    - [49, 61.32]
  - - [4096, 576, 1, 4096]
    - [16, 61.65]
  - - [4096, 704, 1, 4096]
    - [50, 56.55]
  - - [4096, 832, 1, 4096]
    - [49, 57.95]
  - - [4096, 960, 1, 4096]
    - [13, 60.98]
  - - [4096, 1088, 1, 4096]
    - [16, 59.03]
  - - [4096, 1216, 1, 4096]
    - [14, 62.43]
  - - [4096, 1344, 1, 4096]
    - [19, 56.97]
  - - [4096, 1472, 1, 4096]
    - [5, 60.13]
  - - [4096, 1600, 1, 4096]
    - [15, 61.77]
  - - [4096, 1728, 1, 4096]
    - [15, 65.27]
  - - [4096, 1856, 1, 4096]
    - [8, 64.38]
  - - [4096, 1984, 1, 4096]
    - [3, 62.79]
  - - [4096, 2112, 1, 4096]
    - [3, 64.27]
  - - [4096, 2240, 1, 4096]
    - [15, 64.47]
  - - [4096, 2368, 1, 4096]
    - [8, 63.61]
  - - [4096, 2496, 1, 4096]
    - [8, 66.12]
  - - [4096, 2624, 1, 4096]
    - [6, 63.19]
  - - [4096, 2752, 1, 4096]
    - [20, 63.02]
  - - [4096, 2880, 1, 4096]
    - [15, 64.52]
  - - [4096, 3008, 1, 4096]
    - [7, 64.22]
  - - [4096, 3136, 1, 4096]
    - [8, 65.58]
  - - [4096, 3264, 1, 4096]
    - [8, 66.18]
  - - [4096, 3392, 1, 4096]
    - [6, 64.77]
  - - [4096, 3520, 1, 4096]
    - [6, 65.87]
  - - [4096, 3648, 1, 4096]
    - [21, 64.75]
  - - [4096, 3776, 1, 4096]
    - [8, 65.49]
  - - [4096, 3904, 1, 4096]
    - [6, 63.66]
  - - [4096, 4032, 1, 4096]
    - [15, 64.49]
  - - [4096, 64, 1, 14336]
    - [0, 36.48]
  - - [4096, 192, 1, 14336]
    - [51, 66.08]
  - - [4096, 320, 1, 14336]
    - [42, 76.72]
  - - [4096, 448, 1, 14336]
    - [13, 72.5]
  - - [4096, 576, 1, 14336]
    - [16, 76.33]
  - - [4096, 704, 1, 14336]
    - [12, 66.81]
  - - [4096, 832, 1, 14336]
    - [52, 67.5]
  - - [4096, 960, 1, 14336]
    - [20, 73.8]
  - - [4096, 1088, 1, 14336]
    - [16, 73.52]
  - - [4096, 1216, 1, 14336]
    - [4, 74.23]
  - - [4096, 1344, 1, 14336]
    - [20, 67.82]
  - - [4096, 1472, 1, 14336]
    - [20, 71.75]
  - - [4096, 1600, 1, 14336]
    - [20, 75.43]
  - - [4096, 1728, 1, 14336]
    - [16, 74.48]
  - - [4096, 1856, 1, 14336]
    - [8, 74.25]
  - - [4096, 1984, 1, 14336]
    - [20, 72.42]
  - - [4096, 2112, 1, 14336]
    - [20, 73.9]
  - - [4096, 2240, 1, 14336]
    - [16, 73.43]
  - - [4096, 2368, 1, 14336]
    - [21, 75.02]
  - - [4096, 2496, 1, 14336]
    - [53, 75.02]
  - - [4096, 2624, 1, 14336]
    - [20, 74.67]
  - - [4096, 2752, 1, 14336]
    - [20, 75.19]
  - - [4096, 2880, 1, 14336]
    - [21, 74.99]
  - - [4096, 3008, 1, 14336]
    - [21, 76.12]
  - - [4096, 3136, 1, 14336]
    - [20, 74.11]
  - - [4096, 3264, 1, 14336]
    - [8, 76.48]
  - - [4096, 3392, 1, 14336]
    - [16, 74.21]
  - - [4096, 3520, 1, 14336]
    - [22, 75.82]
  - - [4096, 3648, 1, 14336]
    - [4, 74.55]
  - - [4096, 3776, 1, 14336]
    - [53, 75.57]
  - - [4096, 3904, 1, 14336]
    - [4, 71.98]
  - - [4096, 4032, 1, 14336]
    - [4, 71.78]
  - - [28672, 64, 1, 4096]
    - [24, 21.92]
  - - [28672, 192, 1, 4096]
    - [12, 47.66]
  - - [28672, 320, 1, 4096]
    - [15, 55.69]
  - - [28672, 448, 1, 4096]
    - [39, 60.98]
  - - [28672, 576, 1, 4096]
    - [8, 65.7]
  - - [28672, 704, 1, 4096]
    - [6, 62.69]
  - - [28672, 832, 1, 4096]
    - [7, 64.88]
  - - [28672, 960, 1, 4096]
    - [6, 66.09]
  - - [28672, 1088, 1, 4096]
    - [30, 61.96]
  - - [28672, 1216, 1, 4096]
    - [15, 60.86]
  - - [28672, 1344, 1, 4096]
    - [9, 38.68]
  - - [28672, 1472, 1, 4096]
    - [39, 39.55]
  - - [28672, 1600, 1, 4096]
    - [14, 39.99]
  - - [28672, 1728, 1, 4096]
    - [39, 41.19]
  - - [28672, 1856, 1, 4096]
    - [23, 43.61]
  - - [28672, 1984, 1, 4096]
    - [19, 41.86]
  - - [28672, 2112, 1, 4096]
    - [16, 42.27]
  - - [28672, 2240, 1, 4096]
    - [45, 46.7]
  - - [28672, 2368, 1, 4096]
    - [23, 46.14]
  - - [28672, 2496, 1, 4096]
    - [7, 47.8]
  - - [28672, 2624, 1, 4096]
    - [21, 47.48]
  - - [28672, 2752, 1, 4096]
    - [19, 45.82]
  - - [28672, 2880, 1, 4096]
    - [7, 48.78]
  - - [28672, 3008, 1, 4096]
    - [9, 49.64]
  - - [28672, 3136, 1, 4096]
    - [15, 48.95]
  - - [28672, 3264, 1, 4096]
    - [15, 49.32]
  - - [28672, 3392, 1, 4096]
    - [23, 49.69]
  - - [28672, 3520, 1, 4096]
    - [14, 49.45]
  - - [28672, 3648, 1, 4096]
    - [37, 51.44]
  - - [28672, 3776, 1, 4096]
    - [22, 50.93]
  - - [28672, 3904, 1, 4096]
    - [9, 51.92]
  - - [28672, 4032, 1, 4096]
    - [7, 52.72]
  - - [8192, 1, 1, 7168]
    - [0, 1.15]
  - - [8192, 128, 1, 7168]
    - [26, 59.47]
  - - [8192, 256, 1, 7168]
    - [19, 70.5]
  - - [8192, 384, 1, 7168]
    - [6, 64.52]
  - - [8192, 512, 1, 7168]
    - [20, 68.36]
  - - [8192, 640, 1, 7168]
    - [14, 69.86]
  - - [8192, 768, 1, 7168]
    - [3, 67.76]
  - - [8192, 896, 1, 7168]
    - [8, 67.76]
  - - [8192, 1024, 1, 7168]
    - [16, 65.01]
  - - [8192, 1152, 1, 7168]
    - [16, 69.16]
  - - [8192, 1280, 1, 7168]
    - [14, 70.29]
  - - [8192, 1408, 1, 7168]
    - [20, 68.84]
  - - [8192, 1536, 1, 7168]
    - [22, 70.61]
  - - [8192, 1664, 1, 7168]
    - [20, 69.66]
  - - [8192, 1792, 1, 7168]
    - [22, 70.71]
  - - [8192, 1920, 1, 7168]
    - [8, 71.54]
  - - [8192, 2048, 1, 7168]
    - [21, 69.73]
  - - [8192, 2176, 1, 7168]
    - [21, 70.35]
  - - [8192, 2304, 1, 7168]
    - [8, 71.72]
  - - [8192, 2432, 1, 7168]
    - [22, 70.08]
  - - [8192, 2560, 1, 7168]
    - [20, 70.49]
  - - [8192, 2688, 1, 7168]
    - [21, 69.68]
  - - [8192, 2816, 1, 7168]
    - [20, 70.41]
  - - [8192, 2944, 1, 7168]
    - [8, 69.59]
  - - [8192, 3072, 1, 7168]
    - [37, 69.67]
  - - [8192, 3200, 1, 7168]
    - [4, 65.59]
  - - [8192, 3328, 1, 7168]
    - [53, 68.26]
  - - [8192, 3456, 1, 7168]
    - [22, 66.02]
  - - [8192, 3584, 1, 7168]
    - [21, 66.44]
  - - [8192, 3712, 1, 7168]
    - [15, 66.65]
  - - [8192, 3840, 1, 7168]
    - [4, 67.14]
  - - [8192, 3968, 1, 7168]
    - [22, 67.44]
  - - [8192, 4096, 1, 7168]
    - [21, 63.99]
  - - [8192, 1, 1, 2048]
    - [0, 0.65]
  - - [8192, 128, 1, 2048]
    - [54, 44.45]
  - - [8192, 256, 1, 2048]
    - [55, 53.16]
  - - [8192, 384, 1, 2048]
    - [45, 57.64]
  - - [8192, 512, 1, 2048]
    - [41, 56.17]
  - - [8192, 640, 1, 2048]
    - [31, 57.66]
  - - [8192, 768, 1, 2048]
    - [45, 58.71]
  - - [8192, 896, 1, 2048]
    - [9, 59.81]
  - - [8192, 1024, 1, 2048]
    - [19, 61.27]
  - - [8192, 1152, 1, 2048]
    - [6, 60.84]
  - - [8192, 1280, 1, 2048]
    - [6, 62.69]
  - - [8192, 1408, 1, 2048]
    - [1, 62.32]
  - - [8192, 1536, 1, 2048]
    - [6, 61.46]
  - - [8192, 1664, 1, 2048]
    - [6, 62.19]
  - - [8192, 1792, 1, 2048]
    - [19, 60.58]
  - - [8192, 1920, 1, 2048]
    - [56, 60.09]
  - - [8192, 2048, 1, 2048]
    - [9, 59.15]
  - - [8192, 2176, 1, 2048]
    - [19, 59.37]
  - - [8192, 2304, 1, 2048]
    - [19, 60.19]
  - - [8192, 2432, 1, 2048]
    - [19, 59.38]
  - - [8192, 2560, 1, 2048]
    - [19, 61.14]
  - - [8192, 2688, 1, 2048]
    - [45, 60.8]
  - - [8192, 2816, 1, 2048]
    - [19, 60.98]
  - - [8192, 2944, 1, 2048]
    - [45, 61.29]
  - - [8192, 3072, 1, 2048]
    - [9, 59.97]
  - - [8192, 3200, 1, 2048]
    - [9, 60.9]
  - - [8192, 3328, 1, 2048]
    - [19, 61.45]
  - - [8192, 3456, 1, 2048]
    - [19, 61.36]
  - - [8192, 3584, 1, 2048]
    - [19, 62.14]
  - - [8192, 3712, 1, 2048]
    - [19, 62.33]
  - - [8192, 3840, 1, 2048]
    - [19, 61.74]
  - - [8192, 3968, 1, 2048]
    - [19, 62.86]
  - - [8192, 4096, 1, 2048]
    - [19, 62.72]
  - - [2560, 1, 1, 8192]
    - [57, 0.51]
  - - [2560, 128, 1, 8192]
    - [58, 41.33]
  - - [2560, 256, 1, 8192]
    - [58, 56.44]
  - - [2560, 384, 1, 8192]
    - [59, 66.85]
  - - [2560, 512, 1, 8192]
    - [60, 73.82]
  - - [2560, 640, 1, 8192]
    - [12, 64.42]
  - - [2560, 768, 1, 8192]
    - [12, 76.98]
  - - [2560, 896, 1, 8192]
    - [61, 69.48]
  - - [2560, 1024, 1, 8192]
    - [61, 80.28]
  - - [2560, 1152, 1, 8192]
    - [59, 56.2]
  - - [2560, 1280, 1, 8192]
    - [52, 59.32]
  - - [2560, 1408, 1, 8192]
    - [12, 59.15]
  - - [2560, 1536, 1, 8192]
    - [12, 61.65]
  - - [2560, 1664, 1, 8192]
    - [8, 62.95]
  - - [2560, 1792, 1, 8192]
    - [20, 60.09]
  - - [2560, 1920, 1, 8192]
    - [8, 65.23]
  - - [2560, 2048, 1, 8192]
    - [8, 64.4]
  - - [2560, 2176, 1, 8192]
    - [12, 60.18]
  - - [2560, 2304, 1, 8192]
    - [12, 59.78]
  - - [2560, 2432, 1, 8192]
    - [20, 63.99]
  - - [2560, 2560, 1, 8192]
    - [16, 65.7]
  - - [2560, 2688, 1, 8192]
    - [16, 62.7]
  - - [2560, 2816, 1, 8192]
    - [8, 59.56]
  - - [2560, 2944, 1, 8192]
    - [16, 59.93]
  - - [2560, 3072, 1, 8192]
    - [20, 57.69]
  - - [2560, 3200, 1, 8192]
    - [20, 59.84]
  - - [2560, 3328, 1, 8192]
    - [16, 61.74]
  - - [2560, 3456, 1, 8192]
    - [16, 58.77]
  - - [2560, 3584, 1, 8192]
    - [16, 62.51]
  - - [2560, 3712, 1, 8192]
    - [16, 57.46]
  - - [2560, 3840, 1, 8192]
    - [20, 58.52]
  - - [2560, 3968, 1, 8192]
    - [20, 57.23]
  - - [2560, 4096, 1, 8192]
    - [16, 59.56]
  - - [14336, 1, 1, 8192]
    - [24, 0.45]
  - - [14336, 128, 1, 8192]
    - [29, 34.99]
  - - [14336, 256, 1, 8192]
    - [12, 47.3]
  - - [14336, 384, 1, 8192]
    - [8, 59.99]
  - - [14336, 512, 1, 8192]
    - [61, 60.19]
  - - [14336, 640, 1, 8192]
    - [8, 60.63]
  - - [14336, 768, 1, 8192]
    - [8, 66.35]
  - - [14336, 896, 1, 8192]
    - [20, 60.27]
  - - [14336, 1024, 1, 8192]
    - [16, 63.75]
  - - [14336, 1152, 1, 8192]
    - [16, 65.44]
  - - [14336, 1280, 1, 8192]
    - [20, 62.41]
  - - [14336, 1408, 1, 8192]
    - [16, 59.96]
  - - [14336, 1536, 1, 8192]
    - [20, 59.06]
  - - [14336, 1664, 1, 8192]
    - [20, 58.42]
  - - [14336, 1792, 1, 8192]
    - [16, 58.52]
  - - [14336, 1920, 1, 8192]
    - [20, 57.87]
  - - [14336, 2048, 1, 8192]
    - [20, 57.99]
  - - [14336, 2176, 1, 8192]
    - [16, 57.49]
  - - [14336, 2304, 1, 8192]
    - [16, 59.65]
  - - [14336, 2432, 1, 8192]
    - [53, 55.82]
  - - [14336, 2560, 1, 8192]
    - [20, 45.4]
  - - [14336, 2688, 1, 8192]
    - [53, 44.17]
  - - [14336, 2816, 1, 8192]
    - [20, 44.15]
  - - [14336, 2944, 1, 8192]
    - [20, 45.12]
  - - [14336, 3072, 1, 8192]
    - [16, 47.09]
  - - [14336, 3200, 1, 8192]
    - [53, 46.44]
  - - [14336, 3328, 1, 8192]
    - [53, 47.65]
  - - [14336, 3456, 1, 8192]
    - [7, 47.29]
  - - [14336, 3584, 1, 8192]
    - [20, 49.28]
  - - [14336, 3712, 1, 8192]
    - [4, 47.49]
  - - [14336, 3840, 1, 8192]
    - [53, 50.38]
  - - [14336, 3968, 1, 8192]
    - [53, 49.17]
  - - [14336, 4096, 1, 8192]
    - [21, 50.14]
  - - [2048, 128, 1, 1536]
    - [33, 18.53]
  - - [2048, 384, 1, 1536]
    - [44, 32.45]
  - - [2048, 512, 1, 1536]
    - [54, 35.67]
  - - [2048, 640, 1, 1536]
    - [63, 38.2]
  - - [2048, 768, 1, 1536]
    - [12, 33.23]
  - - [2048, 896, 1, 1536]
    - [50, 31.43]
  - - [2048, 1024, 1, 1536]
    - [64, 39.45]
  - - [2048, 1152, 1, 1536]
    - [65, 33.53]
  - - [2048, 1280, 1, 1536]
    - [42, 38.77]
  - - [2048, 1408, 1, 1536]
    - [66, 38.5]
  - - [2048, 1536, 1, 1536]
    - [10, 37.17]
  - - [2048, 1664, 1, 1536]
    - [67, 41.79]
  - - [2048, 1792, 1, 1536]
    - [41, 43.82]
  - - [2048, 1920, 1, 1536]
    - [29, 38.85]
  - - [2048, 2048, 1, 1536]
    - [31, 44.0]
  - - [2048, 2176, 1, 1536]
    - [68, 38.13]
  - - [2048, 2304, 1, 1536]
    - [69, 37.48]
  - - [2048, 2432, 1, 1536]
    - [45, 45.76]
  - - [2048, 2560, 1, 1536]
    - [15, 41.51]
  - - [2048, 2688, 1, 1536]
    - [70, 34.41]
  - - [2048, 2816, 1, 1536]
    - [71, 43.14]
  - - [2048, 2944, 1, 1536]
    - [6, 48.89]
  - - [2048, 3072, 1, 1536]
    - [9, 23.49]
  - - [2048, 3200, 1, 1536]
    - [72, 26.4]
  - - [2048, 3328, 1, 1536]
    - [37, 44.78]
  - - [2048, 3456, 1, 1536]
    - [6, 47.22]
  - - [2048, 3584, 1, 1536]
    - [31, 45.62]
  - - [2048, 3712, 1, 1536]
    - [73, 37.99]
  - - [2048, 3840, 1, 1536]
    - [74, 42.23]
  - - [2048, 3968, 1, 1536]
    - [71, 43.96]
  - - [2048, 4096, 1, 1536]
    - [19, 23.13]
  - - [17920, 128, 1, 1536]
    - [25, 43.35]
  - - [17920, 384, 1, 1536]
    - [76, 40.68]
  - - [17920, 512, 1, 1536]
    - [77, 25.06]
  - - [17920, 640, 1, 1536]
    - [23, 40.97]
  - - [17920, 768, 1, 1536]
    - [6, 24.22]
  - - [17920, 896, 1, 1536]
    - [16, 38.43]
  - - [17920, 1024, 1, 1536]
    - [45, 48.06]
  - - [17920, 1152, 1, 1536]
    - [67, 29.92]
  - - [17920, 1280, 1, 1536]
    - [78, 38.62]
  - - [17920, 1408, 1, 1536]
    - [53, 33.8]
  - - [17920, 1536, 1, 1536]
    - [79, 31.38]
  - - [17920, 1664, 1, 1536]
    - [80, 35.57]
  - - [17920, 1792, 1, 1536]
    - [76, 45.2]
  - - [17920, 1920, 1, 1536]
    - [31, 40.42]
  - - [17920, 2048, 1, 1536]
    - [56, 44.09]
  - - [17920, 2176, 1, 1536]
    - [8, 39.76]
  - - [17920, 2304, 1, 1536]
    - [15, 38.26]
  - - [17920, 2432, 1, 1536]
    - [81, 22.35]
  - - [17920, 2560, 1, 1536]
    - [19, 22.82]
  - - [17920, 2688, 1, 1536]
    - [82, 22.6]
  - - [17920, 2816, 1, 1536]
    - [74, 22.12]
  - - [17920, 2944, 1, 1536]
    - [7, 23.75]
  - - [17920, 3072, 1, 1536]
    - [9, 25.35]
  - - [17920, 3200, 1, 1536]
    - [74, 23.16]
  - - [17920, 3328, 1, 1536]
    - [67, 25.67]
  - - [17920, 3456, 1, 1536]
    - [67, 26.62]
  - - [17920, 3584, 1, 1536]
    - [7, 25.3]
  - - [17920, 3712, 1, 1536]
    - [19, 26.13]
  - - [17920, 3840, 1, 1536]
    - [9, 25.65]
  - - [17920, 3968, 1, 1536]
    - [7, 25.42]
  - - [17920, 4096, 1, 1536]
    - [19, 28.72]
  - - [1536, 128, 1, 8960]
    - [83, 35.75]
  - - [1536, 384, 1, 8960]
    - [85, 60.76]
  - - [1536, 512, 1, 8960]
    - [86, 63.3]
  - - [1536, 640, 1, 8960]
    - [87, 65.84]
  - - [1536, 768, 1, 8960]
    - [88, 69.46]
  - - [1536, 896, 1, 8960]
    - [49, 64.44]
  - - [1536, 1024, 1, 8960]
    - [37, 66.78]
  - - [1536, 1152, 1, 8960]
    - [19, 69.36]
  - - [1536, 1280, 1, 8960]
    - [71, 64.07]
  - - [1536, 1408, 1, 8960]
    - [82, 63.98]
  - - [1536, 1536, 1, 8960]
    - [15, 70.15]
  - - [1536, 1664, 1, 8960]
    - [45, 66.39]
  - - [1536, 1792, 1, 8960]
    - [19, 68.94]
  - - [1536, 1920, 1, 8960]
    - [81, 50.71]
  - - [1536, 2048, 1, 8960]
    - [80, 52.0]
  - - [1536, 2176, 1, 8960]
    - [64, 57.19]
  - - [1536, 2304, 1, 8960]
    - [46, 67.63]
  - - [1536, 2432, 1, 8960]
    - [89, 55.42]
  - - [1536, 2560, 1, 8960]
    - [1, 52.43]
  - - [1536, 2688, 1, 8960]
    - [49, 56.49]
  - - [1536, 2816, 1, 8960]
    - [15, 67.61]
  - - [1536, 2944, 1, 8960]
    - [90, 45.62]
  - - [1536, 3072, 1, 8960]
    - [16, 57.56]
  - - [1536, 3200, 1, 8960]
    - [42, 62.92]
  - - [1536, 3328, 1, 8960]
    - [91, 62.94]
  - - [1536, 3456, 1, 8960]
    - [19, 62.38]
  - - [1536, 3584, 1, 8960]
    - [46, 59.98]
  - - [1536, 3712, 1, 8960]
    - [38, 57.51]
  - - [1536, 3840, 1, 8960]
    - [92, 57.01]
  - - [1536, 3968, 1, 8960]
    - [60, 57.57]
  - - [1536, 4096, 1, 8960]
    - [93, 62.17]
  - - [1536, 128, 1, 1536]
    - [0, 15.37]
  - - [1536, 384, 1, 1536]
    - [44, 30.89]
  - - [1536, 512, 1, 1536]
    - [94, 32.93]
  - - [1536, 640, 1, 1536]
    - [63, 35.17]
  - - [1536, 768, 1, 1536]
    - [88, 37.18]
  - - [1536, 896, 1, 1536]
    - [88, 38.01]
  - - [1536, 1024, 1, 1536]
    - [80, 31.53]
  - - [1536, 1152, 1, 1536]
    - [95, 37.54]
  - - [1536, 1280, 1, 1536]
    - [67, 43.3]
  - - [1536, 1408, 1, 1536]
    - [88, 40.16]
  - - [1536, 1536, 1, 1536]
    - [96, 38.53]
  - - [1536, 1664, 1, 1536]
    - [10, 36.72]
  - - [1536, 1792, 1, 1536]
    - [42, 35.01]
  - - [1536, 1920, 1, 1536]
    - [97, 33.46]
  - - [1536, 2048, 1, 1536]
    - [98, 39.46]
  - - [1536, 2176, 1, 1536]
    - [9, 45.43]
  - - [1536, 2304, 1, 1536]
    - [12, 42.45]
  - - [1536, 2432, 1, 1536]
    - [92, 38.4]
  - - [1536, 2560, 1, 1536]
    - [19, 42.2]
  - - [1536, 2688, 1, 1536]
    - [25, 44.19]
  - - [1536, 2816, 1, 1536]
    - [41, 39.86]
  - - [1536, 2944, 1, 1536]
    - [8, 41.89]
  - - [1536, 3072, 1, 1536]
    - [89, 39.8]
  - - [1536, 3200, 1, 1536]
    - [71, 40.82]
  - - [1536, 3328, 1, 1536]
    - [71, 41.21]
  - - [1536, 3456, 1, 1536]
    - [25, 42.92]
  - - [1536, 3584, 1, 1536]
    - [18, 37.99]
  - - [1536, 3712, 1, 1536]
    - [99, 42.2]
  - - [1536, 3840, 1, 1536]
    - [25, 44.25]
  - - [1536, 3968, 1, 1536]
    - [64, 38.78]
  - - [1536, 4096, 1, 1536]
    - [67, 42.97]
  - - [7168, 1, 1, 5120]
    - [0, 0.95]
  - - [7168, 128, 1, 5120]
    - [100, 60.21]
  - - [7168, 256, 1, 5120]
    - [13, 66.06]
  - - [7168, 384, 1, 5120]
    - [8, 69.12]
  - - [7168, 512, 1, 5120]
    - [6, 69.63]
  - - [7168, 640, 1, 5120]
    - [14, 67.12]
  - - [7168, 768, 1, 5120]
    - [8, 69.56]
  - - [7168, 896, 1, 5120]
    - [61, 64.38]
  - - [7168, 1024, 1, 5120]
    - [61, 69.48]
  - - [7168, 1152, 1, 5120]
    - [8, 67.11]
  - - [7168, 1280, 1, 5120]
    - [20, 68.16]
  - - [7168, 1408, 1, 5120]
    - [22, 67.11]
  - - [7168, 1536, 1, 5120]
    - [6, 69.02]
  - - [7168, 1664, 1, 5120]
    - [22, 65.63]
  - - [7168, 1792, 1, 5120]
    - [22, 67.5]
  - - [7168, 1920, 1, 5120]
    - [6, 68.67]
  - - [7168, 2048, 1, 5120]
    - [6, 68.6]
  - - [7168, 2176, 1, 5120]
    - [8, 68.17]
  - - [7168, 2304, 1, 5120]
    - [8, 70.19]
  - - [7168, 2432, 1, 5120]
    - [6, 67.94]
  - - [7168, 2560, 1, 5120]
    - [8, 67.02]
  - - [7168, 2688, 1, 5120]
    - [8, 68.62]
  - - [7168, 2816, 1, 5120]
    - [22, 68.01]
  - - [7168, 2944, 1, 5120]
    - [6, 68.84]
  - - [7168, 3072, 1, 5120]
    - [8, 69.87]
  - - [7168, 3200, 1, 5120]
    - [22, 68.82]
  - - [7168, 3328, 1, 5120]
    - [8, 68.16]
  - - [7168, 3456, 1, 5120]
    - [22, 68.15]
  - - [7168, 3584, 1, 5120]
    - [21, 68.77]
  - - [7168, 3712, 1, 5120]
    - [22, 68.18]
  - - [7168, 3840, 1, 5120]
    - [21, 68.54]
  - - [7168, 3968, 1, 5120]
    - [22, 69.36]
  - - [7168, 4096, 1, 5120]
    - [21, 68.4]
  - - [5120, 1, 1, 5120]
    - [0, 0.75]
  - - [5120, 128, 1, 5120]
    - [101, 56.66]
  - - [5120, 256, 1, 5120]
    - [25, 63.69]
  - - [5120, 384, 1, 5120]
    - [12, 70.16]
  - - [5120, 512, 1, 5120]
    - [61, 72.83]
  - - [5120, 640, 1, 5120]
    - [93, 61.45]
  - - [5120, 768, 1, 5120]
    - [12, 67.41]
  - - [5120, 896, 1, 5120]
    - [61, 64.36]
  - - [5120, 1024, 1, 5120]
    - [61, 70.95]
  - - [5120, 1152, 1, 5120]
    - [20, 64.44]
  - - [5120, 1280, 1, 5120]
    - [20, 69.81]
  - - [5120, 1408, 1, 5120]
    - [8, 68.13]
  - - [5120, 1536, 1, 5120]
    - [8, 71.79]
  - - [5120, 1664, 1, 5120]
    - [20, 67.62]
  - - [5120, 1792, 1, 5120]
    - [20, 68.36]
  - - [5120, 1920, 1, 5120]
    - [8, 67.26]
  - - [5120, 2048, 1, 5120]
    - [8, 69.81]
  - - [5120, 2176, 1, 5120]
    - [20, 66.34]
  - - [5120, 2304, 1, 5120]
    - [8, 65.81]
  - - [5120, 2432, 1, 5120]
    - [8, 67.82]
  - - [5120, 2560, 1, 5120]
    - [22, 67.65]
  - - [5120, 2688, 1, 5120]
    - [20, 68.07]
  - - [5120, 2816, 1, 5120]
    - [6, 68.22]
  - - [5120, 2944, 1, 5120]
    - [8, 68.97]
  - - [5120, 3072, 1, 5120]
    - [8, 70.59]
  - - [5120, 3200, 1, 5120]
    - [6, 66.54]
  - - [5120, 3328, 1, 5120]
    - [6, 68.04]
  - - [5120, 3456, 1, 5120]
    - [8, 68.63]
  - - [5120, 3584, 1, 5120]
    - [8, 68.31]
  - - [5120, 3712, 1, 5120]
    - [8, 66.14]
  - - [5120, 3840, 1, 5120]
    - [8, 67.64]
  - - [5120, 3968, 1, 5120]
    - [21, 68.72]
  - - [5120, 4096, 1, 5120]
    - [8, 68.84]
  - - [5120, 1, 1, 13824]
    - [103, 0.63]
  - - [5120, 128, 1, 13824]
    - [94, 57.73]
  - - [5120, 256, 1, 13824]
    - [93, 81.05]
  - - [5120, 384, 1, 13824]
    - [116, 84.55]
  - - [5120, 512, 1, 13824]
    - [61, 88.2]
  - - [5120, 640, 1, 13824]
    - [93, 72.16]
  - - [5120, 768, 1, 13824]
    - [12, 80.44]
  - - [5120, 896, 1, 13824]
    - [20, 77.05]
  - - [5120, 1024, 1, 13824]
    - [61, 82.06]
  - - [5120, 1152, 1, 13824]
    - [20, 75.05]
  - - [5120, 1280, 1, 13824]
    - [20, 80.14]
  - - [5120, 1408, 1, 13824]
    - [21, 81.46]
  - - [5120, 1536, 1, 13824]
    - [8, 82.77]
  - - [5120, 1664, 1, 13824]
    - [20, 78.57]
  - - [5120, 1792, 1, 13824]
    - [21, 80.59]
  - - [5120, 1920, 1, 13824]
    - [21, 82.32]
  - - [5120, 2048, 1, 13824]
    - [8, 81.29]
  - - [5120, 2176, 1, 13824]
    - [20, 79.28]
  - - [5120, 2304, 1, 13824]
    - [21, 82.83]
  - - [5120, 2432, 1, 13824]
    - [21, 83.02]
  - - [5120, 2560, 1, 13824]
    - [53, 81.13]
  - - [5120, 2688, 1, 13824]
    - [21, 81.76]
  - - [5120, 2816, 1, 13824]
    - [22, 80.83]
  - - [5120, 2944, 1, 13824]
    - [21, 83.83]
  - - [5120, 3072, 1, 13824]
    - [21, 81.34]
  - - [5120, 3200, 1, 13824]
    - [22, 82.04]
  - - [5120, 3328, 1, 13824]
    - [21, 76.08]
  - - [5120, 3456, 1, 13824]
    - [8, 80.54]
  - - [5120, 3584, 1, 13824]
    - [16, 79.14]
  - - [5120, 3712, 1, 13824]
    - [7, 76.35]
  - - [5120, 3840, 1, 13824]
    - [22, 77.03]
  - - [5120, 3968, 1, 13824]
    - [22, 78.34]
  - - [5120, 4096, 1, 13824]
    - [22, 77.45]
  - - [27648, 1, 1, 5120]
    - [24, 0.47]
  - - [27648, 128, 1, 5120]
    - [116, 39.75]
  - - [27648, 256, 1, 5120]
    - [21, 56.7]
  - - [27648, 384, 1, 5120]
    - [8, 64.74]
  - - [27648, 512, 1, 5120]
    - [20, 66.27]
  - - [27648, 640, 1, 5120]
    - [22, 66.77]
  - - [27648, 768, 1, 5120]
    - [8, 69.57]
  - - [27648, 896, 1, 5120]
    - [39, 67.96]
  - - [27648, 1024, 1, 5120]
    - [22, 69.39]
  - - [27648, 1152, 1, 5120]
    - [15, 63.72]
  - - [27648, 1280, 1, 5120]
    - [14, 59.27]
  - - [27648, 1408, 1, 5120]
    - [23, 44.17]
  - - [27648, 1536, 1, 5120]
    - [21, 45.03]
  - - [27648, 1664, 1, 5120]
    - [7, 44.82]
  - - [27648, 1792, 1, 5120]
    - [3, 45.13]
  - - [27648, 1920, 1, 5120]
    - [8, 46.21]
  - - [27648, 2048, 1, 5120]
    - [21, 49.13]
  - - [27648, 2176, 1, 5120]
    - [39, 47.77]
  - - [27648, 2304, 1, 5120]
    - [4, 49.92]
  - - [27648, 2432, 1, 5120]
    - [21, 49.96]
  - - [27648, 2560, 1, 5120]
    - [14, 50.28]
  - - [27648, 2688, 1, 5120]
    - [8, 51.47]
  - - [27648, 2816, 1, 5120]
    - [21, 51.67]
  - - [27648, 2944, 1, 5120]
    - [20, 51.5]
  - - [27648, 3072, 1, 5120]
    - [21, 52.93]
  - - [27648, 3200, 1, 5120]
    - [21, 51.71]
  - - [27648, 3328, 1, 5120]
    - [39, 54.96]
  - - [27648, 3456, 1, 5120]
    - [21, 54.81]
  - - [27648, 3584, 1, 5120]
    - [21, 54.27]
  - - [27648, 3712, 1, 5120]
    - [21, 56.96]
  - - [27648, 3840, 1, 5120]
    - [8, 56.73]
  - - [27648, 3968, 1, 5120]
    - [20, 56.79]
  - - [27648, 4096, 1, 5120]
    - [37, 56.73]
  - - [4608, 1, 1, 3584]
    - [103, 0.69]
  - - [4608, 128, 1, 3584]
    - [94, 43.37]
  - - [4608, 256, 1, 3584]
    - [69, 52.18]
  - - [4608, 384, 1, 3584]
    - [28, 54.75]
  - - [4608, 512, 1, 3584]
    - [38, 52.91]
  - - [4608, 640, 1, 3584]
    - [45, 51.47]
  - - [4608, 768, 1, 3584]
    - [46, 55.1]
  - - [4608, 896, 1, 3584]
    - [13, 44.31]
  - - [4608, 1024, 1, 3584]
    - [37, 58.03]
  - - [4608, 1152, 1, 3584]
    - [71, 51.16]
  - - [4608, 1280, 1, 3584]
    - [55, 52.09]
  - - [4608, 1408, 1, 3584]
    - [3, 58.04]
  - - [4608, 1536, 1, 3584]
    - [76, 50.56]
  - - [4608, 1664, 1, 3584]
    - [104, 49.39]
  - - [4608, 1792, 1, 3584]
    - [16, 45.87]
  - - [4608, 1920, 1, 3584]
    - [25, 54.37]
  - - [4608, 2048, 1, 3584]
    - [105, 42.69]
  - - [4608, 2176, 1, 3584]
    - [15, 46.12]
  - - [4608, 2304, 1, 3584]
    - [22, 46.27]
  - - [4608, 2432, 1, 3584]
    - [12, 55.49]
  - - [4608, 2560, 1, 3584]
    - [106, 47.39]
  - - [4608, 2688, 1, 3584]
    - [107, 46.51]
  - - [4608, 2816, 1, 3584]
    - [37, 57.99]
  - - [4608, 2944, 1, 3584]
    - [53, 52.83]
  - - [4608, 3072, 1, 3584]
    - [21, 48.09]
  - - [4608, 3200, 1, 3584]
    - [21, 52.0]
  - - [4608, 3328, 1, 3584]
    - [19, 58.48]
  - - [4608, 3456, 1, 3584]
    - [41, 50.61]
  - - [4608, 3584, 1, 3584]
    - [16, 47.81]
  - - [4608, 3712, 1, 3584]
    - [20, 43.34]
  - - [4608, 3840, 1, 3584]
    - [45, 50.62]
  - - [4608, 3968, 1, 3584]
    - [19, 50.26]
  - - [4608, 4096, 1, 3584]
    - [12, 48.82]
  - - [37888, 1, 1, 3584]
    - [108, 0.48]
  - - [37888, 128, 1, 3584]
    - [76, 40.45]
  - - [37888, 256, 1, 3584]
    - [64, 37.18]
  - - [37888, 384, 1, 3584]
    - [109, 46.89]
  - - [37888, 512, 1, 3584]
    - [21, 45.93]
  - - [37888, 640, 1, 3584]
    - [15, 59.62]
  - - [37888, 768, 1, 3584]
    - [9, 50.01]
  - - [37888, 896, 1, 3584]
    - [23, 46.42]
  - - [37888, 1024, 1, 3584]
    - [8, 49.85]
  - - [37888, 1152, 1, 3584]
    - [3, 37.52]
  - - [37888, 1280, 1, 3584]
    - [15, 39.35]
  - - [37888, 1408, 1, 3584]
    - [3, 39.45]
  - - [37888, 1536, 1, 3584]
    - [37, 40.56]
  - - [37888, 1664, 1, 3584]
    - [23, 39.94]
  - - [37888, 1792, 1, 3584]
    - [15, 42.35]
  - - [37888, 1920, 1, 3584]
    - [6, 41.06]
  - - [37888, 2048, 1, 3584]
    - [8, 42.41]
  - - [37888, 2176, 1, 3584]
    - [15, 44.45]
  - - [37888, 2304, 1, 3584]
    - [21, 46.01]
  - - [37888, 2432, 1, 3584]
    - [21, 45.88]
  - - [37888, 2560, 1, 3584]
    - [15, 46.25]
  - - [37888, 2688, 1, 3584]
    - [21, 46.81]
  - - [37888, 2816, 1, 3584]
    - [21, 48.07]
  - - [37888, 2944, 1, 3584]
    - [37, 48.15]
  - - [37888, 3072, 1, 3584]
    - [8, 48.45]
  - - [37888, 3200, 1, 3584]
    - [15, 50.07]
  - - [37888, 3328, 1, 3584]
    - [39, 50.81]
  - - [37888, 3456, 1, 3584]
    - [21, 51.35]
  - - [37888, 3584, 1, 3584]
    - [23, 51.48]
  - - [37888, 3712, 1, 3584]
    - [7, 52.29]
  - - [37888, 3840, 1, 3584]
    - [15, 52.79]
  - - [37888, 3968, 1, 3584]
    - [21, 52.97]
  - - [37888, 4096, 1, 3584]
    - [21, 53.73]
  - - [3584, 1, 1, 3584]
    - [103, 0.54]
  - - [3584, 128, 1, 3584]
    - [102, 38.17]
  - - [3584, 256, 1, 3584]
    - [100, 49.74]
  - - [3584, 384, 1, 3584]
    - [88, 54.01]
  - - [3584, 512, 1, 3584]
    - [110, 47.4]
  - - [3584, 640, 1, 3584]
    - [111, 49.75]
  - - [3584, 768, 1, 3584]
    - [6, 58.5]
  - - [3584, 896, 1, 3584]
    - [109, 52.45]
  - - [3584, 1024, 1, 3584]
    - [112, 48.87]
  - - [3584, 1152, 1, 3584]
    - [66, 53.16]
  - - [3584, 1280, 1, 3584]
    - [79, 46.78]
  - - [3584, 1408, 1, 3584]
    - [91, 51.58]
  - - [3584, 1536, 1, 3584]
    - [31, 48.59]
  - - [3584, 1664, 1, 3584]
    - [16, 54.89]
  - - [3584, 1792, 1, 3584]
    - [73, 48.86]
  - - [3584, 1920, 1, 3584]
    - [4, 57.34]
  - - [3584, 2048, 1, 3584]
    - [22, 61.45]
  - - [3584, 2176, 1, 3584]
    - [78, 46.72]
  - - [3584, 2304, 1, 3584]
    - [1, 58.48]
  - - [3584, 2432, 1, 3584]
    - [113, 45.54]
  - - [3584, 2560, 1, 3584]
    - [71, 48.98]
  - - [3584, 2688, 1, 3584]
    - [50, 53.53]
  - - [3584, 2816, 1, 3584]
    - [114, 44.56]
  - - [3584, 2944, 1, 3584]
    - [56, 43.31]
  - - [3584, 3072, 1, 3584]
    - [89, 46.25]
  - - [3584, 3200, 1, 3584]
    - [21, 57.93]
  - - [3584, 3328, 1, 3584]
    - [109, 47.67]
  - - [3584, 3456, 1, 3584]
    - [20, 55.63]
  - - [3584, 3584, 1, 3584]
    - [21, 56.59]
  - - [3584, 3712, 1, 3584]
    - [115, 41.47]
  - - [3584, 3840, 1, 3584]
    - [116, 51.41]
  - - [3584, 3968, 1, 3584]
    - [16, 53.23]
  - - [3584, 4096, 1, 3584]
    - [7, 60.24]
  - - [3584, 1, 1, 18944]
    - [117, 0.81]
  - - [3584, 128, 1, 18944]
    - [118, 51.78]
  - - [3584, 256, 1, 18944]
    - [2, 69.38]
  - - [3584, 384, 1, 18944]
    - [119, 79.52]
  - - [3584, 512, 1, 18944]
    - [19, 78.51]
  - - [3584, 640, 1, 18944]
    - [23, 63.69]
  - - [3584, 768, 1, 18944]
    - [19, 64.69]
  - - [3584, 896, 1, 18944]
    - [6, 66.73]
  - - [3584, 1024, 1, 18944]
    - [92, 66.97]
  - - [3584, 1152, 1, 18944]
    - [119, 74.81]
  - - [3584, 1280, 1, 18944]
    - [9, 58.51]
  - - [3584, 1408, 1, 18944]
    - [25, 67.19]
  - - [3584, 1536, 1, 18944]
    - [120, 62.26]
  - - [3584, 1664, 1, 18944]
    - [45, 67.24]
  - - [3584, 1792, 1, 18944]
    - [8, 59.58]
  - - [3584, 1920, 1, 18944]
    - [14, 72.61]
  - - [3584, 2048, 1, 18944]
    - [48, 71.15]
  - - [3584, 2176, 1, 18944]
    - [8, 76.13]
  - - [3584, 2304, 1, 18944]
    - [8, 69.38]
  - - [3584, 2432, 1, 18944]
    - [4, 70.55]
  - - [3584, 2560, 1, 18944]
    - [53, 65.32]
  - - [3584, 2688, 1, 18944]
    - [14, 69.26]
  - - [3584, 2816, 1, 18944]
    - [16, 68.95]
  - - [3584, 2944, 1, 18944]
    - [3, 62.98]
  - - [3584, 3072, 1, 18944]
    - [96, 67.56]
  - - [3584, 3200, 1, 18944]
    - [20, 67.98]
  - - [3584, 3328, 1, 18944]
    - [22, 67.03]
  - - [3584, 3456, 1, 18944]
    - [21, 67.68]
  - - [3584, 3584, 1, 18944]
    - [37, 65.07]
  - - [3584, 3712, 1, 18944]
    - [22, 67.74]
  - - [3584, 3840, 1, 18944]
    - [20, 66.53]
  - - [3584, 3968, 1, 18944]
    - [8, 66.54]
  - - [3584, 4096, 1, 18944]
    - [22, 69.64]
  - - [5120, 1, 1, 2560]
    - [103, 0.65]
  - - [5120, 128, 1, 2560]
    - [94, 43.01]
  - - [5120, 256, 1, 2560]
    - [25, 52.96]
  - - [5120, 384, 1, 2560]
    - [12, 60.2]
  - - [5120, 512, 1, 2560]
    - [61, 63.43]
  - - [5120, 640, 1, 2560]
    - [9, 57.39]
  - - [5120, 768, 1, 2560]
    - [12, 59.98]
  - - [5120, 896, 1, 2560]
    - [9, 60.26]
  - - [5120, 1024, 1, 2560]
    - [61, 62.26]
  - - [5120, 1152, 1, 2560]
    - [1, 61.69]
  - - [5120, 1280, 1, 2560]
    - [6, 63.29]
  - - [5120, 1408, 1, 2560]
    - [6, 64.57]
  - - [5120, 1536, 1, 2560]
    - [8, 64.1]
  - - [5120, 1664, 1, 2560]
    - [19, 62.34]
  - - [5120, 1792, 1, 2560]
    - [6, 62.53]
  - - [5120, 1920, 1, 2560]
    - [6, 64.49]
  - - [5120, 2048, 1, 2560]
    - [6, 65.2]
  - - [5120, 2176, 1, 2560]
    - [6, 62.51]
  - - [5120, 2304, 1, 2560]
    - [19, 61.93]
  - - [5120, 2432, 1, 2560]
    - [6, 62.85]
  - - [5120, 2560, 1, 2560]
    - [6, 63.54]
  - - [5120, 2688, 1, 2560]
    - [6, 63.73]
  - - [5120, 2816, 1, 2560]
    - [6, 64.86]
  - - [5120, 2944, 1, 2560]
    - [6, 62.56]
  - - [5120, 3072, 1, 2560]
    - [7, 62.16]
  - - [5120, 3200, 1, 2560]
    - [6, 62.49]
  - - [5120, 3328, 1, 2560]
    - [6, 62.41]
  - - [5120, 3456, 1, 2560]
    - [6, 63.65]
  - - [5120, 3584, 1, 2560]
    - [9, 62.29]
  - - [5120, 3712, 1, 2560]
    - [6, 61.62]
  - - [5120, 3840, 1, 2560]
    - [6, 61.87]
  - - [5120, 3968, 1, 2560]
    - [6, 63.13]
  - - [5120, 4096, 1, 2560]
    - [6, 63.38]
  - - [3584, 1, 1, 5120]
    - [103, 0.59]
  - - [3584, 128, 1, 5120]
    - [33, 46.79]
  - - [3584, 256, 1, 5120]
    - [100, 62.28]
  - - [3584, 384, 1, 5120]
    - [119, 66.4]
  - - [3584, 512, 1, 5120]
    - [6, 71.34]
  - - [3584, 640, 1, 5120]
    - [15, 69.33]
  - - [3584, 768, 1, 5120]
    - [8, 75.32]
  - - [3584, 896, 1, 5120]
    - [9, 68.3]
  - - [3584, 1024, 1, 5120]
    - [6, 71.46]
  - - [3584, 1152, 1, 5120]
    - [20, 69.6]
  - - [3584, 1280, 1, 5120]
    - [16, 70.06]
  - - [3584, 1408, 1, 5120]
    - [23, 69.68]
  - - [3584, 1536, 1, 5120]
    - [8, 72.53]
  - - [3584, 1664, 1, 5120]
    - [20, 66.19]
  - - [3584, 1792, 1, 5120]
    - [20, 66.96]
  - - [3584, 1920, 1, 5120]
    - [20, 70.35]
  - - [3584, 2048, 1, 5120]
    - [8, 69.74]
  - - [3584, 2176, 1, 5120]
    - [8, 70.51]
  - - [3584, 2304, 1, 5120]
    - [20, 66.47]
  - - [3584, 2432, 1, 5120]
    - [20, 68.61]
  - - [3584, 2560, 1, 5120]
    - [20, 67.64]
  - - [3584, 2688, 1, 5120]
    - [8, 67.73]
  - - [3584, 2816, 1, 5120]
    - [8, 69.66]
  - - [3584, 2944, 1, 5120]
    - [8, 68.65]
  - - [3584, 3072, 1, 5120]
    - [8, 70.07]
  - - [3584, 3200, 1, 5120]
    - [20, 67.31]
  - - [3584, 3328, 1, 5120]
    - [22, 65.36]
  - - [3584, 3456, 1, 5120]
    - [8, 68.03]
  - - [3584, 3584, 1, 5120]
    - [8, 69.15]
  - - [3584, 3712, 1, 5120]
    - [8, 68.82]
  - - [3584, 3840, 1, 5120]
    - [8, 70.95]
  - - [3584, 3968, 1, 5120]
    - [6, 68.62]
  - - [3584, 4096, 1, 5120]
    - [6, 68.05]
- null
- null
- DeviceEfficiency
- GridBased
