library/src/amd_detail/rocblaslt/src/Tensile/Logic/asm_full/gfx1201/GridBased/gfx1201_Cijk_Alik_Bljk_BBS_BH_Bias_HAS_SAV_UserArgs.yaml
- {MinimumRequiredVersion: 4.33.0}
- gfx1201
- gfx1201
- [Device 73f0]
    SolutionIndex: 0
    SolutionNameMin: Cijk_Alik_Bljk_BBS_BH_Bias_HAS_SAV_UserArgs_MT32x32x32_MI16x16x1_SN_CLR1_GSU1_LBSPPA128_LBSPPB128_MIWT1_1_PGR1_PLR1_SS0_SU32_SUM0_SUS256_SVW8_TLDS1_WG32_4_1_WGM8
    SolutionIndex: 1
    SolutionNameMin: Cijk_Alik_Bljk_BBS_BH_Bias_HAS_SAV_UserArgs_MT64x32x32_MI16x16x1_SN_CLR1_GSU1_LBSPPA128_LBSPPB128_MIWT2_1_PGR1_PLR1_SS0_SU32_SUM0_SUS256_SVW8_TLDS1_WG32_4_1_WGM8
    SolutionIndex: 2
    SolutionNameMin: Cijk_Alik_Bljk_BBS_BH_Bias_HAS_SAV_UserArgs_MT64x32x32_MI16x16x1_SN_CLR1_GSU1_LBSPPA128_LBSPPB128_MIWT2_1_PGR2_PLR1_SS0_SU32_SUM0_SUS256_SVW8_TLDS1_WG32_4_1_WGM8
    SolutionIndex: 3
    SolutionNameMin: Cijk_Alik_Bljk_BBS_BH_Bias_HAS_SAV_UserArgs_MT64x32x32_MI16x16x1_SN_CLR0_GSU1_LBSPPA128_LBSPPB128_MIWT2_1_PGR1_PLR0_SS0_SU32_SUM0_SUS256_SVW8_TLDS1_WG32_4_1_WGM8
    SolutionIndex: 4
    SolutionNameMin: Cijk_Alik_Bljk_BBS_BH_Bias_HAS_SAV_UserArgs_MT32x64x32_MI16x16x1_SN_CLR1_GSU1_LBSPPA128_LBSPPB128_MIWT2_1_PGR1_PLR1_SS0_SU32_SUM0_SUS256_SVW8_TLDS1_WG16_8_1_WGM8
    SolutionIndex: 5
    SolutionNameMin: Cijk_Alik_Bljk_BBS_BH_Bias_HAS_SAV_UserArgs_MT32x64x32_MI16x16x1_SN_CLR1_GSU1_LBSPPA128_LBSPPB128_MIWT2_1_PGR2_PLR1_SS0_SU32_SUM0_SUS256_SVW8_TLDS1_WG16_8_1_WGM8
    SolutionIndex: 6
    SolutionNameMin: Cijk_Alik_Bljk_BBS_BH_Bias_HAS_SAV_UserArgs_MT32x64x32_MI16x16x1_SN_CLR0_GSU1_LBSPPA128_LBSPPB128_MIWT2_1_PGR1_PLR0_SS0_SU32_SUM0_SUS256_SVW8_TLDS1_WG16_8_1_WGM8
    SolutionIndex: 7
    SolutionNameMin: Cijk_Alik_Bljk_BBS_BH_Bias_HAS_SAV_UserArgs_MT32x64x32_MI16x16x1_SN_CLR0_GSU1_LBSPPA128_LBSPPB128_MIWT2_1_PGR2_PLR0_SS0_SU32_SUM0_SUS256_SVW8_TLDS1_WG16_8_1_WGM8
    SolutionIndex: 8
    SolutionNameMin: Cijk_Alik_Bljk_BBS_BH_Bias_HAS_SAV_UserArgs_MT32x32x64_MI16x16x1_SN_CLR1_GSU1_LBSPPA128_LBSPPB128_MIWT1_1_PGR1_PLR1_SS0_SU32_SUM0_SUS256_SVW8_TLDS1_WG32_4_1_WGM8
    SolutionIndex: 9
    SolutionNameMin: Cijk_Alik_Bljk_BBS_BH_Bias_HAS_SAV_UserArgs_MT32x32x64_MI16x16x1_SN_CLR1_GSU1_LBSPPA128_LBSPPB128_MIWT1_1_PGR1_PLR3_SS0_SU32_SUM0_SUS256_SVW8_TLDS1_WG32_4_1_WGM8
    SolutionIndex: 10
    SolutionNameMin: Cijk_Alik_Bljk_BBS_BH_Bias_HAS_SAV_UserArgs_MT32x32x64_MI16x16x1_SN_CLR0_GSU1_LBSPPA128_LBSPPB128_MIWT1_1_PGR1_PLR0_SS0_SU32_SUM0_SUS256_SVW8_TLDS1_WG32_4_1_WGM8
    SolutionIndex: 11
    SolutionNameMin: Cijk_Alik_Bljk_BBS_BH_Bias_HAS_SAV_UserArgs_MT64x16x32_MI16x16x1_SN_CLR1_GSU1_LBSPPA128_LBSPPB128_MIWT1_1_PGR2_PLR1_SS1_SU32_SUM0_SUS256_SVW1_TLDS1_WG64_2_1_WGM8
    SolutionIndex: 12
    SolutionNameMin: Cijk_Alik_Bljk_BBS_BH_Bias_HAS_SAV_UserArgs_MT64x16x32_MI16x16x1_SN_CLR0_GSU1_LBSPPA128_LBSPPB128_MIWT1_1_PGR2_PLR0_SS1_SU32_SUM0_SUS256_SVW1_TLDS1_WG64_2_1_WGM8
    SolutionIndex: 13
    SolutionNameMin: Cijk_Alik_Bljk_BBS_BH_Bias_HAS_SAV_UserArgs_MT32x32x32_MI16x16x1_SN_CLR1_GSU1_LBSPPA128_LBSPPB128_MIWT1_1_PGR1_PLR1_SS1_SU32_SUM0_SUS256_SVW1_TLDS1_WG32_4_1_WGM8
    SolutionIndex: 14
    SolutionNameMin: Cijk_Alik_Bljk_BBS_BH_Bias_HAS_SAV_UserArgs_MT32x32x32_MI16x16x1_SN_CLR1_GSU1_LBSPPA128_LBSPPB128_MIWT1_1_PGR2_PLR1_SS1_SU32_SUM0_SUS256_SVW1_TLDS1_WG32_4_1_WGM8
    SolutionIndex: 15
    SolutionNameMin: Cijk_Alik_Bljk_BBS_BH_Bias_HAS_SAV_UserArgs_MT32x32x32_MI16x16x1_SN_CLR0_GSU1_LBSPPA128_LBSPPB128_MIWT1_1_PGR1_PLR0_SS1_SU32_SUM0_SUS256_SVW1_TLDS1_WG32_4_1_WGM8
    SolutionIndex: 16
    SolutionNameMin: Cijk_Alik_Bljk_BBS_BH_Bias_HAS_SAV_UserArgs_MT32x32x32_MI16x16x1_SN_CLR0_GSU1_LBSPPA128_LBSPPB128_MIWT1_1_PGR2_PLR0_SS1_SU32_SUM0_SUS256_SVW1_TLDS1_WG32_4_1_WGM8
    SolutionIndex: 17
    SolutionNameMin: Cijk_Alik_Bljk_BBS_BH_Bias_HAS_SAV_UserArgs_MT64x32x32_MI16x16x1_SN_CLR1_GSU1_LBSPPA128_LBSPPB128_MIWT2_1_PGR1_PLR1_SS1_SU32_SUM0_SUS256_SVW1_TLDS1_WG32_4_1_WGM8
    SolutionIndex: 18
    SolutionNameMin: Cijk_Alik_Bljk_BBS_BH_Bias_HAS_SAV_UserArgs_MT64x32x32_MI16x16x1_SN_CLR0_GSU1_LBSPPA128_LBSPPB128_MIWT2_1_PGR1_PLR0_SS1_SU32_SUM0_SUS256_SVW1_TLDS1_WG32_4_1_WGM8
    SolutionIndex: 19
    SolutionNameMin: Cijk_Alik_Bljk_BBS_BH_Bias_HAS_SAV_UserArgs_MT32x64x32_MI16x16x1_SN_CLR1_GSU1_LBSPPA128_LBSPPB128_MIWT2_1_PGR1_PLR1_SS1_SU32_SUM0_SUS256_SVW1_TLDS1_WG16_8_1_WGM8
    SolutionIndex: 20
    SolutionNameMin: Cijk_Alik_Bljk_BBS_BH_Bias_HAS_SAV_UserArgs_MT32x64x32_MI16x16x1_SN_CLR0_GSU1_LBSPPA128_LBSPPB128_MIWT2_1_PGR1_PLR0_SS1_SU32_SUM0_SUS256_SVW1_TLDS1_WG16_8_1_WGM8
    SolutionIndex: 21
    SolutionNameMin: Cijk_Alik_Bljk_BBS_BH_Bias_HAS_SAV_UserArgs_MT32x32x64_MI16x16x1_SN_CLR1_GSU1_LBSPPA128_LBSPPB128_MIWT1_1_PGR1_PLR1_SS1_SU32_SUM0_SUS256_SVW1_TLDS1_WG32_4_1_WGM8
    SolutionIndex: 22
    SolutionNameMin: Cijk_Alik_Bljk_BBS_BH_Bias_HAS_SAV_UserArgs_MT32x32x64_MI16x16x1_SN_CLR1_GSU1_LBSPPA128_LBSPPB128_MIWT1_1_PGR1_PLR3_SS1_SU32_SUM0_SUS256_SVW1_TLDS1_WG32_4_1_WGM8
    SolutionIndex: 23
    SolutionNameMin: Cijk_Alik_Bljk_BBS_BH_Bias_HAS_SAV_UserArgs_MT64x16x64_MI16x16x1_SN_LDSB0_GRVWA8_GRVWB8_GSU1_GSUC0_GSUWGMRR0_K1_LBSPPA128_LBSPPB128_MIWT1_1_SS0_SU32_SUM0_SUS256_SVW8_TLDS1_WG64_2_1_WGM8_WGMXCC1_WGMXCCGn1
    SolutionIndex: 24
    SolutionNameMin: Cijk_Alik_Bljk_BBS_BH_Bias_HAS_SAV_UserArgs_MT64x64x64_MI16x16x1_SN_LDSB1_GRVWA8_GRVWB8_GSU1_GSUC0_GSUWGMRR0_K1_LBSPPA128_LBSPPB128_MIWT2_2_SS1_SU32_SUM0_SUS256_SVW1_TLDS1_WG32_4_1_WGM8_WGMXCC1_WGMXCCGn1
    SolutionIndex: 25
    SolutionNameMin: Cijk_Alik_Bljk_BBS_BH_Bias_HAS_SAV_UserArgs_MT80x128x64_MI16x16x1_SN_LDSB1_GRVWA8_GRVWB8_GSU1_GSUC0_GSUWGMRR0_K1_LBSPPA128_LBSPPB128_MIWT5_2_SS0_SU32_SUM0_SUS256_SVW8_TLDS1_WG16_8_1_WGM8_WGMXCC1_WGMXCCGn1
    SolutionIndex: 26
    SolutionNameMin: Cijk_Alik_Bljk_BBS_BH_Bias_HAS_SAV_UserArgs_MT160x96x32_MI16x16x1_SN_LDSB1_GRVWA8_GRVWB8_GSU1_GSUC0_GSUWGMRR0_K1_LBSPPA128_LBSPPB128_MIWT5_3_SS0_SU32_SUM0_SUS256_SVW8_TLDS1_WG32_4_1_WGM8_WGMXCC1_WGMXCCGn1
    SolutionIndex: 27
    SolutionNameMin: Cijk_Alik_Bljk_BBS_BH_Bias_HAS_SAV_UserArgs_MT80x128x32_MI16x16x1_SN_LDSB1_GRVWA4_GRVWB8_GSU1_GSUC0_GSUWGMRR0_K1_LBSPPA128_LBSPPB128_MIWT5_2_SS0_SU32_SUM0_SUS256_SVW8_TLDS1_WG16_8_1_WGM8_WGMXCC1_WGMXCCGn1
    SolutionIndex: 28
    SolutionNameMin: Cijk_Alik_Bljk_BBS_BH_Bias_HAS_SAV_UserArgs_MT64x160x32_MI16x16x1_SN_LDSB1_GRVWA8_GRVWB8_GSU1_GSUC0_GSUWGMRR0_K1_LBSPPA128_LBSPPB128_MIWT2_5_SS0_SU32_SUM0_SUS256_SVW8_TLDS1_WG32_4_1_WGM8_WGMXCC1_WGMXCCGn1
    SolutionIndex: 29
    SolutionNameMin: Cijk_Alik_Bljk_BBS_BH_Bias_HAS_SAV_UserArgs_MT128x128x32_MI16x16x1_SN_LDSB1_GRVWA8_GRVWB8_GSU1_GSUC0_GSUWGMRR0_K1_LBSPPA128_LBSPPB128_MIWT4_4_SS0_SU32_SUM0_SUS256_SVW8_TLDS1_WG32_4_1_WGM8_WGMXCC1_WGMXCCGn1
    SolutionIndex: 30
    SolutionNameMin: Cijk_Alik_Bljk_BBS_BH_Bias_HAS_SAV_UserArgs_MT128x96x32_MI16x16x1_SN_LDSB1_GRVWA8_GRVWB8_GSU1_GSUC0_GSUWGMRR0_K1_LBSPPA128_LBSPPB128_MIWT2_6_SS1_SU32_SUM0_SUS256_SVW1_TLDS1_WG64_2_1_WGM8_WGMXCC1_WGMXCCGn1
    SolutionIndex: 31
    SolutionNameMin: Cijk_Alik_Bljk_BBS_BH_Bias_HAS_SAV_UserArgs_MT96x160x32_MI16x16x1_SN_LDSB1_GRVWA8_GRVWB8_GSU1_GSUC0_GSUWGMRR0_K1_LBSPPA128_LBSPPB128_MIWT3_5_SS0_SU32_SUM0_SUS256_SVW8_TLDS1_WG32_4_1_WGM8_WGMXCC1_WGMXCCGn1
    SolutionIndex: 32
    SolutionNameMin: Cijk_Alik_Bljk_BBS_BH_Bias_HAS_SAV_UserArgs_MT128x96x32_MI16x16x1_SN_LDSB1_GRVWA8_GRVWB8_GSU1_GSUC0_GSUWGMRR0_K1_LBSPPA128_LBSPPB128_MIWT4_3_SS0_SU32_SUM0_SUS256_SVW8_TLDS1_WG32_4_1_WGM8_WGMXCC1_WGMXCCGn1
    SolutionIndex: 33
    SolutionNameMin: Cijk_Alik_Bljk_BBS_BH_Bias_HAS_SAV_UserArgs_MT64x192x32_MI16x16x1_SN_LDSB1_GRVWA8_GRVWB8_GSU1_GSUC0_GSUWGMRR0_K1_LBSPPA128_LBSPPB128_MIWT4_3_SS0_SU32_SUM0_SUS256_SVW8_TLDS1_WG16_8_1_WGM8_WGMXCC1_WGMXCCGn1
    SolutionIndex: 34
    SolutionNameMin: Cijk_Alik_Bljk_BBS_BH_Bias_HAS_SAV_UserArgs_MT128x128x32_MI16x16x1_SN_LDSB1_GRVWA8_GRVWB8_GSU1_GSUC0_GSUWGMRR0_K1_LBSPPA128_LBSPPB128_MIWT4_4_SS1_SU32_SUM0_SUS256_SVW1_TLDS1_WG32_4_1_WGM8_WGMXCC1_WGMXCCGn1
    SolutionIndex: 35
    SolutionNameMin: Cijk_Alik_Bljk_BBS_BH_Bias_HAS_SAV_UserArgs_MT128x128x32_MI16x16x1_SN_LDSB1_GRVWA8_GRVWB8_GSU1_GSUC0_GSUWGMRR0_K1_LBSPPA128_LBSPPB128_MIWT2_8_SS1_SU32_SUM0_SUS256_SVW1_TLDS1_WG64_2_1_WGM8_WGMXCC1_WGMXCCGn1
    SolutionIndex: 36
    SolutionNameMin: Cijk_Alik_Bljk_BBS_BH_Bias_HAS_SAV_UserArgs_MT128x128x32_MI16x16x1_SN_LDSB1_GRVWA8_GRVWB8_GSU1_GSUC0_GSUWGMRR0_K1_LBSPPA128_LBSPPB128_MIWT2_8_SS0_SU32_SUM0_SUS256_SVW8_TLDS1_WG64_2_1_WGM8_WGMXCC1_WGMXCCGn1
    SolutionIndex: 37
    SolutionNameMin: Cijk_Alik_Bljk_BBS_BH_Bias_HAS_SAV_UserArgs_MT128x128x32_MI16x16x1_SN_LDSB1_GRVWA8_GRVWB8_GSU1_GSUC0_GSUWGMRR0_K1_LBSPPA128_LBSPPB128_MIWT8_2_SS0_SU32_SUM0_SUS256_SVW8_TLDS1_WG16_8_1_WGM8_WGMXCC1_WGMXCCGn1
    SolutionIndex: 38
    SolutionNameMin: Cijk_Alik_Bljk_BBS_BH_Bias_HAS_SAV_UserArgs_MT128x112x32_MI16x16x1_SN_LDSB1_GRVWA8_GRVWB4_GSU1_GSUC0_GSUWGMRR0_K1_LBSPPA128_LBSPPB128_MIWT2_7_SS1_SU32_SUM0_SUS256_SVW1_TLDS1_WG64_2_1_WGM8_WGMXCC1_WGMXCCGn1
    SolutionIndex: 39
    SolutionNameMin: Cijk_Alik_Bljk_BBS_BH_Bias_HAS_SAV_UserArgs_MT64x16x64_MI16x16x1_SN_LDSB0_GRVWA8_GRVWB8_GSU1_GSUC0_GSUWGMRR0_K1_LBSPPA128_LBSPPB128_MIWT1_1_SS1_SU32_SUM0_SUS256_SVW1_TLDS1_WG64_2_1_WGM8_WGMXCC1_WGMXCCGn1
    SolutionIndex: 40
    SolutionNameMin: Cijk_Alik_Bljk_BBS_BH_Bias_HAS_SAV_UserArgs_MT48x128x32_MI16x16x1_SN_LDSB0_GRVWA4_GRVWB8_GSU1_GSUC0_GSUWGMRR0_K1_LBSPPA128_LBSPPB128_MIWT3_2_SS1_SU32_SUM0_SUS256_SVW1_TLDS1_WG16_8_1_WGM8_WGMXCC1_WGMXCCGn1
    SolutionIndex: 41
    SolutionNameMin: Cijk_Alik_Bljk_BBS_BH_Bias_HAS_SAV_UserArgs_MT96x96x64_MI16x16x1_SN_LDSB1_GRVWA8_GRVWB8_GSU1_GSUC0_GSUWGMRR0_K1_LBSPPA128_LBSPPB128_MIWT3_3_SS0_SU32_SUM0_SUS256_SVW8_TLDS1_WG32_4_1_WGM8_WGMXCC1_WGMXCCGn1
    SolutionIndex: 42
    SolutionNameMin: Cijk_Alik_Bljk_BBS_BH_Bias_HAS_SAV_UserArgs_MT96x128x32_MI16x16x1_SN_LDSB1_GRVWA8_GRVWB8_GSU1_GSUC0_GSUWGMRR0_K1_LBSPPA128_LBSPPB128_MIWT3_4_SS1_SU32_SUM0_SUS256_SVW1_TLDS1_WG32_4_1_WGM8_WGMXCC1_WGMXCCGn1
    SolutionIndex: 43
    SolutionNameMin: Cijk_Alik_Bljk_BBS_BH_Bias_HAS_SAV_UserArgs_MT96x96x64_MI16x16x1_SN_LDSB1_GRVWA8_GRVWB8_GSU1_GSUC0_GSUWGMRR0_K1_LBSPPA128_LBSPPB128_MIWT3_3_SS1_SU32_SUM0_SUS256_SVW1_TLDS1_WG32_4_1_WGM8_WGMXCC1_WGMXCCGn1
    SolutionIndex: 44
    SolutionNameMin: Cijk_Alik_Bljk_BBS_BH_Bias_HAS_SAV_UserArgs_MT64x224x32_MI16x16x1_SN_LDSB1_GRVWA8_GRVWB8_GSU1_GSUC0_GSUWGMRR0_K1_LBSPPA128_LBSPPB128_MIWT2_7_SS0_SU32_SUM0_SUS256_SVW8_TLDS1_WG32_4_1_WGM8_WGMXCC1_WGMXCCGn1
    SolutionIndex: 45
    SolutionNameMin: Cijk_Alik_Bljk_BBS_BH_Bias_HAS_SAV_UserArgs_MT48x128x64_MI16x16x1_SN_LDSB1_GRVWA8_GRVWB8_GSU1_GSUC0_GSUWGMRR0_K1_LBSPPA128_LBSPPB128_MIWT3_2_SS1_SU32_SUM0_SUS256_SVW1_TLDS1_WG16_8_1_WGM8_WGMXCC1_WGMXCCGn1
    SolutionIndex: 46
    SolutionNameMin: Cijk_Alik_Bljk_BBS_BH_Bias_HAS_SAV_UserArgs_MT48x192x64_MI16x16x1_SN_LDSB1_GRVWA8_GRVWB8_GSU1_GSUC0_GSUWGMRR0_K1_LBSPPA128_LBSPPB128_MIWT3_3_SS0_SU32_SUM0_SUS256_SVW8_TLDS1_WG16_8_1_WGM8_WGMXCC1_WGMXCCGn1
    SolutionIndex: 47
    SolutionNameMin: Cijk_Alik_Bljk_BBS_BH_Bias_HAS_SAV_UserArgs_MT64x128x64_MI16x16x1_SN_LDSB1_GRVWA8_GRVWB8_GSU1_GSUC0_GSUWGMRR0_K1_LBSPPA128_LBSPPB128_MIWT2_4_SS1_SU32_SUM0_SUS256_SVW1_TLDS1_WG32_4_1_WGM8_WGMXCC1_WGMXCCGn1
    SolutionIndex: 48
    SolutionNameMin: Cijk_Alik_Bljk_BBS_BH_Bias_HAS_SAV_UserArgs_MT80x128x64_MI16x16x1_SN_LDSB1_GRVWA8_GRVWB8_GSU1_GSUC0_GSUWGMRR0_K1_LBSPPA128_LBSPPB128_MIWT5_2_SS1_SU32_SUM0_SUS256_SVW1_TLDS1_WG16_8_1_WGM8_WGMXCC1_WGMXCCGn1
    SolutionIndex: 49
    SolutionNameMin: Cijk_Alik_Bljk_BBS_BH_Bias_HAS_SAV_UserArgs_MT128x80x64_MI16x16x1_SN_LDSB1_GRVWA8_GRVWB8_GSU1_GSUC0_GSUWGMRR0_K1_LBSPPA128_LBSPPB128_MIWT2_5_SS0_SU32_SUM0_SUS256_SVW8_TLDS1_WG64_2_1_WGM8_WGMXCC1_WGMXCCGn1
    SolutionIndex: 50
    SolutionNameMin: Cijk_Alik_Bljk_BBS_BH_Bias_HAS_SAV_UserArgs_MT64x128x64_MI16x16x1_SN_LDSB1_GRVWA8_GRVWB8_GSU1_GSUC0_GSUWGMRR0_K1_LBSPPA128_LBSPPB128_MIWT4_2_SS1_SU32_SUM0_SUS256_SVW1_TLDS1_WG16_8_1_WGM8_WGMXCC1_WGMXCCGn1
    SolutionIndex: 51
    SolutionNameMin: Cijk_Alik_Bljk_BBS_BH_Bias_HAS_SAV_UserArgs_MT192x48x64_MI16x16x1_SN_LDSB1_GRVWA8_GRVWB8_GSU1_GSUC0_GSUWGMRR0_K1_LBSPPA128_LBSPPB128_MIWT3_3_SS0_SU32_SUM0_SUS256_SVW8_TLDS1_WG64_2_1_WGM8_WGMXCC1_WGMXCCGn1
    SolutionIndex: 52
    SolutionNameMin: Cijk_Alik_Bljk_BBS_BH_Bias_HAS_SAV_UserArgs_MT128x80x64_MI16x16x1_SN_LDSB1_GRVWA8_GRVWB8_GSU1_GSUC0_GSUWGMRR0_K1_LBSPPA128_LBSPPB128_MIWT2_5_SS1_SU32_SUM0_SUS256_SVW1_TLDS1_WG64_2_1_WGM8_WGMXCC1_WGMXCCGn1
    SolutionIndex: 53
    SolutionNameMin: Cijk_Alik_Bljk_BBS_BH_Bias_HAS_SAV_UserArgs_MT32x16x64_MI16x16x1_SN_LDSB0_GRVWA8_GRVWB8_GSU1_GSUC0_GSUWGMRR0_K1_LBSPPA128_LBSPPB128_MIWT1_1_SS1_SU32_SUM0_SUS256_SVW1_TLDS1_WG32_2_1_WGM8_WGMXCC1_WGMXCCGn1
    SolutionIndex: 54
    SolutionNameMin: Cijk_Alik_Bljk_BBS_BH_Bias_HAS_SAV_UserArgs_MT48x64x32_MI16x16x1_SN_LDSB0_GRVWA4_GRVWB8_GSU1_GSUC0_GSUWGMRR0_K1_LBSPPA128_LBSPPB128_MIWT3_1_SS1_SU32_SUM0_SUS256_SVW1_TLDS1_WG16_8_1_WGM8_WGMXCC1_WGMXCCGn1
    SolutionIndex: 55
    SolutionNameMin: Cijk_Alik_Bljk_BBS_BH_Bias_HAS_SAV_UserArgs_MT48x128x64_MI16x16x1_SN_LDSB1_GRVWA8_GRVWB8_GSU1_GSUC0_GSUWGMRR0_K1_LBSPPA128_LBSPPB128_MIWT3_2_SS0_SU32_SUM0_SUS256_SVW8_TLDS1_WG16_8_1_WGM8_WGMXCC1_WGMXCCGn1
    SolutionIndex: 56
    SolutionNameMin: Cijk_Alik_Bljk_BBS_BH_Bias_HAS_SAV_UserArgs_MT96x96x32_MI16x16x1_SN_LDSB0_GRVWA8_GRVWB8_GSU1_GSUC0_GSUWGMRR0_K1_LBSPPA128_LBSPPB128_MIWT3_3_SS0_SU32_SUM0_SUS256_SVW8_TLDS1_WG32_4_1_WGM8_WGMXCC1_WGMXCCGn1
    SolutionIndex: 57
    SolutionNameMin: Cijk_Alik_Bljk_BBS_BH_Bias_HAS_SAV_UserArgs_MT96x128x32_MI16x16x1_SN_LDSB1_GRVWA8_GRVWB8_GSU1_GSUC0_GSUWGMRR0_K1_LBSPPA128_LBSPPB128_MIWT3_4_SS0_SU32_SUM0_SUS256_SVW8_TLDS1_WG32_4_1_WGM8_WGMXCC1_WGMXCCGn1
    SolutionIndex: 58
    SolutionNameMin: Cijk_Alik_Bljk_BBS_BH_Bias_HAS_SAV_UserArgs_MT80x192x32_MI16x16x1_SN_LDSB1_GRVWA4_GRVWB8_GSU1_GSUC0_GSUWGMRR0_K1_LBSPPA128_LBSPPB128_MIWT5_3_SS1_SU32_SUM0_SUS256_SVW1_TLDS1_WG16_8_1_WGM8_WGMXCC1_WGMXCCGn1
    SolutionIndex: 59
    SolutionNameMin: Cijk_Alik_Bljk_BBS_BH_Bias_HAS_SAV_UserArgs_MT128x96x32_MI16x16x1_SN_LDSB1_GRVWA8_GRVWB8_GSU1_GSUC0_GSUWGMRR0_K1_LBSPPA128_LBSPPB128_MIWT2_6_SS0_SU32_SUM0_SUS256_SVW8_TLDS1_WG64_2_1_WGM8_WGMXCC1_WGMXCCGn1
    SolutionIndex: 60
    SolutionNameMin: Cijk_Alik_Bljk_BBS_BH_Bias_HAS_SAV_UserArgs_MT128x96x32_MI16x16x1_SN_LDSB1_GRVWA8_GRVWB8_GSU1_GSUC0_GSUWGMRR0_K1_LBSPPA128_LBSPPB128_MIWT4_3_SS1_SU32_SUM0_SUS256_SVW1_TLDS1_WG32_4_1_WGM8_WGMXCC1_WGMXCCGn1
    SolutionIndex: 61
    SolutionNameMin: Cijk_Alik_Bljk_BBS_BH_Bias_HAS_SAV_UserArgs_MT16x16x64_MI16x16x1_SN_LDSB0_GRVWA8_GRVWB8_GSU1_GSUC0_GSUWGMRR0_K1_LBSPPA256_LBSPPB256_MIWT1_1_SS0_SU32_SUM0_SUS256_SVW8_TLDS0_WG16_2_1_WGM8_WGMXCC1_WGMXCCGn1
    SolutionIndex: 62
    SolutionNameMin: Cijk_Alik_Bljk_BBS_BH_Bias_HAS_SAV_UserArgs_MT64x32x64_MI16x16x1_SN_LDSB0_GRVWA8_GRVWB8_GSU1_GSUC0_GSUWGMRR0_K1_LBSPPA128_LBSPPB128_MIWT1_2_SS1_SU32_SUM0_SUS256_SVW1_TLDS1_WG64_2_1_WGM8_WGMXCC1_WGMXCCGn1
    SolutionIndex: 63
    SolutionNameMin: Cijk_Alik_Bljk_BBS_BH_Bias_HAS_SAV_UserArgs_MT256x32x64_MI16x16x1_SN_LDSB1_GRVWA8_GRVWB8_GSU1_GSUC0_GSUWGMRR0_K1_LBSPPA128_LBSPPB128_MIWT4_2_SS0_SU32_SUM0_SUS256_SVW8_TLDS1_WG64_2_1_WGM8_WGMXCC1_WGMXCCGn1
    SolutionIndex: 64
    SolutionNameMin: Cijk_Alik_Bljk_BBS_BH_Bias_HAS_SAV_UserArgs_MT128x48x64_MI16x16x1_SN_LDSB1_GRVWA8_GRVWB8_GSU1_GSUC0_GSUWGMRR0_K1_LBSPPA128_LBSPPB128_MIWT2_3_SS1_SU32_SUM0_SUS256_SVW1_TLDS1_WG64_2_1_WGM8_WGMXCC1_WGMXCCGn1
    SolutionIndex: 65
    SolutionNameMin: Cijk_Alik_Bljk_BBS_BH_Bias_HAS_SAV_UserArgs_MT64x128x64_MI16x16x1_SN_LDSB1_GRVWA8_GRVWB8_GSU1_GSUC0_GSUWGMRR0_K1_LBSPPA128_LBSPPB128_MIWT4_2_SS0_SU32_SUM0_SUS256_SVW8_TLDS1_WG16_8_1_WGM8_WGMXCC1_WGMXCCGn1
    SolutionIndex: 66
    SolutionNameMin: Cijk_Alik_Bljk_BBS_BH_Bias_HAS_SAV_UserArgs_MT128x64x64_MI16x16x1_SN_LDSB1_GRVWA8_GRVWB8_GSU1_GSUC0_GSUWGMRR0_K1_LBSPPA128_LBSPPB128_MIWT4_2_SS0_SU32_SUM0_SUS256_SVW8_TLDS1_WG32_4_1_WGM8_WGMXCC1_WGMXCCGn1
    SolutionIndex: 67
    SolutionNameMin: Cijk_Alik_Bljk_BBS_BH_Bias_HAS_SAV_UserArgs_MT96x160x32_MI16x16x1_SN_LDSB1_GRVWA8_GRVWB8_GSU1_GSUC0_GSUWGMRR0_K1_LBSPPA128_LBSPPB128_MIWT3_5_SS1_SU32_SUM0_SUS256_SVW1_TLDS1_WG32_4_1_WGM8_WGMXCC1_WGMXCCGn1
    SolutionIndex: 68
    SolutionNameMin: Cijk_Alik_Bljk_BBS_BH_Bias_HAS_SAV_UserArgs_MT128x128x32_MI16x16x1_SN_LDSB1_GRVWA8_GRVWB8_GSU1_GSUC0_GSUWGMRR0_K1_LBSPPA128_LBSPPB128_MIWT8_2_SS1_SU32_SUM0_SUS256_SVW1_TLDS1_WG16_8_1_WGM8_WGMXCC1_WGMXCCGn1
    SolutionIndex: 69
    SolutionNameMin: Cijk_Alik_Bljk_BBS_BH_Bias_HAS_SAV_UserArgs_MT128x112x32_MI16x16x1_SN_LDSB1_GRVWA8_GRVWB4_GSU1_GSUC0_GSUWGMRR0_K1_LBSPPA128_LBSPPB128_MIWT2_7_SS0_SU32_SUM0_SUS256_SVW8_TLDS1_WG64_2_1_WGM8_WGMXCC1_WGMXCCGn1
    SolutionIndex: 70
    SolutionNameMin: Cijk_Alik_Bljk_BBS_BH_Bias_HAS_SAV_UserArgs_MT16x16x64_MI16x16x1_SN_LDSB0_GRVWA8_GRVWB8_GSU1_GSUC0_GSUWGMRR0_K1_LBSPPA128_LBSPPB128_MIWT1_1_SS1_SU32_SUM0_SUS256_SVW1_TLDS1_WG16_2_1_WGM8_WGMXCC1_WGMXCCGn1
    SolutionIndex: 71
    SolutionNameMin: Cijk_Alik_Bljk_BBS_BH_Bias_HAS_SAV_UserArgs_MT32x64x64_MI16x16x1_SN_LDSB0_GRVWA8_GRVWB8_GSU1_GSUC0_GSUWGMRR0_K1_LBSPPA128_LBSPPB128_MIWT1_2_SS0_SU32_SUM0_SUS256_SVW8_TLDS1_WG32_4_1_WGM8_WGMXCC1_WGMXCCGn1
    SolutionIndex: 72
    SolutionNameMin: Cijk_Alik_Bljk_BBS_BH_Bias_HAS_SAV_UserArgs_MT64x64x32_MI16x16x1_SN_LDSB0_GRVWA8_GRVWB8_GSU1_GSUC0_GSUWGMRR0_K1_LBSPPA1024_LBSPPB1024_MIWT4_1_SS0_SU32_SUM0_SUS256_SVW8_TLDS0_WG16_8_1_WGM8_WGMXCC1_WGMXCCGn1
    SolutionIndex: 73
    SolutionNameMin: Cijk_Alik_Bljk_BBS_BH_Bias_HAS_SAV_UserArgs_MT16x16x64_MI16x16x1_SN_LDSB0_GRVWA8_GRVWB8_GSU1_GSUC0_GSUWGMRR0_K1_LBSPPA128_LBSPPB128_MIWT1_1_SS0_SU32_SUM0_SUS256_SVW8_TLDS1_WG16_2_1_WGM8_WGMXCC1_WGMXCCGn1
    SolutionIndex: 74
    SolutionNameMin: Cijk_Alik_Bljk_BBS_BH_Bias_HAS_SAV_UserArgs_MT128x64x64_MI16x16x1_SN_LDSB1_GRVWA8_GRVWB8_GSU1_GSUC0_GSUWGMRR0_K1_LBSPPA128_LBSPPB128_MIWT2_4_SS0_SU32_SUM0_SUS256_SVW8_TLDS1_WG64_2_1_WGM8_WGMXCC1_WGMXCCGn1
    SolutionIndex: 75
    SolutionNameMin: Cijk_Alik_Bljk_BBS_BH_Bias_HAS_SAV_UserArgs_MT48x256x32_MI16x16x1_SN_LDSB1_GRVWA4_GRVWB8_GSU1_GSUC0_GSUWGMRR0_K1_LBSPPA128_LBSPPB128_MIWT3_4_SS1_SU32_SUM0_SUS256_SVW1_TLDS1_WG16_8_1_WGM8_WGMXCC1_WGMXCCGn1
    SolutionIndex: 76
    SolutionNameMin: Cijk_Alik_Bljk_BBS_BH_Bias_HAS_SAV_UserArgs_MT80x192x32_MI16x16x1_SN_LDSB1_GRVWA4_GRVWB8_GSU1_GSUC0_GSUWGMRR0_K1_LBSPPA128_LBSPPB128_MIWT5_3_SS0_SU32_SUM0_SUS256_SVW8_TLDS1_WG16_8_1_WGM8_WGMXCC1_WGMXCCGn1
    SolutionIndex: 77
    SolutionNameMin: Cijk_Alik_Bljk_BBS_BH_Bias_HAS_SAV_UserArgs_MT112x128x32_MI16x16x1_SN_LDSB1_GRVWA4_GRVWB8_GSU1_GSUC0_GSUWGMRR0_K1_LBSPPA128_LBSPPB128_MIWT7_2_SS0_SU32_SUM0_SUS256_SVW8_TLDS1_WG16_8_1_WGM8_WGMXCC1_WGMXCCGn1
    SolutionIndex: 78
    SolutionNameMin: Cijk_Alik_Bljk_BBS_BH_Bias_HAS_SAV_UserArgs_MT64x64x64_MI16x16x1_SN_LDSB1_GRVWA8_GRVWB8_GSU1_GSUC0_GSUWGMRR0_K1_LBSPPA128_LBSPPB128_MIWT2_2_SS0_SU32_SUM0_SUS256_SVW8_TLDS1_WG32_4_1_WGM8_WGMXCC1_WGMXCCGn1
    SolutionIndex: 79
    SolutionNameMin: Cijk_Alik_Bljk_BBS_BH_Bias_HAS_SAV_UserArgs_MT64x128x64_MI16x16x1_SN_LDSB1_GRVWA8_GRVWB8_GSU1_GSUC0_GSUWGMRR0_K1_LBSPPA128_LBSPPB128_MIWT2_4_SS0_SU32_SUM0_SUS256_SVW8_TLDS1_WG32_4_1_WGM8_WGMXCC1_WGMXCCGn1
    SolutionIndex: 80
    SolutionNameMin: Cijk_Alik_Bljk_BBS_BH_Bias_HAS_SAV_UserArgs_MT192x80x32_MI16x16x1_SN_LDSB1_GRVWA8_GRVWB4_GSU1_GSUC0_GSUWGMRR0_K1_LBSPPA128_LBSPPB128_MIWT3_5_SS0_SU32_SUM0_SUS256_SVW8_TLDS1_WG64_2_1_WGM8_WGMXCC1_WGMXCCGn1
    SolutionIndex: 81
    SolutionNameMin: Cijk_Alik_Bljk_BBS_BH_Bias_HAS_SAV_UserArgs_MT112x128x32_MI16x16x1_SN_LDSB1_GRVWA4_GRVWB8_GSU1_GSUC0_GSUWGMRR0_K1_LBSPPA128_LBSPPB128_MIWT7_2_SS1_SU32_SUM0_SUS256_SVW1_TLDS1_WG16_8_1_WGM8_WGMXCC1_WGMXCCGn1
    SolutionIndex: 82
    SolutionNameMin: Cijk_Alik_Bljk_BBS_BH_Bias_HAS_SAV_UserArgs_MT64x192x32_MI16x16x1_SN_LDSB1_GRVWA8_GRVWB8_GSU1_GSUC0_GSUWGMRR0_K1_LBSPPA128_LBSPPB128_MIWT2_6_SS1_SU32_SUM0_SUS256_SVW1_TLDS1_WG32_4_1_WGM8_WGMXCC1_WGMXCCGn1
    SolutionIndex: 83
    SolutionNameMin: Cijk_Alik_Bljk_BBS_BH_Bias_HAS_SAV_UserArgs_MT64x256x32_MI16x16x1_SN_LDSB1_GRVWA8_GRVWB8_GSU1_GSUC0_GSUWGMRR0_K1_LBSPPA128_LBSPPB128_MIWT4_4_SS1_SU32_SUM0_SUS256_SVW1_TLDS1_WG16_8_1_WGM8_WGMXCC1_WGMXCCGn1
    SolutionIndex: 84
    SolutionNameMin: Cijk_Alik_Bljk_BBS_BH_Bias_HAS_SAV_UserArgs_MT64x256x32_MI16x16x1_SN_LDSB1_GRVWA8_GRVWB8_GSU1_GSUC0_GSUWGMRR0_K1_LBSPPA128_LBSPPB128_MIWT4_4_SS0_SU32_SUM0_SUS256_SVW8_TLDS1_WG16_8_1_WGM8_WGMXCC1_WGMXCCGn1
    SolutionIndex: 85
    SolutionNameMin: Cijk_Alik_Bljk_BBS_BH_Bias_HAS_SAV_UserArgs_MT16x16x64_MI16x16x1_SN_LDSB0_GRVWA8_GRVWB8_GSU1_GSUC0_GSUWGMRR0_K1_LBSPPA128_LBSPPB128_MIWT1_1_SS0_SU32_SUM0_SUS256_SVW8_TLDS1_WG16_2_1_WGM8_WGMXCC1_WGMXCCGn1
    SolutionIndex: 86
    SolutionNameMin: Cijk_Alik_Bljk_BBS_BH_Bias_HAS_SAV_UserArgs_MT96x64x64_MI16x16x1_SN_LDSB1_GRVWA8_GRVWB8_GSU1_GSUC0_GSUWGMRR0_K1_LBSPPA128_LBSPPB128_MIWT3_2_SS0_SU32_SUM0_SUS256_SVW8_TLDS1_WG32_4_1_WGM8_WGMXCC1_WGMXCCGn1
    SolutionIndex: 87
    SolutionNameMin: Cijk_Alik_Bljk_BBS_BH_Bias_HAS_SAV_UserArgs_MT48x128x32_MI16x16x1_SN_LDSB0_GRVWA4_GRVWB8_GSU1_GSUC0_GSUWGMRR0_K1_LBSPPA128_LBSPPB128_MIWT3_2_SS1_SU32_SUM0_SUS256_SVW1_TLDS1_WG16_8_1_WGM8_WGMXCC1_WGMXCCGn1
    SolutionIndex: 88
    SolutionNameMin: Cijk_Alik_Bljk_BBS_BH_Bias_HAS_SAV_UserArgs_MT96x96x32_MI16x16x1_SN_LDSB0_GRVWA8_GRVWB8_GSU1_GSUC0_GSUWGMRR0_K1_LBSPPA128_LBSPPB128_MIWT3_3_SS0_SU32_SUM0_SUS256_SVW8_TLDS1_WG32_4_1_WGM8_WGMXCC1_WGMXCCGn1
    SolutionIndex: 89
    SolutionNameMin: Cijk_Alik_Bljk_BBS_BH_Bias_HAS_SAV_UserArgs_MT96x128x32_MI16x16x1_SN_LDSB1_GRVWA8_GRVWB8_GSU1_GSUC0_GSUWGMRR0_K1_LBSPPA128_LBSPPB128_MIWT3_4_SS0_SU32_SUM0_SUS256_SVW8_TLDS1_WG32_4_1_WGM8_WGMXCC1_WGMXCCGn1
    SolutionIndex: 90
    SolutionNameMin: Cijk_Alik_Bljk_BBS_BH_Bias_HAS_SAV_UserArgs_MT96x160x32_MI16x16x1_SN_LDSB1_GRVWA8_GRVWB8_GSU1_GSUC0_GSUWGMRR0_K1_LBSPPA128_LBSPPB128_MIWT3_5_SS0_SU32_SUM0_SUS256_SVW8_TLDS1_WG32_4_1_WGM8_WGMXCC1_WGMXCCGn1
    SolutionIndex: 91
    SolutionNameMin: Cijk_Alik_Bljk_BBS_BH_Bias_HAS_SAV_UserArgs_MT48x192x64_MI16x16x1_SN_LDSB1_GRVWA8_GRVWB8_GSU1_GSUC0_GSUWGMRR0_K1_LBSPPA128_LBSPPB128_MIWT3_3_SS1_SU32_SUM0_SUS256_SVW1_TLDS1_WG16_8_1_WGM8_WGMXCC1_WGMXCCGn1
    SolutionIndex: 92
    SolutionNameMin: Cijk_Alik_Bljk_BBS_BH_Bias_HAS_SAV_UserArgs_MT128x64x64_MI16x16x1_SN_LDSB1_GRVWA8_GRVWB8_GSU1_GSUC0_GSUWGMRR0_K1_LBSPPA128_LBSPPB128_MIWT2_4_SS1_SU32_SUM0_SUS256_SVW1_TLDS1_WG64_2_1_WGM8_WGMXCC1_WGMXCCGn1
    SolutionIndex: 93
    SolutionNameMin: Cijk_Alik_Bljk_BBS_BH_Bias_HAS_SAV_UserArgs_MT160x96x32_MI16x16x1_SN_LDSB1_GRVWA8_GRVWB8_GSU1_GSUC0_GSUWGMRR0_K1_LBSPPA128_LBSPPB128_MIWT5_3_SS0_SU32_SUM0_SUS256_SVW8_TLDS1_WG32_4_1_WGM8_WGMXCC1_WGMXCCGn1
    SolutionIndex: 94
    SolutionNameMin: Cijk_Alik_Bljk_BBS_BH_Bias_HAS_SAV_UserArgs_MT128x128x32_MI16x16x1_SN_LDSB1_GRVWA8_GRVWB8_GSU1_GSUC0_GSUWGMRR0_K1_LBSPPA128_LBSPPB128_MIWT4_4_SS0_SU32_SUM0_SUS256_SVW8_TLDS1_WG32_4_1_WGM8_WGMXCC1_WGMXCCGn1
    SolutionIndex: 95
    SolutionNameMin: Cijk_Alik_Bljk_BBS_BH_Bias_HAS_SAV_UserArgs_MT128x128x32_MI16x16x1_SN_LDSB1_GRVWA8_GRVWB8_GSU1_GSUC0_GSUWGMRR0_K1_LBSPPA128_LBSPPB128_MIWT4_4_SS1_SU32_SUM0_SUS256_SVW1_TLDS1_WG32_4_1_WGM8_WGMXCC1_WGMXCCGn1
    SolutionIndex: 96
    SolutionNameMin: Cijk_Alik_Bljk_BBS_BH_Bias_HAS_SAV_UserArgs_MT128x128x32_MI16x16x1_SN_LDSB1_GRVWA8_GRVWB8_GSU1_GSUC0_GSUWGMRR0_K1_LBSPPA128_LBSPPB128_MIWT2_8_SS0_SU32_SUM0_SUS256_SVW8_TLDS1_WG64_2_1_WGM8_WGMXCC1_WGMXCCGn1
    SolutionIndex: 97
    SolutionNameMin: Cijk_Alik_Bljk_BBS_BH_Bias_HAS_SAV_UserArgs_MT64x224x32_MI16x16x1_SN_LDSB1_GRVWA8_GRVWB8_GSU1_GSUC0_GSUWGMRR0_K1_LBSPPA128_LBSPPB128_MIWT2_7_SS0_SU32_SUM0_SUS256_SVW8_TLDS1_WG32_4_1_WGM8_WGMXCC1_WGMXCCGn1
    SolutionIndex: 98
    SolutionNameMin: Cijk_Alik_Bljk_BBS_BH_Bias_HAS_SAV_UserArgs_MT64x256x32_MI16x16x1_SN_LDSB1_GRVWA8_GRVWB8_GSU1_GSUC0_GSUWGMRR0_K1_LBSPPA128_LBSPPB128_MIWT4_4_SS0_SU32_SUM0_SUS256_SVW8_TLDS1_WG16_8_1_WGM8_WGMXCC1_WGMXCCGn1
    SolutionIndex: 99
    SolutionNameMin: Cijk_Alik_Bljk_BBS_BH_Bias_HAS_SAV_UserArgs_MT128x96x32_MI16x16x1_SN_LDSB1_GRVWA8_GRVWB8_GSU1_GSUC0_GSUWGMRR0_K1_LBSPPA128_LBSPPB128_MIWT2_6_SS0_SU32_SUM0_SUS256_SVW8_TLDS1_WG64_2_1_WGM8_WGMXCC1_WGMXCCGn1
    SolutionIndex: 100
    SolutionNameMin: Cijk_Alik_Bljk_BBS_BH_Bias_HAS_SAV_UserArgs_MT160x96x32_MI16x16x1_SN_LDSB1_GRVWA8_GRVWB8_GSU1_GSUC0_GSUWGMRR0_K1_LBSPPA128_LBSPPB128_MIWT5_3_SS1_SU32_SUM0_SUS256_SVW1_TLDS1_WG32_4_1_WGM8_WGMXCC1_WGMXCCGn1
    SolutionIndex: 101
    SolutionNameMin: Cijk_Alik_Bljk_BBS_BH_Bias_HAS_SAV_UserArgs_MT96x128x32_MI16x16x1_SN_LDSB1_GRVWA8_GRVWB8_GSU1_GSUC0_GSUWGMRR0_K1_LBSPPA128_LBSPPB128_MIWT3_4_SS1_SU32_SUM0_SUS256_SVW1_TLDS1_WG32_4_1_WGM8_WGMXCC1_WGMXCCGn1
    SolutionIndex: 102
    SolutionNameMin: Cijk_Alik_Bljk_BBS_BH_Bias_HAS_SAV_UserArgs_MT128x96x32_MI16x16x1_SN_LDSB1_GRVWA8_GRVWB8_GSU1_GSUC0_GSUWGMRR0_K1_LBSPPA128_LBSPPB128_MIWT4_3_SS0_SU32_SUM0_SUS256_SVW8_TLDS1_WG32_4_1_WGM8_WGMXCC1_WGMXCCGn1
    SolutionIndex: 103
    SolutionNameMin: Cijk_Alik_Bljk_BBS_BH_Bias_HAS_SAV_UserArgs_MT96x160x32_MI16x16x1_SN_LDSB1_GRVWA8_GRVWB8_GSU1_GSUC0_GSUWGMRR0_K1_LBSPPA128_LBSPPB128_MIWT3_5_SS1_SU32_SUM0_SUS256_SVW1_TLDS1_WG32_4_1_WGM8_WGMXCC1_WGMXCCGn1
    SolutionIndex: 104
    SolutionNameMin: Cijk_Alik_Bljk_BBS_BH_Bias_HAS_SAV_UserArgs_MT128x128x32_MI16x16x1_SN_LDSB1_GRVWA8_GRVWB8_GSU1_GSUC0_GSUWGMRR0_K1_LBSPPA128_LBSPPB128_MIWT8_2_SS0_SU32_SUM0_SUS256_SVW8_TLDS1_WG16_8_1_WGM8_WGMXCC1_WGMXCCGn1
    SolutionIndex: 105
    SolutionNameMin: Cijk_Alik_Bljk_BBS_BH_Bias_HAS_SAV_UserArgs_MT192x16x64_MI16x16x1_SN_LDSB1_GRVWA8_GRVWB8_GSU1_GSUC0_GSUWGMRR0_K1_LBSPPA3072_LBSPPB256_MIWT3_1_SS0_SU32_SUM0_SUS256_SVW8_TLDS0_WG64_2_1_WGM8_WGMXCC1_WGMXCCGn1
    SolutionIndex: 106
    SolutionNameMin: Cijk_Alik_Bljk_BBS_BH_Bias_HAS_SAV_UserArgs_MT96x32x64_MI16x16x1_SN_LDSB1_GRVWA8_GRVWB8_GSU1_GSUC0_GSUWGMRR0_K1_LBSPPA128_LBSPPB128_MIWT3_1_SS1_SU32_SUM0_SUS256_SVW1_TLDS1_WG32_4_1_WGM8_WGMXCC1_WGMXCCGn1
    SolutionIndex: 107
    SolutionNameMin: Cijk_Alik_Bljk_BBS_BH_Bias_HAS_SAV_UserArgs_MT48x128x64_MI16x16x1_SN_LDSB1_GRVWA8_GRVWB8_GSU1_GSUC0_GSUWGMRR0_K1_LBSPPA128_LBSPPB128_MIWT3_2_SS1_SU32_SUM0_SUS256_SVW1_TLDS1_WG16_8_1_WGM8_WGMXCC1_WGMXCCGn1
    SolutionIndex: 108
    SolutionNameMin: Cijk_Alik_Bljk_BBS_BH_Bias_HAS_SAV_UserArgs_MT96x96x64_MI16x16x1_SN_LDSB1_GRVWA8_GRVWB8_GSU1_GSUC0_GSUWGMRR0_K1_LBSPPA128_LBSPPB128_MIWT3_3_SS0_SU32_SUM0_SUS256_SVW8_TLDS1_WG32_4_1_WGM8_WGMXCC1_WGMXCCGn1
    SolutionIndex: 109
    SolutionNameMin: Cijk_Alik_Bljk_BBS_BH_Bias_HAS_SAV_UserArgs_MT64x128x64_MI16x16x1_SN_LDSB1_GRVWA8_GRVWB8_GSU1_GSUC0_GSUWGMRR0_K1_LBSPPA128_LBSPPB128_MIWT4_2_SS0_SU32_SUM0_SUS256_SVW8_TLDS1_WG16_8_1_WGM8_WGMXCC1_WGMXCCGn1
    SolutionIndex: 110
    SolutionNameMin: Cijk_Alik_Bljk_BBS_BH_Bias_HAS_SAV_UserArgs_MT64x64x32_MI16x16x1_SN_LDSB0_GRVWA8_GRVWB8_GSU1_GSUC0_GSUWGMRR0_K1_LBSPPA128_LBSPPB128_MIWT1_4_SS0_SU32_SUM0_SUS256_SVW8_TLDS1_WG64_2_1_WGM8_WGMXCC1_WGMXCCGn1
    SolutionIndex: 111
    SolutionNameMin: Cijk_Alik_Bljk_BBS_BH_Bias_HAS_SAV_UserArgs_MT80x64x64_MI16x16x1_SN_LDSB1_GRVWA8_GRVWB8_GSU1_GSUC0_GSUWGMRR0_K1_LBSPPA128_LBSPPB128_MIWT5_1_SS0_SU32_SUM0_SUS256_SVW8_TLDS1_WG16_8_1_WGM8_WGMXCC1_WGMXCCGn1
    SolutionIndex: 112
    SolutionNameMin: Cijk_Alik_Bljk_BBS_BH_Bias_HAS_SAV_UserArgs_MT128x64x64_MI16x16x1_SN_LDSB1_GRVWA8_GRVWB8_GSU1_GSUC0_GSUWGMRR0_K1_LBSPPA128_LBSPPB128_MIWT4_2_SS1_SU32_SUM0_SUS256_SVW1_TLDS1_WG32_4_1_WGM8_WGMXCC1_WGMXCCGn1
    SolutionIndex: 113
    SolutionNameMin: Cijk_Alik_Bljk_BBS_BH_Bias_HAS_SAV_UserArgs_MT80x192x32_MI16x16x1_SN_LDSB1_GRVWA4_GRVWB8_GSU1_GSUC0_GSUWGMRR0_K1_LBSPPA128_LBSPPB128_MIWT5_3_SS0_SU32_SUM0_SUS256_SVW8_TLDS1_WG16_8_1_WGM8_WGMXCC1_WGMXCCGn1
    SolutionIndex: 114
    SolutionNameMin: Cijk_Alik_Bljk_BBS_BH_Bias_HAS_SAV_UserArgs_MT128x112x32_MI16x16x1_SN_LDSB1_GRVWA8_GRVWB4_GSU1_GSUC0_GSUWGMRR0_K1_LBSPPA128_LBSPPB128_MIWT2_7_SS0_SU32_SUM0_SUS256_SVW8_TLDS1_WG64_2_1_WGM8_WGMXCC1_WGMXCCGn1
    SolutionIndex: 115
    SolutionNameMin: Cijk_Alik_Bljk_BBS_BH_Bias_HAS_SAV_UserArgs_MT32x16x64_MI16x16x1_SN_LDSB0_GRVWA8_GRVWB8_GSU1_GSUC0_GSUWGMRR0_K1_LBSPPA128_LBSPPB128_MIWT1_1_SS0_SU32_SUM0_SUS256_SVW8_TLDS1_WG32_2_1_WGM8_WGMXCC1_WGMXCCGn1
    SolutionIndex: 116
    SolutionNameMin: Cijk_Alik_Bljk_BBS_BH_Bias_HAS_SAV_UserArgs_MT64x64x64_MI16x16x1_SN_LDSB1_GRVWA8_GRVWB8_GSU1_GSUC0_GSUWGMRR0_K1_LBSPPA128_LBSPPB128_MIWT2_2_SS1_SU32_SUM0_SUS256_SVW1_TLDS1_WG32_4_1_WGM8_WGMXCC1_WGMXCCGn1
    SolutionIndex: 117
    SolutionNameMin: Cijk_Alik_Bljk_BBS_BH_Bias_HAS_SAV_UserArgs_MT128x64x64_MI16x16x1_SN_LDSB1_GRVWA8_GRVWB8_GSU1_GSUC0_GSUWGMRR0_K1_LBSPPA128_LBSPPB128_MIWT2_4_SS0_SU32_SUM0_SUS256_SVW8_TLDS1_WG64_2_1_WGM8_WGMXCC1_WGMXCCGn1
    SolutionIndex: 118
    SolutionNameMin: Cijk_Alik_Bljk_BBS_BH_Bias_HAS_SAV_UserArgs_MT64x192x32_MI16x16x1_SN_LDSB1_GRVWA8_GRVWB8_GSU1_GSUC0_GSUWGMRR0_K1_LBSPPA128_LBSPPB128_MIWT4_3_SS0_SU32_SUM0_SUS256_SVW8_TLDS1_WG16_8_1_WGM8_WGMXCC1_WGMXCCGn1
    SolutionIndex: 119
    SolutionNameMin: Cijk_Alik_Bljk_BBS_BH_Bias_HAS_SAV_UserArgs_MT112x128x32_MI16x16x1_SN_LDSB1_GRVWA4_GRVWB8_GSU1_GSUC0_GSUWGMRR0_K1_LBSPPA128_LBSPPB128_MIWT7_2_SS0_SU32_SUM0_SUS256_SVW8_TLDS1_WG16_8_1_WGM8_WGMXCC1_WGMXCCGn1
    SolutionIndex: 120
    SolutionNameMin: Cijk_Alik_Bljk_BBS_BH_Bias_HAS_SAV_UserArgs_MT64x160x32_MI16x16x1_SN_LDSB1_GRVWA8_GRVWB8_GSU1_GSUC0_GSUWGMRR0_K1_LBSPPA128_LBSPPB128_MIWT2_5_SS1_SU32_SUM0_SUS256_SVW1_TLDS1_WG32_4_1_WGM8_WGMXCC1_WGMXCCGn1
    SolutionIndex: 121
    SolutionNameMin: Cijk_Alik_Bljk_BBS_BH_Bias_HAS_SAV_UserArgs_MT80x128x64_MI16x16x1_SN_LDSB1_GRVWA8_GRVWB8_GSU1_GSUC0_GSUWGMRR0_K1_LBSPPA128_LBSPPB128_MIWT5_2_SS0_SU32_SUM0_SUS256_SVW8_TLDS1_WG16_8_1_WGM8_WGMXCC1_WGMXCCGn1
    SolutionIndex: 122
    SolutionNameMin: Cijk_Alik_Bljk_BBS_BH_Bias_HAS_SAV_UserArgs_MT128x96x32_MI16x16x1_SN_LDSB1_GRVWA8_GRVWB8_GSU1_GSUC0_GSUWGMRR0_K1_LBSPPA128_LBSPPB128_MIWT4_3_SS1_SU32_SUM0_SUS256_SVW1_TLDS1_WG32_4_1_WGM8_WGMXCC1_WGMXCCGn1
    SolutionIndex: 123
    SolutionNameMin: Cijk_Alik_Bljk_BBS_BH_Bias_HAS_SAV_UserArgs_MT64x16x32_MI16x16x1_SN_LDSB0_GRVWA8_GRVWB4_GSU1_GSUC0_GSUWGMRR0_K1_LBSPPA128_LBSPPB128_MIWT1_1_SS1_SU32_SUM0_SUS256_SVW1_TLDS1_WG64_2_1_WGM8_WGMXCC1_WGMXCCGn1
    SolutionIndex: 124
    SolutionNameMin: Cijk_Alik_Bljk_BBS_BH_Bias_HAS_SAV_UserArgs_MT64x32x64_MI16x16x1_SN_LDSB0_GRVWA8_GRVWB8_GSU1_GSUC0_GSUWGMRR0_K1_LBSPPA128_LBSPPB128_MIWT1_2_SS0_SU32_SUM0_SUS256_SVW8_TLDS1_WG64_2_1_WGM8_WGMXCC1_WGMXCCGn1
    SolutionIndex: 125
    SolutionNameMin: Cijk_Alik_Bljk_BBS_BH_Bias_HAS_SAV_UserArgs_MT192x64x32_MI16x16x1_SN_LDSB1_GRVWA8_GRVWB8_GSU1_GSUC0_GSUWGMRR0_K1_LBSPPA128_LBSPPB128_MIWT3_4_SS0_SU32_SUM0_SUS256_SVW8_TLDS1_WG64_2_1_WGM8_WGMXCC1_WGMXCCGn1
    SolutionIndex: 126
    SolutionNameMin: Cijk_Alik_Bljk_BBS_BH_Bias_HAS_SAV_UserArgs_MT192x48x64_MI16x16x1_SN_LDSB1_GRVWA8_GRVWB8_GSU1_GSUC0_GSUWGMRR0_K1_LBSPPA128_LBSPPB128_MIWT3_3_SS1_SU32_SUM0_SUS256_SVW1_TLDS1_WG64_2_1_WGM8_WGMXCC1_WGMXCCGn1
    SolutionIndex: 127
    SolutionNameMin: Cijk_Alik_Bljk_BBS_BH_Bias_HAS_SAV_UserArgs_MT80x128x32_MI16x16x1_SN_LDSB1_GRVWA4_GRVWB8_GSU1_GSUC0_GSUWGMRR0_K1_LBSPPA128_LBSPPB128_MIWT5_2_SS0_SU32_SUM0_SUS256_SVW8_TLDS1_WG16_8_1_WGM8_WGMXCC1_WGMXCCGn1
    SolutionIndex: 128
    SolutionNameMin: Cijk_Alik_Bljk_BBS_BH_Bias_HAS_SAV_UserArgs_MT96x96x64_MI16x16x1_SN_LDSB1_GRVWA8_GRVWB8_GSU1_GSUC0_GSUWGMRR0_K1_LBSPPA128_LBSPPB128_MIWT3_3_SS1_SU32_SUM0_SUS256_SVW1_TLDS1_WG32_4_1_WGM8_WGMXCC1_WGMXCCGn1
    SolutionIndex: 129
    SolutionNameMin: Cijk_Alik_Bljk_BBS_BH_Bias_HAS_SAV_UserArgs_MT32x32x64_MI16x16x1_SN_LDSB0_GRVWA8_GRVWB8_GSU1_GSUC0_GSUWGMRR0_K1_LBSPPA128_LBSPPB128_MIWT1_1_SS1_SU32_SUM0_SUS256_SVW1_TLDS1_WG32_4_1_WGM8_WGMXCC1_WGMXCCGn1
    SolutionIndex: 130
    SolutionNameMin: Cijk_Alik_Bljk_BBS_BH_Bias_HAS_SAV_UserArgs_MT32x64x64_MI16x16x1_SN_LDSB0_GRVWA8_GRVWB8_GSU1_GSUC0_GSUWGMRR0_K1_LBSPPA128_LBSPPB128_MIWT2_1_SS0_SU32_SUM0_SUS256_SVW8_TLDS1_WG16_8_1_WGM8_WGMXCC1_WGMXCCGn1
    SolutionIndex: 131
    SolutionNameMin: Cijk_Alik_Bljk_BBS_BH_Bias_HAS_SAV_UserArgs_MT64x64x32_MI16x16x1_SN_LDSB0_GRVWA8_GRVWB8_GSU1_GSUC0_GSUWGMRR0_K1_LBSPPA128_LBSPPB128_MIWT2_2_SS1_SU32_SUM0_SUS256_SVW1_TLDS1_WG32_4_1_WGM8_WGMXCC1_WGMXCCGn1
    SolutionIndex: 132
    SolutionNameMin: Cijk_Alik_Bljk_BBS_BH_Bias_HAS_SAV_UserArgs_MT128x48x64_MI16x16x1_SN_LDSB1_GRVWA8_GRVWB8_GSU1_GSUC0_GSUWGMRR0_K1_LBSPPA128_LBSPPB128_MIWT2_3_SS1_SU32_SUM0_SUS256_SVW1_TLDS1_WG64_2_1_WGM8_WGMXCC1_WGMXCCGn1
    SolutionIndex: 133
    SolutionNameMin: Cijk_Alik_Bljk_BBS_BH_Bias_HAS_SAV_UserArgs_MT64x48x32_MI16x16x1_SN_LDSB0_GRVWA8_GRVWB4_GSU1_GSUC0_GSUWGMRR0_K1_LBSPPA128_LBSPPB128_MIWT1_3_SS0_SU32_SUM0_SUS256_SVW8_TLDS1_WG64_2_1_WGM8_WGMXCC1_WGMXCCGn1
    SolutionIndex: 134
    SolutionNameMin: Cijk_Alik_Bljk_BBS_BH_Bias_HAS_SAV_UserArgs_MT32x64x32_MI16x16x1_SN_LDSB0_GRVWA8_GRVWB8_GSU1_GSUC0_GSUWGMRR0_K1_LBSPPA128_LBSPPB128_MIWT2_1_SS1_SU32_SUM0_SUS256_SVW1_TLDS1_WG16_8_1_WGM8_WGMXCC1_WGMXCCGn1
    SolutionIndex: 135
    SolutionNameMin: Cijk_Alik_Bljk_BBS_BH_Bias_HAS_SAV_UserArgs_MT64x96x32_MI16x16x1_SN_LDSB0_GRVWA8_GRVWB8_GSU1_GSUC0_GSUWGMRR0_K1_LBSPPA128_LBSPPB128_MIWT2_3_SS0_SU32_SUM0_SUS256_SVW8_TLDS1_WG32_4_1_WGM8_WGMXCC1_WGMXCCGn1
    SolutionIndex: 136
    SolutionNameMin: Cijk_Alik_Bljk_BBS_BH_Bias_HAS_SAV_UserArgs_MT64x128x64_MI16x16x1_SN_LDSB1_GRVWA8_GRVWB8_GSU1_GSUC0_GSUWGMRR0_K1_LBSPPA128_LBSPPB128_MIWT2_4_SS0_SU32_SUM0_SUS256_SVW8_TLDS1_WG32_4_1_WGM8_WGMXCC1_WGMXCCGn1
    SolutionIndex: 137
    SolutionNameMin: Cijk_Alik_Bljk_BBS_BH_Bias_HAS_SAV_UserArgs_MT128x80x32_MI16x16x1_SN_LDSB1_GRVWA8_GRVWB4_GSU1_GSUC0_GSUWGMRR0_K1_LBSPPA128_LBSPPB128_MIWT2_5_SS0_SU32_SUM0_SUS256_SVW8_TLDS1_WG64_2_1_WGM8_WGMXCC1_WGMXCCGn1
    SolutionIndex: 138
    SolutionNameMin: Cijk_Alik_Bljk_BBS_BH_Bias_HAS_SAV_UserArgs_MT64x160x32_MI16x16x1_SN_LDSB1_GRVWA8_GRVWB8_GSU1_GSUC0_GSUWGMRR0_K1_LBSPPA128_LBSPPB128_MIWT2_5_SS0_SU32_SUM0_SUS256_SVW8_TLDS1_WG32_4_1_WGM8_WGMXCC1_WGMXCCGn1
    SolutionIndex: 139
    SolutionNameMin: Cijk_Alik_Bljk_BBS_BH_Bias_HAS_SAV_UserArgs_MT64x192x32_MI16x16x1_SN_LDSB1_GRVWA8_GRVWB8_GSU1_GSUC0_GSUWGMRR0_K1_LBSPPA128_LBSPPB128_MIWT2_6_SS1_SU32_SUM0_SUS256_SVW1_TLDS1_WG32_4_1_WGM8_WGMXCC1_WGMXCCGn1
    SolutionIndex: 140
    SolutionNameMin: Cijk_Alik_Bljk_BBS_BH_Bias_HAS_SAV_UserArgs_MT64x192x32_MI16x16x1_SN_LDSB1_GRVWA8_GRVWB8_GSU1_GSUC0_GSUWGMRR0_K1_LBSPPA128_LBSPPB128_MIWT2_6_SS0_SU32_SUM0_SUS256_SVW8_TLDS1_WG32_4_1_WGM8_WGMXCC1_WGMXCCGn1
    SolutionIndex: 141
    SolutionNameMin: Cijk_Alik_Bljk_BBS_BH_Bias_HAS_SAV_UserArgs_MT128x80x64_MI16x16x1_SN_LDSB1_GRVWA8_GRVWB8_GSU1_GSUC0_GSUWGMRR0_K1_LBSPPA128_LBSPPB128_MIWT2_5_SS0_SU32_SUM0_SUS256_SVW8_TLDS1_WG64_2_1_WGM8_WGMXCC1_WGMXCCGn1
    SolutionIndex: 142
    SolutionNameMin: Cijk_Alik_Bljk_BBS_BH_Bias_HAS_SAV_UserArgs_MT256x64x32_MI16x16x1_SN_LDSB1_GRVWA8_GRVWB8_GSU1_GSUC0_GSUWGMRR0_K1_LBSPPA128_LBSPPB128_MIWT4_4_SS0_SU32_SUM0_SUS256_SVW8_TLDS1_WG64_2_1_WGM8_WGMXCC1_WGMXCCGn1
    SolutionIndex: 143
    SolutionNameMin: Cijk_Alik_Bljk_BBS_BH_Bias_HAS_SAV_UserArgs_MT16x16x64_MI16x16x1_SN_LDSB0_GRVWA8_GRVWB8_GSU1_GSUC0_GSUWGMRR0_K1_LBSPPA128_LBSPPB128_MIWT1_1_SS1_SU32_SUM0_SUS256_SVW1_TLDS1_WG16_2_1_WGM8_WGMXCC1_WGMXCCGn1
    SolutionIndex: 144
    SolutionNameMin: Cijk_Alik_Bljk_BBS_BH_Bias_HAS_SAV_UserArgs_MT48x64x64_MI16x16x1_SN_LDSB1_GRVWA8_GRVWB8_GSU1_GSUC0_GSUWGMRR0_K1_LBSPPA128_LBSPPB128_MIWT3_1_SS0_SU32_SUM0_SUS256_SVW8_TLDS1_WG16_8_1_WGM8_WGMXCC1_WGMXCCGn1
    SolutionIndex: 145
    SolutionNameMin: Cijk_Alik_Bljk_BBS_BH_Bias_HAS_SAV_UserArgs_MT96x96x32_MI16x16x1_SN_LDSB0_GRVWA8_GRVWB8_GSU1_GSUC0_GSUWGMRR0_K1_LBSPPA128_LBSPPB128_MIWT3_3_SS1_SU32_SUM0_SUS256_SVW1_TLDS1_WG32_4_1_WGM8_WGMXCC1_WGMXCCGn1
    SolutionIndex: 146
    SolutionNameMin: Cijk_Alik_Bljk_BBS_BH_Bias_HAS_SAV_UserArgs_MT96x64x32_MI16x16x1_SN_LDSB0_GRVWA8_GRVWB8_GSU1_GSUC0_GSUWGMRR0_K1_LBSPPA128_LBSPPB128_MIWT3_2_SS0_SU32_SUM0_SUS256_SVW8_TLDS1_WG32_4_1_WGM8_WGMXCC1_WGMXCCGn1
    SolutionIndex: 147
    SolutionNameMin: Cijk_Alik_Bljk_BBS_BH_Bias_HAS_SAV_UserArgs_MT96x128x32_MI16x16x1_SN_LDSB1_GRVWA8_GRVWB8_GSU1_GSUC0_GSUWGMRR0_K1_LBSPPA128_LBSPPB128_MIWT6_2_SS0_SU32_SUM0_SUS256_SVW8_TLDS1_WG16_8_1_WGM8_WGMXCC1_WGMXCCGn1
    SolutionIndex: 148
    SolutionNameMin: Cijk_Alik_Bljk_BBS_BH_Bias_HAS_SAV_UserArgs_MT192x80x32_MI16x16x1_SN_LDSB1_GRVWA8_GRVWB4_GSU1_GSUC0_GSUWGMRR0_K1_LBSPPA128_LBSPPB128_MIWT3_5_SS0_SU32_SUM0_SUS256_SVW8_TLDS1_WG64_2_1_WGM8_WGMXCC1_WGMXCCGn1
    SolutionIndex: 149
    SolutionNameMin: Cijk_Alik_Bljk_BBS_BH_Bias_HAS_SAV_UserArgs_MT64x256x32_MI16x16x1_SN_LDSB1_GRVWA8_GRVWB8_GSU1_GSUC0_GSUWGMRR0_K1_LBSPPA128_LBSPPB128_MIWT4_4_SS1_SU32_SUM0_SUS256_SVW1_TLDS1_WG16_8_1_WGM8_WGMXCC1_WGMXCCGn1
    SolutionIndex: 150
    SolutionNameMin: Cijk_Alik_Bljk_BBS_BH_Bias_HAS_SAV_UserArgs_MT112x128x32_MI16x16x1_SN_LDSB1_GRVWA4_GRVWB8_GSU1_GSUC0_GSUWGMRR0_K1_LBSPPA128_LBSPPB128_MIWT7_2_SS1_SU32_SUM0_SUS256_SVW1_TLDS1_WG16_8_1_WGM8_WGMXCC1_WGMXCCGn1
    SolutionIndex: 151
    SolutionNameMin: Cijk_Alik_Bljk_BBS_BH_Bias_HAS_SAV_UserArgs_MT32x16x32_MI16x16x1_SN_LDSB0_GRVWA8_GRVWB8_GSU1_GSUC0_GSUWGMRR0_K1_LBSPPA128_LBSPPB128_MIWT1_1_SS0_SU32_SUM0_SUS256_SVW8_TLDS1_WG32_2_1_WGM8_WGMXCC1_WGMXCCGn1
    SolutionIndex: 152
    SolutionNameMin: Cijk_Alik_Bljk_BBS_BH_Bias_HAS_SAV_UserArgs_MT32x64x64_MI16x16x1_SN_LDSB0_GRVWA8_GRVWB8_GSU1_GSUC0_GSUWGMRR0_K1_LBSPPA128_LBSPPB128_MIWT1_2_SS0_SU32_SUM0_SUS256_SVW8_TLDS1_WG32_4_1_WGM8_WGMXCC1_WGMXCCGn1
    SolutionIndex: 153
    SolutionNameMin: Cijk_Alik_Bljk_BBS_BH_Bias_HAS_SAV_UserArgs_MT48x64x32_MI16x16x1_SN_LDSB0_GRVWA4_GRVWB8_GSU1_GSUC0_GSUWGMRR0_K1_LBSPPA128_LBSPPB128_MIWT3_1_SS0_SU32_SUM0_SUS256_SVW8_TLDS1_WG16_8_1_WGM8_WGMXCC1_WGMXCCGn1
    SolutionIndex: 154
    SolutionNameMin: Cijk_Alik_Bljk_BBS_BH_Bias_HAS_SAV_UserArgs_MT48x128x32_MI16x16x1_SN_LDSB0_GRVWA4_GRVWB8_GSU1_GSUC0_GSUWGMRR0_K1_LBSPPA128_LBSPPB128_MIWT3_2_SS0_SU32_SUM0_SUS256_SVW8_TLDS1_WG16_8_1_WGM8_WGMXCC1_WGMXCCGn1
    SolutionIndex: 155
    SolutionNameMin: Cijk_Alik_Bljk_BBS_BH_Bias_HAS_SAV_UserArgs_MT64x192x32_MI16x16x1_SN_LDSB1_GRVWA8_GRVWB8_GSU1_GSUC0_GSUWGMRR0_K1_LBSPPA128_LBSPPB128_MIWT4_3_SS1_SU32_SUM0_SUS256_SVW1_TLDS1_WG16_8_1_WGM8_WGMXCC1_WGMXCCGn1
    SolutionIndex: 156
    SolutionNameMin: Cijk_Alik_Bljk_BBS_BH_Bias_HAS_SAV_UserArgs_MT192x64x32_MI16x16x1_SN_LDSB1_GRVWA8_GRVWB8_GSU1_GSUC0_GSUWGMRR0_K1_LBSPPA128_LBSPPB128_MIWT6_2_SS0_SU32_SUM0_SUS256_SVW8_TLDS1_WG32_4_1_WGM8_WGMXCC1_WGMXCCGn1
    SolutionIndex: 157
    SolutionNameMin: Cijk_Alik_Bljk_BBS_BH_Bias_HAS_SAV_UserArgs_MT192x80x32_MI16x16x1_SN_LDSB1_GRVWA8_GRVWB4_GSU1_GSUC0_GSUWGMRR0_K1_LBSPPA128_LBSPPB128_MIWT3_5_SS1_SU32_SUM0_SUS256_SVW1_TLDS1_WG64_2_1_WGM8_WGMXCC1_WGMXCCGn1
    SolutionIndex: 158
    SolutionNameMin: Cijk_Alik_Bljk_BBS_BH_Bias_HAS_SAV_UserArgs_MT16x64x32_MI16x16x1_SN_LDSB0_GRVWA4_GRVWB8_GSU1_GSUC0_GSUWGMRR0_K1_LBSPPA128_LBSPPB128_MIWT1_1_SS0_SU32_SUM0_SUS256_SVW8_TLDS1_WG16_8_1_WGM8_WGMXCC1_WGMXCCGn1
    SolutionIndex: 159
    SolutionNameMin: Cijk_Alik_Bljk_BBS_BH_Bias_HAS_SAV_UserArgs_MT64x96x32_MI16x16x1_SN_LDSB0_GRVWA8_GRVWB8_GSU1_GSUC0_GSUWGMRR0_K1_LBSPPA1024_LBSPPB1536_MIWT1_6_SS0_SU32_SUM0_SUS256_SVW8_TLDS0_WG64_2_1_WGM8_WGMXCC1_WGMXCCGn1
    SolutionIndex: 160
    SolutionNameMin: Cijk_Alik_Bljk_BBS_BH_Bias_HAS_SAV_UserArgs_MT80x128x64_MI16x16x1_SN_LDSB1_GRVWA8_GRVWB8_GSU1_GSUC0_GSUWGMRR0_K1_LBSPPA128_LBSPPB128_MIWT5_2_SS1_SU32_SUM0_SUS256_SVW1_TLDS1_WG16_8_1_WGM8_WGMXCC1_WGMXCCGn1
    SolutionIndex: 161
    SolutionNameMin: Cijk_Alik_Bljk_BBS_BH_Bias_HAS_SAV_UserArgs_MT32x64x64_MI16x16x1_SN_LDSB0_GRVWA8_GRVWB8_GSU1_GSUC0_GSUWGMRR0_K1_LBSPPA512_LBSPPB1024_MIWT1_2_SS1_SU32_SUM0_SUS256_SVW1_TLDS0_WG32_4_1_WGM8_WGMXCC1_WGMXCCGn1
    SolutionIndex: 162
    SolutionNameMin: Cijk_Alik_Bljk_BBS_BH_Bias_HAS_SAV_UserArgs_MT64x96x64_MI16x16x1_SN_LDSB1_GRVWA8_GRVWB8_GSU1_GSUC0_GSUWGMRR0_K1_LBSPPA128_LBSPPB128_MIWT2_3_SS0_SU32_SUM0_SUS256_SVW8_TLDS1_WG32_4_1_WGM8_WGMXCC1_WGMXCCGn1
    SolutionIndex: 163
    SolutionNameMin: Cijk_Alik_Bljk_BBS_BH_Bias_HAS_SAV_UserArgs_MT32x64x64_MI16x16x1_SN_LDSB0_GRVWA8_GRVWB8_GSU1_GSUC0_GSUWGMRR0_K1_LBSPPA128_LBSPPB128_MIWT1_2_SS1_SU32_SUM0_SUS256_SVW1_TLDS1_WG32_4_1_WGM8_WGMXCC1_WGMXCCGn1
    SolutionIndex: 164
    SolutionNameMin: Cijk_Alik_Bljk_BBS_BH_Bias_HAS_SAV_UserArgs_MT48x192x64_MI16x16x1_SN_LDSB1_GRVWA8_GRVWB8_GSU1_GSUC0_GSUWGMRR0_K1_LBSPPA128_LBSPPB128_MIWT3_3_SS0_SU32_SUM0_SUS256_SVW8_TLDS1_WG16_8_1_WGM8_WGMXCC1_WGMXCCGn1
    SolutionIndex: 165
    SolutionNameMin: Cijk_Alik_Bljk_BBS_BH_Bias_HAS_SAV_UserArgs_MT32x64x32_MI16x16x1_SN_LDSB0_GRVWA8_GRVWB8_GSU1_GSUC0_GSUWGMRR0_K1_LBSPPA128_LBSPPB128_MIWT1_2_SS1_SU32_SUM0_SUS256_SVW1_TLDS1_WG32_4_1_WGM8_WGMXCC1_WGMXCCGn1
    SolutionIndex: 166
    SolutionNameMin: Cijk_Alik_Bljk_BBS_BH_Bias_HAS_SAV_UserArgs_MT64x32x64_MI16x16x1_SN_LDSB0_GRVWA8_GRVWB8_GSU1_GSUC0_GSUWGMRR0_K1_LBSPPA128_LBSPPB128_MIWT2_1_SS0_SU32_SUM0_SUS256_SVW8_TLDS1_WG32_4_1_WGM8_WGMXCC1_WGMXCCGn1
    SolutionIndex: 167
    SolutionNameMin: Cijk_Alik_Bljk_BBS_BH_Bias_HAS_SAV_UserArgs_MT80x192x32_MI16x16x1_SN_LDSB1_GRVWA4_GRVWB8_GSU1_GSUC0_GSUWGMRR0_K1_LBSPPA128_LBSPPB128_MIWT5_3_SS1_SU32_SUM0_SUS256_SVW1_TLDS1_WG16_8_1_WGM8_WGMXCC1_WGMXCCGn1
    SolutionIndex: 168
    SolutionNameMin: Cijk_Alik_Bljk_BBS_BH_Bias_HAS_SAV_UserArgs_MT32x16x64_MI16x16x1_SN_LDSB0_GRVWA8_GRVWB8_GSU1_GSUC0_GSUWGMRR0_K1_LBSPPA128_LBSPPB128_MIWT1_1_SS1_SU32_SUM0_SUS256_SVW1_TLDS1_WG32_2_1_WGM8_WGMXCC1_WGMXCCGn1
    SolutionIndex: 169
    SolutionNameMin: Cijk_Alik_Bljk_BBS_BH_Bias_HAS_SAV_UserArgs_MT64x16x64_MI16x16x1_SN_LDSB0_GRVWA8_GRVWB8_GSU1_GSUC0_GSUWGMRR0_K1_LBSPPA128_LBSPPB128_MIWT1_1_SS1_SU32_SUM0_SUS256_SVW1_TLDS1_WG64_2_1_WGM8_WGMXCC1_WGMXCCGn1
    SolutionIndex: 170
    SolutionNameMin: Cijk_Alik_Bljk_BBS_BH_Bias_HAS_SAV_UserArgs_MT192x48x64_MI16x16x1_SN_LDSB1_GRVWA8_GRVWB8_GSU1_GSUC0_GSUWGMRR0_K1_LBSPPA128_LBSPPB128_MIWT3_3_SS0_SU32_SUM0_SUS256_SVW8_TLDS1_WG64_2_1_WGM8_WGMXCC1_WGMXCCGn1
    SolutionIndex: 171
    SolutionNameMin: Cijk_Alik_Bljk_BBS_BH_Bias_HAS_SAV_UserArgs_MT16x16x32_MI16x16x1_SN_LDSB0_GRVWA8_GRVWB8_GSU1_GSUC0_GSUWGMRR0_K1_LBSPPA128_LBSPPB128_MIWT1_1_SS1_SU32_SUM0_SUS256_SVW1_TLDS1_WG16_2_1_WGM8_WGMXCC1_WGMXCCGn1
    SolutionIndex: 172
    SolutionNameMin: Cijk_Alik_Bljk_BBS_BH_Bias_HAS_SAV_UserArgs_MT64x224x32_MI16x16x1_SN_LDSB1_GRVWA8_GRVWB8_GSU1_GSUC0_GSUWGMRR0_K1_LBSPPA128_LBSPPB128_MIWT2_7_SS1_SU32_SUM0_SUS256_SVW1_TLDS1_WG32_4_1_WGM8_WGMXCC1_WGMXCCGn1
    SolutionIndex: 173
    SolutionNameMin: Cijk_Alik_Bljk_BBS_BH_Bias_HAS_SAV_UserArgs_MT80x64x64_MI16x16x1_SN_LDSB1_GRVWA8_GRVWB8_GSU1_GSUC0_GSUWGMRR0_K1_LBSPPA128_LBSPPB128_MIWT5_1_SS1_SU32_SUM0_SUS256_SVW1_TLDS1_WG16_8_1_WGM8_WGMXCC1_WGMXCCGn1
    SolutionIndex: 174
    SolutionNameMin: Cijk_Alik_Bljk_BBS_BH_Bias_HAS_SAV_UserArgs_MT32x64x32_MI16x16x1_SN_LDSB0_GRVWA8_GRVWB8_GSU1_GSUC0_GSUWGMRR0_K1_LBSPPA128_LBSPPB128_MIWT2_1_SS0_SU32_SUM0_SUS256_SVW8_TLDS1_WG16_8_1_WGM8_WGMXCC1_WGMXCCGn1
    SolutionIndex: 175
    SolutionNameMin: Cijk_Alik_Bljk_BBS_BH_Bias_HAS_SAV_UserArgs_MT32x128x64_MI16x16x1_SN_LDSB1_GRVWA8_GRVWB8_GSU1_GSUC0_GSUWGMRR0_K1_LBSPPA128_LBSPPB128_MIWT2_2_SS0_SU32_SUM0_SUS256_SVW8_TLDS1_WG16_8_1_WGM8_WGMXCC1_WGMXCCGn1
    SolutionIndex: 176
    SolutionNameMin: Cijk_Alik_Bljk_BBS_BH_Bias_HAS_SAV_UserArgs_MT64x128x32_MI16x16x1_SN_LDSB0_GRVWA8_GRVWB8_GSU1_GSUC0_GSUWGMRR0_K1_LBSPPA128_LBSPPB128_MIWT2_4_SS0_SU32_SUM0_SUS256_SVW8_TLDS1_WG32_4_1_WGM8_WGMXCC1_WGMXCCGn1
    SolutionIndex: 177
    SolutionNameMin: Cijk_Alik_Bljk_BBS_BH_Bias_HAS_SAV_UserArgs_MT128x80x64_MI16x16x1_SN_LDSB1_GRVWA8_GRVWB8_GSU1_GSUC0_GSUWGMRR0_K1_LBSPPA128_LBSPPB128_MIWT2_5_SS1_SU32_SUM0_SUS256_SVW1_TLDS1_WG64_2_1_WGM8_WGMXCC1_WGMXCCGn1
    SolutionIndex: 178
    SolutionNameMin: Cijk_Alik_Bljk_BBS_BH_Bias_HAS_SAV_UserArgs_MT128x128x32_MI16x16x1_SN_LDSB1_GRVWA8_GRVWB8_GSU1_GSUC0_GSUWGMRR0_K1_LBSPPA128_LBSPPB128_MIWT2_8_SS1_SU32_SUM0_SUS256_SVW1_TLDS1_WG64_2_1_WGM8_WGMXCC1_WGMXCCGn1
- - - [512, 512, 1, 64]
    - [11, 1131.84]
  - - [1024, 512, 1, 64]
    - [3, 2046.5]
  - - [1536, 512, 1, 64]
    - [5, 2832.63]
  - - [2048, 512, 1, 64]
    - [1, 3619.68]
  - - [2560, 512, 1, 64]
    - [4, 4289.31]
  - - [3072, 512, 1, 64]
    - [4, 5043.88]
  - - [512, 1024, 1, 64]
    - [4, 2088.6]
  - - [1024, 1024, 1, 64]
    - [2, 3693.59]
  - - [1536, 1024, 1, 64]
    - [4, 5043.76]
  - - [2048, 1024, 1, 64]
    - [3, 5929.0]
  - - [2560, 1024, 1, 64]
    - [6, 6985.99]
  - - [3072, 1024, 1, 64]
    - [4, 7814.41]
  - - [512, 1536, 1, 64]
    - [3, 2822.31]
  - - [1024, 1536, 1, 64]
    - [4, 5040.09]
  - - [1536, 1536, 1, 64]
    - [1, 6542.53]
  - - [2048, 1536, 1, 64]
    - [4, 7775.18]
  - - [2560, 1536, 1, 64]
    - [4, 8900.85]
  - - [3072, 1536, 1, 64]
    - [4, 9853.65]
  - - [512, 2048, 1, 64]
    - [6, 3716.09]
  - - [1024, 2048, 1, 64]
    - [1, 5907.99]
  - - [1536, 2048, 1, 64]
    - [4, 7794.75]
  - - [2048, 2048, 1, 64]
    - [4, 9256.71]
  - - [2560, 2048, 1, 64]
    - [4, 10386.4]
  - - [3072, 2048, 1, 64]
    - [5, 11218.2]
  - - [512, 2560, 1, 64]
    - [4, 4281.65]
  - - [1024, 2560, 1, 64]
    - [7, 6698.29]
  - - [1536, 2560, 1, 64]
    - [5, 8896.13]
  - - [2048, 2560, 1, 64]
    - [4, 10133.5]
  - - [2560, 2560, 1, 64]
    - [2, 11539.1]
  - - [3072, 2560, 1, 64]
    - [1, 12551.4]
  - - [512, 3072, 1, 64]
    - [1, 5022.37]
  - - [1024, 3072, 1, 64]
    - [1, 7505.05]
  - - [1536, 3072, 1, 64]
    - [1, 9829.44]
  - - [2048, 3072, 1, 64]
    - [4, 11303.3]
  - - [2560, 3072, 1, 64]
    - [7, 12434.8]
  - - [3072, 3072, 1, 64]
    - [1, 13456.3]
  - - [512, 512, 1, 256]
    - [0, 3818.86]
  - - [1024, 512, 1, 256]
    - [4, 7196.66]
  - - [1536, 512, 1, 256]
    - [4, 9144.35]
  - - [2048, 512, 1, 256]
    - [4, 11408.5]
  - - [2560, 512, 1, 256]
    - [4, 12809.7]
  - - [3072, 512, 1, 256]
    - [4, 14104.2]
  - - [512, 1024, 1, 256]
    - [17, 7202.45]
  - - [1024, 1024, 1, 256]
    - [1, 11010.0]
  - - [1536, 1024, 1, 256]
    - [1, 14441.1]
  - - [2048, 1024, 1, 256]
    - [1, 16287.6]
  - - [2560, 1024, 1, 256]
    - [4, 18464.9]
  - - [3072, 1024, 1, 256]
    - [1, 20007.1]
  - - [512, 1536, 1, 256]
    - [4, 9232.41]
  - - [1024, 1536, 1, 256]
    - [1, 14448.6]
  - - [1536, 1536, 1, 256]
    - [4, 17194.7]
  - - [2048, 1536, 1, 256]
    - [4, 19878.7]
  - - [2560, 1536, 1, 256]
    - [4, 21584.0]
  - - [3072, 1536, 1, 256]
    - [1, 22774.3]
  - - [512, 2048, 1, 256]
    - [4, 11154.4]
  - - [1024, 2048, 1, 256]
    - [4, 16613.2]
  - - [1536, 2048, 1, 256]
    - [4, 19720.0]
  - - [2048, 2048, 1, 256]
    - [1, 22195.8]
  - - [2560, 2048, 1, 256]
    - [4, 23639.7]
  - - [3072, 2048, 1, 256]
    - [1, 25225.1]
  - - [512, 2560, 1, 256]
    - [4, 12506.3]
  - - [1024, 2560, 1, 256]
    - [4, 18331.2]
  - - [1536, 2560, 1, 256]
    - [4, 21584.0]
  - - [2048, 2560, 1, 256]
    - [19, 23933.0]
  - - [2560, 2560, 1, 256]
    - [1, 25278.3]
  - - [3072, 2560, 1, 256]
    - [1, 26967.2]
  - - [512, 3072, 1, 256]
    - [4, 14335.4]
  - - [1024, 3072, 1, 256]
    - [4, 19746.6]
  - - [1536, 3072, 1, 256]
    - [4, 22963.0]
  - - [2048, 3072, 1, 256]
    - [4, 25016.7]
  - - [2560, 3072, 1, 256]
    - [1, 26691.8]
  - - [3072, 3072, 1, 256]
    - [4, 27611.9]
  - - [512, 512, 1, 512]
    - [13, 7017.55]
  - - [1024, 512, 1, 512]
    - [4, 12074.6]
  - - [1536, 512, 1, 512]
    - [1, 14389.5]
  - - [2048, 512, 1, 512]
    - [20, 17174.6]
  - - [2560, 512, 1, 512]
    - [1, 18346.3]
  - - [3072, 512, 1, 512]
    - [1, 20869.9]
  - - [512, 1024, 1, 512]
    - [4, 11858.0]
  - - [1024, 1024, 1, 512]
    - [1, 17263.6]
  - - [1536, 1024, 1, 512]
    - [1, 20382.3]
  - - [2048, 1024, 1, 512]
    - [1, 23074.8]
  - - [2560, 1024, 1, 512]
    - [4, 24844.8]
  - - [3072, 1024, 1, 512]
    - [4, 26508.2]
  - - [512, 1536, 1, 512]
    - [17, 14428.1]
  - - [1024, 1536, 1, 512]
    - [4, 20785.6]
  - - [1536, 1536, 1, 512]
    - [4, 23077.5]
  - - [2048, 1536, 1, 512]
    - [1, 26148.2]
  - - [2560, 1536, 1, 512]
    - [4, 27371.4]
  - - [3072, 1536, 1, 512]
    - [17, 29072.1]
  - - [512, 2048, 1, 512]
    - [4, 17664.6]
  - - [1024, 2048, 1, 512]
    - [4, 23099.9]
  - - [1536, 2048, 1, 512]
    - [4, 26250.3]
  - - [2048, 2048, 1, 512]
    - [4, 28624.7]
  - - [2560, 2048, 1, 512]
    - [4, 28991.8]
  - - [3072, 2048, 1, 512]
    - [1, 30185.2]
  - - [512, 2560, 1, 512]
    - [1, 18773.0]
  - - [1024, 2560, 1, 512]
    - [4, 25089.5]
  - - [1536, 2560, 1, 512]
    - [17, 26780.5]
  - - [2048, 2560, 1, 512]
    - [17, 29535.1]
  - - [2560, 2560, 1, 512]
    - [4, 30957.3]
  - - [3072, 2560, 1, 512]
    - [4, 31762.6]
  - - [512, 3072, 1, 512]
    - [4, 20753.4]
  - - [1024, 3072, 1, 512]
    - [4, 26237.9]
  - - [1536, 3072, 1, 512]
    - [4, 28640.1]
  - - [2048, 3072, 1, 512]
    - [4, 30390.6]
  - - [2560, 3072, 1, 512]
    - [17, 31538.6]
  - - [3072, 3072, 1, 512]
    - [1, 32706.3]
  - - [512, 512, 1, 1024]
    - [15, 11117.6]
  - - [1024, 512, 1, 1024]
    - [19, 18357.7]
  - - [1536, 512, 1, 1024]
    - [4, 20069.4]
  - - [2048, 512, 1, 1024]
    - [17, 23587.8]
  - - [2560, 512, 1, 1024]
    - [1, 23693.9]
  - - [3072, 512, 1, 1024]
    - [1, 26646.6]
  - - [512, 1024, 1, 1024]
    - [1, 18124.7]
  - - [1024, 1024, 1, 1024]
    - [19, 23967.7]
  - - [1536, 1024, 1, 1024]
    - [1, 26750.4]
  - - [2048, 1024, 1, 1024]
    - [1, 28711.2]
  - - [2560, 1024, 1, 1024]
    - [17, 30367.4]
  - - [3072, 1024, 1, 1024]
    - [6, 31081.1]
  - - [512, 1536, 1, 1024]
    - [1, 20246.5]
  - - [1024, 1536, 1, 1024]
    - [4, 27120.9]
  - - [1536, 1536, 1, 1024]
    - [6, 27946.7]
  - - [2048, 1536, 1, 1024]
    - [1, 31691.9]
  - - [2560, 1536, 1, 1024]
    - [1, 31615.5]
  - - [3072, 1536, 1, 1024]
    - [20, 32386.7]
  - - [512, 2048, 1, 1024]
    - [19, 23890.4]
  - - [1024, 2048, 1, 1024]
    - [4, 29312.2]
  - - [1536, 2048, 1, 1024]
    - [4, 31593.8]
  - - [2048, 2048, 1, 1024]
    - [1, 32514.4]
  - - [2560, 2048, 1, 1024]
    - [17, 33441.9]
  - - [3072, 2048, 1, 1024]
    - [1, 33751.2]
  - - [512, 2560, 1, 1024]
    - [4, 24273.3]
  - - [1024, 2560, 1, 1024]
    - [4, 30872.6]
  - - [1536, 2560, 1, 1024]
    - [1, 30981.5]
  - - [2048, 2560, 1, 1024]
    - [17, 33489.3]
  - - [2560, 2560, 1, 1024]
    - [3, 33926.5]
  - - [3072, 2560, 1, 1024]
    - [1, 35153.9]
  - - [512, 3072, 1, 1024]
    - [4, 27201.0]
  - - [1024, 3072, 1, 1024]
    - [4, 31670.4]
  - - [1536, 3072, 1, 1024]
    - [17, 32943.5]
  - - [2048, 3072, 1, 1024]
    - [1, 33271.4]
  - - [2560, 3072, 1, 1024]
    - [1, 34281.6]
  - - [3072, 3072, 1, 1024]
    - [1, 35205.5]
  - - [512, 512, 1, 2048]
    - [13, 15858.4]
  - - [1024, 512, 1, 2048]
    - [19, 24837.3]
  - - [1536, 512, 1, 2048]
    - [1, 24867.8]
  - - [2048, 512, 1, 2048]
    - [4, 29460.8]
  - - [2560, 512, 1, 2048]
    - [4, 28262.8]
  - - [3072, 512, 1, 2048]
    - [19, 31985.2]
  - - [512, 1024, 1, 2048]
    - [19, 24779.7]
  - - [1024, 1024, 1, 2048]
    - [1, 29354.1]
  - - [1536, 1024, 1, 2048]
    - [4, 31620.5]
  - - [2048, 1024, 1, 2048]
    - [4, 32749.4]
  - - [2560, 1024, 1, 2048]
    - [1, 33944.4]
  - - [3072, 1024, 1, 2048]
    - [19, 34116.6]
  - - [512, 1536, 1, 2048]
    - [19, 25092.9]
  - - [1024, 1536, 1, 2048]
    - [4, 31863.0]
  - - [1536, 1536, 1, 2048]
    - [19, 31392.0]
  - - [2048, 1536, 1, 2048]
    - [19, 34443.0]
  - - [2560, 1536, 1, 2048]
    - [1, 34168.8]
  - - [3072, 1536, 1, 2048]
    - [4, 34863.3]
  - - [512, 2048, 1, 2048]
    - [4, 29461.2]
  - - [1024, 2048, 1, 2048]
    - [4, 33197.0]
  - - [1536, 2048, 1, 2048]
    - [17, 34372.8]
  - - [2048, 2048, 1, 2048]
    - [4, 35018.0]
  - - [2560, 2048, 1, 2048]
    - [1, 35878.8]
  - - [3072, 2048, 1, 2048]
    - [1, 36021.0]
  - - [512, 2560, 1, 2048]
    - [4, 28241.9]
  - - [1024, 2560, 1, 2048]
    - [4, 33588.7]
  - - [1536, 2560, 1, 2048]
    - [1, 34152.1]
  - - [2048, 2560, 1, 2048]
    - [19, 35289.2]
  - - [2560, 2560, 1, 2048]
    - [17, 35112.0]
  - - [3072, 2560, 1, 2048]
    - [4, 36060.8]
  - - [512, 3072, 1, 2048]
    - [1, 31668.5]
  - - [1024, 3072, 1, 2048]
    - [17, 34452.3]
  - - [1536, 3072, 1, 2048]
    - [4, 36120.6]
  - - [2048, 3072, 1, 2048]
    - [19, 36110.4]
  - - [2560, 3072, 1, 2048]
    - [4, 36058.3]
  - - [3072, 3072, 1, 2048]
    - [4, 36694.5]
  - - [512, 512, 1, 3072]
    - [15, 18835.2]
  - - [1024, 512, 1, 3072]
    - [19, 27916.7]
  - - [1536, 512, 1, 3072]
    - [4, 27353.8]
  - - [2048, 512, 1, 3072]
    - [4, 32518.9]
  - - [2560, 512, 1, 3072]
    - [6, 29850.6]
  - - [3072, 512, 1, 3072]
    - [1, 33443.5]
  - - [512, 1024, 1, 3072]
    - [4, 27945.8]
  - - [1024, 1024, 1, 3072]
    - [17, 31996.4]
  - - [1536, 1024, 1, 3072]
    - [1, 33940.1]
  - - [2048, 1024, 1, 3072]
    - [4, 34608.9]
  - - [2560, 1024, 1, 3072]
    - [1, 35421.1]
  - - [3072, 1024, 1, 3072]
    - [1, 36053.7]
  - - [512, 1536, 1, 3072]
    - [1, 27516.0]
  - - [1024, 1536, 1, 3072]
    - [19, 33895.1]
  - - [1536, 1536, 1, 3072]
    - [1, 32973.2]
  - - [2048, 1536, 1, 3072]
    - [4, 35897.7]
  - - [2560, 1536, 1, 3072]
    - [17, 34625.4]
  - - [3072, 1536, 1, 3072]
    - [1, 35997.5]
  - - [512, 2048, 1, 3072]
    - [4, 32305.0]
  - - [1024, 2048, 1, 3072]
    - [4, 34318.0]
  - - [1536, 2048, 1, 3072]
    - [17, 35643.7]
  - - [2048, 2048, 1, 3072]
    - [19, 35777.8]
  - - [2560, 2048, 1, 3072]
    - [4, 36045.4]
  - - [3072, 2048, 1, 3072]
    - [17, 36339.3]
  - - [512, 2560, 1, 3072]
    - [18, 30484.9]
  - - [1024, 2560, 1, 3072]
    - [17, 34803.6]
  - - [1536, 2560, 1, 3072]
    - [20, 35231.7]
  - - [2048, 2560, 1, 3072]
    - [1, 36340.3]
  - - [2560, 2560, 1, 3072]
    - [20, 35421.3]
  - - [3072, 2560, 1, 3072]
    - [4, 36974.8]
  - - [512, 3072, 1, 3072]
    - [1, 33797.5]
  - - [1024, 3072, 1, 3072]
    - [19, 36148.3]
  - - [1536, 3072, 1, 3072]
    - [1, 37101.5]
  - - [2048, 3072, 1, 3072]
    - [17, 36773.7]
  - - [2560, 3072, 1, 3072]
    - [19, 36481.1]
  - - [3072, 3072, 1, 3072]
    - [4, 36856.4]
  - - [1, 1, 1, 1]
    - [12, 6.63196e-05]
  - - [1, 1, 1, 64]
    - [16, 0.00410401]
  - - [1, 64, 1, 1]
    - [12, 0.00425292]
  - - [64, 1, 1, 1]
    - [16, 0.00425164]
  - - [64, 64, 1, 1]
    - [14, 0.258097]
  - - [64, 1, 1, 64]
    - [21, 0.265036]
  - - [1, 64, 1, 64]
    - [16, 0.271916]
  - - [64, 64, 1, 64]
    - [8, 17.8232]
  - - [64, 64, 1, 256]
    - [9, 66.767]
  - - [64, 64, 1, 512]
    - [10, 122.087]
  - - [64, 64, 1, 1024]
    - [9, 207.244]
  - - [64, 64, 1, 2048]
    - [21, 317.871]
  - - [64, 64, 1, 4096]
    - [22, 445.829]
  - - [5120, 1, 1, 3072]
    - [23, 0.26]
  - - [5120, 64, 1, 3072]
    - [24, 13.0]
  - - [5120, 128, 1, 3072]
    - [25, 22.66]
  - - [5120, 192, 1, 3072]
    - [26, 28.32]
  - - [5120, 256, 1, 3072]
    - [27, 31.47]
  - - [5120, 320, 1, 3072]
    - [28, 33.12]
  - - [5120, 384, 1, 3072]
    - [26, 39.43]
  - - [5120, 448, 1, 3072]
    - [29, 38.22]
  - - [5120, 512, 1, 3072]
    - [29, 42.7]
  - - [5120, 576, 1, 3072]
    - [30, 36.72]
  - - [5120, 640, 1, 3072]
    - [31, 39.58]
  - - [5120, 704, 1, 3072]
    - [32, 39.82]
  - - [5120, 768, 1, 3072]
    - [33, 43.44]
  - - [5120, 832, 1, 3072]
    - [26, 40.75]
  - - [5120, 896, 1, 3072]
    - [29, 43.5]
  - - [5120, 960, 1, 3072]
    - [29, 44.42]
  - - [5120, 1024, 1, 3072]
    - [29, 46.29]
  - - [5120, 1088, 1, 3072]
    - [32, 42.57]
  - - [5120, 1152, 1, 3072]
    - [32, 44.68]
  - - [5120, 1216, 1, 3072]
    - [31, 43.67]
  - - [5120, 1280, 1, 3072]
    - [34, 45.69]
  - - [5120, 1344, 1, 3072]
    - [29, 45.33]
  - - [5120, 1408, 1, 3072]
    - [29, 47.67]
  - - [5120, 1472, 1, 3072]
    - [29, 46.31]
  - - [5120, 1536, 1, 3072]
    - [35, 47.23]
  - - [5120, 1600, 1, 3072]
    - [32, 45.28]
  - - [5120, 1664, 1, 3072]
    - [34, 45.98]
  - - [5120, 1728, 1, 3072]
    - [31, 46.15]
  - - [5120, 1792, 1, 3072]
    - [34, 46.61]
  - - [5120, 1856, 1, 3072]
    - [29, 45.93]
  - - [5120, 1920, 1, 3072]
    - [32, 47.83]
  - - [5120, 1984, 1, 3072]
    - [29, 47.21]
  - - [5120, 2048, 1, 3072]
    - [36, 48.36]
  - - [5120, 2112, 1, 3072]
    - [32, 45.82]
  - - [5120, 2176, 1, 3072]
    - [36, 46.36]
  - - [5120, 2240, 1, 3072]
    - [36, 46.37]
  - - [5120, 2304, 1, 3072]
    - [35, 47.5]
  - - [5120, 2368, 1, 3072]
    - [29, 46.92]
  - - [5120, 2432, 1, 3072]
    - [35, 48.26]
  - - [5120, 2496, 1, 3072]
    - [36, 47.9]
  - - [5120, 2560, 1, 3072]
    - [36, 48.87]
  - - [5120, 2624, 1, 3072]
    - [36, 46.47]
  - - [5120, 2688, 1, 3072]
    - [36, 47.34]
  - - [5120, 2752, 1, 3072]
    - [36, 47.26]
  - - [5120, 2816, 1, 3072]
    - [36, 48.38]
  - - [5120, 2880, 1, 3072]
    - [29, 48.13]
  - - [5120, 2944, 1, 3072]
    - [37, 48.03]
  - - [5120, 3008, 1, 3072]
    - [36, 48.5]
  - - [5120, 3072, 1, 3072]
    - [36, 49.54]
  - - [5120, 3136, 1, 3072]
    - [38, 46.69]
  - - [5120, 3200, 1, 3072]
    - [35, 48.09]
  - - [5120, 3264, 1, 3072]
    - [36, 48.06]
  - - [5120, 3328, 1, 3072]
    - [35, 48.44]
  - - [5120, 3392, 1, 3072]
    - [36, 47.69]
  - - [5120, 3456, 1, 3072]
    - [35, 48.98]
  - - [5120, 3520, 1, 3072]
    - [36, 48.96]
  - - [5120, 3584, 1, 3072]
    - [35, 49.36]
  - - [5120, 3648, 1, 3072]
    - [35, 47.37]
  - - [5120, 3712, 1, 3072]
    - [36, 48.89]
  - - [5120, 3776, 1, 3072]
    - [35, 48.19]
  - - [5120, 3840, 1, 3072]
    - [35, 48.95]
  - - [5120, 3904, 1, 3072]
    - [36, 47.99]
  - - [5120, 3968, 1, 3072]
    - [35, 48.88]
  - - [5120, 4032, 1, 3072]
    - [36, 48.78]
  - - [5120, 4096, 1, 3072]
    - [36, 49.4]
  - - [3072, 1, 1, 8192]
    - [39, 0.27]
  - - [3072, 64, 1, 8192]
    - [24, 13.51]
  - - [3072, 128, 1, 8192]
    - [40, 21.38]
  - - [3072, 192, 1, 8192]
    - [41, 26.69]
  - - [3072, 256, 1, 8192]
    - [42, 30.41]
  - - [3072, 320, 1, 8192]
    - [31, 34.03]
  - - [3072, 384, 1, 8192]
    - [43, 30.49]
  - - [3072, 448, 1, 8192]
    - [44, 31.12]
  - - [3072, 512, 1, 8192]
    - [45, 32.57]
  - - [3072, 576, 1, 8192]
    - [46, 32.52]
  - - [3072, 640, 1, 8192]
    - [47, 32.48]
  - - [3072, 704, 1, 8192]
    - [46, 32.74]
  - - [3072, 768, 1, 8192]
    - [46, 33.99]
  - - [3072, 832, 1, 8192]
    - [25, 32.48]
  - - [3072, 896, 1, 8192]
    - [48, 34.25]
  - - [3072, 960, 1, 8192]
    - [49, 32.7]
  - - [3072, 1024, 1, 8192]
    - [50, 32.7]
  - - [3072, 1088, 1, 8192]
    - [41, 32.81]
  - - [3072, 1152, 1, 8192]
    - [48, 33.86]
  - - [3072, 1216, 1, 8192]
    - [49, 34.11]
  - - [3072, 1280, 1, 8192]
    - [49, 34.87]
  - - [3072, 1344, 1, 8192]
    - [43, 32.35]
  - - [3072, 1408, 1, 8192]
    - [48, 34.48]
  - - [3072, 1472, 1, 8192]
    - [48, 34.68]
  - - [3072, 1536, 1, 8192]
    - [43, 36.18]
  - - [3072, 1600, 1, 8192]
    - [49, 37.73]
  - - [3072, 1664, 1, 8192]
    - [51, 35.34]
  - - [3072, 1728, 1, 8192]
    - [48, 34.17]
  - - [3072, 1792, 1, 8192]
    - [52, 35.98]
  - - [3072, 1856, 1, 8192]
    - [52, 36.91]
  - - [3072, 1920, 1, 8192]
    - [49, 38.73]
  - - [3072, 1984, 1, 8192]
    - [43, 34.76]
  - - [3072, 2048, 1, 8192]
    - [41, 35.97]
  - - [3072, 2112, 1, 8192]
    - [52, 37.05]
  - - [3072, 2176, 1, 8192]
    - [49, 37.31]
  - - [3072, 2240, 1, 8192]
    - [52, 38.33]
  - - [3072, 2304, 1, 8192]
    - [43, 38.08]
  - - [3072, 2368, 1, 8192]
    - [52, 37.0]
  - - [3072, 2432, 1, 8192]
    - [52, 37.24]
  - - [3072, 2496, 1, 8192]
    - [49, 38.2]
  - - [3072, 2560, 1, 8192]
    - [49, 39.06]
  - - [3072, 2624, 1, 8192]
    - [41, 37.9]
  - - [3072, 2688, 1, 8192]
    - [43, 38.8]
  - - [3072, 2752, 1, 8192]
    - [49, 37.7]
  - - [3072, 2816, 1, 8192]
    - [52, 38.65]
  - - [3072, 2880, 1, 8192]
    - [49, 39.2]
  - - [3072, 2944, 1, 8192]
    - [43, 38.67]
  - - [3072, 3008, 1, 8192]
    - [41, 39.0]
  - - [3072, 3072, 1, 8192]
    - [43, 38.4]
  - - [3072, 3136, 1, 8192]
    - [49, 39.54]
  - - [3072, 3200, 1, 8192]
    - [49, 39.98]
  - - [3072, 3264, 1, 8192]
    - [41, 39.49]
  - - [3072, 3328, 1, 8192]
    - [41, 40.34]
  - - [3072, 3392, 1, 8192]
    - [41, 39.2]
  - - [3072, 3456, 1, 8192]
    - [43, 40.73]
  - - [3072, 3520, 1, 8192]
    - [52, 40.63]
  - - [3072, 3584, 1, 8192]
    - [52, 39.57]
  - - [3072, 3648, 1, 8192]
    - [52, 40.01]
  - - [3072, 3712, 1, 8192]
    - [52, 39.88]
  - - [3072, 3776, 1, 8192]
    - [41, 40.39]
  - - [3072, 3840, 1, 8192]
    - [52, 41.04]
  - - [3072, 3904, 1, 8192]
    - [52, 39.39]
  - - [3072, 3968, 1, 8192]
    - [52, 40.07]
  - - [3072, 4032, 1, 8192]
    - [52, 39.88]
  - - [3072, 4096, 1, 8192]
    - [49, 40.85]
  - - [3072, 1, 1, 3072]
    - [53, 0.18]
  - - [3072, 64, 1, 3072]
    - [54, 9.52]
  - - [3072, 128, 1, 3072]
    - [55, 16.59]
  - - [3072, 192, 1, 3072]
    - [56, 21.93]
  - - [3072, 256, 1, 3072]
    - [57, 26.22]
  - - [3072, 320, 1, 3072]
    - [31, 28.86]
  - - [3072, 384, 1, 3072]
    - [41, 30.76]
  - - [3072, 448, 1, 3072]
    - [44, 32.78]
  - - [3072, 576, 1, 3072]
    - [31, 36.11]
  - - [3072, 640, 1, 3072]
    - [31, 40.12]
  - - [3072, 704, 1, 3072]
    - [31, 36.3]
  - - [3072, 768, 1, 3072]
    - [58, 38.96]
  - - [3072, 832, 1, 3072]
    - [59, 35.45]
  - - [3072, 896, 1, 3072]
    - [44, 36.7]
  - - [3072, 960, 1, 3072]
    - [32, 38.33]
  - - [3072, 1088, 1, 3072]
    - [60, 39.33]
  - - [3072, 1152, 1, 3072]
    - [36, 41.38]
  - - [3072, 1216, 1, 3072]
    - [32, 41.59]
  - - [3072, 1280, 1, 3072]
    - [31, 43.67]
  - - [3072, 1344, 1, 3072]
    - [29, 42.18]
  - - [3072, 1408, 1, 3072]
    - [29, 44.83]
  - - [3072, 1472, 1, 3072]
    - [31, 44.27]
  - - [3072, 1600, 1, 3072]
    - [29, 44.99]
  - - [3072, 1664, 1, 3072]
    - [29, 45.63]
  - - [3072, 1728, 1, 3072]
    - [33, 42.84]
  - - [3072, 1792, 1, 3072]
    - [57, 43.12]
  - - [3072, 1856, 1, 3072]
    - [57, 45.06]
  - - [3072, 1920, 1, 3072]
    - [32, 45.65]
  - - [3072, 1984, 1, 3072]
    - [31, 43.64]
  - - [3072, 2112, 1, 3072]
    - [36, 44.38]
  - - [3072, 2176, 1, 3072]
    - [35, 45.53]
  - - [3072, 2240, 1, 3072]
    - [29, 45.74]
  - - [3072, 2304, 1, 3072]
    - [34, 45.89]
  - - [3072, 2368, 1, 3072]
    - [31, 45.39]
  - - [3072, 2432, 1, 3072]
    - [29, 45.69]
  - - [3072, 2496, 1, 3072]
    - [29, 47.02]
  - - [3072, 2624, 1, 3072]
    - [57, 44.35]
  - - [3072, 2688, 1, 3072]
    - [32, 45.32]
  - - [3072, 2752, 1, 3072]
    - [29, 45.19]
  - - [3072, 2816, 1, 3072]
    - [35, 46.07]
  - - [3072, 2880, 1, 3072]
    - [31, 45.92]
  - - [3072, 2944, 1, 3072]
    - [29, 46.34]
  - - [3072, 3008, 1, 3072]
    - [29, 45.69]
  - - [3072, 3136, 1, 3072]
    - [29, 47.31]
  - - [3072, 3200, 1, 3072]
    - [34, 47.37]
  - - [3072, 3264, 1, 3072]
    - [29, 46.85]
  - - [3072, 3328, 1, 3072]
    - [36, 47.63]
  - - [3072, 3392, 1, 3072]
    - [57, 45.6]
  - - [3072, 3456, 1, 3072]
    - [42, 47.11]
  - - [3072, 3520, 1, 3072]
    - [42, 45.76]
  - - [3072, 3584, 1, 3072]
    - [36, 46.43]
  - - [3072, 3648, 1, 3072]
    - [36, 47.0]
  - - [3072, 3712, 1, 3072]
    - [35, 47.78]
  - - [3072, 3776, 1, 3072]
    - [57, 47.66]
  - - [3072, 3840, 1, 3072]
    - [57, 47.67]
  - - [3072, 3904, 1, 3072]
    - [36, 46.67]
  - - [3072, 3968, 1, 3072]
    - [34, 47.54]
  - - [3072, 4032, 1, 3072]
    - [37, 47.41]
  - - [3072, 4096, 1, 3072]
    - [37, 48.12]
  - - [16384, 1, 1, 3072]
    - [61, 0.16]
  - - [16384, 64, 1, 3072]
    - [62, 10.33]
  - - [16384, 128, 1, 3072]
    - [63, 19.58]
  - - [16384, 192, 1, 3072]
    - [64, 28.31]
  - - [16384, 256, 1, 3072]
    - [65, 34.47]
  - - [16384, 320, 1, 3072]
    - [66, 34.6]
  - - [16384, 384, 1, 3072]
    - [33, 37.89]
  - - [16384, 448, 1, 3072]
    - [32, 39.45]
  - - [16384, 512, 1, 3072]
    - [57, 41.55]
  - - [16384, 576, 1, 3072]
    - [33, 43.1]
  - - [16384, 640, 1, 3072]
    - [36, 44.38]
  - - [16384, 704, 1, 3072]
    - [29, 43.7]
  - - [16384, 768, 1, 3072]
    - [36, 43.88]
  - - [16384, 832, 1, 3072]
    - [29, 41.87]
  - - [16384, 896, 1, 3072]
    - [37, 44.86]
  - - [16384, 960, 1, 3072]
    - [33, 43.9]
  - - [16384, 1024, 1, 3072]
    - [37, 45.03]
  - - [16384, 1088, 1, 3072]
    - [44, 44.43]
  - - [16384, 1152, 1, 3072]
    - [41, 43.06]
  - - [16384, 1216, 1, 3072]
    - [67, 43.22]
  - - [16384, 1280, 1, 3072]
    - [67, 45.21]
  - - [16384, 1344, 1, 3072]
    - [44, 44.28]
  - - [16384, 1408, 1, 3072]
    - [37, 46.14]
  - - [16384, 1472, 1, 3072]
    - [68, 44.88]
  - - [16384, 1536, 1, 3072]
    - [37, 46.33]
  - - [16384, 1600, 1, 3072]
    - [37, 45.16]
  - - [16384, 1664, 1, 3072]
    - [37, 46.5]
  - - [16384, 1728, 1, 3072]
    - [68, 45.16]
  - - [16384, 1792, 1, 3072]
    - [68, 46.47]
  - - [16384, 1856, 1, 3072]
    - [35, 46.15]
  - - [16384, 1920, 1, 3072]
    - [68, 47.24]
  - - [16384, 1984, 1, 3072]
    - [68, 46.8]
  - - [16384, 2048, 1, 3072]
    - [37, 47.18]
  - - [16384, 2112, 1, 3072]
    - [38, 45.26]
  - - [16384, 2176, 1, 3072]
    - [31, 45.32]
  - - [16384, 2240, 1, 3072]
    - [69, 45.29]
  - - [16384, 2304, 1, 3072]
    - [68, 45.96]
  - - [16384, 2368, 1, 3072]
    - [35, 46.56]
  - - [16384, 2432, 1, 3072]
    - [35, 47.31]
  - - [16384, 2496, 1, 3072]
    - [35, 47.3]
  - - [16384, 2560, 1, 3072]
    - [68, 48.13]
  - - [16384, 2624, 1, 3072]
    - [68, 47.46]
  - - [16384, 2688, 1, 3072]
    - [36, 48.37]
  - - [16384, 2752, 1, 3072]
    - [35, 47.88]
  - - [16384, 2816, 1, 3072]
    - [35, 48.16]
  - - [16384, 2880, 1, 3072]
    - [68, 47.76]
  - - [16384, 2944, 1, 3072]
    - [68, 47.89]
  - - [16384, 3008, 1, 3072]
    - [68, 47.57]
  - - [16384, 3072, 1, 3072]
    - [36, 47.95]
  - - [16384, 3136, 1, 3072]
    - [38, 46.07]
  - - [16384, 3200, 1, 3072]
    - [35, 46.57]
  - - [16384, 3264, 1, 3072]
    - [36, 46.56]
  - - [16384, 3328, 1, 3072]
    - [36, 47.44]
  - - [16384, 3392, 1, 3072]
    - [36, 47.56]
  - - [16384, 3456, 1, 3072]
    - [68, 48.54]
  - - [16384, 3520, 1, 3072]
    - [35, 48.28]
  - - [16384, 3584, 1, 3072]
    - [35, 48.62]
  - - [16384, 3648, 1, 3072]
    - [35, 48.21]
  - - [16384, 3712, 1, 3072]
    - [35, 48.72]
  - - [16384, 3776, 1, 3072]
    - [68, 48.56]
  - - [16384, 3840, 1, 3072]
    - [35, 49.03]
  - - [16384, 3904, 1, 3072]
    - [35, 48.52]
  - - [16384, 3968, 1, 3072]
    - [35, 49.3]
  - - [16384, 4032, 1, 3072]
    - [35, 48.8]
  - - [16384, 4096, 1, 3072]
    - [35, 49.45]
  - - [128256, 1, 1, 3072]
    - [70, 0.19]
  - - [128256, 64, 1, 3072]
    - [71, 11.6]
  - - [128256, 128, 1, 3072]
    - [72, 22.15]
  - - [128256, 192, 1, 3072]
    - [41, 32.13]
  - - [128256, 256, 1, 3072]
    - [48, 40.35]
  - - [6144, 1, 1, 4096]
    - [73, 0.3]
  - - [6144, 64, 1, 4096]
    - [74, 15.62]
  - - [6144, 128, 1, 4096]
    - [47, 25.45]
  - - [6144, 192, 1, 4096]
    - [41, 30.54]
  - - [6144, 256, 1, 4096]
    - [75, 33.92]
  - - [6144, 320, 1, 4096]
    - [49, 35.57]
  - - [6144, 384, 1, 4096]
    - [76, 38.99]
  - - [6144, 448, 1, 4096]
    - [49, 35.99]
  - - [6144, 512, 1, 4096]
    - [65, 38.05]
  - - [6144, 576, 1, 4096]
    - [41, 41.01]
  - - [6144, 640, 1, 4096]
    - [49, 39.9]
  - - [6144, 704, 1, 4096]
    - [76, 41.17]
  - - [6144, 768, 1, 4096]
    - [76, 43.26]
  - - [6144, 832, 1, 4096]
    - [66, 38.43]
  - - [6144, 896, 1, 4096]
    - [41, 40.16]
  - - [6144, 960, 1, 4096]
    - [41, 43.0]
  - - [6144, 1024, 1, 4096]
    - [76, 41.79]
  - - [6144, 1088, 1, 4096]
    - [58, 43.86]
  - - [6144, 1152, 1, 4096]
    - [58, 44.29]
  - - [6144, 1216, 1, 4096]
    - [57, 41.31]
  - - [6144, 1280, 1, 4096]
    - [42, 42.71]
  - - [6144, 1344, 1, 4096]
    - [41, 43.57]
  - - [6144, 1408, 1, 4096]
    - [76, 43.75]
  - - [6144, 1472, 1, 4096]
    - [58, 44.69]
  - - [6144, 1536, 1, 4096]
    - [58, 45.85]
  - - [6144, 1600, 1, 4096]
    - [67, 44.14]
  - - [6144, 1664, 1, 4096]
    - [41, 42.87]
  - - [6144, 1728, 1, 4096]
    - [41, 44.34]
  - - [6144, 1792, 1, 4096]
    - [77, 43.87]
  - - [6144, 1856, 1, 4096]
    - [58, 44.37]
  - - [6144, 1920, 1, 4096]
    - [76, 45.43]
  - - [6144, 1984, 1, 4096]
    - [41, 42.6]
  - - [6144, 2048, 1, 4096]
    - [77, 43.61]
  - - [6144, 2112, 1, 4096]
    - [41, 44.5]
  - - [6144, 2176, 1, 4096]
    - [76, 44.65]
  - - [6144, 2240, 1, 4096]
    - [76, 45.21]
  - - [6144, 2304, 1, 4096]
    - [58, 45.49]
  - - [6144, 2368, 1, 4096]
    - [58, 43.54]
  - - [6144, 2432, 1, 4096]
    - [41, 43.86]
  - - [6144, 2496, 1, 4096]
    - [41, 44.93]
  - - [6144, 2560, 1, 4096]
    - [76, 45.7]
  - - [6144, 2624, 1, 4096]
    - [58, 45.31]
  - - [6144, 2688, 1, 4096]
    - [76, 45.87]
  - - [6144, 2752, 1, 4096]
    - [58, 44.18]
  - - [6144, 2816, 1, 4096]
    - [41, 44.12]
  - - [6144, 2880, 1, 4096]
    - [41, 45.19]
  - - [6144, 2944, 1, 4096]
    - [58, 45.32]
  - - [6144, 3008, 1, 4096]
    - [41, 44.11]
  - - [6144, 3072, 1, 4096]
    - [41, 45.11]
  - - [6144, 3136, 1, 4096]
    - [41, 44.25]
  - - [6144, 3200, 1, 4096]
    - [57, 44.66]
  - - [6144, 3264, 1, 4096]
    - [41, 45.02]
  - - [6144, 3328, 1, 4096]
    - [77, 44.61]
  - - [6144, 3392, 1, 4096]
    - [41, 44.62]
  - - [6144, 3456, 1, 4096]
    - [41, 45.05]
  - - [6144, 3520, 1, 4096]
    - [43, 44.41]
  - - [6144, 3584, 1, 4096]
    - [41, 44.39]
  - - [6144, 3648, 1, 4096]
    - [41, 45.45]
  - - [6144, 3712, 1, 4096]
    - [77, 44.6]
  - - [6144, 3776, 1, 4096]
    - [41, 44.57]
  - - [6144, 3840, 1, 4096]
    - [41, 45.33]
  - - [6144, 3904, 1, 4096]
    - [41, 44.5]
  - - [6144, 3968, 1, 4096]
    - [41, 44.77]
  - - [6144, 4032, 1, 4096]
    - [41, 45.42]
  - - [6144, 4096, 1, 4096]
    - [43, 44.66]
  - - [4096, 1, 1, 4096]
    - [73, 0.25]
  - - [4096, 64, 1, 4096]
    - [78, 13.02]
  - - [4096, 128, 1, 4096]
    - [65, 21.81]
  - - [4096, 192, 1, 4096]
    - [66, 26.65]
  - - [4096, 256, 1, 4096]
    - [79, 29.92]
  - - [4096, 320, 1, 4096]
    - [80, 29.96]
  - - [4096, 384, 1, 4096]
    - [58, 33.93]
  - - [4096, 448, 1, 4096]
    - [49, 33.9]
  - - [4096, 512, 1, 4096]
    - [50, 35.41]
  - - [4096, 576, 1, 4096]
    - [76, 36.9]
  - - [4096, 640, 1, 4096]
    - [49, 34.72]
  - - [4096, 704, 1, 4096]
    - [49, 37.22]
  - - [4096, 768, 1, 4096]
    - [65, 37.53]
  - - [4096, 832, 1, 4096]
    - [41, 35.58]
  - - [4096, 896, 1, 4096]
    - [48, 37.59]
  - - [4096, 960, 1, 4096]
    - [49, 39.87]
  - - [4096, 1024, 1, 4096]
    - [81, 40.57]
  - - [4096, 1088, 1, 4096]
    - [58, 41.78]
  - - [4096, 1152, 1, 4096]
    - [76, 42.0]
  - - [4096, 1216, 1, 4096]
    - [66, 38.13]
  - - [4096, 1280, 1, 4096]
    - [65, 39.97]
  - - [4096, 1344, 1, 4096]
    - [41, 40.64]
  - - [4096, 1408, 1, 4096]
    - [77, 41.58]
  - - [4096, 1472, 1, 4096]
    - [58, 41.49]
  - - [4096, 1536, 1, 4096]
    - [76, 43.3]
  - - [4096, 1600, 1, 4096]
    - [76, 43.96]
  - - [4096, 1664, 1, 4096]
    - [76, 45.42]
  - - [4096, 1728, 1, 4096]
    - [76, 45.23]
  - - [4096, 1792, 1, 4096]
    - [42, 41.11]
  - - [4096, 1856, 1, 4096]
    - [76, 41.69]
  - - [4096, 1920, 1, 4096]
    - [43, 42.24]
  - - [4096, 1984, 1, 4096]
    - [76, 42.6]
  - - [4096, 2048, 1, 4096]
    - [76, 44.44]
  - - [4096, 2112, 1, 4096]
    - [58, 43.98]
  - - [4096, 2176, 1, 4096]
    - [58, 45.0]
  - - [4096, 2240, 1, 4096]
    - [58, 46.64]
  - - [4096, 2304, 1, 4096]
    - [76, 46.45]
  - - [4096, 2368, 1, 4096]
    - [76, 42.54]
  - - [4096, 2432, 1, 4096]
    - [58, 42.82]
  - - [4096, 2496, 1, 4096]
    - [58, 43.74]
  - - [4096, 2560, 1, 4096]
    - [76, 44.38]
  - - [4096, 2624, 1, 4096]
    - [76, 44.06]
  - - [4096, 2688, 1, 4096]
    - [77, 44.42]
  - - [4096, 2752, 1, 4096]
    - [76, 45.63]
  - - [4096, 2816, 1, 4096]
    - [76, 46.18]
  - - [4096, 2880, 1, 4096]
    - [58, 46.39]
  - - [4096, 2944, 1, 4096]
    - [76, 43.36]
  - - [4096, 3008, 1, 4096]
    - [58, 43.77]
  - - [4096, 3072, 1, 4096]
    - [77, 43.93]
  - - [4096, 3136, 1, 4096]
    - [81, 43.53]
  - - [4096, 3200, 1, 4096]
    - [81, 44.71]
  - - [4096, 3264, 1, 4096]
    - [58, 44.07]
  - - [4096, 3328, 1, 4096]
    - [76, 44.49]
  - - [4096, 3392, 1, 4096]
    - [58, 44.66]
  - - [4096, 3456, 1, 4096]
    - [76, 44.8]
  - - [4096, 3520, 1, 4096]
    - [58, 43.06]
  - - [4096, 3584, 1, 4096]
    - [58, 43.84]
  - - [4096, 3648, 1, 4096]
    - [41, 43.82]
  - - [4096, 3712, 1, 4096]
    - [81, 43.78]
  - - [4096, 3776, 1, 4096]
    - [81, 43.84]
  - - [4096, 3840, 1, 4096]
    - [77, 44.7]
  - - [4096, 3904, 1, 4096]
    - [58, 44.59]
  - - [4096, 3968, 1, 4096]
    - [76, 45.76]
  - - [4096, 4032, 1, 4096]
    - [58, 45.58]
  - - [4096, 4096, 1, 4096]
    - [41, 43.62]
  - - [4096, 1, 1, 14336]
    - [105, 0.17]
  - - [4096, 64, 1, 14336]
    - [106, 10.91]
  - - [4096, 128, 1, 14336]
    - [107, 21.02]
  - - [4096, 192, 1, 14336]
    - [108, 30.07]
  - - [4096, 256, 1, 14336]
    - [109, 36.33]
  - - [4096, 320, 1, 14336]
    - [31, 40.47]
  - - [4096, 384, 1, 14336]
    - [82, 39.35]
  - - [4096, 448, 1, 14336]
    - [83, 42.89]
  - - [4096, 512, 1, 14336]
    - [84, 46.36]
  - - [4096, 576, 1, 14336]
    - [76, 44.94]
  - - [4096, 640, 1, 14336]
    - [37, 45.12]
  - - [4096, 704, 1, 14336]
    - [33, 40.34]
  - - [4096, 768, 1, 14336]
    - [65, 41.94]
  - - [4096, 832, 1, 14336]
    - [42, 43.91]
  - - [4096, 896, 1, 14336]
    - [60, 45.52]
  - - [4096, 960, 1, 14336]
    - [60, 46.14]
  - - [4096, 1024, 1, 14336]
    - [31, 46.69]
  - - [4096, 1088, 1, 14336]
    - [38, 46.49]
  - - [4096, 1152, 1, 14336]
    - [76, 49.09]
  - - [4096, 1216, 1, 14336]
    - [29, 51.49]
  - - [4096, 1280, 1, 14336]
    - [35, 50.36]
  - - [4096, 1344, 1, 14336]
    - [32, 46.57]
  - - [4096, 1408, 1, 14336]
    - [57, 48.52]
  - - [4096, 1472, 1, 14336]
    - [29, 45.9]
  - - [4096, 1536, 1, 14336]
    - [76, 47.29]
  - - [4096, 1600, 1, 14336]
    - [29, 46.41]
  - - [4096, 1664, 1, 14336]
    - [29, 48.66]
  - - [4096, 1728, 1, 14336]
    - [34, 49.62]
  - - [4096, 1792, 1, 14336]
    - [68, 49.94]
  - - [4096, 1856, 1, 14336]
    - [29, 51.83]
  - - [4096, 1920, 1, 14336]
    - [36, 50.58]
  - - [4096, 1984, 1, 14336]
    - [77, 45.63]
  - - [4096, 2048, 1, 14336]
    - [77, 47.01]
  - - [4096, 2112, 1, 14336]
    - [76, 46.32]
  - - [4096, 2176, 1, 14336]
    - [69, 47.46]
  - - [4096, 2240, 1, 14336]
    - [69, 48.58]
  - - [4096, 2304, 1, 14336]
    - [37, 48.61]
  - - [4096, 2368, 1, 14336]
    - [68, 48.9]
  - - [4096, 2432, 1, 14336]
    - [37, 50.06]
  - - [4096, 2496, 1, 14336]
    - [36, 50.39]
  - - [4096, 2560, 1, 14336]
    - [35, 51.38]
  - - [4096, 2624, 1, 14336]
    - [76, 47.55]
  - - [4096, 2688, 1, 14336]
    - [36, 47.71]
  - - [4096, 2752, 1, 14336]
    - [57, 47.96]
  - - [4096, 2816, 1, 14336]
    - [57, 50.19]
  - - [4096, 2880, 1, 14336]
    - [32, 50.01]
  - - [4096, 2944, 1, 14336]
    - [37, 50.17]
  - - [4096, 3008, 1, 14336]
    - [29, 50.66]
  - - [4096, 3072, 1, 14336]
    - [68, 50.53]
  - - [4096, 3136, 1, 14336]
    - [36, 50.74]
  - - [4096, 3200, 1, 14336]
    - [35, 51.59]
  - - [4096, 3264, 1, 14336]
    - [36, 48.66]
  - - [4096, 3328, 1, 14336]
    - [69, 48.9]
  - - [4096, 3392, 1, 14336]
    - [68, 48.32]
  - - [4096, 3456, 1, 14336]
    - [37, 48.78]
  - - [4096, 3520, 1, 14336]
    - [68, 49.77]
  - - [4096, 3584, 1, 14336]
    - [37, 50.42]
  - - [4096, 3648, 1, 14336]
    - [37, 50.0]
  - - [4096, 3712, 1, 14336]
    - [36, 50.54]
  - - [4096, 3776, 1, 14336]
    - [35, 50.98]
  - - [4096, 3840, 1, 14336]
    - [35, 51.72]
  - - [4096, 3904, 1, 14336]
    - [38, 49.23]
  - - [4096, 3968, 1, 14336]
    - [36, 48.93]
  - - [4096, 4032, 1, 14336]
    - [68, 48.72]
  - - [4096, 4096, 1, 14336]
    - [36, 49.99]
  - - [28672, 1, 1, 4096]
    - [129, 0.2]
  - - [28672, 64, 1, 4096]
    - [130, 12.31]
  - - [28672, 128, 1, 4096]
    - [131, 23.24]
  - - [28672, 192, 1, 4096]
    - [132, 31.82]
  - - [28672, 256, 1, 4096]
    - [65, 38.1]
  - - [28672, 320, 1, 4096]
    - [49, 40.07]
  - - [28672, 384, 1, 4096]
    - [41, 42.08]
  - - [28672, 448, 1, 4096]
    - [67, 42.24]
  - - [28672, 512, 1, 4096]
    - [57, 44.04]
  - - [28672, 576, 1, 4096]
    - [76, 46.37]
  - - [28672, 640, 1, 4096]
    - [77, 45.81]
  - - [28672, 704, 1, 4096]
    - [76, 45.98]
  - - [28672, 768, 1, 4096]
    - [76, 47.09]
  - - [28672, 832, 1, 4096]
    - [42, 44.68]
  - - [28672, 896, 1, 4096]
    - [81, 45.78]
  - - [28672, 960, 1, 4096]
    - [42, 45.32]
  - - [28672, 1024, 1, 4096]
    - [42, 46.15]
  - - [28672, 1088, 1, 4096]
    - [76, 46.27]
  - - [28672, 1152, 1, 4096]
    - [60, 47.63]
  - - [28672, 1216, 1, 4096]
    - [60, 45.72]
  - - [28672, 1280, 1, 4096]
    - [60, 45.42]
  - - [28672, 1344, 1, 4096]
    - [32, 47.17]
  - - [28672, 1408, 1, 4096]
    - [42, 47.9]
  - - [28672, 1472, 1, 4096]
    - [60, 46.04]
  - - [28672, 1536, 1, 4096]
    - [34, 47.65]
  - - [28672, 1600, 1, 4096]
    - [34, 46.38]
  - - [28672, 1664, 1, 4096]
    - [57, 47.55]
  - - [28672, 1728, 1, 4096]
    - [35, 46.45]
  - - [28672, 1792, 1, 4096]
    - [42, 47.21]
  - - [28672, 1856, 1, 4096]
    - [42, 47.35]
  - - [28672, 1920, 1, 4096]
    - [60, 47.13]
  - - [28672, 1984, 1, 4096]
    - [35, 46.49]
  - - [28672, 2048, 1, 4096]
    - [29, 47.2]
  - - [28672, 2112, 1, 4096]
    - [60, 47.9]
  - - [28672, 2176, 1, 4096]
    - [60, 46.45]
  - - [28672, 2240, 1, 4096]
    - [38, 46.73]
  - - [28672, 2304, 1, 4096]
    - [43, 46.64]
  - - [28672, 2368, 1, 4096]
    - [35, 46.59]
  - - [28672, 2432, 1, 4096]
    - [35, 47.59]
  - - [28672, 2496, 1, 4096]
    - [35, 46.92]
  - - [28672, 2560, 1, 4096]
    - [35, 47.8]
  - - [28672, 2624, 1, 4096]
    - [29, 47.63]
  - - [28672, 2688, 1, 4096]
    - [35, 47.59]
  - - [28672, 2752, 1, 4096]
    - [32, 47.86]
  - - [28672, 2816, 1, 4096]
    - [57, 47.48]
  - - [28672, 2880, 1, 4096]
    - [35, 46.87]
  - - [28672, 2944, 1, 4096]
    - [35, 48.43]
  - - [28672, 3008, 1, 4096]
    - [32, 47.79]
  - - [28672, 3072, 1, 4096]
    - [32, 48.79]
  - - [28672, 3136, 1, 4096]
    - [38, 47.52]
  - - [28672, 3200, 1, 4096]
    - [35, 46.37]
  - - [28672, 3264, 1, 4096]
    - [60, 46.37]
  - - [28672, 3328, 1, 4096]
    - [36, 46.76]
  - - [28672, 3392, 1, 4096]
    - [60, 47.97]
  - - [28672, 3456, 1, 4096]
    - [68, 47.87]
  - - [28672, 3520, 1, 4096]
    - [36, 47.36]
  - - [28672, 3584, 1, 4096]
    - [35, 48.24]
  - - [28672, 3648, 1, 4096]
    - [60, 48.85]
  - - [28672, 3712, 1, 4096]
    - [35, 48.94]
  - - [28672, 3776, 1, 4096]
    - [35, 48.36]
  - - [28672, 3840, 1, 4096]
    - [32, 48.96]
  - - [28672, 3904, 1, 4096]
    - [34, 47.89]
  - - [28672, 3968, 1, 4096]
    - [35, 48.15]
  - - [28672, 4032, 1, 4096]
    - [34, 48.13]
  - - [28672, 4096, 1, 4096]
    - [35, 47.74]
  - - [128256, 1, 1, 4096]
    - [143, 0.22]
  - - [128256, 64, 1, 4096]
    - [163, 13.16]
  - - [128256, 128, 1, 4096]
    - [164, 25.21]
  - - [128256, 192, 1, 4096]
    - [91, 36.54]
  - - [128256, 256, 1, 4096]
    - [25, 42.96]
  - - [4608, 1, 1, 3584]
    - [85, 0.25]
  - - [4608, 64, 1, 3584]
    - [86, 13.17]
  - - [4608, 128, 1, 3584]
    - [87, 21.35]
  - - [4608, 192, 1, 3584]
    - [88, 27.65]
  - - [4608, 256, 1, 3584]
    - [89, 31.43]
  - - [4608, 320, 1, 3584]
    - [90, 29.91]
  - - [4608, 384, 1, 3584]
    - [91, 31.2]
  - - [4608, 448, 1, 3584]
    - [92, 31.73]
  - - [4608, 512, 1, 3584]
    - [89, 35.0]
  - - [4608, 576, 1, 3584]
    - [93, 33.54]
  - - [4608, 640, 1, 3584]
    - [90, 38.21]
  - - [4608, 704, 1, 3584]
    - [94, 34.28]
  - - [4608, 768, 1, 3584]
    - [95, 36.99]
  - - [4608, 832, 1, 3584]
    - [96, 34.04]
  - - [4608, 896, 1, 3584]
    - [97, 38.74]
  - - [4608, 960, 1, 3584]
    - [98, 39.24]
  - - [4608, 1024, 1, 3584]
    - [96, 41.2]
  - - [4608, 1088, 1, 3584]
    - [89, 38.92]
  - - [4608, 1152, 1, 3584]
    - [89, 40.88]
  - - [4608, 1216, 1, 3584]
    - [99, 39.82]
  - - [4608, 1280, 1, 3584]
    - [90, 42.67]
  - - [4608, 1344, 1, 3584]
    - [100, 41.04]
  - - [4608, 1408, 1, 3584]
    - [95, 42.72]
  - - [4608, 1472, 1, 3584]
    - [101, 40.76]
  - - [4608, 1536, 1, 3584]
    - [102, 42.89]
  - - [4608, 1600, 1, 3584]
    - [96, 43.14]
  - - [4608, 1664, 1, 3584]
    - [96, 44.08]
  - - [4608, 1728, 1, 3584]
    - [90, 43.26]
  - - [4608, 1792, 1, 3584]
    - [96, 43.46]
  - - [4608, 1856, 1, 3584]
    - [94, 44.03]
  - - [4608, 1920, 1, 3584]
    - [94, 44.21]
  - - [4608, 1984, 1, 3584]
    - [94, 42.97]
  - - [4608, 2048, 1, 3584]
    - [96, 43.46]
  - - [4608, 2112, 1, 3584]
    - [96, 44.23]
  - - [4608, 2176, 1, 3584]
    - [96, 45.1]
  - - [4608, 2240, 1, 3584]
    - [103, 44.62]
  - - [4608, 2304, 1, 3584]
    - [96, 44.41]
  - - [4608, 2368, 1, 3584]
    - [94, 44.12]
  - - [4608, 2432, 1, 3584]
    - [95, 44.86]
  - - [4608, 2496, 1, 3584]
    - [94, 43.77]
  - - [4608, 2560, 1, 3584]
    - [96, 44.15]
  - - [4608, 2624, 1, 3584]
    - [96, 44.39]
  - - [4608, 2688, 1, 3584]
    - [96, 45.49]
  - - [4608, 2752, 1, 3584]
    - [96, 45.22]
  - - [4608, 2816, 1, 3584]
    - [96, 45.48]
  - - [4608, 2880, 1, 3584]
    - [90, 45.32]
  - - [4608, 2944, 1, 3584]
    - [96, 45.04]
  - - [4608, 3008, 1, 3584]
    - [104, 43.75]
  - - [4608, 3072, 1, 3584]
    - [94, 46.28]
  - - [4608, 3136, 1, 3584]
    - [96, 44.51]
  - - [4608, 3200, 1, 3584]
    - [96, 45.54]
  - - [4608, 3264, 1, 3584]
    - [96, 45.26]
  - - [4608, 3328, 1, 3584]
    - [96, 46.31]
  - - [4608, 3392, 1, 3584]
    - [94, 45.28]
  - - [4608, 3456, 1, 3584]
    - [94, 46.23]
  - - [4608, 3520, 1, 3584]
    - [94, 46.49]
  - - [4608, 3584, 1, 3584]
    - [94, 45.79]
  - - [4608, 3648, 1, 3584]
    - [95, 45.36]
  - - [4608, 3712, 1, 3584]
    - [96, 46.01]
  - - [4608, 3776, 1, 3584]
    - [90, 46.06]
  - - [4608, 3840, 1, 3584]
    - [96, 46.67]
  - - [4608, 3904, 1, 3584]
    - [95, 45.77]
  - - [4608, 3968, 1, 3584]
    - [94, 46.51]
  - - [4608, 4032, 1, 3584]
    - [94, 46.53]
  - - [4608, 4096, 1, 3584]
    - [94, 46.42]
  - - [37888, 1, 1, 3584]
    - [85, 0.2]
  - - [37888, 64, 1, 3584]
    - [110, 12.25]
  - - [37888, 128, 1, 3584]
    - [111, 23.31]
  - - [37888, 192, 1, 3584]
    - [112, 32.82]
  - - [37888, 256, 1, 3584]
    - [98, 38.46]
  - - [37888, 320, 1, 3584]
    - [90, 40.4]
  - - [37888, 384, 1, 3584]
    - [96, 42.84]
  - - [37888, 448, 1, 3584]
    - [103, 42.24]
  - - [37888, 512, 1, 3584]
    - [94, 45.04]
  - - [37888, 576, 1, 3584]
    - [113, 44.76]
  - - [37888, 640, 1, 3584]
    - [90, 46.23]
  - - [37888, 704, 1, 3584]
    - [94, 43.49]
  - - [37888, 768, 1, 3584]
    - [94, 46.76]
  - - [37888, 832, 1, 3584]
    - [94, 44.52]
  - - [37888, 896, 1, 3584]
    - [96, 46.59]
  - - [37888, 960, 1, 3584]
    - [90, 46.62]
  - - [37888, 1024, 1, 3584]
    - [94, 47.02]
  - - [37888, 1088, 1, 3584]
    - [90, 45.26]
  - - [37888, 1152, 1, 3584]
    - [113, 46.36]
  - - [37888, 1216, 1, 3584]
    - [90, 44.92]
  - - [37888, 1280, 1, 3584]
    - [96, 46.91]
  - - [37888, 1344, 1, 3584]
    - [96, 45.83]
  - - [37888, 1408, 1, 3584]
    - [96, 47.98]
  - - [37888, 1472, 1, 3584]
    - [96, 46.48]
  - - [37888, 1536, 1, 3584]
    - [96, 48.21]
  - - [37888, 1600, 1, 3584]
    - [96, 46.68]
  - - [37888, 1664, 1, 3584]
    - [96, 48.16]
  - - [37888, 1728, 1, 3584]
    - [96, 46.89]
  - - [37888, 1792, 1, 3584]
    - [96, 48.25]
  - - [37888, 1856, 1, 3584]
    - [96, 46.65]
  - - [37888, 1920, 1, 3584]
    - [96, 47.68]
  - - [37888, 1984, 1, 3584]
    - [96, 46.64]
  - - [37888, 2048, 1, 3584]
    - [96, 47.65]
  - - [37888, 2112, 1, 3584]
    - [114, 45.02]
  - - [37888, 2176, 1, 3584]
    - [96, 45.7]
  - - [37888, 2240, 1, 3584]
    - [96, 46.23]
  - - [37888, 2304, 1, 3584]
    - [96, 47.06]
  - - [37888, 2368, 1, 3584]
    - [96, 47.03]
  - - [37888, 2432, 1, 3584]
    - [96, 48.17]
  - - [37888, 2496, 1, 3584]
    - [96, 46.75]
  - - [37888, 2560, 1, 3584]
    - [96, 48.12]
  - - [37888, 2624, 1, 3584]
    - [96, 46.59]
  - - [37888, 2688, 1, 3584]
    - [96, 48.33]
  - - [37888, 2752, 1, 3584]
    - [96, 47.04]
  - - [37888, 2816, 1, 3584]
    - [96, 48.62]
  - - [37888, 2880, 1, 3584]
    - [96, 47.12]
  - - [37888, 2944, 1, 3584]
    - [96, 47.4]
  - - [37888, 3008, 1, 3584]
    - [94, 46.66]
  - - [37888, 3072, 1, 3584]
    - [96, 48.45]
  - - [37888, 3136, 1, 3584]
    - [90, 46.41]
  - - [37888, 3200, 1, 3584]
    - [90, 47.2]
  - - [37888, 3264, 1, 3584]
    - [94, 47.57]
  - - [37888, 3328, 1, 3584]
    - [94, 48.38]
  - - [37888, 3392, 1, 3584]
    - [94, 47.89]
  - - [37888, 3456, 1, 3584]
    - [94, 48.96]
  - - [37888, 3520, 1, 3584]
    - [95, 46.95]
  - - [37888, 3584, 1, 3584]
    - [94, 47.95]
  - - [37888, 3648, 1, 3584]
    - [94, 47.28]
  - - [37888, 3712, 1, 3584]
    - [94, 48.6]
  - - [37888, 3776, 1, 3584]
    - [94, 48.05]
  - - [37888, 3840, 1, 3584]
    - [94, 48.7]
  - - [37888, 3904, 1, 3584]
    - [94, 48.58]
  - - [37888, 3968, 1, 3584]
    - [94, 48.79]
  - - [37888, 4032, 1, 3584]
    - [94, 47.93]
  - - [37888, 4096, 1, 3584]
    - [94, 49.09]
  - - [3584, 1, 1, 3584]
    - [115, 0.21]
  - - [3584, 64, 1, 3584]
    - [116, 11.5]
  - - [3584, 128, 1, 3584]
    - [117, 18.61]
  - - [3584, 192, 1, 3584]
    - [118, 24.06]
  - - [3584, 256, 1, 3584]
    - [119, 27.45]
  - - [3584, 320, 1, 3584]
    - [120, 26.44]
  - - [3584, 384, 1, 3584]
    - [118, 29.07]
  - - [3584, 448, 1, 3584]
    - [114, 29.94]
  - - [3584, 512, 1, 3584]
    - [121, 31.41]
  - - [3584, 576, 1, 3584]
    - [117, 32.19]
  - - [3584, 640, 1, 3584]
    - [89, 33.24]
  - - [3584, 704, 1, 3584]
    - [113, 31.88]
  - - [3584, 768, 1, 3584]
    - [94, 34.46]
  - - [3584, 832, 1, 3584]
    - [94, 34.38]
  - - [3584, 896, 1, 3584]
    - [94, 36.98]
  - - [3584, 960, 1, 3584]
    - [99, 36.01]
  - - [3584, 1024, 1, 3584]
    - [95, 38.69]
  - - [3584, 1088, 1, 3584]
    - [114, 36.79]
  - - [3584, 1152, 1, 3584]
    - [94, 40.07]
  - - [3584, 1216, 1, 3584]
    - [114, 39.7]
  - - [3584, 1280, 1, 3584]
    - [96, 40.45]
  - - [3584, 1344, 1, 3584]
    - [104, 40.71]
  - - [3584, 1408, 1, 3584]
    - [96, 43.06]
  - - [3584, 1472, 1, 3584]
    - [122, 39.83]
  - - [3584, 1536, 1, 3584]
    - [95, 41.07]
  - - [3584, 1600, 1, 3584]
    - [99, 40.82]
  - - [3584, 1664, 1, 3584]
    - [95, 41.82]
  - - [3584, 1728, 1, 3584]
    - [113, 41.47]
  - - [3584, 1792, 1, 3584]
    - [95, 42.46]
  - - [3584, 1856, 1, 3584]
    - [114, 41.63]
  - - [3584, 1920, 1, 3584]
    - [95, 42.06]
  - - [3584, 1984, 1, 3584]
    - [96, 42.81]
  - - [3584, 2048, 1, 3584]
    - [96, 43.79]
  - - [3584, 2112, 1, 3584]
    - [96, 43.27]
  - - [3584, 2176, 1, 3584]
    - [96, 44.9]
  - - [3584, 2240, 1, 3584]
    - [103, 43.86]
  - - [3584, 2304, 1, 3584]
    - [113, 43.44]
  - - [3584, 2368, 1, 3584]
    - [103, 44.09]
  - - [3584, 2432, 1, 3584]
    - [95, 44.84]
  - - [3584, 2496, 1, 3584]
    - [94, 44.07]
  - - [3584, 2560, 1, 3584]
    - [95, 44.55]
  - - [3584, 2624, 1, 3584]
    - [96, 43.08]
  - - [3584, 2688, 1, 3584]
    - [96, 44.18]
  - - [3584, 2752, 1, 3584]
    - [96, 44.54]
  - - [3584, 2816, 1, 3584]
    - [96, 44.94]
  - - [3584, 2880, 1, 3584]
    - [94, 44.78]
  - - [3584, 2944, 1, 3584]
    - [96, 44.01]
  - - [3584, 3008, 1, 3584]
    - [94, 43.8]
  - - [3584, 3072, 1, 3584]
    - [96, 44.51]
  - - [3584, 3136, 1, 3584]
    - [95, 44.85]
  - - [3584, 3200, 1, 3584]
    - [95, 44.86]
  - - [3584, 3264, 1, 3584]
    - [94, 43.79]
  - - [3584, 3328, 1, 3584]
    - [95, 43.78]
  - - [3584, 3392, 1, 3584]
    - [96, 44.59]
  - - [3584, 3456, 1, 3584]
    - [96, 45.47]
  - - [3584, 3520, 1, 3584]
    - [96, 45.27]
  - - [3584, 3584, 1, 3584]
    - [96, 45.78]
  - - [3584, 3648, 1, 3584]
    - [96, 44.55]
  - - [3584, 3712, 1, 3584]
    - [96, 45.28]
  - - [3584, 3776, 1, 3584]
    - [95, 44.97]
  - - [3584, 3840, 1, 3584]
    - [95, 45.97]
  - - [3584, 3904, 1, 3584]
    - [94, 44.96]
  - - [3584, 3968, 1, 3584]
    - [95, 46.36]
  - - [3584, 4032, 1, 3584]
    - [96, 45.15]
  - - [3584, 4096, 1, 3584]
    - [96, 45.67]
  - - [3584, 1, 1, 18944]
    - [123, 0.19]
  - - [3584, 64, 1, 18944]
    - [124, 11.97]
  - - [3584, 128, 1, 18944]
    - [92, 23.3]
  - - [3584, 192, 1, 18944]
    - [117, 31.94]
  - - [3584, 256, 1, 18944]
    - [96, 36.13]
  - - [3584, 320, 1, 18944]
    - [125, 36.73]
  - - [3584, 384, 1, 18944]
    - [93, 41.45]
  - - [3584, 448, 1, 18944]
    - [101, 40.39]
  - - [3584, 512, 1, 18944]
    - [119, 45.75]
  - - [3584, 576, 1, 18944]
    - [103, 43.93]
  - - [3584, 640, 1, 18944]
    - [103, 44.02]
  - - [3584, 704, 1, 18944]
    - [126, 38.97]
  - - [3584, 768, 1, 18944]
    - [113, 40.56]
  - - [3584, 832, 1, 18944]
    - [127, 39.06]
  - - [3584, 896, 1, 18944]
    - [95, 42.19]
  - - [3584, 960, 1, 18944]
    - [128, 42.85]
  - - [3584, 1024, 1, 18944]
    - [94, 44.2]
  - - [3584, 1088, 1, 18944]
    - [95, 40.0]
  - - [3584, 1152, 1, 18944]
    - [114, 42.84]
  - - [3584, 1216, 1, 18944]
    - [114, 45.19]
  - - [3584, 1280, 1, 18944]
    - [96, 44.8]
  - - [3584, 1344, 1, 18944]
    - [96, 46.77]
  - - [3584, 1408, 1, 18944]
    - [96, 48.35]
  - - [3584, 1472, 1, 18944]
    - [96, 42.32]
  - - [3584, 1536, 1, 18944]
    - [96, 43.93]
  - - [3584, 1600, 1, 18944]
    - [99, 44.14]
  - - [3584, 1664, 1, 18944]
    - [94, 44.52]
  - - [3584, 1728, 1, 18944]
    - [95, 43.89]
  - - [3584, 1792, 1, 18944]
    - [94, 44.42]
  - - [3584, 1856, 1, 18944]
    - [114, 45.31]
  - - [3584, 1920, 1, 18944]
    - [96, 44.62]
  - - [3584, 1984, 1, 18944]
    - [96, 46.38]
  - - [3584, 2048, 1, 18944]
    - [96, 47.47]
  - - [3584, 2112, 1, 18944]
    - [96, 46.91]
  - - [3584, 2176, 1, 18944]
    - [90, 44.43]
  - - [3584, 2240, 1, 18944]
    - [90, 45.87]
  - - [3584, 2304, 1, 18944]
    - [104, 45.81]
  - - [3584, 2368, 1, 18944]
    - [94, 45.48]
  - - [3584, 2432, 1, 18944]
    - [94, 46.57]
  - - [3584, 2496, 1, 18944]
    - [98, 44.47]
  - - [3584, 2560, 1, 18944]
    - [96, 45.65]
  - - [3584, 2624, 1, 18944]
    - [96, 46.08]
  - - [3584, 2688, 1, 18944]
    - [96, 47.1]
  - - [3584, 2752, 1, 18944]
    - [96, 47.46]
  - - [3584, 2816, 1, 18944]
    - [96, 48.09]
  - - [3584, 2880, 1, 18944]
    - [96, 45.55]
  - - [3584, 2944, 1, 18944]
    - [96, 45.87]
  - - [3584, 3008, 1, 18944]
    - [96, 45.75]
  - - [3584, 3072, 1, 18944]
    - [96, 46.58]
  - - [3584, 3136, 1, 18944]
    - [96, 46.02]
  - - [3584, 3200, 1, 18944]
    - [96, 45.57]
  - - [3584, 3264, 1, 18944]
    - [96, 46.25]
  - - [3584, 3328, 1, 18944]
    - [96, 47.05]
  - - [3584, 3392, 1, 18944]
    - [96, 45.92]
  - - [3584, 3456, 1, 18944]
    - [96, 46.96]
  - - [3584, 3520, 1, 18944]
    - [114, 44.84]
  - - [3584, 3584, 1, 18944]
    - [94, 45.98]
  - - [3584, 3648, 1, 18944]
    - [96, 45.25]
  - - [3584, 3712, 1, 18944]
    - [96, 45.57]
  - - [3584, 3776, 1, 18944]
    - [96, 46.13]
  - - [3584, 3840, 1, 18944]
    - [96, 46.92]
  - - [3584, 3904, 1, 18944]
    - [96, 46.11]
  - - [3584, 3968, 1, 18944]
    - [96, 46.13]
  - - [3584, 4032, 1, 18944]
    - [114, 44.41]
  - - [3584, 4096, 1, 18944]
    - [96, 46.03]
  - - [2048, 1, 1, 1536]
    - [133, 0.07]
  - - [2048, 64, 1, 1536]
    - [134, 4.09]
  - - [2048, 128, 1, 1536]
    - [116, 7.37]
  - - [2048, 192, 1, 1536]
    - [135, 10.38]
  - - [2048, 256, 1, 1536]
    - [136, 13.11]
  - - [2048, 320, 1, 1536]
    - [137, 14.66]
  - - [2048, 384, 1, 1536]
    - [99, 16.9]
  - - [2048, 448, 1, 1536]
    - [97, 17.81]
  - - [2048, 512, 1, 1536]
    - [96, 20.14]
  - - [2048, 576, 1, 1536]
    - [122, 19.5]
  - - [2048, 640, 1, 1536]
    - [138, 21.45]
  - - [2048, 704, 1, 1536]
    - [139, 21.9]
  - - [2048, 768, 1, 1536]
    - [140, 23.43]
  - - [2048, 832, 1, 1536]
    - [114, 23.54]
  - - [2048, 896, 1, 1536]
    - [97, 24.87]
  - - [2048, 960, 1, 1536]
    - [141, 25.23]
  - - [2048, 1024, 1, 1536]
    - [98, 25.48]
  - - [2048, 1088, 1, 1536]
    - [102, 25.8]
  - - [2048, 1152, 1, 1536]
    - [102, 26.8]
  - - [2048, 1216, 1, 1536]
    - [114, 26.08]
  - - [2048, 1280, 1, 1536]
    - [104, 26.58]
  - - [2048, 1344, 1, 1536]
    - [94, 28.32]
  - - [2048, 1408, 1, 1536]
    - [94, 28.85]
  - - [2048, 1472, 1, 1536]
    - [142, 30.3]
  - - [2048, 1536, 1, 1536]
    - [94, 29.2]
  - - [2048, 1600, 1, 1536]
    - [142, 30.47]
  - - [2048, 1664, 1, 1536]
    - [95, 29.55]
  - - [2048, 1728, 1, 1536]
    - [94, 30.76]
  - - [2048, 1792, 1, 1536]
    - [95, 31.74]
  - - [2048, 1856, 1, 1536]
    - [99, 31.51]
  - - [2048, 1920, 1, 1536]
    - [99, 31.76]
  - - [2048, 1984, 1, 1536]
    - [114, 31.93]
  - - [2048, 2048, 1, 1536]
    - [96, 32.75]
  - - [2048, 2112, 1, 1536]
    - [96, 32.13]
  - - [2048, 2176, 1, 1536]
    - [96, 32.71]
  - - [2048, 2240, 1, 1536]
    - [118, 32.25]
  - - [2048, 2304, 1, 1536]
    - [96, 34.39]
  - - [2048, 2368, 1, 1536]
    - [96, 35.31]
  - - [2048, 2432, 1, 1536]
    - [96, 34.86]
  - - [2048, 2496, 1, 1536]
    - [96, 35.21]
  - - [2048, 2560, 1, 1536]
    - [96, 35.89]
  - - [2048, 2624, 1, 1536]
    - [98, 35.88]
  - - [2048, 2688, 1, 1536]
    - [96, 36.11]
  - - [2048, 2752, 1, 1536]
    - [98, 36.4]
  - - [2048, 2816, 1, 1536]
    - [94, 37.44]
  - - [2048, 2880, 1, 1536]
    - [95, 36.51]
  - - [2048, 2944, 1, 1536]
    - [94, 38.31]
  - - [2048, 3008, 1, 1536]
    - [142, 36.54]
  - - [2048, 3072, 1, 1536]
    - [94, 37.76]
  - - [2048, 3136, 1, 1536]
    - [94, 36.77]
  - - [2048, 3200, 1, 1536]
    - [94, 37.66]
  - - [2048, 3264, 1, 1536]
    - [94, 38.02]
  - - [2048, 3328, 1, 1536]
    - [98, 37.86]
  - - [2048, 3392, 1, 1536]
    - [94, 37.49]
  - - [2048, 3456, 1, 1536]
    - [94, 37.89]
  - - [2048, 3520, 1, 1536]
    - [96, 37.61]
  - - [2048, 3584, 1, 1536]
    - [96, 38.35]
  - - [2048, 3648, 1, 1536]
    - [96, 38.95]
  - - [2048, 3712, 1, 1536]
    - [96, 39.14]
  - - [2048, 3776, 1, 1536]
    - [96, 38.01]
  - - [2048, 3840, 1, 1536]
    - [96, 39.11]
  - - [2048, 3904, 1, 1536]
    - [104, 37.8]
  - - [2048, 3968, 1, 1536]
    - [96, 39.14]
  - - [2048, 4032, 1, 1536]
    - [94, 38.64]
  - - [2048, 4096, 1, 1536]
    - [96, 39.38]
  - - [17920, 1, 1, 1536]
    - [143, 0.32]
  - - [17920, 64, 1, 1536]
    - [131, 16.44]
  - - [17920, 128, 1, 1536]
    - [96, 25.27]
  - - [17920, 192, 1, 1536]
    - [118, 31.79]
  - - [17920, 256, 1, 1536]
    - [96, 31.97]
  - - [17920, 320, 1, 1536]
    - [103, 33.84]
  - - [17920, 384, 1, 1536]
    - [113, 37.19]
  - - [17920, 448, 1, 1536]
    - [95, 34.34]
  - - [17920, 512, 1, 1536]
    - [95, 39.39]
  - - [17920, 576, 1, 1536]
    - [113, 38.45]
  - - [17920, 640, 1, 1536]
    - [90, 40.63]
  - - [17920, 704, 1, 1536]
    - [113, 38.42]
  - - [17920, 768, 1, 1536]
    - [94, 40.63]
  - - [17920, 832, 1, 1536]
    - [95, 38.97]
  - - [17920, 896, 1, 1536]
    - [94, 41.12]
  - - [17920, 960, 1, 1536]
    - [113, 41.25]
  - - [17920, 1024, 1, 1536]
    - [94, 42.24]
  - - [17920, 1088, 1, 1536]
    - [113, 41.43]
  - - [17920, 1152, 1, 1536]
    - [113, 42.38]
  - - [17920, 1216, 1, 1536]
    - [94, 42.13]
  - - [17920, 1280, 1, 1536]
    - [90, 42.94]
  - - [17920, 1344, 1, 1536]
    - [113, 42.8]
  - - [17920, 1408, 1, 1536]
    - [94, 44.11]
  - - [17920, 1472, 1, 1536]
    - [94, 42.23]
  - - [17920, 1536, 1, 1536]
    - [94, 44.17]
  - - [17920, 1600, 1, 1536]
    - [90, 43.35]
  - - [17920, 1664, 1, 1536]
    - [94, 44.54]
  - - [17920, 1728, 1, 1536]
    - [90, 43.54]
  - - [17920, 1792, 1, 1536]
    - [94, 44.46]
  - - [17920, 1856, 1, 1536]
    - [94, 43.41]
  - - [17920, 1920, 1, 1536]
    - [94, 44.74]
  - - [17920, 1984, 1, 1536]
    - [94, 43.52]
  - - [17920, 2048, 1, 1536]
    - [94, 44.84]
  - - [17920, 2112, 1, 1536]
    - [113, 44.09]
  - - [17920, 2176, 1, 1536]
    - [94, 44.97]
  - - [17920, 2240, 1, 1536]
    - [90, 44.68]
  - - [17920, 2304, 1, 1536]
    - [94, 45.28]
  - - [17920, 2368, 1, 1536]
    - [90, 44.66]
  - - [17920, 2432, 1, 1536]
    - [94, 45.59]
  - - [17920, 2496, 1, 1536]
    - [113, 45.02]
  - - [17920, 2560, 1, 1536]
    - [94, 45.47]
  - - [17920, 2624, 1, 1536]
    - [94, 45.11]
  - - [17920, 2688, 1, 1536]
    - [94, 45.73]
  - - [17920, 2752, 1, 1536]
    - [94, 45.08]
  - - [17920, 2816, 1, 1536]
    - [94, 45.51]
  - - [17920, 2880, 1, 1536]
    - [94, 45.22]
  - - [17920, 2944, 1, 1536]
    - [94, 45.79]
  - - [17920, 3008, 1, 1536]
    - [94, 45.47]
  - - [17920, 3072, 1, 1536]
    - [94, 46.11]
  - - [17920, 3136, 1, 1536]
    - [94, 44.99]
  - - [17920, 3200, 1, 1536]
    - [94, 46.06]
  - - [17920, 3264, 1, 1536]
    - [94, 45.39]
  - - [17920, 3328, 1, 1536]
    - [94, 46.15]
  - - [17920, 3392, 1, 1536]
    - [94, 45.63]
  - - [17920, 3456, 1, 1536]
    - [94, 46.34]
  - - [17920, 3520, 1, 1536]
    - [94, 46.05]
  - - [17920, 3584, 1, 1536]
    - [94, 46.29]
  - - [17920, 3648, 1, 1536]
    - [94, 45.7]
  - - [17920, 3712, 1, 1536]
    - [94, 46.63]
  - - [17920, 3776, 1, 1536]
    - [94, 46.24]
  - - [17920, 3840, 1, 1536]
    - [94, 46.41]
  - - [17920, 3904, 1, 1536]
    - [94, 46.25]
  - - [17920, 3968, 1, 1536]
    - [94, 46.5]
  - - [17920, 4032, 1, 1536]
    - [94, 46.16]
  - - [17920, 4096, 1, 1536]
    - [94, 46.17]
  - - [1536, 1, 1, 8960]
    - [143, 0.2]
  - - [1536, 64, 1, 8960]
    - [144, 9.66]
  - - [1536, 128, 1, 8960]
    - [86, 15.38]
  - - [1536, 192, 1, 8960]
    - [145, 19.91]
  - - [1536, 256, 1, 8960]
    - [146, 24.81]
  - - [1536, 320, 1, 8960]
    - [117, 27.13]
  - - [1536, 384, 1, 8960]
    - [145, 31.06]
  - - [1536, 448, 1, 8960]
    - [102, 30.56]
  - - [1536, 512, 1, 8960]
    - [147, 33.68]
  - - [1536, 576, 1, 8960]
    - [103, 33.03]
  - - [1536, 640, 1, 8960]
    - [148, 36.55]
  - - [1536, 704, 1, 8960]
    - [118, 35.17]
  - - [1536, 768, 1, 8960]
    - [122, 38.74]
  - - [1536, 832, 1, 8960]
    - [98, 37.93]
  - - [1536, 896, 1, 8960]
    - [149, 39.51]
  - - [1536, 960, 1, 8960]
    - [149, 42.0]
  - - [1536, 1024, 1, 8960]
    - [98, 43.79]
  - - [1536, 1088, 1, 8960]
    - [119, 38.95]
  - - [1536, 1152, 1, 8960]
    - [103, 42.3]
  - - [1536, 1216, 1, 8960]
    - [103, 43.16]
  - - [1536, 1280, 1, 8960]
    - [103, 43.51]
  - - [1536, 1344, 1, 8960]
    - [103, 39.86]
  - - [1536, 1408, 1, 8960]
    - [150, 41.2]
  - - [1536, 1472, 1, 8960]
    - [113, 40.81]
  - - [1536, 1536, 1, 8960]
    - [108, 42.34]
  - - [1536, 1600, 1, 8960]
    - [96, 42.52]
  - - [1536, 1664, 1, 8960]
    - [96, 44.05]
  - - [1536, 1728, 1, 8960]
    - [90, 41.79]
  - - [1536, 1792, 1, 8960]
    - [94, 40.79]
  - - [1536, 1856, 1, 8960]
    - [90, 41.29]
  - - [1536, 1920, 1, 8960]
    - [90, 42.77]
  - - [1536, 1984, 1, 8960]
    - [90, 40.24]
  - - [1536, 2048, 1, 8960]
    - [90, 41.68]
  - - [1536, 2112, 1, 8960]
    - [89, 40.69]
  - - [1536, 2176, 1, 8960]
    - [94, 42.1]
  - - [1536, 2240, 1, 8960]
    - [89, 42.56]
  - - [1536, 2304, 1, 8960]
    - [89, 43.8]
  - - [1536, 2368, 1, 8960]
    - [118, 43.08]
  - - [1536, 2432, 1, 8960]
    - [118, 42.89]
  - - [1536, 2496, 1, 8960]
    - [99, 43.4]
  - - [1536, 2560, 1, 8960]
    - [147, 43.8]
  - - [1536, 2624, 1, 8960]
    - [94, 42.13]
  - - [1536, 2688, 1, 8960]
    - [94, 43.26]
  - - [1536, 2752, 1, 8960]
    - [98, 42.89]
  - - [1536, 2816, 1, 8960]
    - [90, 44.25]
  - - [1536, 2880, 1, 8960]
    - [114, 44.46]
  - - [1536, 2944, 1, 8960]
    - [98, 43.57]
  - - [1536, 3008, 1, 8960]
    - [96, 44.2]
  - - [1536, 3072, 1, 8960]
    - [98, 45.12]
  - - [1536, 3136, 1, 8960]
    - [96, 45.27]
  - - [1536, 3200, 1, 8960]
    - [96, 46.56]
  - - [1536, 3264, 1, 8960]
    - [96, 46.79]
  - - [1536, 3328, 1, 8960]
    - [96, 47.28]
  - - [1536, 3392, 1, 8960]
    - [89, 43.3]
  - - [1536, 3456, 1, 8960]
    - [102, 44.33]
  - - [1536, 3520, 1, 8960]
    - [90, 44.4]
  - - [1536, 3584, 1, 8960]
    - [96, 44.92]
  - - [1536, 3648, 1, 8960]
    - [90, 45.62]
  - - [1536, 3712, 1, 8960]
    - [94, 44.44]
  - - [1536, 3776, 1, 8960]
    - [103, 44.9]
  - - [1536, 3840, 1, 8960]
    - [90, 45.71]
  - - [1536, 3904, 1, 8960]
    - [94, 45.02]
  - - [1536, 3968, 1, 8960]
    - [90, 44.96]
  - - [1536, 4032, 1, 8960]
    - [95, 45.58]
  - - [1536, 4096, 1, 8960]
    - [90, 44.59]
  - - [1536, 1, 1, 1536]
    - [151, 0.05]
  - - [1536, 64, 1, 1536]
    - [152, 3.1]
  - - [1536, 128, 1, 1536]
    - [153, 5.58]
  - - [1536, 192, 1, 1536]
    - [108, 7.92]
  - - [1536, 256, 1, 1536]
    - [154, 10.08]
  - - [1536, 320, 1, 1536]
    - [88, 12.07]
  - - [1536, 384, 1, 1536]
    - [128, 13.82]
  - - [1536, 448, 1, 1536]
    - [136, 14.79]
  - - [1536, 512, 1, 1536]
    - [112, 16.41]
  - - [1536, 576, 1, 1536]
    - [90, 17.66]
  - - [1536, 640, 1, 1536]
    - [112, 18.96]
  - - [1536, 704, 1, 1536]
    - [118, 19.93]
  - - [1536, 768, 1, 1536]
    - [155, 20.59]
  - - [1536, 832, 1, 1536]
    - [97, 20.88]
  - - [1536, 896, 1, 1536]
    - [97, 22.76]
  - - [1536, 960, 1, 1536]
    - [96, 22.43]
  - - [1536, 1024, 1, 1536]
    - [98, 23.34]
  - - [1536, 1088, 1, 1536]
    - [156, 22.86]
  - - [1536, 1152, 1, 1536]
    - [141, 23.62]
  - - [1536, 1216, 1, 1536]
    - [141, 24.25]
  - - [1536, 1280, 1, 1536]
    - [141, 25.29]
  - - [1536, 1344, 1, 1536]
    - [89, 25.47]
  - - [1536, 1408, 1, 1536]
    - [89, 26.36]
  - - [1536, 1472, 1, 1536]
    - [89, 26.69]
  - - [1536, 1536, 1, 1536]
    - [89, 27.64]
  - - [1536, 1600, 1, 1536]
    - [90, 26.42]
  - - [1536, 1664, 1, 1536]
    - [148, 27.41]
  - - [1536, 1728, 1, 1536]
    - [90, 28.33]
  - - [1536, 1792, 1, 1536]
    - [94, 28.37]
  - - [1536, 1856, 1, 1536]
    - [148, 29.35]
  - - [1536, 1920, 1, 1536]
    - [90, 30.84]
  - - [1536, 1984, 1, 1536]
    - [142, 29.56]
  - - [1536, 2048, 1, 1536]
    - [94, 31.39]
  - - [1536, 2112, 1, 1536]
    - [142, 29.7]
  - - [1536, 2176, 1, 1536]
    - [94, 31.2]
  - - [1536, 2240, 1, 1536]
    - [125, 31.31]
  - - [1536, 2304, 1, 1536]
    - [118, 32.31]
  - - [1536, 2368, 1, 1536]
    - [125, 31.98]
  - - [1536, 2432, 1, 1536]
    - [96, 32.54]
  - - [1536, 2496, 1, 1536]
    - [99, 32.39]
  - - [1536, 2560, 1, 1536]
    - [147, 32.48]
  - - [1536, 2624, 1, 1536]
    - [102, 32.87]
  - - [1536, 2688, 1, 1536]
    - [118, 33.48]
  - - [1536, 2752, 1, 1536]
    - [96, 34.11]
  - - [1536, 2816, 1, 1536]
    - [89, 34.03]
  - - [1536, 2880, 1, 1536]
    - [96, 34.91]
  - - [1536, 2944, 1, 1536]
    - [96, 35.16]
  - - [1536, 3008, 1, 1536]
    - [94, 34.66]
  - - [1536, 3072, 1, 1536]
    - [98, 35.44]
  - - [1536, 3136, 1, 1536]
    - [96, 35.73]
  - - [1536, 3200, 1, 1536]
    - [96, 36.13]
  - - [1536, 3264, 1, 1536]
    - [96, 36.32]
  - - [1536, 3328, 1, 1536]
    - [104, 36.23]
  - - [1536, 3392, 1, 1536]
    - [90, 35.6]
  - - [1536, 3456, 1, 1536]
    - [148, 36.22]
  - - [1536, 3520, 1, 1536]
    - [157, 36.22]
  - - [1536, 3584, 1, 1536]
    - [94, 36.17]
  - - [1536, 3648, 1, 1536]
    - [90, 35.99]
  - - [1536, 3712, 1, 1536]
    - [94, 36.71]
  - - [1536, 3776, 1, 1536]
    - [94, 37.36]
  - - [1536, 3840, 1, 1536]
    - [94, 37.15]
  - - [1536, 3904, 1, 1536]
    - [142, 36.85]
  - - [1536, 3968, 1, 1536]
    - [95, 36.45]
  - - [1536, 4032, 1, 1536]
    - [90, 36.55]
  - - [1536, 4096, 1, 1536]
    - [95, 37.37]
  - - [152064, 1, 1, 3584]
    - [158, 0.22]
  - - [152064, 64, 1, 3584]
    - [159, 12.92]
  - - [152064, 128, 1, 3584]
    - [141, 24.85]
  - - [152064, 192, 1, 3584]
    - [108, 36.03]
  - - [152064, 256, 1, 3584]
    - [160, 41.56]
  - - [151936, 1, 1, 1536]
    - [134, 0.21]
  - - [151936, 64, 1, 1536]
    - [161, 12.01]
  - - [151936, 128, 1, 1536]
    - [141, 22.63]
  - - [151936, 192, 1, 1536]
    - [162, 32.22]
  - - [151936, 256, 1, 1536]
    - [160, 39.05]
  - - [76032, 1, 1, 5120]
    - [165, 0.21]
  - - [76032, 64, 1, 5120]
    - [166, 12.93]
  - - [76032, 128, 1, 5120]
    - [141, 24.61]
  - - [76032, 192, 1, 5120]
    - [92, 35.6]
  - - [76032, 256, 1, 5120]
    - [160, 41.08]
  - - [5120, 1, 1, 6912]
    - [105, 0.23]
  - - [5120, 64, 1, 6912]
    - [134, 13.41]
  - - [5120, 128, 1, 6912]
    - [121, 24.39]
  - - [5120, 192, 1, 6912]
    - [93, 34.3]
  - - [5120, 256, 1, 6912]
    - [95, 37.0]
  - - [5120, 320, 1, 6912]
    - [120, 37.49]
  - - [5120, 384, 1, 6912]
    - [167, 41.16]
  - - [5120, 448, 1, 6912]
    - [97, 41.55]
  - - [5120, 512, 1, 6912]
    - [96, 41.98]
  - - [5120, 576, 1, 6912]
    - [93, 38.08]
  - - [5120, 640, 1, 6912]
    - [138, 38.96]
  - - [5120, 704, 1, 6912]
    - [99, 38.72]
  - - [5120, 768, 1, 6912]
    - [167, 41.02]
  - - [5120, 832, 1, 6912]
    - [114, 40.56]
  - - [5120, 896, 1, 6912]
    - [114, 42.93]
  - - [5120, 960, 1, 6912]
    - [96, 43.48]
  - - [5120, 1024, 1, 6912]
    - [96, 44.37]
  - - [5120, 1088, 1, 6912]
    - [90, 41.85]
  - - [5120, 1152, 1, 6912]
    - [93, 43.51]
  - - [5120, 1216, 1, 6912]
    - [95, 42.78]
  - - [5120, 1280, 1, 6912]
    - [95, 44.84]
  - - [5120, 1344, 1, 6912]
    - [114, 44.11]
  - - [5120, 1408, 1, 6912]
    - [96, 45.28]
  - - [5120, 1472, 1, 6912]
    - [96, 44.12]
  - - [5120, 1536, 1, 6912]
    - [96, 45.09]
  - - [5120, 1600, 1, 6912]
    - [90, 43.51]
  - - [5120, 1664, 1, 6912]
    - [95, 45.48]
  - - [5120, 1728, 1, 6912]
    - [95, 44.49]
  - - [5120, 1792, 1, 6912]
    - [95, 45.45]
  - - [5120, 1856, 1, 6912]
    - [96, 44.05]
  - - [5120, 1920, 1, 6912]
    - [96, 46.09]
  - - [5120, 1984, 1, 6912]
    - [96, 44.06]
  - - [5120, 2048, 1, 6912]
    - [95, 44.95]
  - - [5120, 2112, 1, 6912]
    - [113, 44.98]
  - - [5120, 2176, 1, 6912]
    - [96, 45.5]
  - - [5120, 2240, 1, 6912]
    - [114, 43.6]
  - - [5120, 2304, 1, 6912]
    - [96, 45.03]
  - - [5120, 2368, 1, 6912]
    - [96, 45.26]
  - - [5120, 2432, 1, 6912]
    - [96, 46.76]
  - - [5120, 2496, 1, 6912]
    - [113, 44.99]
  - - [5120, 2560, 1, 6912]
    - [90, 46.14]
  - - [5120, 2624, 1, 6912]
    - [96, 45.14]
  - - [5120, 2688, 1, 6912]
    - [94, 46.03]
  - - [5120, 2752, 1, 6912]
    - [96, 44.55]
  - - [5120, 2816, 1, 6912]
    - [94, 46.47]
  - - [5120, 2880, 1, 6912]
    - [96, 46.09]
  - - [5120, 2944, 1, 6912]
    - [96, 46.9]
  - - [5120, 3008, 1, 6912]
    - [113, 45.36]
  - - [5120, 3072, 1, 6912]
    - [94, 46.86]
  - - [5120, 3136, 1, 6912]
    - [94, 45.5]
  - - [5120, 3200, 1, 6912]
    - [96, 46.22]
  - - [5120, 3264, 1, 6912]
    - [96, 45.6]
  - - [5120, 3328, 1, 6912]
    - [96, 46.81]
  - - [5120, 3392, 1, 6912]
    - [96, 46.63]
  - - [5120, 3456, 1, 6912]
    - [96, 47.65]
  - - [5120, 3520, 1, 6912]
    - [94, 45.68]
  - - [5120, 3584, 1, 6912]
    - [94, 46.28]
  - - [5120, 3648, 1, 6912]
    - [96, 46.08]
  - - [5120, 3712, 1, 6912]
    - [96, 46.48]
  - - [5120, 3776, 1, 6912]
    - [96, 46.12]
  - - [5120, 3840, 1, 6912]
    - [96, 47.3]
  - - [5120, 3904, 1, 6912]
    - [96, 46.93]
  - - [5120, 3968, 1, 6912]
    - [96, 47.63]
  - - [5120, 4032, 1, 6912]
    - [96, 45.79]
  - - [5120, 4096, 1, 6912]
    - [96, 46.37]
  - - [5120, 1, 1, 2560]
    - [168, 0.21]
  - - [5120, 64, 1, 2560]
    - [111, 11.45]
  - - [5120, 128, 1, 2560]
    - [121, 20.43]
  - - [5120, 192, 1, 2560]
    - [113, 25.31]
  - - [5120, 256, 1, 2560]
    - [98, 27.91]
  - - [5120, 320, 1, 2560]
    - [120, 26.94]
  - - [5120, 384, 1, 2560]
    - [113, 29.26]
  - - [5120, 448, 1, 2560]
    - [114, 29.16]
  - - [5120, 512, 1, 2560]
    - [96, 35.37]
  - - [5120, 576, 1, 2560]
    - [100, 33.97]
  - - [5120, 640, 1, 2560]
    - [94, 35.05]
  - - [5120, 704, 1, 2560]
    - [94, 32.69]
  - - [5120, 768, 1, 2560]
    - [99, 36.14]
  - - [5120, 832, 1, 2560]
    - [102, 34.17]
  - - [5120, 896, 1, 2560]
    - [96, 37.82]
  - - [5120, 960, 1, 2560]
    - [96, 38.03]
  - - [5120, 1024, 1, 2560]
    - [96, 39.07]
  - - [5120, 1088, 1, 2560]
    - [94, 37.62]
  - - [5120, 1152, 1, 2560]
    - [94, 41.02]
  - - [5120, 1216, 1, 2560]
    - [94, 39.35]
  - - [5120, 1280, 1, 2560]
    - [95, 40.75]
  - - [5120, 1344, 1, 2560]
    - [114, 40.13]
  - - [5120, 1408, 1, 2560]
    - [96, 41.22]
  - - [5120, 1472, 1, 2560]
    - [96, 40.96]
  - - [5120, 1536, 1, 2560]
    - [96, 42.18]
  - - [5120, 1600, 1, 2560]
    - [103, 41.62]
  - - [5120, 1664, 1, 2560]
    - [94, 43.09]
  - - [5120, 1728, 1, 2560]
    - [94, 42.28]
  - - [5120, 1792, 1, 2560]
    - [95, 43.2]
  - - [5120, 1856, 1, 2560]
    - [96, 41.83]
  - - [5120, 1920, 1, 2560]
    - [104, 42.13]
  - - [5120, 1984, 1, 2560]
    - [100, 42.06]
  - - [5120, 2048, 1, 2560]
    - [94, 43.27]
  - - [5120, 2112, 1, 2560]
    - [100, 42.76]
  - - [5120, 2176, 1, 2560]
    - [94, 44.53]
  - - [5120, 2240, 1, 2560]
    - [90, 42.25]
  - - [5120, 2304, 1, 2560]
    - [96, 42.55]
  - - [5120, 2368, 1, 2560]
    - [96, 43.31]
  - - [5120, 2432, 1, 2560]
    - [96, 43.9]
  - - [5120, 2496, 1, 2560]
    - [113, 44.02]
  - - [5120, 2560, 1, 2560]
    - [96, 43.23]
  - - [5120, 2624, 1, 2560]
    - [94, 43.3]
  - - [5120, 2688, 1, 2560]
    - [95, 43.85]
  - - [5120, 2752, 1, 2560]
    - [96, 42.74]
  - - [5120, 2816, 1, 2560]
    - [95, 44.52]
  - - [5120, 2880, 1, 2560]
    - [96, 44.09]
  - - [5120, 2944, 1, 2560]
    - [96, 45.12]
  - - [5120, 3008, 1, 2560]
    - [96, 43.03]
  - - [5120, 3072, 1, 2560]
    - [94, 44.03]
  - - [5120, 3136, 1, 2560]
    - [96, 44.25]
  - - [5120, 3200, 1, 2560]
    - [94, 46.28]
  - - [5120, 3264, 1, 2560]
    - [94, 43.99]
  - - [5120, 3328, 1, 2560]
    - [96, 44.72]
  - - [5120, 3392, 1, 2560]
    - [96, 44.51]
  - - [5120, 3456, 1, 2560]
    - [96, 45.94]
  - - [5120, 3520, 1, 2560]
    - [94, 44.92]
  - - [5120, 3584, 1, 2560]
    - [94, 45.69]
  - - [5120, 3648, 1, 2560]
    - [96, 44.73]
  - - [5120, 3712, 1, 2560]
    - [94, 45.95]
  - - [5120, 3776, 1, 2560]
    - [96, 44.62]
  - - [5120, 3840, 1, 2560]
    - [94, 45.63]
  - - [5120, 3904, 1, 2560]
    - [94, 45.47]
  - - [5120, 3968, 1, 2560]
    - [96, 46.13]
  - - [5120, 4032, 1, 2560]
    - [94, 45.48]
  - - [5120, 4096, 1, 2560]
    - [94, 45.38]
  - - [3584, 1, 1, 5120]
    - [169, 0.26]
  - - [3584, 64, 1, 5120]
    - [116, 13.53]
  - - [3584, 128, 1, 5120]
    - [109, 21.45]
  - - [3584, 192, 1, 5120]
    - [102, 27.35]
  - - [3584, 256, 1, 5120]
    - [98, 30.04]
  - - [3584, 320, 1, 5120]
    - [120, 28.75]
  - - [3584, 384, 1, 5120]
    - [167, 31.2]
  - - [3584, 448, 1, 5120]
    - [142, 31.23]
  - - [3584, 512, 1, 5120]
    - [160, 33.48]
  - - [3584, 576, 1, 5120]
    - [117, 34.07]
  - - [3584, 640, 1, 5120]
    - [101, 33.54]
  - - [3584, 704, 1, 5120]
    - [170, 35.1]
  - - [3584, 768, 1, 5120]
    - [93, 37.03]
  - - [3584, 832, 1, 5120]
    - [94, 35.56]
  - - [3584, 896, 1, 5120]
    - [95, 38.43]
  - - [3584, 960, 1, 5120]
    - [102, 39.64]
  - - [3584, 1024, 1, 5120]
    - [95, 40.47]
  - - [3584, 1088, 1, 5120]
    - [94, 39.48]
  - - [3584, 1152, 1, 5120]
    - [95, 41.43]
  - - [3584, 1216, 1, 5120]
    - [114, 41.58]
  - - [3584, 1280, 1, 5120]
    - [96, 41.87]
  - - [3584, 1344, 1, 5120]
    - [96, 43.64]
  - - [3584, 1408, 1, 5120]
    - [96, 45.17]
  - - [3584, 1472, 1, 5120]
    - [96, 41.78]
  - - [3584, 1536, 1, 5120]
    - [104, 42.39]
  - - [3584, 1600, 1, 5120]
    - [103, 43.18]
  - - [3584, 1664, 1, 5120]
    - [94, 41.59]
  - - [3584, 1728, 1, 5120]
    - [113, 43.04]
  - - [3584, 1792, 1, 5120]
    - [94, 44.0]
  - - [3584, 1856, 1, 5120]
    - [114, 43.18]
  - - [3584, 1920, 1, 5120]
    - [96, 42.89]
  - - [3584, 1984, 1, 5120]
    - [96, 43.87]
  - - [3584, 2048, 1, 5120]
    - [96, 43.98]
  - - [3584, 2112, 1, 5120]
    - [96, 44.78]
  - - [3584, 2176, 1, 5120]
    - [96, 45.03]
  - - [3584, 2240, 1, 5120]
    - [103, 44.56]
  - - [3584, 2304, 1, 5120]
    - [96, 44.8]
  - - [3584, 2368, 1, 5120]
    - [95, 45.13]
  - - [3584, 2432, 1, 5120]
    - [119, 43.75]
  - - [3584, 2496, 1, 5120]
    - [94, 45.16]
  - - [3584, 2560, 1, 5120]
    - [95, 45.15]
  - - [3584, 2624, 1, 5120]
    - [96, 44.28]
  - - [3584, 2688, 1, 5120]
    - [96, 45.01]
  - - [3584, 2752, 1, 5120]
    - [96, 45.29]
  - - [3584, 2816, 1, 5120]
    - [96, 45.76]
  - - [3584, 2880, 1, 5120]
    - [90, 44.28]
  - - [3584, 2944, 1, 5120]
    - [96, 44.38]
  - - [3584, 3008, 1, 5120]
    - [104, 44.46]
  - - [3584, 3072, 1, 5120]
    - [94, 45.54]
  - - [3584, 3136, 1, 5120]
    - [95, 44.71]
  - - [3584, 3200, 1, 5120]
    - [94, 46.4]
  - - [3584, 3264, 1, 5120]
    - [96, 44.56]
  - - [3584, 3328, 1, 5120]
    - [94, 46.15]
  - - [3584, 3392, 1, 5120]
    - [96, 45.56]
  - - [3584, 3456, 1, 5120]
    - [96, 46.46]
  - - [3584, 3520, 1, 5120]
    - [96, 45.92]
  - - [3584, 3584, 1, 5120]
    - [96, 47.23]
  - - [3584, 3648, 1, 5120]
    - [113, 45.73]
  - - [3584, 3712, 1, 5120]
    - [95, 45.6]
  - - [3584, 3776, 1, 5120]
    - [94, 46.33]
  - - [3584, 3840, 1, 5120]
    - [94, 47.11]
  - - [3584, 3904, 1, 5120]
    - [94, 46.16]
  - - [3584, 3968, 1, 5120]
    - [94, 46.76]
  - - [3584, 4032, 1, 5120]
    - [96, 45.81]
  - - [3584, 4096, 1, 5120]
    - [96, 46.66]
  - - [13824, 1, 1, 5120]
    - [153, 0.19]
  - - [13824, 64, 1, 5120]
    - [166, 11.67]
  - - [13824, 128, 1, 5120]
    - [164, 22.41]
  - - [13824, 192, 1, 5120]
    - [164, 32.36]
  - - [13824, 256, 1, 5120]
    - [160, 34.65]
  - - [13824, 320, 1, 5120]
    - [148, 37.58]
  - - [13824, 384, 1, 5120]
    - [96, 39.25]
  - - [13824, 448, 1, 5120]
    - [103, 40.0]
  - - [13824, 512, 1, 5120]
    - [96, 42.36]
  - - [13824, 576, 1, 5120]
    - [113, 41.36]
  - - [13824, 640, 1, 5120]
    - [95, 43.58]
  - - [13824, 704, 1, 5120]
    - [113, 41.72]
  - - [13824, 768, 1, 5120]
    - [167, 43.43]
  - - [13824, 832, 1, 5120]
    - [96, 42.33]
  - - [13824, 896, 1, 5120]
    - [96, 45.21]
  - - [13824, 960, 1, 5120]
    - [95, 43.71]
  - - [13824, 1024, 1, 5120]
    - [96, 45.59]
  - - [13824, 1088, 1, 5120]
    - [103, 44.2]
  - - [13824, 1152, 1, 5120]
    - [113, 43.53]
  - - [13824, 1216, 1, 5120]
    - [100, 43.37]
  - - [13824, 1280, 1, 5120]
    - [90, 45.95]
  - - [13824, 1344, 1, 5120]
    - [113, 44.73]
  - - [13824, 1408, 1, 5120]
    - [96, 45.89]
  - - [13824, 1472, 1, 5120]
    - [95, 44.78]
  - - [13824, 1536, 1, 5120]
    - [94, 45.89]
  - - [13824, 1600, 1, 5120]
    - [95, 45.54]
  - - [13824, 1664, 1, 5120]
    - [94, 46.98]
  - - [13824, 1728, 1, 5120]
    - [94, 45.51]
  - - [13824, 1792, 1, 5120]
    - [96, 46.66]
  - - [13824, 1856, 1, 5120]
    - [96, 45.69]
  - - [13824, 1920, 1, 5120]
    - [96, 47.0]
  - - [13824, 1984, 1, 5120]
    - [96, 45.94]
  - - [13824, 2048, 1, 5120]
    - [96, 47.08]
  - - [13824, 2112, 1, 5120]
    - [113, 45.16]
  - - [13824, 2176, 1, 5120]
    - [96, 45.65]
  - - [13824, 2240, 1, 5120]
    - [96, 45.9]
  - - [13824, 2304, 1, 5120]
    - [96, 47.15]
  - - [13824, 2368, 1, 5120]
    - [90, 45.49]
  - - [13824, 2432, 1, 5120]
    - [94, 46.94]
  - - [13824, 2496, 1, 5120]
    - [96, 47.04]
  - - [13824, 2560, 1, 5120]
    - [96, 47.78]
  - - [13824, 2624, 1, 5120]
    - [96, 46.63]
  - - [13824, 2688, 1, 5120]
    - [96, 47.62]
  - - [13824, 2752, 1, 5120]
    - [96, 46.74]
  - - [13824, 2816, 1, 5120]
    - [96, 47.53]
  - - [13824, 2880, 1, 5120]
    - [96, 47.08]
  - - [13824, 2944, 1, 5120]
    - [96, 47.75]
  - - [13824, 3008, 1, 5120]
    - [96, 47.2]
  - - [13824, 3072, 1, 5120]
    - [96, 48.33]
  - - [13824, 3136, 1, 5120]
    - [96, 45.99]
  - - [13824, 3200, 1, 5120]
    - [96, 47.49]
  - - [13824, 3264, 1, 5120]
    - [96, 46.52]
  - - [13824, 3328, 1, 5120]
    - [96, 47.44]
  - - [13824, 3392, 1, 5120]
    - [96, 47.29]
  - - [13824, 3456, 1, 5120]
    - [96, 48.09]
  - - [13824, 3520, 1, 5120]
    - [90, 45.78]
  - - [13824, 3584, 1, 5120]
    - [96, 46.13]
  - - [13824, 3648, 1, 5120]
    - [96, 47.05]
  - - [13824, 3712, 1, 5120]
    - [96, 47.05]
  - - [13824, 3776, 1, 5120]
    - [96, 45.75]
  - - [13824, 3840, 1, 5120]
    - [96, 46.8]
  - - [13824, 3904, 1, 5120]
    - [96, 46.4]
  - - [13824, 3968, 1, 5120]
    - [96, 46.82]
  - - [13824, 4032, 1, 5120]
    - [96, 45.74]
  - - [13824, 4096, 1, 5120]
    - [96, 47.31]
  - - [5120, 1, 1, 1280]
    - [171, 0.14]
  - - [5120, 64, 1, 1280]
    - [111, 7.54]
  - - [5120, 128, 1, 1280]
    - [121, 13.45]
  - - [5120, 192, 1, 1280]
    - [93, 17.49]
  - - [5120, 256, 1, 1280]
    - [94, 20.31]
  - - [5120, 320, 1, 1280]
    - [137, 21.59]
  - - [5120, 384, 1, 1280]
    - [167, 23.0]
  - - [5120, 448, 1, 1280]
    - [172, 23.57]
  - - [5120, 512, 1, 1280]
    - [98, 25.44]
  - - [5120, 576, 1, 1280]
    - [113, 27.58]
  - - [5120, 640, 1, 1280]
    - [94, 29.04]
  - - [5120, 704, 1, 1280]
    - [94, 27.14]
  - - [5120, 768, 1, 1280]
    - [94, 29.56]
  - - [5120, 832, 1, 1280]
    - [94, 28.69]
  - - [5120, 896, 1, 1280]
    - [114, 32.05]
  - - [5120, 960, 1, 1280]
    - [104, 32.07]
  - - [5120, 1024, 1, 1280]
    - [96, 32.79]
  - - [5120, 1088, 1, 1280]
    - [95, 31.7]
  - - [5120, 1152, 1, 1280]
    - [96, 33.36]
  - - [5120, 1216, 1, 1280]
    - [94, 33.41]
  - - [5120, 1280, 1, 1280]
    - [94, 34.8]
  - - [5120, 1344, 1, 1280]
    - [94, 35.1]
  - - [5120, 1408, 1, 1280]
    - [89, 35.58]
  - - [5120, 1472, 1, 1280]
    - [96, 35.3]
  - - [5120, 1536, 1, 1280]
    - [113, 36.39]
  - - [5120, 1600, 1, 1280]
    - [90, 36.88]
  - - [5120, 1664, 1, 1280]
    - [94, 38.26]
  - - [5120, 1728, 1, 1280]
    - [113, 38.76]
  - - [5120, 1792, 1, 1280]
    - [94, 39.1]
  - - [5120, 1856, 1, 1280]
    - [96, 36.75]
  - - [5120, 1920, 1, 1280]
    - [104, 38.38]
  - - [5120, 1984, 1, 1280]
    - [93, 38.07]
  - - [5120, 2048, 1, 1280]
    - [96, 38.84]
  - - [5120, 2112, 1, 1280]
    - [113, 39.18]
  - - [5120, 2176, 1, 1280]
    - [94, 40.16]
  - - [5120, 2240, 1, 1280]
    - [98, 38.65]
  - - [5120, 2304, 1, 1280]
    - [94, 39.73]
  - - [5120, 2368, 1, 1280]
    - [104, 38.9]
  - - [5120, 2432, 1, 1280]
    - [96, 40.22]
  - - [5120, 2496, 1, 1280]
    - [94, 40.0]
  - - [5120, 2560, 1, 1280]
    - [94, 40.45]
  - - [5120, 2624, 1, 1280]
    - [94, 40.16]
  - - [5120, 2688, 1, 1280]
    - [94, 41.22]
  - - [5120, 2752, 1, 1280]
    - [94, 40.56]
  - - [5120, 2816, 1, 1280]
    - [94, 40.89]
  - - [5120, 2880, 1, 1280]
    - [94, 40.61]
  - - [5120, 2944, 1, 1280]
    - [94, 41.27]
  - - [5120, 3008, 1, 1280]
    - [90, 41.15]
  - - [5120, 3072, 1, 1280]
    - [94, 41.78]
  - - [5120, 3136, 1, 1280]
    - [94, 40.67]
  - - [5120, 3200, 1, 1280]
    - [94, 42.29]
  - - [5120, 3264, 1, 1280]
    - [94, 41.1]
  - - [5120, 3328, 1, 1280]
    - [95, 41.1]
  - - [5120, 3392, 1, 1280]
    - [96, 41.48]
  - - [5120, 3456, 1, 1280]
    - [96, 41.98]
  - - [5120, 3520, 1, 1280]
    - [94, 42.03]
  - - [5120, 3584, 1, 1280]
    - [95, 42.05]
  - - [5120, 3648, 1, 1280]
    - [95, 42.05]
  - - [5120, 3712, 1, 1280]
    - [94, 42.94]
  - - [5120, 3776, 1, 1280]
    - [94, 41.72]
  - - [5120, 3840, 1, 1280]
    - [94, 42.05]
  - - [5120, 3904, 1, 1280]
    - [94, 42.33]
  - - [5120, 3968, 1, 1280]
    - [96, 42.66]
  - - [5120, 4032, 1, 1280]
    - [93, 42.05]
  - - [5120, 4096, 1, 1280]
    - [94, 43.25]
  - - [38016, 1, 1, 5120]
    - [153, 0.21]
  - - [38016, 64, 1, 5120]
    - [166, 12.51]
  - - [38016, 128, 1, 5120]
    - [173, 23.54]
  - - [38016, 192, 1, 5120]
    - [112, 34.25]
  - - [38016, 256, 1, 5120]
    - [160, 39.39]
  - - [1792, 1, 1, 5120]
    - [115, 0.15]
  - - [1792, 64, 1, 5120]
    - [174, 8.12]
  - - [1792, 128, 1, 5120]
    - [175, 13.51]
  - - [1792, 192, 1, 5120]
    - [162, 18.14]
  - - [1792, 256, 1, 5120]
    - [176, 21.3]
  - - [1792, 320, 1, 5120]
    - [177, 23.67]
  - - [1792, 384, 1, 5120]
    - [118, 26.16]
  - - [1792, 448, 1, 5120]
    - [108, 27.3]
  - - [1792, 512, 1, 5120]
    - [150, 29.63]
  - - [1792, 576, 1, 5120]
    - [117, 30.15]
  - - [1792, 640, 1, 5120]
    - [138, 29.04]
  - - [1792, 704, 1, 5120]
    - [118, 31.01]
  - - [1792, 768, 1, 5120]
    - [96, 33.03]
  - - [1792, 832, 1, 5120]
    - [99, 35.08]
  - - [1792, 896, 1, 5120]
    - [97, 34.76]
  - - [1792, 960, 1, 5120]
    - [119, 36.93]
  - - [1792, 1024, 1, 5120]
    - [119, 38.88]
  - - [1792, 1088, 1, 5120]
    - [104, 38.04]
  - - [1792, 1152, 1, 5120]
    - [96, 40.58]
  - - [1792, 1216, 1, 5120]
    - [119, 38.37]
  - - [1792, 1280, 1, 5120]
    - [119, 38.53]
  - - [1792, 1344, 1, 5120]
    - [104, 38.42]
  - - [1792, 1408, 1, 5120]
    - [104, 39.7]
  - - [1792, 1472, 1, 5120]
    - [94, 36.91]
  - - [1792, 1536, 1, 5120]
    - [94, 37.24]
  - - [1792, 1600, 1, 5120]
    - [90, 38.66]
  - - [1792, 1664, 1, 5120]
    - [118, 37.88]
  - - [1792, 1728, 1, 5120]
    - [118, 39.58]
  - - [1792, 1792, 1, 5120]
    - [89, 38.53]
  - - [1792, 1856, 1, 5120]
    - [101, 39.24]
  - - [1792, 1920, 1, 5120]
    - [102, 40.82]
  - - [1792, 1984, 1, 5120]
    - [101, 40.75]
  - - [1792, 2048, 1, 5120]
    - [155, 41.3]
  - - [1792, 2112, 1, 5120]
    - [118, 41.01]
  - - [1792, 2176, 1, 5120]
    - [90, 40.2]
  - - [1792, 2240, 1, 5120]
    - [98, 40.26]
  - - [1792, 2304, 1, 5120]
    - [113, 41.72]
  - - [1792, 2368, 1, 5120]
    - [103, 42.36]
  - - [1792, 2432, 1, 5120]
    - [119, 42.41]
  - - [1792, 2496, 1, 5120]
    - [98, 42.44]
  - - [1792, 2560, 1, 5120]
    - [98, 43.41]
  - - [1792, 2624, 1, 5120]
    - [96, 42.92]
  - - [1792, 2688, 1, 5120]
    - [178, 43.19]
  - - [1792, 2752, 1, 5120]
    - [96, 43.9]
  - - [1792, 2816, 1, 5120]
    - [96, 44.56]
  - - [1792, 2880, 1, 5120]
    - [90, 41.42]
  - - [1792, 2944, 1, 5120]
    - [103, 42.49]
  - - [1792, 3008, 1, 5120]
    - [103, 43.13]
  - - [1792, 3072, 1, 5120]
    - [178, 42.78]
  - - [1792, 3136, 1, 5120]
    - [96, 42.38]
  - - [1792, 3200, 1, 5120]
    - [96, 43.7]
  - - [1792, 3264, 1, 5120]
    - [95, 42.47]
  - - [1792, 3328, 1, 5120]
    - [94, 43.74]
  - - [1792, 3392, 1, 5120]
    - [113, 42.17]
  - - [1792, 3456, 1, 5120]
    - [94, 45.41]
  - - [1792, 3520, 1, 5120]
    - [94, 42.92]
  - - [1792, 3584, 1, 5120]
    - [95, 43.87]
  - - [1792, 3648, 1, 5120]
    - [103, 43.51]
  - - [1792, 3712, 1, 5120]
    - [94, 44.87]
  - - [1792, 3776, 1, 5120]
    - [114, 43.42]
  - - [1792, 3840, 1, 5120]
    - [102, 43.03]
  - - [1792, 3904, 1, 5120]
    - [96, 43.78]
  - - [1792, 3968, 1, 5120]
    - [96, 44.21]
  - - [1792, 4032, 1, 5120]
    - [96, 44.66]
  - - [1792, 4096, 1, 5120]
    - [96, 45.06]
- null
- null
- DeviceEfficiency
- GridBased
