library/src/amd_detail/rocblaslt/src/Tensile/Logic/asm_full/gfx1201/GridBased/gfx1201_Cijk_Alik_Bljk_HHS_BH_Bias_HAS_SAV_UserArgs.yaml
- {MinimumRequiredVersion: 4.33.0}
- gfx1201
- gfx1201
- [Device 73f0]
    SolutionIndex: 0
    SolutionNameMin: Cijk_Alik_Bljk_HHS_BH_Bias_HAS_SAV_UserArgs_MT32x32x32_MI16x16x1_SN_CLR1_GSU1_LBSPPA128_LBSPPB128_MIWT1_1_PGR1_PLR1_SS0_SU32_SUM0_SUS256_SVW8_TLDS1_WG32_4_1_WGM8
    SolutionIndex: 1
    SolutionNameMin: Cijk_Alik_Bljk_HHS_BH_Bias_HAS_SAV_UserArgs_MT32x32x32_MI16x16x1_SN_CLR0_GSU1_LBSPPA128_LBSPPB128_MIWT1_1_PGR1_PLR0_SS0_SU32_SUM0_SUS256_SVW8_TLDS1_WG32_4_1_WGM8
    SolutionIndex: 2
    SolutionNameMin: Cijk_Alik_Bljk_HHS_BH_Bias_HAS_SAV_UserArgs_MT32x32x32_MI16x16x1_SN_CLR0_GSU1_LBSPPA128_LBSPPB128_MIWT1_1_PGR2_PLR0_SS0_SU32_SUM0_SUS256_SVW8_TLDS1_WG32_4_1_WGM8
    SolutionIndex: 3
    SolutionNameMin: Cijk_Alik_Bljk_HHS_BH_Bias_HAS_SAV_UserArgs_MT64x32x32_MI16x16x1_SN_CLR1_GSU1_LBSPPA128_LBSPPB128_MIWT2_1_PGR1_PLR1_SS0_SU32_SUM0_SUS256_SVW8_TLDS1_WG32_4_1_WGM8
    SolutionIndex: 4
    SolutionNameMin: Cijk_Alik_Bljk_HHS_BH_Bias_HAS_SAV_UserArgs_MT64x32x32_MI16x16x1_SN_CLR1_GSU1_LBSPPA128_LBSPPB128_MIWT2_1_PGR2_PLR1_SS0_SU32_SUM0_SUS256_SVW8_TLDS1_WG32_4_1_WGM8
    SolutionIndex: 5
    SolutionNameMin: Cijk_Alik_Bljk_HHS_BH_Bias_HAS_SAV_UserArgs_MT64x32x32_MI16x16x1_SN_CLR0_GSU1_LBSPPA128_LBSPPB128_MIWT2_1_PGR1_PLR0_SS0_SU32_SUM0_SUS256_SVW8_TLDS1_WG32_4_1_WGM8
    SolutionIndex: 6
    SolutionNameMin: Cijk_Alik_Bljk_HHS_BH_Bias_HAS_SAV_UserArgs_MT64x32x32_MI16x16x1_SN_CLR0_GSU1_LBSPPA128_LBSPPB128_MIWT2_1_PGR2_PLR0_SS0_SU32_SUM0_SUS256_SVW8_TLDS1_WG32_4_1_WGM8
    SolutionIndex: 7
    SolutionNameMin: Cijk_Alik_Bljk_HHS_BH_Bias_HAS_SAV_UserArgs_MT32x64x32_MI16x16x1_SN_CLR1_GSU1_LBSPPA128_LBSPPB128_MIWT2_1_PGR1_PLR1_SS0_SU32_SUM0_SUS256_SVW8_TLDS1_WG16_8_1_WGM8
    SolutionIndex: 8
    SolutionNameMin: Cijk_Alik_Bljk_HHS_BH_Bias_HAS_SAV_UserArgs_MT32x64x32_MI16x16x1_SN_CLR1_GSU1_LBSPPA128_LBSPPB128_MIWT2_1_PGR2_PLR1_SS0_SU32_SUM0_SUS256_SVW8_TLDS1_WG16_8_1_WGM8
    SolutionIndex: 9
    SolutionNameMin: Cijk_Alik_Bljk_HHS_BH_Bias_HAS_SAV_UserArgs_MT32x64x32_MI16x16x1_SN_CLR0_GSU1_LBSPPA128_LBSPPB128_MIWT2_1_PGR1_PLR0_SS0_SU32_SUM0_SUS256_SVW8_TLDS1_WG16_8_1_WGM8
    SolutionIndex: 10
    SolutionNameMin: Cijk_Alik_Bljk_HHS_BH_Bias_HAS_SAV_UserArgs_MT32x32x64_MI16x16x1_SN_CLR1_GSU1_LBSPPA128_LBSPPB128_MIWT1_1_PGR2_PLR1_SS0_SU32_SUM0_SUS256_SVW8_TLDS1_WG32_4_1_WGM8
    SolutionIndex: 11
    SolutionNameMin: Cijk_Alik_Bljk_HHS_BH_Bias_HAS_SAV_UserArgs_MT32x32x64_MI16x16x1_SN_CLR1_GSU1_LBSPPA128_LBSPPB128_MIWT1_1_PGR1_PLR3_SS0_SU32_SUM0_SUS256_SVW8_TLDS1_WG32_4_1_WGM8
    SolutionIndex: 12
    SolutionNameMin: Cijk_Alik_Bljk_HHS_BH_Bias_HAS_SAV_UserArgs_MT32x32x64_MI16x16x1_SN_CLR0_GSU1_LBSPPA128_LBSPPB128_MIWT1_1_PGR1_PLR0_SS0_SU32_SUM0_SUS256_SVW8_TLDS1_WG32_4_1_WGM8
    SolutionIndex: 13
    SolutionNameMin: Cijk_Alik_Bljk_HHS_BH_Bias_HAS_SAV_UserArgs_MT64x16x32_MI16x16x1_SN_CLR0_GSU1_LBSPPA128_LBSPPB128_MIWT1_1_PGR1_PLR0_SS1_SU32_SUM0_SUS256_SVW1_TLDS1_WG64_2_1_WGM8
    SolutionIndex: 14
    SolutionNameMin: Cijk_Alik_Bljk_HHS_BH_Bias_HAS_SAV_UserArgs_MT32x32x32_MI16x16x1_SN_CLR1_GSU1_LBSPPA128_LBSPPB128_MIWT1_1_PGR1_PLR1_SS1_SU32_SUM0_SUS256_SVW1_TLDS1_WG32_4_1_WGM8
    SolutionIndex: 15
    SolutionNameMin: Cijk_Alik_Bljk_HHS_BH_Bias_HAS_SAV_UserArgs_MT32x32x32_MI16x16x1_SN_CLR1_GSU1_LBSPPA128_LBSPPB128_MIWT1_1_PGR2_PLR1_SS1_SU32_SUM0_SUS256_SVW1_TLDS1_WG32_4_1_WGM8
    SolutionIndex: 16
    SolutionNameMin: Cijk_Alik_Bljk_HHS_BH_Bias_HAS_SAV_UserArgs_MT32x32x32_MI16x16x1_SN_CLR0_GSU1_LBSPPA128_LBSPPB128_MIWT1_1_PGR1_PLR0_SS1_SU32_SUM0_SUS256_SVW1_TLDS1_WG32_4_1_WGM8
    SolutionIndex: 17
    SolutionNameMin: Cijk_Alik_Bljk_HHS_BH_Bias_HAS_SAV_UserArgs_MT32x32x32_MI16x16x1_SN_CLR0_GSU1_LBSPPA128_LBSPPB128_MIWT1_1_PGR2_PLR0_SS1_SU32_SUM0_SUS256_SVW1_TLDS1_WG32_4_1_WGM8
    SolutionIndex: 18
    SolutionNameMin: Cijk_Alik_Bljk_HHS_BH_Bias_HAS_SAV_UserArgs_MT64x32x32_MI16x16x1_SN_CLR1_GSU1_LBSPPA128_LBSPPB128_MIWT2_1_PGR1_PLR1_SS1_SU32_SUM0_SUS256_SVW1_TLDS1_WG32_4_1_WGM8
    SolutionIndex: 19
    SolutionNameMin: Cijk_Alik_Bljk_HHS_BH_Bias_HAS_SAV_UserArgs_MT64x32x32_MI16x16x1_SN_CLR0_GSU1_LBSPPA128_LBSPPB128_MIWT2_1_PGR1_PLR0_SS1_SU32_SUM0_SUS256_SVW1_TLDS1_WG32_4_1_WGM8
    SolutionIndex: 20
    SolutionNameMin: Cijk_Alik_Bljk_HHS_BH_Bias_HAS_SAV_UserArgs_MT64x32x32_MI16x16x1_SN_CLR0_GSU1_LBSPPA128_LBSPPB128_MIWT2_1_PGR2_PLR0_SS1_SU32_SUM0_SUS256_SVW1_TLDS1_WG32_4_1_WGM8
    SolutionIndex: 21
    SolutionNameMin: Cijk_Alik_Bljk_HHS_BH_Bias_HAS_SAV_UserArgs_MT16x64x32_MI16x16x1_SN_CLR1_GSU1_LBSPPA128_LBSPPB128_MIWT1_1_PGR1_PLR1_SS1_SU32_SUM0_SUS256_SVW1_TLDS1_WG16_8_1_WGM8
    SolutionIndex: 22
    SolutionNameMin: Cijk_Alik_Bljk_HHS_BH_Bias_HAS_SAV_UserArgs_MT16x64x32_MI16x16x1_SN_CLR0_GSU1_LBSPPA128_LBSPPB128_MIWT1_1_PGR1_PLR0_SS1_SU32_SUM0_SUS256_SVW1_TLDS1_WG16_8_1_WGM8
    SolutionIndex: 23
    SolutionNameMin: Cijk_Alik_Bljk_HHS_BH_Bias_HAS_SAV_UserArgs_MT32x64x32_MI16x16x1_SN_CLR1_GSU1_LBSPPA128_LBSPPB128_MIWT2_1_PGR1_PLR1_SS1_SU32_SUM0_SUS256_SVW1_TLDS1_WG16_8_1_WGM8
    SolutionIndex: 24
    SolutionNameMin: Cijk_Alik_Bljk_HHS_BH_Bias_HAS_SAV_UserArgs_MT32x64x32_MI16x16x1_SN_CLR1_GSU1_LBSPPA128_LBSPPB128_MIWT2_1_PGR2_PLR1_SS1_SU32_SUM0_SUS256_SVW1_TLDS1_WG16_8_1_WGM8
    SolutionIndex: 25
    SolutionNameMin: Cijk_Alik_Bljk_HHS_BH_Bias_HAS_SAV_UserArgs_MT32x64x32_MI16x16x1_SN_CLR0_GSU1_LBSPPA128_LBSPPB128_MIWT2_1_PGR1_PLR0_SS1_SU32_SUM0_SUS256_SVW1_TLDS1_WG16_8_1_WGM8
    SolutionIndex: 26
    SolutionNameMin: Cijk_Alik_Bljk_HHS_BH_Bias_HAS_SAV_UserArgs_MT32x64x32_MI16x16x1_SN_CLR0_GSU1_LBSPPA128_LBSPPB128_MIWT2_1_PGR2_PLR0_SS1_SU32_SUM0_SUS256_SVW1_TLDS1_WG16_8_1_WGM8
    SolutionIndex: 27
    SolutionNameMin: Cijk_Alik_Bljk_HHS_BH_Bias_HAS_SAV_UserArgs_MT32x32x64_MI16x16x1_SN_CLR1_GSU1_LBSPPA128_LBSPPB128_MIWT1_1_PGR1_PLR3_SS1_SU32_SUM0_SUS256_SVW1_TLDS1_WG32_4_1_WGM8
    SolutionIndex: 28
    SolutionNameMin: Cijk_Alik_Bljk_HHS_BH_Bias_HAS_SAV_UserArgs_MT32x32x64_MI16x16x1_SN_CLR0_GSU1_LBSPPA128_LBSPPB128_MIWT1_1_PGR1_PLR0_SS1_SU32_SUM0_SUS256_SVW1_TLDS1_WG32_4_1_WGM8
    SolutionIndex: 29
    SolutionNameMin: Cijk_Alik_Bljk_HHS_BH_Bias_HAS_SAV_UserArgs_MT64x32x64_MI16x16x1_SN_CLR1_GSU1_LBSPPA128_LBSPPB128_MIWT2_1_PGR1_PLR1_SS1_SU32_SUM0_SUS256_SVW1_TLDS1_WG32_4_1_WGM8
    SolutionIndex: 30
    SolutionNameMin: Cijk_Alik_Bljk_HHS_BH_Bias_HAS_SAV_UserArgs_MT64x32x64_MI16x16x1_SN_CLR1_GSU1_LBSPPA128_LBSPPB128_MIWT2_1_PGR1_PLR3_SS1_SU32_SUM0_SUS256_SVW1_TLDS1_WG32_4_1_WGM8
    SolutionIndex: 31
    SolutionNameMin: Cijk_Alik_Bljk_HHS_BH_Bias_HAS_SAV_UserArgs_MT32x64x64_MI16x16x1_SN_CLR1_GSU1_LBSPPA128_LBSPPB128_MIWT2_1_PGR1_PLR3_SS1_SU32_SUM0_SUS256_SVW1_TLDS1_WG16_8_1_WGM8
    SolutionIndex: 32
    SolutionNameMin: Cijk_Alik_Bljk_HHS_BH_Bias_HAS_SAV_UserArgs_MT32x64x64_MI16x16x1_SN_CLR0_GSU1_LBSPPA128_LBSPPB128_MIWT2_1_PGR1_PLR0_SS1_SU32_SUM0_SUS256_SVW1_TLDS1_WG16_8_1_WGM8
    SolutionIndex: 33
    SolutionNameMin: Cijk_Alik_Bljk_HHS_BH_Bias_HAS_SAV_UserArgs_MT32x16x64_MI16x16x1_SN_LDSB0_GRVWA8_GRVWB8_GSU1_GSUC0_GSUWGMRR0_K1_LBSPPA128_LBSPPB128_MIWT1_1_SS0_SU32_SUM0_SUS256_SVW8_TLDS1_WG32_2_1_WGM8_WGMXCC1_WGMXCCGn1
    SolutionIndex: 34
    SolutionNameMin: Cijk_Alik_Bljk_HHS_BH_Bias_HAS_SAV_UserArgs_MT160x64x32_MI16x16x1_SN_LDSB1_GRVWA8_GRVWB8_GSU1_GSUC0_GSUWGMRR0_K1_LBSPPA128_LBSPPB128_MIWT5_2_SS1_SU32_SUM0_SUS256_SVW1_TLDS1_WG32_4_1_WGM8_WGMXCC1_WGMXCCGn1
    SolutionIndex: 35
    SolutionNameMin: Cijk_Alik_Bljk_HHS_BH_Bias_HAS_SAV_UserArgs_MT80x128x64_MI16x16x1_SN_LDSB1_GRVWA8_GRVWB8_GSU1_GSUC0_GSUWGMRR0_K1_LBSPPA128_LBSPPB128_MIWT5_2_SS0_SU32_SUM0_SUS256_SVW8_TLDS1_WG16_8_1_WGM8_WGMXCC1_WGMXCCGn1
    SolutionIndex: 36
    SolutionNameMin: Cijk_Alik_Bljk_HHS_BH_Bias_HAS_SAV_UserArgs_MT160x96x32_MI16x16x1_SN_LDSB1_GRVWA8_GRVWB8_GSU1_GSUC0_GSUWGMRR0_K1_LBSPPA128_LBSPPB128_MIWT5_3_SS0_SU32_SUM0_SUS256_SVW8_TLDS1_WG32_4_1_WGM8_WGMXCC1_WGMXCCGn1
    SolutionIndex: 37
    SolutionNameMin: Cijk_Alik_Bljk_HHS_BH_Bias_HAS_SAV_UserArgs_MT128x128x32_MI16x16x1_SN_LDSB1_GRVWA8_GRVWB8_GSU1_GSUC0_GSUWGMRR0_K1_LBSPPA128_LBSPPB128_MIWT4_4_SS0_SU32_SUM0_SUS256_SVW8_TLDS1_WG32_4_1_WGM8_WGMXCC1_WGMXCCGn1
    SolutionIndex: 38
    SolutionNameMin: Cijk_Alik_Bljk_HHS_BH_Bias_HAS_SAV_UserArgs_MT128x96x32_MI16x16x1_SN_LDSB1_GRVWA8_GRVWB8_GSU1_GSUC0_GSUWGMRR0_K1_LBSPPA128_LBSPPB128_MIWT4_3_SS0_SU32_SUM0_SUS256_SVW8_TLDS1_WG32_4_1_WGM8_WGMXCC1_WGMXCCGn1
    SolutionIndex: 39
    SolutionNameMin: Cijk_Alik_Bljk_HHS_BH_Bias_HAS_SAV_UserArgs_MT96x160x32_MI16x16x1_SN_LDSB1_GRVWA8_GRVWB8_GSU1_GSUC0_GSUWGMRR0_K1_LBSPPA128_LBSPPB128_MIWT3_5_SS0_SU32_SUM0_SUS256_SVW8_TLDS1_WG32_4_1_WGM8_WGMXCC1_WGMXCCGn1
    SolutionIndex: 40
    SolutionNameMin: Cijk_Alik_Bljk_HHS_BH_Bias_HAS_SAV_UserArgs_MT80x192x32_MI16x16x1_SN_LDSB1_GRVWA4_GRVWB8_GSU1_GSUC0_GSUWGMRR0_K1_LBSPPA128_LBSPPB128_MIWT5_3_SS0_SU32_SUM0_SUS256_SVW8_TLDS1_WG16_8_1_WGM8_WGMXCC1_WGMXCCGn1
    SolutionIndex: 41
    SolutionNameMin: Cijk_Alik_Bljk_HHS_BH_Bias_HAS_SAV_UserArgs_MT96x160x32_MI16x16x1_SN_LDSB1_GRVWA8_GRVWB8_GSU1_GSUC0_GSUWGMRR0_K1_LBSPPA128_LBSPPB128_MIWT3_5_SS1_SU32_SUM0_SUS256_SVW1_TLDS1_WG32_4_1_WGM8_WGMXCC1_WGMXCCGn1
    SolutionIndex: 42
    SolutionNameMin: Cijk_Alik_Bljk_HHS_BH_Bias_HAS_SAV_UserArgs_MT128x128x32_MI16x16x1_SN_LDSB1_GRVWA8_GRVWB8_GSU1_GSUC0_GSUWGMRR0_K1_LBSPPA128_LBSPPB128_MIWT4_4_SS1_SU32_SUM0_SUS256_SVW1_TLDS1_WG32_4_1_WGM8_WGMXCC1_WGMXCCGn1
    SolutionIndex: 43
    SolutionNameMin: Cijk_Alik_Bljk_HHS_BH_Bias_HAS_SAV_UserArgs_MT16x16x64_MI16x16x1_SN_LDSB0_GRVWA8_GRVWB8_GSU1_GSUC0_GSUWGMRR0_K1_LBSPPA128_LBSPPB128_MIWT1_1_SS0_SU32_SUM0_SUS256_SVW8_TLDS1_WG16_2_1_WGM8_WGMXCC1_WGMXCCGn1
    SolutionIndex: 44
    SolutionNameMin: Cijk_Alik_Bljk_HHS_BH_Bias_HAS_SAV_UserArgs_MT64x64x64_MI16x16x1_SN_LDSB1_GRVWA8_GRVWB8_GSU1_GSUC0_GSUWGMRR0_K1_LBSPPA128_LBSPPB128_MIWT2_2_SS0_SU32_SUM0_SUS256_SVW8_TLDS1_WG32_4_1_WGM8_WGMXCC1_WGMXCCGn1
    SolutionIndex: 45
    SolutionNameMin: Cijk_Alik_Bljk_HHS_BH_Bias_HAS_SAV_UserArgs_MT48x128x32_MI16x16x1_SN_LDSB0_GRVWA4_GRVWB8_GSU1_GSUC0_GSUWGMRR0_K1_LBSPPA128_LBSPPB128_MIWT3_2_SS0_SU32_SUM0_SUS256_SVW8_TLDS1_WG16_8_1_WGM8_WGMXCC1_WGMXCCGn1
    SolutionIndex: 46
    SolutionNameMin: Cijk_Alik_Bljk_HHS_BH_Bias_HAS_SAV_UserArgs_MT48x192x64_MI16x16x1_SN_LDSB1_GRVWA8_GRVWB8_GSU1_GSUC0_GSUWGMRR0_K1_LBSPPA128_LBSPPB128_MIWT3_3_SS0_SU32_SUM0_SUS256_SVW8_TLDS1_WG16_8_1_WGM8_WGMXCC1_WGMXCCGn1
    SolutionIndex: 47
    SolutionNameMin: Cijk_Alik_Bljk_HHS_BH_Bias_HAS_SAV_UserArgs_MT96x128x32_MI16x16x1_SN_LDSB1_GRVWA8_GRVWB8_GSU1_GSUC0_GSUWGMRR0_K1_LBSPPA128_LBSPPB128_MIWT3_4_SS0_SU32_SUM0_SUS256_SVW8_TLDS1_WG32_4_1_WGM8_WGMXCC1_WGMXCCGn1
    SolutionIndex: 48
    SolutionNameMin: Cijk_Alik_Bljk_HHS_BH_Bias_HAS_SAV_UserArgs_MT96x96x64_MI16x16x1_SN_LDSB1_GRVWA8_GRVWB8_GSU1_GSUC0_GSUWGMRR0_K1_LBSPPA128_LBSPPB128_MIWT3_3_SS0_SU32_SUM0_SUS256_SVW8_TLDS1_WG32_4_1_WGM8_WGMXCC1_WGMXCCGn1
    SolutionIndex: 49
    SolutionNameMin: Cijk_Alik_Bljk_HHS_BH_Bias_HAS_SAV_UserArgs_MT64x256x32_MI16x16x1_SN_LDSB1_GRVWA8_GRVWB8_GSU1_GSUC0_GSUWGMRR0_K1_LBSPPA128_LBSPPB128_MIWT4_4_SS0_SU32_SUM0_SUS256_SVW8_TLDS1_WG16_8_1_WGM8_WGMXCC1_WGMXCCGn1
    SolutionIndex: 50
    SolutionNameMin: Cijk_Alik_Bljk_HHS_BH_Bias_HAS_SAV_UserArgs_MT48x128x64_MI16x16x1_SN_LDSB1_GRVWA8_GRVWB8_GSU1_GSUC0_GSUWGMRR0_K1_LBSPPA128_LBSPPB128_MIWT3_2_SS1_SU32_SUM0_SUS256_SVW1_TLDS1_WG16_8_1_WGM8_WGMXCC1_WGMXCCGn1
    SolutionIndex: 51
    SolutionNameMin: Cijk_Alik_Bljk_HHS_BH_Bias_HAS_SAV_UserArgs_MT64x128x64_MI16x16x1_SN_LDSB1_GRVWA8_GRVWB8_GSU1_GSUC0_GSUWGMRR0_K1_LBSPPA128_LBSPPB128_MIWT4_2_SS1_SU32_SUM0_SUS256_SVW1_TLDS1_WG16_8_1_WGM8_WGMXCC1_WGMXCCGn1
    SolutionIndex: 52
    SolutionNameMin: Cijk_Alik_Bljk_HHS_BH_Bias_HAS_SAV_UserArgs_MT48x192x64_MI16x16x1_SN_LDSB1_GRVWA8_GRVWB8_GSU1_GSUC0_GSUWGMRR0_K1_LBSPPA128_LBSPPB128_MIWT3_3_SS1_SU32_SUM0_SUS256_SVW1_TLDS1_WG16_8_1_WGM8_WGMXCC1_WGMXCCGn1
    SolutionIndex: 53
    SolutionNameMin: Cijk_Alik_Bljk_HHS_BH_Bias_HAS_SAV_UserArgs_MT80x128x64_MI16x16x1_SN_LDSB1_GRVWA8_GRVWB8_GSU1_GSUC0_GSUWGMRR0_K1_LBSPPA128_LBSPPB128_MIWT5_2_SS1_SU32_SUM0_SUS256_SVW1_TLDS1_WG16_8_1_WGM8_WGMXCC1_WGMXCCGn1
    SolutionIndex: 54
    SolutionNameMin: Cijk_Alik_Bljk_HHS_BH_Bias_HAS_SAV_UserArgs_MT128x80x64_MI16x16x1_SN_LDSB1_GRVWA8_GRVWB8_GSU1_GSUC0_GSUWGMRR0_K1_LBSPPA128_LBSPPB128_MIWT2_5_SS1_SU32_SUM0_SUS256_SVW1_TLDS1_WG64_2_1_WGM8_WGMXCC1_WGMXCCGn1
    SolutionIndex: 55
    SolutionNameMin: Cijk_Alik_Bljk_HHS_BH_Bias_HAS_SAV_UserArgs_MT128x80x64_MI16x16x1_SN_LDSB1_GRVWA8_GRVWB8_GSU1_GSUC0_GSUWGMRR0_K1_LBSPPA128_LBSPPB128_MIWT2_5_SS0_SU32_SUM0_SUS256_SVW8_TLDS1_WG64_2_1_WGM8_WGMXCC1_WGMXCCGn1
    SolutionIndex: 56
    SolutionNameMin: Cijk_Alik_Bljk_HHS_BH_Bias_HAS_SAV_UserArgs_MT96x96x64_MI16x16x1_SN_LDSB1_GRVWA8_GRVWB8_GSU1_GSUC0_GSUWGMRR0_K1_LBSPPA128_LBSPPB128_MIWT3_3_SS1_SU32_SUM0_SUS256_SVW1_TLDS1_WG32_4_1_WGM8_WGMXCC1_WGMXCCGn1
    SolutionIndex: 57
    SolutionNameMin: Cijk_Alik_Bljk_HHS_BH_Bias_HAS_SAV_UserArgs_MT64x128x64_MI16x16x1_SN_LDSB1_GRVWA8_GRVWB8_GSU1_GSUC0_GSUWGMRR0_K1_LBSPPA128_LBSPPB128_MIWT4_2_SS0_SU32_SUM0_SUS256_SVW8_TLDS1_WG16_8_1_WGM8_WGMXCC1_WGMXCCGn1
    SolutionIndex: 58
    SolutionNameMin: Cijk_Alik_Bljk_HHS_BH_Bias_HAS_SAV_UserArgs_MT32x16x64_MI16x16x1_SN_LDSB0_GRVWA8_GRVWB8_GSU1_GSUC0_GSUWGMRR0_K1_LBSPPA128_LBSPPB128_MIWT1_1_SS1_SU32_SUM0_SUS256_SVW1_TLDS1_WG32_2_1_WGM8_WGMXCC1_WGMXCCGn1
    SolutionIndex: 59
    SolutionNameMin: Cijk_Alik_Bljk_HHS_BH_Bias_HAS_SAV_UserArgs_MT48x64x64_MI16x16x1_SN_LDSB1_GRVWA8_GRVWB8_GSU1_GSUC0_GSUWGMRR0_K1_LBSPPA128_LBSPPB128_MIWT3_1_SS1_SU32_SUM0_SUS256_SVW1_TLDS1_WG16_8_1_WGM8_WGMXCC1_WGMXCCGn1
    SolutionIndex: 60
    SolutionNameMin: Cijk_Alik_Bljk_HHS_BH_Bias_HAS_SAV_UserArgs_MT96x64x32_MI16x16x1_SN_LDSB0_GRVWA8_GRVWB8_GSU1_GSUC0_GSUWGMRR0_K1_LBSPPA128_LBSPPB128_MIWT3_2_SS0_SU32_SUM0_SUS256_SVW8_TLDS1_WG32_4_1_WGM8_WGMXCC1_WGMXCCGn1
    SolutionIndex: 61
    SolutionNameMin: Cijk_Alik_Bljk_HHS_BH_Bias_HAS_SAV_UserArgs_MT96x96x32_MI16x16x1_SN_LDSB0_GRVWA8_GRVWB8_GSU1_GSUC0_GSUWGMRR0_K1_LBSPPA128_LBSPPB128_MIWT3_3_SS0_SU32_SUM0_SUS256_SVW8_TLDS1_WG32_4_1_WGM8_WGMXCC1_WGMXCCGn1
    SolutionIndex: 62
    SolutionNameMin: Cijk_Alik_Bljk_HHS_BH_Bias_HAS_SAV_UserArgs_MT64x224x32_MI16x16x1_SN_LDSB1_GRVWA8_GRVWB8_GSU1_GSUC0_GSUWGMRR0_K1_LBSPPA128_LBSPPB128_MIWT2_7_SS0_SU32_SUM0_SUS256_SVW8_TLDS1_WG32_4_1_WGM8_WGMXCC1_WGMXCCGn1
    SolutionIndex: 63
    SolutionNameMin: Cijk_Alik_Bljk_HHS_BH_Bias_HAS_SAV_UserArgs_MT256x64x32_MI16x16x1_SN_LDSB1_GRVWA8_GRVWB8_GSU1_GSUC0_GSUWGMRR0_K1_LBSPPA128_LBSPPB128_MIWT4_4_SS0_SU32_SUM0_SUS256_SVW8_TLDS1_WG64_2_1_WGM8_WGMXCC1_WGMXCCGn1
    SolutionIndex: 64
    SolutionNameMin: Cijk_Alik_Bljk_HHS_BH_Bias_HAS_SAV_UserArgs_MT96x128x32_MI16x16x1_SN_LDSB1_GRVWA8_GRVWB8_GSU1_GSUC0_GSUWGMRR0_K1_LBSPPA128_LBSPPB128_MIWT3_4_SS1_SU32_SUM0_SUS256_SVW1_TLDS1_WG32_4_1_WGM8_WGMXCC1_WGMXCCGn1
    SolutionIndex: 65
    SolutionNameMin: Cijk_Alik_Bljk_HHS_BH_Bias_HAS_SAV_UserArgs_MT192x80x32_MI16x16x1_SN_LDSB1_GRVWA8_GRVWB4_GSU1_GSUC0_GSUWGMRR0_K1_LBSPPA128_LBSPPB128_MIWT3_5_SS0_SU32_SUM0_SUS256_SVW8_TLDS1_WG64_2_1_WGM8_WGMXCC1_WGMXCCGn1
    SolutionIndex: 66
    SolutionNameMin: Cijk_Alik_Bljk_HHS_BH_Bias_HAS_SAV_UserArgs_MT32x32x64_MI16x16x1_SN_LDSB0_GRVWA8_GRVWB8_GSU1_GSUC0_GSUWGMRR0_K1_LBSPPA128_LBSPPB128_MIWT1_1_SS1_SU32_SUM0_SUS256_SVW1_TLDS1_WG32_4_1_WGM8_WGMXCC1_WGMXCCGn1
    SolutionIndex: 67
    SolutionNameMin: Cijk_Alik_Bljk_HHS_BH_Bias_HAS_SAV_UserArgs_MT64x32x64_MI16x16x1_SN_LDSB0_GRVWA8_GRVWB8_GSU1_GSUC0_GSUWGMRR0_K1_LBSPPA128_LBSPPB128_MIWT1_2_SS1_SU32_SUM0_SUS256_SVW1_TLDS1_WG64_2_1_WGM8_WGMXCC1_WGMXCCGn1
    SolutionIndex: 68
    SolutionNameMin: Cijk_Alik_Bljk_HHS_BH_Bias_HAS_SAV_UserArgs_MT128x64x64_MI16x16x1_SN_LDSB1_GRVWA8_GRVWB8_GSU1_GSUC0_GSUWGMRR0_K1_LBSPPA128_LBSPPB128_MIWT4_2_SS0_SU32_SUM0_SUS256_SVW8_TLDS1_WG32_4_1_WGM8_WGMXCC1_WGMXCCGn1
    SolutionIndex: 69
    SolutionNameMin: Cijk_Alik_Bljk_HHS_BH_Bias_HAS_SAV_UserArgs_MT80x192x32_MI16x16x1_SN_LDSB1_GRVWA4_GRVWB8_GSU1_GSUC0_GSUWGMRR0_K1_LBSPPA128_LBSPPB128_MIWT5_3_SS1_SU32_SUM0_SUS256_SVW1_TLDS1_WG16_8_1_WGM8_WGMXCC1_WGMXCCGn1
    SolutionIndex: 70
    SolutionNameMin: Cijk_Alik_Bljk_HHS_BH_Bias_HAS_SAV_UserArgs_MT64x256x32_MI16x16x1_SN_LDSB1_GRVWA8_GRVWB8_GSU1_GSUC0_GSUWGMRR0_K1_LBSPPA128_LBSPPB128_MIWT4_4_SS1_SU32_SUM0_SUS256_SVW1_TLDS1_WG16_8_1_WGM8_WGMXCC1_WGMXCCGn1
    SolutionIndex: 71
    SolutionNameMin: Cijk_Alik_Bljk_HHS_BH_Bias_HAS_SAV_UserArgs_MT48x128x64_MI16x16x1_SN_LDSB1_GRVWA8_GRVWB8_GSU1_GSUC0_GSUWGMRR0_K1_LBSPPA128_LBSPPB128_MIWT3_2_SS0_SU32_SUM0_SUS256_SVW8_TLDS1_WG16_8_1_WGM8_WGMXCC1_WGMXCCGn1
    SolutionIndex: 72
    SolutionNameMin: Cijk_Alik_Bljk_HHS_BH_Bias_HAS_SAV_UserArgs_MT16x16x64_MI16x16x1_SN_LDSB0_GRVWA8_GRVWB8_GSU1_GSUC0_GSUWGMRR0_K1_LBSPPA128_LBSPPB128_MIWT1_1_SS1_SU32_SUM0_SUS256_SVW1_TLDS1_WG16_2_1_WGM8_WGMXCC1_WGMXCCGn1
    SolutionIndex: 73
    SolutionNameMin: Cijk_Alik_Bljk_HHS_BH_Bias_HAS_SAV_UserArgs_MT96x32x64_MI16x16x1_SN_LDSB1_GRVWA8_GRVWB8_GSU1_GSUC0_GSUWGMRR0_K1_LBSPPA128_LBSPPB128_MIWT3_1_SS0_SU32_SUM0_SUS256_SVW8_TLDS1_WG32_4_1_WGM8_WGMXCC1_WGMXCCGn1
    SolutionIndex: 74
    SolutionNameMin: Cijk_Alik_Bljk_HHS_BH_Bias_HAS_SAV_UserArgs_MT96x64x64_MI16x16x1_SN_LDSB1_GRVWA8_GRVWB8_GSU1_GSUC0_GSUWGMRR0_K1_LBSPPA128_LBSPPB128_MIWT3_2_SS0_SU32_SUM0_SUS256_SVW8_TLDS1_WG32_4_1_WGM8_WGMXCC1_WGMXCCGn1
    SolutionIndex: 75
    SolutionNameMin: Cijk_Alik_Bljk_HHS_BH_Bias_HAS_SAV_UserArgs_MT32x32x64_MI16x16x1_SN_LDSB0_GRVWA8_GRVWB8_GSU1_GSUC0_GSUWGMRR0_K1_LBSPPA128_LBSPPB128_MIWT1_1_SS0_SU32_SUM0_SUS256_SVW8_TLDS1_WG32_4_1_WGM8_WGMXCC1_WGMXCCGn1
    SolutionIndex: 76
    SolutionNameMin: Cijk_Alik_Bljk_HHS_BH_Bias_HAS_SAV_UserArgs_MT32x64x64_MI16x16x1_SN_LDSB0_GRVWA8_GRVWB8_GSU1_GSUC0_GSUWGMRR0_K1_LBSPPA128_LBSPPB128_MIWT1_2_SS0_SU32_SUM0_SUS256_SVW8_TLDS1_WG32_4_1_WGM8_WGMXCC1_WGMXCCGn1
    SolutionIndex: 77
    SolutionNameMin: Cijk_Alik_Bljk_HHS_BH_Bias_HAS_SAV_UserArgs_MT32x64x64_MI16x16x1_SN_LDSB0_GRVWA8_GRVWB8_GSU1_GSUC0_GSUWGMRR0_K1_LBSPPA128_LBSPPB128_MIWT1_2_SS1_SU32_SUM0_SUS256_SVW1_TLDS1_WG32_4_1_WGM8_WGMXCC1_WGMXCCGn1
    SolutionIndex: 78
    SolutionNameMin: Cijk_Alik_Bljk_HHS_BH_Bias_HAS_SAV_UserArgs_MT32x16x64_MI16x16x1_SN_LDSB0_GRVWA8_GRVWB8_GSU1_GSUC0_GSUWGMRR0_K1_LBSPPA128_LBSPPB128_MIWT1_1_SS1_SU32_SUM0_SUS256_SVW1_TLDS1_WG32_2_1_WGM8_WGMXCC1_WGMXCCGn1
    SolutionIndex: 79
    SolutionNameMin: Cijk_Alik_Bljk_HHS_BH_Bias_HAS_SAV_UserArgs_MT96x64x64_MI16x16x1_SN_LDSB1_GRVWA8_GRVWB8_GSU1_GSUC0_GSUWGMRR0_K1_LBSPPA128_LBSPPB128_MIWT3_2_SS0_SU32_SUM0_SUS256_SVW8_TLDS1_WG32_4_1_WGM8_WGMXCC1_WGMXCCGn1
    SolutionIndex: 80
    SolutionNameMin: Cijk_Alik_Bljk_HHS_BH_Bias_HAS_SAV_UserArgs_MT64x128x64_MI16x16x1_SN_LDSB1_GRVWA8_GRVWB8_GSU1_GSUC0_GSUWGMRR0_K1_LBSPPA128_LBSPPB128_MIWT4_2_SS0_SU32_SUM0_SUS256_SVW8_TLDS1_WG16_8_1_WGM8_WGMXCC1_WGMXCCGn1
    SolutionIndex: 81
    SolutionNameMin: Cijk_Alik_Bljk_HHS_BH_Bias_HAS_SAV_UserArgs_MT48x192x32_MI16x16x1_SN_LDSB1_GRVWA4_GRVWB8_GSU1_GSUC0_GSUWGMRR0_K1_LBSPPA128_LBSPPB128_MIWT3_3_SS0_SU32_SUM0_SUS256_SVW8_TLDS1_WG16_8_1_WGM8_WGMXCC1_WGMXCCGn1
    SolutionIndex: 82
    SolutionNameMin: Cijk_Alik_Bljk_HHS_BH_Bias_HAS_SAV_UserArgs_MT48x256x32_MI16x16x1_SN_LDSB1_GRVWA4_GRVWB8_GSU1_GSUC0_GSUWGMRR0_K1_LBSPPA128_LBSPPB128_MIWT3_4_SS0_SU32_SUM0_SUS256_SVW8_TLDS1_WG16_8_1_WGM8_WGMXCC1_WGMXCCGn1
    SolutionIndex: 83
    SolutionNameMin: Cijk_Alik_Bljk_HHS_BH_Bias_HAS_SAV_UserArgs_MT128x80x64_MI16x16x1_SN_LDSB1_GRVWA8_GRVWB8_GSU1_GSUC0_GSUWGMRR0_K1_LBSPPA128_LBSPPB128_MIWT2_5_SS0_SU32_SUM0_SUS256_SVW8_TLDS1_WG64_2_1_WGM8_WGMXCC1_WGMXCCGn1
    SolutionIndex: 84
    SolutionNameMin: Cijk_Alik_Bljk_HHS_BH_Bias_HAS_SAV_UserArgs_MT96x96x64_MI16x16x1_SN_LDSB1_GRVWA8_GRVWB8_GSU1_GSUC0_GSUWGMRR0_K1_LBSPPA128_LBSPPB128_MIWT3_3_SS0_SU32_SUM0_SUS256_SVW8_TLDS1_WG32_4_1_WGM8_WGMXCC1_WGMXCCGn1
    SolutionIndex: 85
    SolutionNameMin: Cijk_Alik_Bljk_HHS_BH_Bias_HAS_SAV_UserArgs_MT128x80x64_MI16x16x1_SN_LDSB1_GRVWA8_GRVWB8_GSU1_GSUC0_GSUWGMRR0_K1_LBSPPA128_LBSPPB128_MIWT2_5_SS1_SU32_SUM0_SUS256_SVW1_TLDS1_WG64_2_1_WGM8_WGMXCC1_WGMXCCGn1
    SolutionIndex: 86
    SolutionNameMin: Cijk_Alik_Bljk_HHS_BH_Bias_HAS_SAV_UserArgs_MT64x128x64_MI16x16x1_SN_LDSB1_GRVWA8_GRVWB8_GSU1_GSUC0_GSUWGMRR0_K1_LBSPPA128_LBSPPB128_MIWT4_2_SS1_SU32_SUM0_SUS256_SVW1_TLDS1_WG16_8_1_WGM8_WGMXCC1_WGMXCCGn1
    SolutionIndex: 87
    SolutionNameMin: Cijk_Alik_Bljk_HHS_BH_Bias_HAS_SAV_UserArgs_MT80x192x32_MI16x16x1_SN_LDSB1_GRVWA4_GRVWB8_GSU1_GSUC0_GSUWGMRR0_K1_LBSPPA128_LBSPPB128_MIWT5_3_SS0_SU32_SUM0_SUS256_SVW8_TLDS1_WG16_8_1_WGM8_WGMXCC1_WGMXCCGn1
    SolutionIndex: 88
    SolutionNameMin: Cijk_Alik_Bljk_HHS_BH_Bias_HAS_SAV_UserArgs_MT80x192x32_MI16x16x1_SN_LDSB1_GRVWA4_GRVWB8_GSU1_GSUC0_GSUWGMRR0_K1_LBSPPA128_LBSPPB128_MIWT5_3_SS1_SU32_SUM0_SUS256_SVW1_TLDS1_WG16_8_1_WGM8_WGMXCC1_WGMXCCGn1
    SolutionIndex: 89
    SolutionNameMin: Cijk_Alik_Bljk_HHS_BH_Bias_HAS_SAV_UserArgs_MT128x64x64_MI16x16x1_SN_LDSB1_GRVWA8_GRVWB8_GSU1_GSUC0_GSUWGMRR0_K1_LBSPPA128_LBSPPB128_MIWT4_2_SS0_SU32_SUM0_SUS256_SVW8_TLDS1_WG32_4_1_WGM8_WGMXCC1_WGMXCCGn1
    SolutionIndex: 90
    SolutionNameMin: Cijk_Alik_Bljk_HHS_BH_Bias_HAS_SAV_UserArgs_MT96x128x32_MI16x16x1_SN_LDSB1_GRVWA8_GRVWB8_GSU1_GSUC0_GSUWGMRR0_K1_LBSPPA128_LBSPPB128_MIWT3_4_SS1_SU32_SUM0_SUS256_SVW1_TLDS1_WG32_4_1_WGM8_WGMXCC1_WGMXCCGn1
    SolutionIndex: 91
    SolutionNameMin: Cijk_Alik_Bljk_HHS_BH_Bias_HAS_SAV_UserArgs_MT96x128x32_MI16x16x1_SN_LDSB1_GRVWA8_GRVWB8_GSU1_GSUC0_GSUWGMRR0_K1_LBSPPA128_LBSPPB128_MIWT3_4_SS0_SU32_SUM0_SUS256_SVW8_TLDS1_WG32_4_1_WGM8_WGMXCC1_WGMXCCGn1
    SolutionIndex: 92
    SolutionNameMin: Cijk_Alik_Bljk_HHS_BH_Bias_HAS_SAV_UserArgs_MT96x160x32_MI16x16x1_SN_LDSB1_GRVWA8_GRVWB8_GSU1_GSUC0_GSUWGMRR0_K1_LBSPPA128_LBSPPB128_MIWT3_5_SS0_SU32_SUM0_SUS256_SVW8_TLDS1_WG32_4_1_WGM8_WGMXCC1_WGMXCCGn1
    SolutionIndex: 93
    SolutionNameMin: Cijk_Alik_Bljk_HHS_BH_Bias_HAS_SAV_UserArgs_MT112x128x32_MI16x16x1_SN_LDSB1_GRVWA4_GRVWB8_GSU1_GSUC0_GSUWGMRR0_K1_LBSPPA128_LBSPPB128_MIWT7_2_SS0_SU32_SUM0_SUS256_SVW8_TLDS1_WG16_8_1_WGM8_WGMXCC1_WGMXCCGn1
    SolutionIndex: 94
    SolutionNameMin: Cijk_Alik_Bljk_HHS_BH_Bias_HAS_SAV_UserArgs_MT96x96x64_MI16x16x1_SN_LDSB1_GRVWA8_GRVWB8_GSU1_GSUC0_GSUWGMRR0_K1_LBSPPA128_LBSPPB128_MIWT3_3_SS1_SU32_SUM0_SUS256_SVW1_TLDS1_WG32_4_1_WGM8_WGMXCC1_WGMXCCGn1
    SolutionIndex: 95
    SolutionNameMin: Cijk_Alik_Bljk_HHS_BH_Bias_HAS_SAV_UserArgs_MT16x16x64_MI16x16x1_SN_LDSB0_GRVWA8_GRVWB8_GSU1_GSUC0_GSUWGMRR0_K1_LBSPPA128_LBSPPB128_MIWT1_1_SS1_SU32_SUM0_SUS256_SVW1_TLDS1_WG16_2_1_WGM8_WGMXCC1_WGMXCCGn1
    SolutionIndex: 96
    SolutionNameMin: Cijk_Alik_Bljk_HHS_BH_Bias_HAS_SAV_UserArgs_MT96x64x64_MI16x16x1_SN_LDSB1_GRVWA8_GRVWB8_GSU1_GSUC0_GSUWGMRR0_K1_LBSPPA128_LBSPPB128_MIWT3_2_SS1_SU32_SUM0_SUS256_SVW1_TLDS1_WG32_4_1_WGM8_WGMXCC1_WGMXCCGn1
    SolutionIndex: 97
    SolutionNameMin: Cijk_Alik_Bljk_HHS_BH_Bias_HAS_SAV_UserArgs_MT48x128x32_MI16x16x1_SN_LDSB0_GRVWA4_GRVWB8_GSU1_GSUC0_GSUWGMRR0_K1_LBSPPA128_LBSPPB128_MIWT3_2_SS0_SU32_SUM0_SUS256_SVW8_TLDS1_WG16_8_1_WGM8_WGMXCC1_WGMXCCGn1
    SolutionIndex: 98
    SolutionNameMin: Cijk_Alik_Bljk_HHS_BH_Bias_HAS_SAV_UserArgs_MT96x96x32_MI16x16x1_SN_LDSB0_GRVWA8_GRVWB8_GSU1_GSUC0_GSUWGMRR0_K1_LBSPPA128_LBSPPB128_MIWT3_3_SS1_SU32_SUM0_SUS256_SVW1_TLDS1_WG32_4_1_WGM8_WGMXCC1_WGMXCCGn1
    SolutionIndex: 99
    SolutionNameMin: Cijk_Alik_Bljk_HHS_BH_Bias_HAS_SAV_UserArgs_MT128x128x32_MI16x16x1_SN_LDSB1_GRVWA8_GRVWB8_GSU1_GSUC0_GSUWGMRR0_K1_LBSPPA128_LBSPPB128_MIWT4_4_SS0_SU32_SUM0_SUS256_SVW8_TLDS1_WG32_4_1_WGM8_WGMXCC1_WGMXCCGn1
    SolutionIndex: 100
    SolutionNameMin: Cijk_Alik_Bljk_HHS_BH_Bias_HAS_SAV_UserArgs_MT256x64x32_MI16x16x1_SN_LDSB1_GRVWA8_GRVWB8_GSU1_GSUC0_GSUWGMRR0_K1_LBSPPA128_LBSPPB128_MIWT4_4_SS1_SU32_SUM0_SUS256_SVW1_TLDS1_WG64_2_1_WGM8_WGMXCC1_WGMXCCGn1
    SolutionIndex: 101
    SolutionNameMin: Cijk_Alik_Bljk_HHS_BH_Bias_HAS_SAV_UserArgs_MT192x48x64_MI16x16x1_SN_LDSB1_GRVWA8_GRVWB8_GSU1_GSUC0_GSUWGMRR0_K1_LBSPPA128_LBSPPB128_MIWT3_3_SS0_SU32_SUM0_SUS256_SVW8_TLDS1_WG64_2_1_WGM8_WGMXCC1_WGMXCCGn1
    SolutionIndex: 102
    SolutionNameMin: Cijk_Alik_Bljk_HHS_BH_Bias_HAS_SAV_UserArgs_MT128x96x32_MI16x16x1_SN_LDSB1_GRVWA8_GRVWB8_GSU1_GSUC0_GSUWGMRR0_K1_LBSPPA128_LBSPPB128_MIWT4_3_SS0_SU32_SUM0_SUS256_SVW8_TLDS1_WG32_4_1_WGM8_WGMXCC1_WGMXCCGn1
    SolutionIndex: 103
    SolutionNameMin: Cijk_Alik_Bljk_HHS_BH_Bias_HAS_SAV_UserArgs_MT128x128x32_MI16x16x1_SN_LDSB1_GRVWA8_GRVWB8_GSU1_GSUC0_GSUWGMRR0_K1_LBSPPA128_LBSPPB128_MIWT8_2_SS0_SU32_SUM0_SUS256_SVW8_TLDS1_WG16_8_1_WGM8_WGMXCC1_WGMXCCGn1
    SolutionIndex: 104
    SolutionNameMin: Cijk_Alik_Bljk_HHS_BH_Bias_HAS_SAV_UserArgs_MT128x128x32_MI16x16x1_SN_LDSB1_GRVWA8_GRVWB8_GSU1_GSUC0_GSUWGMRR0_K1_LBSPPA128_LBSPPB128_MIWT4_4_SS1_SU32_SUM0_SUS256_SVW1_TLDS1_WG32_4_1_WGM8_WGMXCC1_WGMXCCGn1
    SolutionIndex: 105
    SolutionNameMin: Cijk_Alik_Bljk_HHS_BH_Bias_HAS_SAV_UserArgs_MT64x256x32_MI16x16x1_SN_LDSB1_GRVWA8_GRVWB8_GSU1_GSUC0_GSUWGMRR0_K1_LBSPPA128_LBSPPB128_MIWT4_4_SS1_SU32_SUM0_SUS256_SVW1_TLDS1_WG16_8_1_WGM8_WGMXCC1_WGMXCCGn1
    SolutionIndex: 106
    SolutionNameMin: Cijk_Alik_Bljk_HHS_BH_Bias_HAS_SAV_UserArgs_MT64x256x32_MI16x16x1_SN_LDSB1_GRVWA8_GRVWB8_GSU1_GSUC0_GSUWGMRR0_K1_LBSPPA128_LBSPPB128_MIWT4_4_SS0_SU32_SUM0_SUS256_SVW8_TLDS1_WG16_8_1_WGM8_WGMXCC1_WGMXCCGn1
    SolutionIndex: 107
    SolutionNameMin: Cijk_Alik_Bljk_HHS_BH_Bias_HAS_SAV_UserArgs_MT160x96x32_MI16x16x1_SN_LDSB1_GRVWA8_GRVWB8_GSU1_GSUC0_GSUWGMRR0_K1_LBSPPA128_LBSPPB128_MIWT5_3_SS0_SU32_SUM0_SUS256_SVW8_TLDS1_WG32_4_1_WGM8_WGMXCC1_WGMXCCGn1
    SolutionIndex: 108
    SolutionNameMin: Cijk_Alik_Bljk_HHS_BH_Bias_HAS_SAV_UserArgs_MT64x64x64_MI16x16x1_SN_LDSB1_GRVWA8_GRVWB8_GSU1_GSUC0_GSUWGMRR0_K1_LBSPPA128_LBSPPB128_MIWT2_2_SS1_SU32_SUM0_SUS256_SVW1_TLDS1_WG32_4_1_WGM8_WGMXCC1_WGMXCCGn1
    SolutionIndex: 109
    SolutionNameMin: Cijk_Alik_Bljk_HHS_BH_Bias_HAS_SAV_UserArgs_MT80x128x64_MI16x16x1_SN_LDSB1_GRVWA8_GRVWB8_GSU1_GSUC0_GSUWGMRR0_K1_LBSPPA128_LBSPPB128_MIWT5_2_SS0_SU32_SUM0_SUS256_SVW8_TLDS1_WG16_8_1_WGM8_WGMXCC1_WGMXCCGn1
    SolutionIndex: 110
    SolutionNameMin: Cijk_Alik_Bljk_HHS_BH_Bias_HAS_SAV_UserArgs_MT112x128x32_MI16x16x1_SN_LDSB1_GRVWA4_GRVWB8_GSU1_GSUC0_GSUWGMRR0_K1_LBSPPA128_LBSPPB128_MIWT7_2_SS1_SU32_SUM0_SUS256_SVW1_TLDS1_WG16_8_1_WGM8_WGMXCC1_WGMXCCGn1
    SolutionIndex: 111
    SolutionNameMin: Cijk_Alik_Bljk_HHS_BH_Bias_HAS_SAV_UserArgs_MT64x128x64_MI16x16x1_SN_LDSB1_GRVWA8_GRVWB8_GSU1_GSUC0_GSUWGMRR0_K1_LBSPPA128_LBSPPB128_MIWT2_4_SS0_SU32_SUM0_SUS256_SVW8_TLDS1_WG32_4_1_WGM8_WGMXCC1_WGMXCCGn1
    SolutionIndex: 112
    SolutionNameMin: Cijk_Alik_Bljk_HHS_BH_Bias_HAS_SAV_UserArgs_MT128x128x32_MI16x16x1_SN_LDSB1_GRVWA8_GRVWB8_GSU1_GSUC0_GSUWGMRR0_K1_LBSPPA128_LBSPPB128_MIWT8_2_SS1_SU32_SUM0_SUS256_SVW1_TLDS1_WG16_8_1_WGM8_WGMXCC1_WGMXCCGn1
    SolutionIndex: 113
    SolutionNameMin: Cijk_Alik_Bljk_HHS_BH_Bias_HAS_SAV_UserArgs_MT128x96x32_MI16x16x1_SN_LDSB1_GRVWA8_GRVWB8_GSU1_GSUC0_GSUWGMRR0_K1_LBSPPA128_LBSPPB128_MIWT4_3_SS1_SU32_SUM0_SUS256_SVW1_TLDS1_WG32_4_1_WGM8_WGMXCC1_WGMXCCGn1
    SolutionIndex: 114
    SolutionNameMin: Cijk_Alik_Bljk_HHS_BH_Bias_HAS_SAV_UserArgs_MT96x160x32_MI16x16x1_SN_LDSB1_GRVWA8_GRVWB8_GSU1_GSUC0_GSUWGMRR0_K1_LBSPPA128_LBSPPB128_MIWT3_5_SS1_SU32_SUM0_SUS256_SVW1_TLDS1_WG32_4_1_WGM8_WGMXCC1_WGMXCCGn1
    SolutionIndex: 115
    SolutionNameMin: Cijk_Alik_Bljk_HHS_BH_Bias_HAS_SAV_UserArgs_MT32x32x64_MI16x16x1_SN_LDSB0_GRVWA8_GRVWB8_GSU1_GSUC0_GSUWGMRR0_K1_LBSPPA512_LBSPPB512_MIWT1_1_SS0_SU32_SUM0_SUS256_SVW8_TLDS0_WG32_4_1_WGM8_WGMXCC1_WGMXCCGn1
    SolutionIndex: 116
    SolutionNameMin: Cijk_Alik_Bljk_HHS_BH_Bias_HAS_SAV_UserArgs_MT32x64x64_MI16x16x1_SN_LDSB0_GRVWA8_GRVWB8_GSU1_GSUC0_GSUWGMRR0_K1_LBSPPA128_LBSPPB128_MIWT1_2_SS0_SU32_SUM0_SUS256_SVW8_TLDS1_WG32_4_1_WGM8_WGMXCC1_WGMXCCGn1
    SolutionIndex: 117
    SolutionNameMin: Cijk_Alik_Bljk_HHS_BH_Bias_HAS_SAV_UserArgs_MT32x192x64_MI16x16x1_SN_LDSB1_GRVWA8_GRVWB8_GSU1_GSUC0_GSUWGMRR0_K1_LBSPPA128_LBSPPB128_MIWT2_3_SS0_SU32_SUM0_SUS256_SVW8_TLDS1_WG16_8_1_WGM8_WGMXCC1_WGMXCCGn1
    SolutionIndex: 118
    SolutionNameMin: Cijk_Alik_Bljk_HHS_BH_Bias_HAS_SAV_UserArgs_MT64x64x64_MI16x16x1_SN_LDSB1_GRVWA8_GRVWB8_GSU1_GSUC0_GSUWGMRR0_K1_LBSPPA128_LBSPPB128_MIWT2_2_SS0_SU32_SUM0_SUS256_SVW8_TLDS1_WG32_4_1_WGM8_WGMXCC1_WGMXCCGn1
    SolutionIndex: 119
    SolutionNameMin: Cijk_Alik_Bljk_HHS_BH_Bias_HAS_SAV_UserArgs_MT192x64x32_MI16x16x1_SN_LDSB1_GRVWA8_GRVWB8_GSU1_GSUC0_GSUWGMRR0_K1_LBSPPA128_LBSPPB128_MIWT3_4_SS1_SU32_SUM0_SUS256_SVW1_TLDS1_WG64_2_1_WGM8_WGMXCC1_WGMXCCGn1
    SolutionIndex: 120
    SolutionNameMin: Cijk_Alik_Bljk_HHS_BH_Bias_HAS_SAV_UserArgs_MT256x64x32_MI16x16x1_SN_LDSB1_GRVWA8_GRVWB8_GSU1_GSUC0_GSUWGMRR0_K1_LBSPPA128_LBSPPB128_MIWT4_4_SS0_SU32_SUM0_SUS256_SVW8_TLDS1_WG64_2_1_WGM8_WGMXCC1_WGMXCCGn1
    SolutionIndex: 121
    SolutionNameMin: Cijk_Alik_Bljk_HHS_BH_Bias_HAS_SAV_UserArgs_MT32x32x32_MI16x16x1_SN_LDSB0_GRVWA8_GRVWB8_GSU1_GSUC0_GSUWGMRR0_K1_LBSPPA128_LBSPPB128_MIWT1_1_SS1_SU32_SUM0_SUS256_SVW1_TLDS1_WG32_4_1_WGM8_WGMXCC1_WGMXCCGn1
    SolutionIndex: 122
    SolutionNameMin: Cijk_Alik_Bljk_HHS_BH_Bias_HAS_SAV_UserArgs_MT64x32x64_MI16x16x1_SN_LDSB0_GRVWA8_GRVWB8_GSU1_GSUC0_GSUWGMRR0_K1_LBSPPA128_LBSPPB128_MIWT1_2_SS0_SU32_SUM0_SUS256_SVW8_TLDS1_WG64_2_1_WGM8_WGMXCC1_WGMXCCGn1
    SolutionIndex: 123
    SolutionNameMin: Cijk_Alik_Bljk_HHS_BH_Bias_HAS_SAV_UserArgs_MT128x64x32_MI16x16x1_SN_LDSB0_GRVWA8_GRVWB8_GSU1_GSUC0_GSUWGMRR0_K1_LBSPPA128_LBSPPB128_MIWT2_4_SS0_SU32_SUM0_SUS256_SVW8_TLDS1_WG64_2_1_WGM8_WGMXCC1_WGMXCCGn1
    SolutionIndex: 124
    SolutionNameMin: Cijk_Alik_Bljk_HHS_BH_Bias_HAS_SAV_UserArgs_MT80x128x32_MI16x16x1_SN_LDSB1_GRVWA4_GRVWB8_GSU1_GSUC0_GSUWGMRR0_K1_LBSPPA128_LBSPPB128_MIWT5_2_SS0_SU32_SUM0_SUS256_SVW8_TLDS1_WG16_8_1_WGM8_WGMXCC1_WGMXCCGn1
    SolutionIndex: 125
    SolutionNameMin: Cijk_Alik_Bljk_HHS_BH_Bias_HAS_SAV_UserArgs_MT80x128x32_MI16x16x1_SN_LDSB1_GRVWA4_GRVWB8_GSU1_GSUC0_GSUWGMRR0_K1_LBSPPA128_LBSPPB128_MIWT5_2_SS1_SU32_SUM0_SUS256_SVW1_TLDS1_WG16_8_1_WGM8_WGMXCC1_WGMXCCGn1
    SolutionIndex: 126
    SolutionNameMin: Cijk_Alik_Bljk_HHS_BH_Bias_HAS_SAV_UserArgs_MT160x96x32_MI16x16x1_SN_LDSB1_GRVWA8_GRVWB8_GSU1_GSUC0_GSUWGMRR0_K1_LBSPPA128_LBSPPB128_MIWT5_3_SS1_SU32_SUM0_SUS256_SVW1_TLDS1_WG32_4_1_WGM8_WGMXCC1_WGMXCCGn1
    SolutionIndex: 127
    SolutionNameMin: Cijk_Alik_Bljk_HHS_BH_Bias_HAS_SAV_UserArgs_MT192x80x32_MI16x16x1_SN_LDSB1_GRVWA8_GRVWB4_GSU1_GSUC0_GSUWGMRR0_K1_LBSPPA128_LBSPPB128_MIWT3_5_SS0_SU32_SUM0_SUS256_SVW8_TLDS1_WG64_2_1_WGM8_WGMXCC1_WGMXCCGn1
    SolutionIndex: 128
    SolutionNameMin: Cijk_Alik_Bljk_HHS_BH_Bias_HAS_SAV_UserArgs_MT64x96x32_MI16x16x1_SN_LDSB0_GRVWA8_GRVWB8_GSU1_GSUC0_GSUWGMRR0_K1_LBSPPA128_LBSPPB128_MIWT2_3_SS0_SU32_SUM0_SUS256_SVW8_TLDS1_WG32_4_1_WGM8_WGMXCC1_WGMXCCGn1
    SolutionIndex: 129
    SolutionNameMin: Cijk_Alik_Bljk_HHS_BH_Bias_HAS_SAV_UserArgs_MT128x64x64_MI16x16x1_SN_LDSB1_GRVWA8_GRVWB8_GSU1_GSUC0_GSUWGMRR0_K1_LBSPPA128_LBSPPB128_MIWT2_4_SS0_SU32_SUM0_SUS256_SVW8_TLDS1_WG64_2_1_WGM8_WGMXCC1_WGMXCCGn1
    SolutionIndex: 130
    SolutionNameMin: Cijk_Alik_Bljk_HHS_BH_Bias_HAS_SAV_UserArgs_MT64x224x32_MI16x16x1_SN_LDSB1_GRVWA8_GRVWB8_GSU1_GSUC0_GSUWGMRR0_K1_LBSPPA128_LBSPPB128_MIWT2_7_SS0_SU32_SUM0_SUS256_SVW8_TLDS1_WG32_4_1_WGM8_WGMXCC1_WGMXCCGn1
    SolutionIndex: 131
    SolutionNameMin: Cijk_Alik_Bljk_HHS_BH_Bias_HAS_SAV_UserArgs_MT64x160x32_MI16x16x1_SN_LDSB1_GRVWA8_GRVWB8_GSU1_GSUC0_GSUWGMRR0_K1_LBSPPA128_LBSPPB128_MIWT2_5_SS1_SU32_SUM0_SUS256_SVW1_TLDS1_WG32_4_1_WGM8_WGMXCC1_WGMXCCGn1
    SolutionIndex: 132
    SolutionNameMin: Cijk_Alik_Bljk_HHS_BH_Bias_HAS_SAV_UserArgs_MT128x128x32_MI16x16x1_SN_LDSB1_GRVWA8_GRVWB8_GSU1_GSUC0_GSUWGMRR0_K1_LBSPPA128_LBSPPB128_MIWT2_8_SS0_SU32_SUM0_SUS256_SVW8_TLDS1_WG64_2_1_WGM8_WGMXCC1_WGMXCCGn1
    SolutionIndex: 133
    SolutionNameMin: Cijk_Alik_Bljk_HHS_BH_Bias_HAS_SAV_UserArgs_MT32x16x64_MI16x16x1_SN_LDSB0_GRVWA8_GRVWB8_GSU1_GSUC0_GSUWGMRR0_K1_LBSPPA128_LBSPPB128_MIWT1_1_SS0_SU32_SUM0_SUS256_SVW8_TLDS1_WG32_2_1_WGM8_WGMXCC1_WGMXCCGn1
    SolutionIndex: 134
    SolutionNameMin: Cijk_Alik_Bljk_HHS_BH_Bias_HAS_SAV_UserArgs_MT48x64x64_MI16x16x1_SN_LDSB1_GRVWA8_GRVWB8_GSU1_GSUC0_GSUWGMRR0_K1_LBSPPA128_LBSPPB128_MIWT3_1_SS0_SU32_SUM0_SUS256_SVW8_TLDS1_WG16_8_1_WGM8_WGMXCC1_WGMXCCGn1
    SolutionIndex: 135
    SolutionNameMin: Cijk_Alik_Bljk_HHS_BH_Bias_HAS_SAV_UserArgs_MT96x96x32_MI16x16x1_SN_LDSB0_GRVWA8_GRVWB8_GSU1_GSUC0_GSUWGMRR0_K1_LBSPPA128_LBSPPB128_MIWT3_3_SS0_SU32_SUM0_SUS256_SVW8_TLDS1_WG32_4_1_WGM8_WGMXCC1_WGMXCCGn1
    SolutionIndex: 136
    SolutionNameMin: Cijk_Alik_Bljk_HHS_BH_Bias_HAS_SAV_UserArgs_MT32x64x64_MI16x16x1_SN_LDSB0_GRVWA8_GRVWB8_GSU1_GSUC0_GSUWGMRR0_K1_LBSPPA128_LBSPPB128_MIWT2_1_SS0_SU32_SUM0_SUS256_SVW8_TLDS1_WG16_8_1_WGM8_WGMXCC1_WGMXCCGn1
    SolutionIndex: 137
    SolutionNameMin: Cijk_Alik_Bljk_HHS_BH_Bias_HAS_SAV_UserArgs_MT32x64x32_MI16x16x1_SN_LDSB0_GRVWA8_GRVWB8_GSU1_GSUC0_GSUWGMRR0_K1_LBSPPA128_LBSPPB128_MIWT1_2_SS0_SU32_SUM0_SUS256_SVW8_TLDS1_WG32_4_1_WGM8_WGMXCC1_WGMXCCGn1
    SolutionIndex: 138
    SolutionNameMin: Cijk_Alik_Bljk_HHS_BH_Bias_HAS_SAV_UserArgs_MT32x128x32_MI16x16x1_SN_LDSB0_GRVWA8_GRVWB8_GSU1_GSUC0_GSUWGMRR0_K1_LBSPPA128_LBSPPB128_MIWT2_2_SS0_SU32_SUM0_SUS256_SVW8_TLDS1_WG16_8_1_WGM8_WGMXCC1_WGMXCCGn1
    SolutionIndex: 139
    SolutionNameMin: Cijk_Alik_Bljk_HHS_BH_Bias_HAS_SAV_UserArgs_MT128x48x64_MI16x16x1_SN_LDSB1_GRVWA8_GRVWB8_GSU1_GSUC0_GSUWGMRR0_K1_LBSPPA128_LBSPPB128_MIWT2_3_SS0_SU32_SUM0_SUS256_SVW8_TLDS1_WG64_2_1_WGM8_WGMXCC1_WGMXCCGn1
    SolutionIndex: 140
    SolutionNameMin: Cijk_Alik_Bljk_HHS_BH_Bias_HAS_SAV_UserArgs_MT128x64x32_MI16x16x1_SN_LDSB0_GRVWA8_GRVWB8_GSU1_GSUC0_GSUWGMRR0_K1_LBSPPA128_LBSPPB128_MIWT4_2_SS0_SU32_SUM0_SUS256_SVW8_TLDS1_WG32_4_1_WGM8_WGMXCC1_WGMXCCGn1
    SolutionIndex: 141
    SolutionNameMin: Cijk_Alik_Bljk_HHS_BH_Bias_HAS_SAV_UserArgs_MT48x192x64_MI16x16x1_SN_LDSB1_GRVWA8_GRVWB8_GSU1_GSUC0_GSUWGMRR0_K1_LBSPPA128_LBSPPB128_MIWT3_3_SS0_SU32_SUM0_SUS256_SVW8_TLDS1_WG16_8_1_WGM8_WGMXCC1_WGMXCCGn1
    SolutionIndex: 142
    SolutionNameMin: Cijk_Alik_Bljk_HHS_BH_Bias_HAS_SAV_UserArgs_MT192x64x32_MI16x16x1_SN_LDSB1_GRVWA8_GRVWB8_GSU1_GSUC0_GSUWGMRR0_K1_LBSPPA128_LBSPPB128_MIWT3_4_SS0_SU32_SUM0_SUS256_SVW8_TLDS1_WG64_2_1_WGM8_WGMXCC1_WGMXCCGn1
    SolutionIndex: 143
    SolutionNameMin: Cijk_Alik_Bljk_HHS_BH_Bias_HAS_SAV_UserArgs_MT48x192x64_MI16x16x1_SN_LDSB1_GRVWA8_GRVWB8_GSU1_GSUC0_GSUWGMRR0_K1_LBSPPA128_LBSPPB128_MIWT3_3_SS1_SU32_SUM0_SUS256_SVW1_TLDS1_WG16_8_1_WGM8_WGMXCC1_WGMXCCGn1
    SolutionIndex: 144
    SolutionNameMin: Cijk_Alik_Bljk_HHS_BH_Bias_HAS_SAV_UserArgs_MT64x192x32_MI16x16x1_SN_LDSB1_GRVWA8_GRVWB8_GSU1_GSUC0_GSUWGMRR0_K1_LBSPPA128_LBSPPB128_MIWT2_6_SS0_SU32_SUM0_SUS256_SVW8_TLDS1_WG32_4_1_WGM8_WGMXCC1_WGMXCCGn1
    SolutionIndex: 145
    SolutionNameMin: Cijk_Alik_Bljk_HHS_BH_Bias_HAS_SAV_UserArgs_MT32x128x64_MI16x16x1_SN_LDSB1_GRVWA8_GRVWB8_GSU1_GSUC0_GSUWGMRR0_K1_LBSPPA128_LBSPPB128_MIWT2_2_SS0_SU32_SUM0_SUS256_SVW8_TLDS1_WG16_8_1_WGM8_WGMXCC1_WGMXCCGn1
    SolutionIndex: 146
    SolutionNameMin: Cijk_Alik_Bljk_HHS_BH_Bias_HAS_SAV_UserArgs_MT32x32x64_MI16x16x1_SN_LDSB0_GRVWA8_GRVWB8_GSU1_GSUC0_GSUWGMRR0_K1_LBSPPA128_LBSPPB128_MIWT1_1_SS1_SU32_SUM0_SUS256_SVW1_TLDS1_WG32_4_1_WGM8_WGMXCC1_WGMXCCGn1
    SolutionIndex: 147
    SolutionNameMin: Cijk_Alik_Bljk_HHS_BH_Bias_HAS_SAV_UserArgs_MT64x64x64_MI16x16x1_SN_LDSB1_GRVWA8_GRVWB8_GSU1_GSUC0_GSUWGMRR0_K1_LBSPPA1024_LBSPPB1024_MIWT2_2_SS0_SU32_SUM0_SUS256_SVW8_TLDS0_WG32_4_1_WGM8_WGMXCC1_WGMXCCGn1
    SolutionIndex: 148
    SolutionNameMin: Cijk_Alik_Bljk_HHS_BH_Bias_HAS_SAV_UserArgs_MT32x32x64_MI16x16x1_SN_LDSB0_GRVWA8_GRVWB8_GSU1_GSUC0_GSUWGMRR0_K1_LBSPPA128_LBSPPB128_MIWT1_1_SS0_SU32_SUM0_SUS256_SVW8_TLDS1_WG32_4_1_WGM8_WGMXCC1_WGMXCCGn1
    SolutionIndex: 149
    SolutionNameMin: Cijk_Alik_Bljk_HHS_BH_Bias_HAS_SAV_UserArgs_MT64x32x64_MI16x16x1_SN_LDSB0_GRVWA8_GRVWB8_GSU1_GSUC0_GSUWGMRR0_K1_LBSPPA1024_LBSPPB512_MIWT1_2_SS0_SU32_SUM0_SUS256_SVW8_TLDS0_WG64_2_1_WGM8_WGMXCC1_WGMXCCGn1
    SolutionIndex: 150
    SolutionNameMin: Cijk_Alik_Bljk_HHS_BH_Bias_HAS_SAV_UserArgs_MT192x16x64_MI16x16x1_SN_LDSB1_GRVWA8_GRVWB8_GSU1_GSUC0_GSUWGMRR0_K1_LBSPPA3072_LBSPPB256_MIWT3_1_SS1_SU32_SUM0_SUS256_SVW1_TLDS0_WG64_2_1_WGM8_WGMXCC1_WGMXCCGn1
    SolutionIndex: 151
    SolutionNameMin: Cijk_Alik_Bljk_HHS_BH_Bias_HAS_SAV_UserArgs_MT256x32x32_MI16x16x1_SN_LDSB1_GRVWA8_GRVWB8_GSU1_GSUC0_GSUWGMRR0_K1_LBSPPA128_LBSPPB128_MIWT4_2_SS0_SU32_SUM0_SUS256_SVW8_TLDS1_WG64_2_1_WGM8_WGMXCC1_WGMXCCGn1
    SolutionIndex: 152
    SolutionNameMin: Cijk_Alik_Bljk_HHS_BH_Bias_HAS_SAV_UserArgs_MT160x64x32_MI16x16x1_SN_LDSB1_GRVWA8_GRVWB8_GSU1_GSUC0_GSUWGMRR0_K1_LBSPPA128_LBSPPB128_MIWT5_2_SS0_SU32_SUM0_SUS256_SVW8_TLDS1_WG32_4_1_WGM8_WGMXCC1_WGMXCCGn1
    SolutionIndex: 153
    SolutionNameMin: Cijk_Alik_Bljk_HHS_BH_Bias_HAS_SAV_UserArgs_MT64x16x64_MI16x16x1_SN_LDSB0_GRVWA8_GRVWB8_GSU1_GSUC0_GSUWGMRR0_K1_LBSPPA128_LBSPPB128_MIWT1_1_SS1_SU32_SUM0_SUS256_SVW1_TLDS1_WG64_2_1_WGM8_WGMXCC1_WGMXCCGn1
    SolutionIndex: 154
    SolutionNameMin: Cijk_Alik_Bljk_HHS_BH_Bias_HAS_SAV_UserArgs_MT16x16x64_MI16x16x1_SN_LDSB0_GRVWA8_GRVWB8_GSU1_GSUC0_GSUWGMRR0_K1_LBSPPA256_LBSPPB256_MIWT1_1_SS1_SU32_SUM0_SUS256_SVW1_TLDS0_WG16_2_1_WGM8_WGMXCC1_WGMXCCGn1
    SolutionIndex: 155
    SolutionNameMin: Cijk_Alik_Bljk_HHS_BH_Bias_HAS_SAV_UserArgs_MT16x64x64_MI16x16x1_SN_LDSB0_GRVWA8_GRVWB8_GSU1_GSUC0_GSUWGMRR0_K1_LBSPPA128_LBSPPB128_MIWT1_1_SS0_SU32_SUM0_SUS256_SVW8_TLDS1_WG16_8_1_WGM8_WGMXCC1_WGMXCCGn1
    SolutionIndex: 156
    SolutionNameMin: Cijk_Alik_Bljk_HHS_BH_Bias_HAS_SAV_UserArgs_MT192x32x64_MI16x16x1_SN_LDSB1_GRVWA8_GRVWB8_GSU1_GSUC0_GSUWGMRR0_K1_LBSPPA128_LBSPPB128_MIWT3_2_SS0_SU32_SUM0_SUS256_SVW8_TLDS1_WG64_2_1_WGM8_WGMXCC1_WGMXCCGn1
    SolutionIndex: 157
    SolutionNameMin: Cijk_Alik_Bljk_HHS_BH_Bias_HAS_SAV_UserArgs_MT80x128x64_MI16x16x1_SN_LDSB1_GRVWA8_GRVWB8_GSU1_GSUC0_GSUWGMRR0_K1_LBSPPA128_LBSPPB128_MIWT5_2_SS1_SU32_SUM0_SUS256_SVW1_TLDS1_WG16_8_1_WGM8_WGMXCC1_WGMXCCGn1
    SolutionIndex: 158
    SolutionNameMin: Cijk_Alik_Bljk_HHS_BH_Bias_HAS_SAV_UserArgs_MT64x16x32_MI16x16x1_SN_LDSB0_GRVWA8_GRVWB4_GSU1_GSUC0_GSUWGMRR0_K1_LBSPPA128_LBSPPB128_MIWT1_1_SS0_SU32_SUM0_SUS256_SVW8_TLDS1_WG64_2_1_WGM8_WGMXCC1_WGMXCCGn1
    SolutionIndex: 159
    SolutionNameMin: Cijk_Alik_Bljk_HHS_BH_Bias_HAS_SAV_UserArgs_MT64x192x32_MI16x16x1_SN_LDSB1_GRVWA8_GRVWB8_GSU1_GSUC0_GSUWGMRR0_K1_LBSPPA128_LBSPPB128_MIWT4_3_SS0_SU32_SUM0_SUS256_SVW8_TLDS1_WG16_8_1_WGM8_WGMXCC1_WGMXCCGn1
    SolutionIndex: 160
    SolutionNameMin: Cijk_Alik_Bljk_HHS_BH_Bias_HAS_SAV_UserArgs_MT128x48x64_MI16x16x1_SN_LDSB1_GRVWA8_GRVWB8_GSU1_GSUC0_GSUWGMRR0_K1_LBSPPA128_LBSPPB128_MIWT2_3_SS1_SU32_SUM0_SUS256_SVW1_TLDS1_WG64_2_1_WGM8_WGMXCC1_WGMXCCGn1
- - - [512, 512, 1, 64]
    - [26, 1116.36]
  - - [1024, 512, 1, 64]
    - [24, 2109.68]
  - - [1536, 512, 1, 64]
    - [6, 2920.74]
  - - [2048, 512, 1, 64]
    - [24, 3812.35]
  - - [2560, 512, 1, 64]
    - [9, 4280.56]
  - - [3072, 512, 1, 64]
    - [7, 4977.66]
  - - [512, 1024, 1, 64]
    - [20, 2015.7]
  - - [1024, 1024, 1, 64]
    - [5, 3695.63]
  - - [1536, 1024, 1, 64]
    - [6, 5176.29]
  - - [2048, 1024, 1, 64]
    - [26, 5979.18]
  - - [2560, 1024, 1, 64]
    - [7, 7139.54]
  - - [3072, 1024, 1, 64]
    - [7, 8016.99]
  - - [512, 1536, 1, 64]
    - [4, 2992.1]
  - - [1024, 1536, 1, 64]
    - [8, 4945.87]
  - - [1536, 1536, 1, 64]
    - [23, 6493.29]
  - - [2048, 1536, 1, 64]
    - [3, 8039.4]
  - - [2560, 1536, 1, 64]
    - [3, 9563.3]
  - - [3072, 1536, 1, 64]
    - [7, 10179.8]
  - - [512, 2048, 1, 64]
    - [9, 3660.25]
  - - [1024, 2048, 1, 64]
    - [3, 6320.59]
  - - [1536, 2048, 1, 64]
    - [3, 8217.08]
  - - [2048, 2048, 1, 64]
    - [3, 9524.73]
  - - [2560, 2048, 1, 64]
    - [3, 11184.3]
  - - [3072, 2048, 1, 64]
    - [3, 11892.1]
  - - [512, 2560, 1, 64]
    - [4, 4524.6]
  - - [1024, 2560, 1, 64]
    - [3, 7363.92]
  - - [1536, 2560, 1, 64]
    - [7, 9451.78]
  - - [2048, 2560, 1, 64]
    - [3, 11067.7]
  - - [2560, 2560, 1, 64]
    - [4, 12345.4]
  - - [3072, 2560, 1, 64]
    - [3, 13638.3]
  - - [512, 3072, 1, 64]
    - [5, 5016.11]
  - - [1024, 3072, 1, 64]
    - [6, 7863.24]
  - - [1536, 3072, 1, 64]
    - [8, 10419.2]
  - - [2048, 3072, 1, 64]
    - [7, 12251.0]
  - - [2560, 3072, 1, 64]
    - [8, 13673.5]
  - - [3072, 3072, 1, 64]
    - [3, 14721.3]
  - - [512, 512, 1, 256]
    - [23, 3824.3]
  - - [1024, 512, 1, 256]
    - [21, 6310.04]
  - - [1536, 512, 1, 256]
    - [3, 9379.08]
  - - [2048, 512, 1, 256]
    - [7, 11175.5]
  - - [2560, 512, 1, 256]
    - [3, 12621.6]
  - - [3072, 512, 1, 256]
    - [7, 14480.3]
  - - [512, 1024, 1, 256]
    - [7, 7320.5]
  - - [1024, 1024, 1, 256]
    - [7, 11689.9]
  - - [1536, 1024, 1, 256]
    - [32, 11671.1]
  - - [2048, 1024, 1, 256]
    - [7, 16930.9]
  - - [2560, 1024, 1, 256]
    - [3, 18384.2]
  - - [3072, 1024, 1, 256]
    - [3, 20444.7]
  - - [512, 1536, 1, 256]
    - [3, 9420.77]
  - - [1024, 1536, 1, 256]
    - [7, 14561.4]
  - - [1536, 1536, 1, 256]
    - [7, 17782.7]
  - - [2048, 1536, 1, 256]
    - [7, 20398.1]
  - - [2560, 1536, 1, 256]
    - [7, 22130.6]
  - - [3072, 1536, 1, 256]
    - [7, 23282.6]
  - - [512, 2048, 1, 256]
    - [23, 11511.4]
  - - [1024, 2048, 1, 256]
    - [7, 17019.7]
  - - [1536, 2048, 1, 256]
    - [7, 20531.0]
  - - [2048, 2048, 1, 256]
    - [7, 22318.2]
  - - [2560, 2048, 1, 256]
    - [3, 24464.2]
  - - [3072, 2048, 1, 256]
    - [7, 26127.0]
  - - [512, 2560, 1, 256]
    - [23, 12787.8]
  - - [1024, 2560, 1, 256]
    - [23, 17516.4]
  - - [1536, 2560, 1, 256]
    - [7, 22099.0]
  - - [2048, 2560, 1, 256]
    - [3, 24493.2]
  - - [2560, 2560, 1, 256]
    - [23, 26039.0]
  - - [3072, 2560, 1, 256]
    - [7, 27133.3]
  - - [512, 3072, 1, 256]
    - [31, 11673.0]
  - - [1024, 3072, 1, 256]
    - [7, 20336.3]
  - - [1536, 3072, 1, 256]
    - [7, 23677.8]
  - - [2048, 3072, 1, 256]
    - [23, 25872.3]
  - - [2560, 3072, 1, 256]
    - [3, 27085.7]
  - - [3072, 3072, 1, 256]
    - [3, 28148.9]
  - - [512, 512, 1, 512]
    - [29, 6901.9]
  - - [1024, 512, 1, 512]
    - [22, 10023.5]
  - - [1536, 512, 1, 512]
    - [3, 14241.6]
  - - [2048, 512, 1, 512]
    - [7, 17210.7]
  - - [2560, 512, 1, 512]
    - [7, 18333.8]
  - - [3072, 512, 1, 512]
    - [18, 20924.1]
  - - [512, 1024, 1, 512]
    - [18, 11163.9]
  - - [1024, 1024, 1, 512]
    - [3, 17257.7]
  - - [1536, 1024, 1, 512]
    - [3, 21191.4]
  - - [2048, 1024, 1, 512]
    - [3, 23518.1]
  - - [2560, 1024, 1, 512]
    - [7, 24712.4]
  - - [3072, 1024, 1, 512]
    - [3, 26455.7]
  - - [512, 1536, 1, 512]
    - [7, 14173.7]
  - - [1024, 1536, 1, 512]
    - [3, 21272.9]
  - - [1536, 1536, 1, 512]
    - [7, 23413.7]
  - - [2048, 1536, 1, 512]
    - [7, 26629.0]
  - - [2560, 1536, 1, 512]
    - [3, 27606.6]
  - - [3072, 1536, 1, 512]
    - [3, 29315.8]
  - - [512, 2048, 1, 512]
    - [3, 17921.7]
  - - [1024, 2048, 1, 512]
    - [7, 23634.6]
  - - [1536, 2048, 1, 512]
    - [3, 26315.1]
  - - [2048, 2048, 1, 512]
    - [3, 28469.1]
  - - [2560, 2048, 1, 512]
    - [18, 30072.4]
  - - [3072, 2048, 1, 512]
    - [23, 31016.6]
  - - [512, 2560, 1, 512]
    - [3, 18699.8]
  - - [1024, 2560, 1, 512]
    - [3, 24838.3]
  - - [1536, 2560, 1, 512]
    - [3, 27568.4]
  - - [2048, 2560, 1, 512]
    - [3, 30484.8]
  - - [2560, 2560, 1, 512]
    - [7, 31541.9]
  - - [3072, 2560, 1, 512]
    - [23, 31976.4]
  - - [512, 3072, 1, 512]
    - [25, 20206.2]
  - - [1024, 3072, 1, 512]
    - [3, 26139.5]
  - - [1536, 3072, 1, 512]
    - [7, 29248.4]
  - - [2048, 3072, 1, 512]
    - [3, 30635.2]
  - - [2560, 3072, 1, 512]
    - [7, 31928.0]
  - - [3072, 3072, 1, 512]
    - [3, 32401.2]
  - - [512, 512, 1, 1024]
    - [16, 11191.8]
  - - [1024, 512, 1, 1024]
    - [30, 15094.6]
  - - [1536, 512, 1, 1024]
    - [7, 20115.1]
  - - [2048, 512, 1, 1024]
    - [1, 18401.7]
  - - [2560, 512, 1, 1024]
    - [3, 24437.0]
  - - [3072, 512, 1, 1024]
    - [3, 27036.4]
  - - [512, 1024, 1, 1024]
    - [23, 18759.2]
  - - [1024, 1024, 1, 1024]
    - [7, 23930.3]
  - - [1536, 1024, 1, 1024]
    - [3, 27311.9]
  - - [2048, 1024, 1, 1024]
    - [3, 29234.0]
  - - [2560, 1024, 1, 1024]
    - [18, 30887.0]
  - - [3072, 1024, 1, 1024]
    - [3, 31271.5]
  - - [512, 1536, 1, 1024]
    - [3, 15196.0]
  - - [1024, 1536, 1, 1024]
    - [7, 27468.2]
  - - [1536, 1536, 1, 1024]
    - [9, 28538.7]
  - - [2048, 1536, 1, 1024]
    - [3, 31260.8]
  - - [2560, 1536, 1, 1024]
    - [18, 31617.8]
  - - [3072, 1536, 1, 1024]
    - [3, 33265.9]
  - - [512, 2048, 1, 1024]
    - [7, 24437.9]
  - - [1024, 2048, 1, 1024]
    - [23, 29042.0]
  - - [1536, 2048, 1, 1024]
    - [3, 31309.3]
  - - [2048, 2048, 1, 1024]
    - [3, 32573.8]
  - - [2560, 2048, 1, 1024]
    - [7, 33352.6]
  - - [3072, 2048, 1, 1024]
    - [18, 33978.9]
  - - [512, 2560, 1, 1024]
    - [3, 24450.6]
  - - [1024, 2560, 1, 1024]
    - [7, 30538.4]
  - - [1536, 2560, 1, 1024]
    - [18, 31676.3]
  - - [2048, 2560, 1, 1024]
    - [18, 33474.4]
  - - [2560, 2560, 1, 1024]
    - [25, 34230.7]
  - - [3072, 2560, 1, 1024]
    - [18, 34591.6]
  - - [512, 3072, 1, 1024]
    - [7, 27123.1]
  - - [1024, 3072, 1, 1024]
    - [25, 30137.2]
  - - [1536, 3072, 1, 1024]
    - [18, 33263.7]
  - - [2048, 3072, 1, 1024]
    - [3, 33801.1]
  - - [2560, 3072, 1, 1024]
    - [3, 35197.0]
  - - [3072, 3072, 1, 1024]
    - [3, 35739.8]
  - - [512, 512, 1, 2048]
    - [0, 16070.1]
  - - [1024, 512, 1, 2048]
    - [7, 24839.9]
  - - [1536, 512, 1, 2048]
    - [7, 24644.6]
  - - [2048, 512, 1, 2048]
    - [23, 29724.8]
  - - [2560, 512, 1, 2048]
    - [7, 28576.3]
  - - [3072, 512, 1, 2048]
    - [7, 31765.6]
  - - [512, 1024, 1, 2048]
    - [30, 19501.7]
  - - [1024, 1024, 1, 2048]
    - [3, 29849.0]
  - - [1536, 1024, 1, 2048]
    - [7, 31696.9]
  - - [2048, 1024, 1, 2048]
    - [7, 33441.7]
  - - [2560, 1024, 1, 2048]
    - [18, 33752.7]
  - - [3072, 1024, 1, 2048]
    - [7, 34739.8]
  - - [512, 1536, 1, 2048]
    - [7, 25223.0]
  - - [1024, 1536, 1, 2048]
    - [3, 32174.0]
  - - [1536, 1536, 1, 2048]
    - [23, 31646.4]
  - - [2048, 1536, 1, 2048]
    - [3, 34694.8]
  - - [2560, 1536, 1, 2048]
    - [3, 34553.2]
  - - [3072, 1536, 1, 2048]
    - [23, 35759.2]
  - - [512, 2048, 1, 2048]
    - [3, 29652.8]
  - - [1024, 2048, 1, 2048]
    - [7, 33297.5]
  - - [1536, 2048, 1, 2048]
    - [7, 34608.8]
  - - [2048, 2048, 1, 2048]
    - [23, 35139.7]
  - - [2560, 2048, 1, 2048]
    - [23, 35341.3]
  - - [3072, 2048, 1, 2048]
    - [23, 35956.2]
  - - [512, 2560, 1, 2048]
    - [3, 28258.1]
  - - [1024, 2560, 1, 2048]
    - [7, 33681.7]
  - - [1536, 2560, 1, 2048]
    - [3, 34214.0]
  - - [2048, 2560, 1, 2048]
    - [3, 35566.9]
  - - [2560, 2560, 1, 2048]
    - [3, 34975.4]
  - - [3072, 2560, 1, 2048]
    - [7, 36457.3]
  - - [512, 3072, 1, 2048]
    - [23, 32028.3]
  - - [1024, 3072, 1, 2048]
    - [3, 35102.8]
  - - [1536, 3072, 1, 2048]
    - [23, 35622.4]
  - - [2048, 3072, 1, 2048]
    - [23, 36506.3]
  - - [2560, 3072, 1, 2048]
    - [23, 36578.4]
  - - [3072, 3072, 1, 2048]
    - [7, 36227.1]
  - - [512, 512, 1, 3072]
    - [16, 19097.1]
  - - [1024, 512, 1, 3072]
    - [7, 22485.2]
  - - [1536, 512, 1, 3072]
    - [18, 27063.8]
  - - [2048, 512, 1, 3072]
    - [23, 31945.5]
  - - [2560, 512, 1, 3072]
    - [25, 30201.7]
  - - [3072, 512, 1, 3072]
    - [7, 33670.1]
  - - [512, 1024, 1, 3072]
    - [23, 27764.6]
  - - [1024, 1024, 1, 3072]
    - [18, 31934.4]
  - - [1536, 1024, 1, 3072]
    - [18, 33879.6]
  - - [2048, 1024, 1, 3072]
    - [7, 34652.8]
  - - [2560, 1024, 1, 3072]
    - [7, 35678.7]
  - - [3072, 1024, 1, 3072]
    - [7, 36476.6]
  - - [512, 1536, 1, 3072]
    - [19, 26411.6]
  - - [1024, 1536, 1, 3072]
    - [18, 33941.6]
  - - [1536, 1536, 1, 3072]
    - [9, 33518.4]
  - - [2048, 1536, 1, 3072]
    - [7, 35550.4]
  - - [2560, 1536, 1, 3072]
    - [19, 35037.3]
  - - [3072, 1536, 1, 3072]
    - [7, 36761.4]
  - - [512, 2048, 1, 3072]
    - [23, 32025.2]
  - - [1024, 2048, 1, 3072]
    - [23, 34942.8]
  - - [1536, 2048, 1, 3072]
    - [7, 36511.0]
  - - [2048, 2048, 1, 3072]
    - [7, 36512.1]
  - - [2560, 2048, 1, 3072]
    - [3, 36582.2]
  - - [3072, 2048, 1, 3072]
    - [3, 36507.9]
  - - [512, 2560, 1, 3072]
    - [9, 30497.2]
  - - [1024, 2560, 1, 3072]
    - [23, 35525.0]
  - - [1536, 2560, 1, 3072]
    - [9, 35295.7]
  - - [2048, 2560, 1, 3072]
    - [23, 36415.3]
  - - [2560, 2560, 1, 3072]
    - [3, 36079.3]
  - - [3072, 2560, 1, 3072]
    - [7, 36791.5]
  - - [512, 3072, 1, 3072]
    - [23, 33847.3]
  - - [1024, 3072, 1, 3072]
    - [3, 35738.6]
  - - [1536, 3072, 1, 3072]
    - [23, 36281.0]
  - - [2048, 3072, 1, 3072]
    - [3, 36700.7]
  - - [2560, 3072, 1, 3072]
    - [3, 36778.3]
  - - [3072, 3072, 1, 3072]
    - [3, 37457.0]
  - - [1, 1, 1, 1]
    - [17, 6.65624e-05]
  - - [1, 1, 1, 64]
    - [21, 0.00424868]
  - - [1, 64, 1, 1]
    - [13, 0.00424305]
  - - [64, 1, 1, 1]
    - [15, 0.00427565]
  - - [64, 64, 1, 1]
    - [2, 0.269944]
  - - [64, 1, 1, 64]
    - [10, 0.250505]
  - - [1, 64, 1, 64]
    - [28, 0.271195]
  - - [64, 64, 1, 64]
    - [12, 17.4611]
  - - [64, 64, 1, 256]
    - [11, 64.9052]
  - - [64, 64, 1, 512]
    - [14, 118.493]
  - - [64, 64, 1, 1024]
    - [11, 203.869]
  - - [64, 64, 1, 2048]
    - [11, 322.713]
  - - [64, 64, 1, 4096]
    - [27, 447.864]
  - - [5120, 1, 1, 3072]
    - [33, 0.28]
  - - [5120, 64, 1, 3072]
    - [34, 13.28]
  - - [5120, 128, 1, 3072]
    - [35, 23.19]
  - - [5120, 192, 1, 3072]
    - [36, 28.03]
  - - [5120, 256, 1, 3072]
    - [36, 30.77]
  - - [5120, 320, 1, 3072]
    - [36, 32.32]
  - - [5120, 384, 1, 3072]
    - [36, 38.61]
  - - [5120, 448, 1, 3072]
    - [36, 37.44]
  - - [5120, 512, 1, 3072]
    - [37, 42.44]
  - - [5120, 576, 1, 3072]
    - [38, 34.85]
  - - [5120, 640, 1, 3072]
    - [39, 36.97]
  - - [5120, 704, 1, 3072]
    - [38, 38.83]
  - - [5120, 768, 1, 3072]
    - [38, 41.48]
  - - [5120, 832, 1, 3072]
    - [36, 39.45]
  - - [5120, 896, 1, 3072]
    - [37, 42.24]
  - - [5120, 960, 1, 3072]
    - [37, 44.48]
  - - [5120, 1024, 1, 3072]
    - [37, 46.86]
  - - [5120, 1088, 1, 3072]
    - [38, 41.77]
  - - [5120, 1152, 1, 3072]
    - [38, 44.07]
  - - [5120, 1216, 1, 3072]
    - [36, 42.75]
  - - [5120, 1280, 1, 3072]
    - [39, 45.63]
  - - [5120, 1344, 1, 3072]
    - [40, 44.26]
  - - [5120, 1408, 1, 3072]
    - [37, 45.65]
  - - [5120, 1472, 1, 3072]
    - [37, 46.88]
  - - [5120, 1536, 1, 3072]
    - [37, 49.22]
  - - [5120, 1600, 1, 3072]
    - [41, 45.41]
  - - [5120, 1664, 1, 3072]
    - [37, 45.79]
  - - [5120, 1728, 1, 3072]
    - [40, 45.28]
  - - [5120, 1792, 1, 3072]
    - [37, 46.44]
  - - [5120, 1856, 1, 3072]
    - [37, 47.68]
  - - [5120, 1920, 1, 3072]
    - [37, 49.57]
  - - [5120, 1984, 1, 3072]
    - [37, 48.07]
  - - [5120, 2048, 1, 3072]
    - [37, 49.95]
  - - [5120, 2112, 1, 3072]
    - [37, 45.71]
  - - [5120, 2176, 1, 3072]
    - [42, 46.41]
  - - [5120, 2240, 1, 3072]
    - [39, 48.24]
  - - [5120, 2304, 1, 3072]
    - [36, 48.19]
  - - [5120, 2368, 1, 3072]
    - [36, 47.93]
  - - [5120, 2432, 1, 3072]
    - [37, 48.79]
  - - [5120, 2496, 1, 3072]
    - [37, 49.33]
  - - [5120, 2560, 1, 3072]
    - [37, 50.33]
  - - [5120, 2624, 1, 3072]
    - [39, 47.65]
  - - [5120, 2688, 1, 3072]
    - [39, 48.42]
  - - [5120, 2752, 1, 3072]
    - [36, 48.07]
  - - [5120, 2816, 1, 3072]
    - [37, 48.96]
  - - [5120, 2880, 1, 3072]
    - [37, 49.37]
  - - [5120, 2944, 1, 3072]
    - [37, 50.71]
  - - [5120, 3008, 1, 3072]
    - [37, 49.66]
  - - [5120, 3072, 1, 3072]
    - [37, 51.09]
  - - [5120, 3136, 1, 3072]
    - [39, 48.34]
  - - [5120, 3200, 1, 3072]
    - [39, 48.65]
  - - [5120, 3264, 1, 3072]
    - [37, 49.1]
  - - [5120, 3328, 1, 3072]
    - [37, 49.23]
  - - [5120, 3392, 1, 3072]
    - [37, 50.42]
  - - [5120, 3456, 1, 3072]
    - [37, 50.88]
  - - [5120, 3520, 1, 3072]
    - [37, 50.33]
  - - [5120, 3584, 1, 3072]
    - [37, 51.34]
  - - [5120, 3648, 1, 3072]
    - [39, 48.95]
  - - [5120, 3712, 1, 3072]
    - [37, 49.36]
  - - [5120, 3776, 1, 3072]
    - [37, 49.26]
  - - [5120, 3840, 1, 3072]
    - [37, 49.99]
  - - [5120, 3904, 1, 3072]
    - [37, 50.12]
  - - [5120, 3968, 1, 3072]
    - [37, 51.36]
  - - [5120, 4032, 1, 3072]
    - [37, 50.73]
  - - [5120, 4096, 1, 3072]
    - [37, 51.06]
  - - [3072, 1, 1, 8192]
    - [43, 0.26]
  - - [3072, 64, 1, 8192]
    - [44, 12.74]
  - - [3072, 128, 1, 8192]
    - [45, 20.51]
  - - [3072, 192, 1, 8192]
    - [46, 24.94]
  - - [3072, 256, 1, 8192]
    - [47, 29.15]
  - - [3072, 320, 1, 8192]
    - [41, 32.73]
  - - [3072, 384, 1, 8192]
    - [48, 28.74]
  - - [3072, 448, 1, 8192]
    - [49, 29.03]
  - - [3072, 512, 1, 8192]
    - [50, 29.96]
  - - [3072, 576, 1, 8192]
    - [46, 33.07]
  - - [3072, 640, 1, 8192]
    - [51, 30.91]
  - - [3072, 704, 1, 8192]
    - [46, 30.01]
  - - [3072, 768, 1, 8192]
    - [52, 32.77]
  - - [3072, 832, 1, 8192]
    - [53, 31.21]
  - - [3072, 896, 1, 8192]
    - [53, 32.82]
  - - [3072, 960, 1, 8192]
    - [54, 31.22]
  - - [3072, 1024, 1, 8192]
    - [51, 32.2]
  - - [3072, 1088, 1, 8192]
    - [53, 31.53]
  - - [3072, 1152, 1, 8192]
    - [53, 32.66]
  - - [3072, 1216, 1, 8192]
    - [55, 30.39]
  - - [3072, 1280, 1, 8192]
    - [54, 32.71]
  - - [3072, 1344, 1, 8192]
    - [56, 31.65]
  - - [3072, 1408, 1, 8192]
    - [48, 32.86]
  - - [3072, 1472, 1, 8192]
    - [35, 33.03]
  - - [3072, 1536, 1, 8192]
    - [53, 34.11]
  - - [3072, 1600, 1, 8192]
    - [54, 34.17]
  - - [3072, 1664, 1, 8192]
    - [57, 33.08]
  - - [3072, 1728, 1, 8192]
    - [55, 33.26]
  - - [3072, 1792, 1, 8192]
    - [35, 33.8]
  - - [3072, 1856, 1, 8192]
    - [55, 34.23]
  - - [3072, 1920, 1, 8192]
    - [54, 35.01]
  - - [3072, 1984, 1, 8192]
    - [48, 32.76]
  - - [3072, 2048, 1, 8192]
    - [56, 33.21]
  - - [3072, 2112, 1, 8192]
    - [53, 34.03]
  - - [3072, 2176, 1, 8192]
    - [53, 35.15]
  - - [3072, 2240, 1, 8192]
    - [55, 36.63]
  - - [3072, 2304, 1, 8192]
    - [48, 36.08]
  - - [3072, 2368, 1, 8192]
    - [55, 33.8]
  - - [3072, 2432, 1, 8192]
    - [35, 34.73]
  - - [3072, 2496, 1, 8192]
    - [54, 34.51]
  - - [3072, 2560, 1, 8192]
    - [55, 35.66]
  - - [3072, 2624, 1, 8192]
    - [55, 35.08]
  - - [3072, 2688, 1, 8192]
    - [48, 37.07]
  - - [3072, 2752, 1, 8192]
    - [55, 35.73]
  - - [3072, 2816, 1, 8192]
    - [54, 35.73]
  - - [3072, 2880, 1, 8192]
    - [55, 37.08]
  - - [3072, 2944, 1, 8192]
    - [48, 35.6]
  - - [3072, 3008, 1, 8192]
    - [48, 37.14]
  - - [3072, 3072, 1, 8192]
    - [48, 36.97]
  - - [3072, 3136, 1, 8192]
    - [55, 36.91]
  - - [3072, 3200, 1, 8192]
    - [55, 36.79]
  - - [3072, 3264, 1, 8192]
    - [56, 36.57]
  - - [3072, 3328, 1, 8192]
    - [48, 36.95]
  - - [3072, 3392, 1, 8192]
    - [56, 37.59]
  - - [3072, 3456, 1, 8192]
    - [56, 37.52]
  - - [3072, 3520, 1, 8192]
    - [54, 37.58]
  - - [3072, 3584, 1, 8192]
    - [56, 36.87]
  - - [3072, 3648, 1, 8192]
    - [56, 36.37]
  - - [3072, 3712, 1, 8192]
    - [56, 37.3]
  - - [3072, 3776, 1, 8192]
    - [48, 37.8]
  - - [3072, 3840, 1, 8192]
    - [48, 38.42]
  - - [3072, 3904, 1, 8192]
    - [54, 36.93]
  - - [3072, 3968, 1, 8192]
    - [56, 37.11]
  - - [3072, 4032, 1, 8192]
    - [56, 37.47]
  - - [3072, 4096, 1, 8192]
    - [55, 37.98]
  - - [3072, 1, 1, 3072]
    - [58, 0.19]
  - - [3072, 64, 1, 3072]
    - [59, 9.59]
  - - [3072, 128, 1, 3072]
    - [60, 16.22]
  - - [3072, 192, 1, 3072]
    - [61, 22.34]
  - - [3072, 256, 1, 3072]
    - [47, 26.26]
  - - [3072, 320, 1, 3072]
    - [39, 28.85]
  - - [3072, 384, 1, 3072]
    - [47, 31.28]
  - - [3072, 448, 1, 3072]
    - [62, 32.51]
  - - [3072, 576, 1, 3072]
    - [39, 35.02]
  - - [3072, 640, 1, 3072]
    - [39, 40.21]
  - - [3072, 704, 1, 3072]
    - [39, 36.54]
  - - [3072, 768, 1, 3072]
    - [39, 39.94]
  - - [3072, 832, 1, 3072]
    - [63, 35.93]
  - - [3072, 896, 1, 3072]
    - [39, 34.56]
  - - [3072, 960, 1, 3072]
    - [39, 37.03]
  - - [3072, 1088, 1, 3072]
    - [39, 38.4]
  - - [3072, 1152, 1, 3072]
    - [47, 38.64]
  - - [3072, 1216, 1, 3072]
    - [47, 40.09]
  - - [3072, 1280, 1, 3072]
    - [64, 41.74]
  - - [3072, 1344, 1, 3072]
    - [65, 41.25]
  - - [3072, 1408, 1, 3072]
    - [37, 43.22]
  - - [3072, 1472, 1, 3072]
    - [39, 42.95]
  - - [3072, 1600, 1, 3072]
    - [39, 45.99]
  - - [3072, 1664, 1, 3072]
    - [37, 46.06]
  - - [3072, 1728, 1, 3072]
    - [47, 40.39]
  - - [3072, 1792, 1, 3072]
    - [65, 42.36]
  - - [3072, 1856, 1, 3072]
    - [47, 42.79]
  - - [3072, 1920, 1, 3072]
    - [41, 44.05]
  - - [3072, 1984, 1, 3072]
    - [39, 43.41]
  - - [3072, 2112, 1, 3072]
    - [37, 43.85]
  - - [3072, 2176, 1, 3072]
    - [37, 45.05]
  - - [3072, 2240, 1, 3072]
    - [39, 46.08]
  - - [3072, 2304, 1, 3072]
    - [39, 46.45]
  - - [3072, 2368, 1, 3072]
    - [39, 47.73]
  - - [3072, 2432, 1, 3072]
    - [37, 46.97]
  - - [3072, 2496, 1, 3072]
    - [37, 47.34]
  - - [3072, 2624, 1, 3072]
    - [39, 44.88]
  - - [3072, 2688, 1, 3072]
    - [39, 46.38]
  - - [3072, 2752, 1, 3072]
    - [39, 45.51]
  - - [3072, 2816, 1, 3072]
    - [39, 46.17]
  - - [3072, 2880, 1, 3072]
    - [41, 47.06]
  - - [3072, 2944, 1, 3072]
    - [39, 46.19]
  - - [3072, 3008, 1, 3072]
    - [39, 46.91]
  - - [3072, 3136, 1, 3072]
    - [39, 48.48]
  - - [3072, 3200, 1, 3072]
    - [39, 49.66]
  - - [3072, 3264, 1, 3072]
    - [37, 47.89]
  - - [3072, 3328, 1, 3072]
    - [37, 48.64]
  - - [3072, 3392, 1, 3072]
    - [39, 46.56]
  - - [3072, 3456, 1, 3072]
    - [39, 47.18]
  - - [3072, 3520, 1, 3072]
    - [39, 48.19]
  - - [3072, 3584, 1, 3072]
    - [39, 47.03]
  - - [3072, 3648, 1, 3072]
    - [39, 48.01]
  - - [3072, 3712, 1, 3072]
    - [39, 47.43]
  - - [3072, 3776, 1, 3072]
    - [39, 47.73]
  - - [3072, 3840, 1, 3072]
    - [39, 48.86]
  - - [3072, 3904, 1, 3072]
    - [39, 49.13]
  - - [3072, 3968, 1, 3072]
    - [39, 49.86]
  - - [3072, 4032, 1, 3072]
    - [37, 48.17]
  - - [3072, 4096, 1, 3072]
    - [37, 48.89]
  - - [16384, 1, 1, 3072]
    - [66, 0.21]
  - - [16384, 64, 1, 3072]
    - [67, 13.13]
  - - [16384, 128, 1, 3072]
    - [68, 24.56]
  - - [16384, 192, 1, 3072]
    - [68, 31.85]
  - - [16384, 256, 1, 3072]
    - [57, 34.22]
  - - [16384, 320, 1, 3072]
    - [65, 35.76]
  - - [16384, 384, 1, 3072]
    - [37, 40.94]
  - - [16384, 448, 1, 3072]
    - [38, 39.19]
  - - [16384, 512, 1, 3072]
    - [37, 41.3]
  - - [16384, 576, 1, 3072]
    - [69, 43.77]
  - - [16384, 640, 1, 3072]
    - [37, 47.0]
  - - [16384, 704, 1, 3072]
    - [49, 43.71]
  - - [16384, 768, 1, 3072]
    - [49, 46.96]
  - - [16384, 832, 1, 3072]
    - [37, 43.24]
  - - [16384, 896, 1, 3072]
    - [37, 46.1]
  - - [16384, 960, 1, 3072]
    - [39, 46.32]
  - - [16384, 1024, 1, 3072]
    - [49, 47.14]
  - - [16384, 1088, 1, 3072]
    - [39, 45.09]
  - - [16384, 1152, 1, 3072]
    - [40, 46.64]
  - - [16384, 1216, 1, 3072]
    - [70, 46.93]
  - - [16384, 1280, 1, 3072]
    - [70, 48.85]
  - - [16384, 1344, 1, 3072]
    - [40, 46.78]
  - - [16384, 1408, 1, 3072]
    - [42, 48.46]
  - - [16384, 1472, 1, 3072]
    - [37, 47.58]
  - - [16384, 1536, 1, 3072]
    - [37, 48.87]
  - - [16384, 1600, 1, 3072]
    - [39, 48.01]
  - - [16384, 1664, 1, 3072]
    - [37, 48.92]
  - - [16384, 1728, 1, 3072]
    - [39, 48.04]
  - - [16384, 1792, 1, 3072]
    - [37, 48.69]
  - - [16384, 1856, 1, 3072]
    - [37, 48.82]
  - - [16384, 1920, 1, 3072]
    - [37, 50.08]
  - - [16384, 1984, 1, 3072]
    - [37, 48.47]
  - - [16384, 2048, 1, 3072]
    - [37, 50.33]
  - - [16384, 2112, 1, 3072]
    - [39, 47.24]
  - - [16384, 2176, 1, 3072]
    - [37, 48.96]
  - - [16384, 2240, 1, 3072]
    - [39, 49.53]
  - - [16384, 2304, 1, 3072]
    - [37, 49.3]
  - - [16384, 2368, 1, 3072]
    - [42, 49.69]
  - - [16384, 2432, 1, 3072]
    - [37, 50.08]
  - - [16384, 2496, 1, 3072]
    - [37, 50.06]
  - - [16384, 2560, 1, 3072]
    - [42, 50.59]
  - - [16384, 2624, 1, 3072]
    - [37, 49.79]
  - - [16384, 2688, 1, 3072]
    - [37, 51.65]
  - - [16384, 2752, 1, 3072]
    - [42, 50.18]
  - - [16384, 2816, 1, 3072]
    - [37, 51.35]
  - - [16384, 2880, 1, 3072]
    - [37, 50.05]
  - - [16384, 2944, 1, 3072]
    - [37, 50.66]
  - - [16384, 3008, 1, 3072]
    - [42, 50.64]
  - - [16384, 3072, 1, 3072]
    - [37, 50.08]
  - - [16384, 3136, 1, 3072]
    - [39, 48.53]
  - - [16384, 3200, 1, 3072]
    - [39, 49.84]
  - - [16384, 3264, 1, 3072]
    - [37, 50.62]
  - - [16384, 3328, 1, 3072]
    - [42, 50.58]
  - - [16384, 3392, 1, 3072]
    - [37, 49.86]
  - - [16384, 3456, 1, 3072]
    - [37, 51.94]
  - - [16384, 3520, 1, 3072]
    - [39, 50.55]
  - - [16384, 3584, 1, 3072]
    - [42, 51.13]
  - - [16384, 3648, 1, 3072]
    - [37, 50.75]
  - - [16384, 3712, 1, 3072]
    - [42, 51.37]
  - - [16384, 3776, 1, 3072]
    - [37, 50.78]
  - - [16384, 3840, 1, 3072]
    - [37, 52.37]
  - - [16384, 3904, 1, 3072]
    - [37, 50.72]
  - - [16384, 3968, 1, 3072]
    - [37, 51.34]
  - - [16384, 4032, 1, 3072]
    - [42, 51.08]
  - - [16384, 4096, 1, 3072]
    - [42, 51.63]
  - - [128256, 1, 1, 3072]
    - [43, 0.25]
  - - [128256, 64, 1, 3072]
    - [71, 14.96]
  - - [128256, 128, 1, 3072]
    - [55, 28.92]
  - - [128256, 192, 1, 3072]
    - [48, 40.14]
  - - [128256, 256, 1, 3072]
    - [49, 46.36]
  - - [6144, 1, 1, 4096]
    - [78, 0.34]
  - - [6144, 64, 1, 4096]
    - [79, 19.42]
  - - [6144, 128, 1, 4096]
    - [80, 30.32]
  - - [6144, 192, 1, 4096]
    - [81, 35.03]
  - - [6144, 256, 1, 4096]
    - [82, 40.7]
  - - [6144, 320, 1, 4096]
    - [83, 42.29]
  - - [6144, 384, 1, 4096]
    - [84, 45.33]
  - - [6144, 448, 1, 4096]
    - [85, 42.14]
  - - [6144, 512, 1, 4096]
    - [86, 45.0]
  - - [6144, 576, 1, 4096]
    - [84, 48.83]
  - - [6144, 640, 1, 4096]
    - [83, 46.92]
  - - [6144, 704, 1, 4096]
    - [87, 48.83]
  - - [6144, 768, 1, 4096]
    - [88, 51.9]
  - - [6144, 832, 1, 4096]
    - [89, 45.27]
  - - [6144, 896, 1, 4096]
    - [84, 47.65]
  - - [6144, 960, 1, 4096]
    - [84, 50.83]
  - - [6144, 1024, 1, 4096]
    - [87, 50.52]
  - - [6144, 1088, 1, 4096]
    - [87, 52.05]
  - - [6144, 1152, 1, 4096]
    - [87, 54.51]
  - - [6144, 1216, 1, 4096]
    - [90, 48.21]
  - - [6144, 1280, 1, 4096]
    - [91, 50.3]
  - - [6144, 1344, 1, 4096]
    - [84, 51.35]
  - - [6144, 1408, 1, 4096]
    - [87, 53.07]
  - - [6144, 1472, 1, 4096]
    - [87, 54.66]
  - - [6144, 1536, 1, 4096]
    - [88, 55.14]
  - - [6144, 1600, 1, 4096]
    - [92, 50.43]
  - - [6144, 1664, 1, 4096]
    - [84, 50.31]
  - - [6144, 1728, 1, 4096]
    - [84, 52.49]
  - - [6144, 1792, 1, 4096]
    - [93, 51.78]
  - - [6144, 1856, 1, 4096]
    - [88, 52.84]
  - - [6144, 1920, 1, 4096]
    - [88, 53.54]
  - - [6144, 1984, 1, 4096]
    - [84, 50.18]
  - - [6144, 2048, 1, 4096]
    - [84, 50.67]
  - - [6144, 2112, 1, 4096]
    - [87, 52.38]
  - - [6144, 2176, 1, 4096]
    - [88, 54.03]
  - - [6144, 2240, 1, 4096]
    - [88, 53.57]
  - - [6144, 2304, 1, 4096]
    - [88, 55.35]
  - - [6144, 2368, 1, 4096]
    - [84, 51.23]
  - - [6144, 2432, 1, 4096]
    - [87, 53.6]
  - - [6144, 2496, 1, 4096]
    - [84, 53.11]
  - - [6144, 2560, 1, 4096]
    - [88, 53.43]
  - - [6144, 2624, 1, 4096]
    - [87, 53.34]
  - - [6144, 2688, 1, 4096]
    - [88, 55.27]
  - - [6144, 2752, 1, 4096]
    - [84, 51.42]
  - - [6144, 2816, 1, 4096]
    - [88, 52.23]
  - - [6144, 2880, 1, 4096]
    - [84, 53.33]
  - - [6144, 2944, 1, 4096]
    - [88, 51.93]
  - - [6144, 3008, 1, 4096]
    - [88, 55.18]
  - - [6144, 3072, 1, 4096]
    - [88, 54.01]
  - - [6144, 3136, 1, 4096]
    - [84, 52.23]
  - - [6144, 3200, 1, 4096]
    - [90, 52.19]
  - - [6144, 3264, 1, 4096]
    - [84, 52.87]
  - - [6144, 3328, 1, 4096]
    - [84, 51.83]
  - - [6144, 3392, 1, 4096]
    - [87, 52.81]
  - - [6144, 3456, 1, 4096]
    - [84, 53.22]
  - - [6144, 3520, 1, 4096]
    - [84, 52.15]
  - - [6144, 3584, 1, 4096]
    - [84, 52.23]
  - - [6144, 3648, 1, 4096]
    - [84, 53.45]
  - - [6144, 3712, 1, 4096]
    - [84, 52.15]
  - - [6144, 3776, 1, 4096]
    - [88, 56.05]
  - - [6144, 3840, 1, 4096]
    - [84, 53.31]
  - - [6144, 3904, 1, 4096]
    - [94, 52.14]
  - - [6144, 3968, 1, 4096]
    - [84, 52.5]
  - - [6144, 4032, 1, 4096]
    - [84, 53.48]
  - - [6144, 4096, 1, 4096]
    - [90, 53.89]
  - - [4096, 1, 1, 4096]
    - [78, 0.29]
  - - [4096, 64, 1, 4096]
    - [108, 15.45]
  - - [4096, 128, 1, 4096]
    - [86, 25.78]
  - - [4096, 192, 1, 4096]
    - [84, 31.62]
  - - [4096, 256, 1, 4096]
    - [86, 36.35]
  - - [4096, 320, 1, 4096]
    - [92, 33.89]
  - - [4096, 384, 1, 4096]
    - [88, 40.31]
  - - [4096, 448, 1, 4096]
    - [83, 40.42]
  - - [4096, 512, 1, 4096]
    - [89, 42.66]
  - - [4096, 576, 1, 4096]
    - [87, 45.16]
  - - [4096, 640, 1, 4096]
    - [83, 41.27]
  - - [4096, 704, 1, 4096]
    - [83, 43.9]
  - - [4096, 768, 1, 4096]
    - [80, 45.2]
  - - [4096, 832, 1, 4096]
    - [84, 42.33]
  - - [4096, 896, 1, 4096]
    - [109, 44.85]
  - - [4096, 960, 1, 4096]
    - [83, 46.98]
  - - [4096, 1024, 1, 4096]
    - [110, 48.19]
  - - [4096, 1088, 1, 4096]
    - [87, 49.8]
  - - [4096, 1152, 1, 4096]
    - [88, 52.13]
  - - [4096, 1216, 1, 4096]
    - [89, 45.26]
  - - [4096, 1280, 1, 4096]
    - [80, 47.32]
  - - [4096, 1344, 1, 4096]
    - [84, 48.15]
  - - [4096, 1408, 1, 4096]
    - [109, 48.37]
  - - [4096, 1472, 1, 4096]
    - [87, 50.86]
  - - [4096, 1536, 1, 4096]
    - [87, 52.34]
  - - [4096, 1600, 1, 4096]
    - [87, 53.15]
  - - [4096, 1664, 1, 4096]
    - [88, 55.07]
  - - [4096, 1728, 1, 4096]
    - [87, 56.79]
  - - [4096, 1792, 1, 4096]
    - [87, 49.86]
  - - [4096, 1856, 1, 4096]
    - [87, 49.58]
  - - [4096, 1920, 1, 4096]
    - [87, 50.76]
  - - [4096, 1984, 1, 4096]
    - [87, 51.49]
  - - [4096, 2048, 1, 4096]
    - [87, 52.65]
  - - [4096, 2112, 1, 4096]
    - [87, 54.3]
  - - [4096, 2176, 1, 4096]
    - [87, 55.0]
  - - [4096, 2240, 1, 4096]
    - [87, 55.99]
  - - [4096, 2304, 1, 4096]
    - [88, 57.32]
  - - [4096, 2368, 1, 4096]
    - [87, 52.01]
  - - [4096, 2432, 1, 4096]
    - [87, 52.34]
  - - [4096, 2496, 1, 4096]
    - [87, 52.58]
  - - [4096, 2560, 1, 4096]
    - [87, 53.22]
  - - [4096, 2624, 1, 4096]
    - [87, 53.36]
  - - [4096, 2688, 1, 4096]
    - [87, 55.59]
  - - [4096, 2752, 1, 4096]
    - [87, 55.49]
  - - [4096, 2816, 1, 4096]
    - [87, 56.33]
  - - [4096, 2880, 1, 4096]
    - [88, 57.22]
  - - [4096, 2944, 1, 4096]
    - [87, 52.73]
  - - [4096, 3008, 1, 4096]
    - [87, 52.88]
  - - [4096, 3072, 1, 4096]
    - [84, 51.58]
  - - [4096, 3136, 1, 4096]
    - [88, 51.51]
  - - [4096, 3200, 1, 4096]
    - [87, 52.77]
  - - [4096, 3264, 1, 4096]
    - [88, 54.64]
  - - [4096, 3328, 1, 4096]
    - [88, 54.58]
  - - [4096, 3392, 1, 4096]
    - [88, 55.49]
  - - [4096, 3456, 1, 4096]
    - [88, 55.58]
  - - [4096, 3520, 1, 4096]
    - [84, 50.69]
  - - [4096, 3584, 1, 4096]
    - [87, 52.96]
  - - [4096, 3648, 1, 4096]
    - [87, 54.58]
  - - [4096, 3712, 1, 4096]
    - [88, 52.9]
  - - [4096, 3776, 1, 4096]
    - [88, 53.62]
  - - [4096, 3840, 1, 4096]
    - [88, 53.86]
  - - [4096, 3904, 1, 4096]
    - [88, 54.21]
  - - [4096, 3968, 1, 4096]
    - [87, 54.23]
  - - [4096, 4032, 1, 4096]
    - [88, 56.21]
  - - [4096, 4096, 1, 4096]
    - [84, 51.54]
  - - [4096, 1, 1, 14336]
    - [72, 0.2]
  - - [4096, 64, 1, 14336]
    - [73, 12.9]
  - - [4096, 128, 1, 14336]
    - [74, 24.11]
  - - [4096, 192, 1, 14336]
    - [56, 32.52]
  - - [4096, 256, 1, 14336]
    - [111, 40.41]
  - - [4096, 320, 1, 14336]
    - [92, 44.11]
  - - [4096, 384, 1, 14336]
    - [106, 45.5]
  - - [4096, 448, 1, 14336]
    - [99, 49.34]
  - - [4096, 512, 1, 14336]
    - [106, 53.75]
  - - [4096, 576, 1, 14336]
    - [88, 53.04]
  - - [4096, 640, 1, 14336]
    - [112, 50.69]
  - - [4096, 704, 1, 14336]
    - [80, 45.37]
  - - [4096, 768, 1, 14336]
    - [80, 49.43]
  - - [4096, 832, 1, 14336]
    - [90, 51.19]
  - - [4096, 896, 1, 14336]
    - [90, 54.29]
  - - [4096, 960, 1, 14336]
    - [113, 54.45]
  - - [4096, 1024, 1, 14336]
    - [114, 54.79]
  - - [4096, 1088, 1, 14336]
    - [114, 57.79]
  - - [4096, 1152, 1, 14336]
    - [88, 59.12]
  - - [4096, 1216, 1, 14336]
    - [104, 59.33]
  - - [4096, 1280, 1, 14336]
    - [99, 62.08]
  - - [4096, 1344, 1, 14336]
    - [102, 53.97]
  - - [4096, 1408, 1, 14336]
    - [113, 57.01]
  - - [4096, 1472, 1, 14336]
    - [88, 54.62]
  - - [4096, 1536, 1, 14336]
    - [87, 54.5]
  - - [4096, 1600, 1, 14336]
    - [92, 55.44]
  - - [4096, 1664, 1, 14336]
    - [114, 57.99]
  - - [4096, 1728, 1, 14336]
    - [92, 60.35]
  - - [4096, 1792, 1, 14336]
    - [99, 59.28]
  - - [4096, 1856, 1, 14336]
    - [99, 63.43]
  - - [4096, 1920, 1, 14336]
    - [99, 64.91]
  - - [4096, 1984, 1, 14336]
    - [99, 55.76]
  - - [4096, 2048, 1, 14336]
    - [87, 56.59]
  - - [4096, 2112, 1, 14336]
    - [92, 57.44]
  - - [4096, 2176, 1, 14336]
    - [114, 58.45]
  - - [4096, 2240, 1, 14336]
    - [92, 60.72]
  - - [4096, 2304, 1, 14336]
    - [88, 59.7]
  - - [4096, 2368, 1, 14336]
    - [104, 58.04]
  - - [4096, 2432, 1, 14336]
    - [104, 59.39]
  - - [4096, 2496, 1, 14336]
    - [99, 62.98]
  - - [4096, 2560, 1, 14336]
    - [99, 64.64]
  - - [4096, 2624, 1, 14336]
    - [99, 57.04]
  - - [4096, 2688, 1, 14336]
    - [99, 58.32]
  - - [4096, 2752, 1, 14336]
    - [104, 58.85]
  - - [4096, 2816, 1, 14336]
    - [114, 59.72]
  - - [4096, 2880, 1, 14336]
    - [114, 60.67]
  - - [4096, 2944, 1, 14336]
    - [104, 59.69]
  - - [4096, 3008, 1, 14336]
    - [99, 59.8]
  - - [4096, 3072, 1, 14336]
    - [104, 61.21]
  - - [4096, 3136, 1, 14336]
    - [99, 63.06]
  - - [4096, 3200, 1, 14336]
    - [99, 63.56]
  - - [4096, 3264, 1, 14336]
    - [92, 59.37]
  - - [4096, 3328, 1, 14336]
    - [99, 60.99]
  - - [4096, 3392, 1, 14336]
    - [92, 61.21]
  - - [4096, 3456, 1, 14336]
    - [92, 62.14]
  - - [4096, 3520, 1, 14336]
    - [92, 62.27]
  - - [4096, 3584, 1, 14336]
    - [104, 60.66]
  - - [4096, 3648, 1, 14336]
    - [99, 59.85]
  - - [4096, 3712, 1, 14336]
    - [104, 62.0]
  - - [4096, 3776, 1, 14336]
    - [99, 62.64]
  - - [4096, 3840, 1, 14336]
    - [99, 61.73]
  - - [4096, 3904, 1, 14336]
    - [92, 59.2]
  - - [4096, 3968, 1, 14336]
    - [92, 59.71]
  - - [4096, 4032, 1, 14336]
    - [92, 61.32]
  - - [4096, 4096, 1, 14336]
    - [92, 62.66]
  - - [28672, 1, 1, 4096]
    - [75, 0.24]
  - - [28672, 64, 1, 4096]
    - [76, 14.44]
  - - [28672, 128, 1, 4096]
    - [50, 26.19]
  - - [28672, 192, 1, 4096]
    - [46, 34.7]
  - - [28672, 256, 1, 4096]
    - [80, 44.33]
  - - [28672, 320, 1, 4096]
    - [83, 45.55]
  - - [28672, 384, 1, 4096]
    - [90, 49.33]
  - - [28672, 448, 1, 4096]
    - [92, 49.92]
  - - [28672, 512, 1, 4096]
    - [99, 54.6]
  - - [28672, 576, 1, 4096]
    - [87, 57.85]
  - - [28672, 640, 1, 4096]
    - [114, 57.2]
  - - [28672, 704, 1, 4096]
    - [87, 54.99]
  - - [28672, 768, 1, 4096]
    - [87, 59.63]
  - - [28672, 832, 1, 4096]
    - [104, 53.99]
  - - [28672, 896, 1, 4096]
    - [88, 55.43]
  - - [28672, 960, 1, 4096]
    - [88, 57.97]
  - - [28672, 1024, 1, 4096]
    - [90, 54.64]
  - - [28672, 1088, 1, 4096]
    - [88, 53.98]
  - - [28672, 1152, 1, 4096]
    - [88, 56.9]
  - - [28672, 1216, 1, 4096]
    - [113, 54.7]
  - - [28672, 1280, 1, 4096]
    - [113, 54.41]
  - - [28672, 1344, 1, 4096]
    - [113, 56.49]
  - - [28672, 1408, 1, 4096]
    - [113, 56.25]
  - - [28672, 1472, 1, 4096]
    - [113, 54.76]
  - - [28672, 1536, 1, 4096]
    - [104, 57.09]
  - - [28672, 1600, 1, 4096]
    - [104, 54.76]
  - - [28672, 1664, 1, 4096]
    - [104, 57.43]
  - - [28672, 1728, 1, 4096]
    - [104, 55.45]
  - - [28672, 1792, 1, 4096]
    - [90, 56.52]
  - - [28672, 1856, 1, 4096]
    - [104, 56.62]
  - - [28672, 1920, 1, 4096]
    - [113, 57.65]
  - - [28672, 1984, 1, 4096]
    - [113, 56.16]
  - - [28672, 2048, 1, 4096]
    - [113, 56.14]
  - - [28672, 2112, 1, 4096]
    - [113, 58.03]
  - - [28672, 2176, 1, 4096]
    - [113, 56.74]
  - - [28672, 2240, 1, 4096]
    - [113, 56.5]
  - - [28672, 2304, 1, 4096]
    - [102, 57.38]
  - - [28672, 2368, 1, 4096]
    - [90, 54.99]
  - - [28672, 2432, 1, 4096]
    - [90, 57.19]
  - - [28672, 2496, 1, 4096]
    - [90, 55.49]
  - - [28672, 2560, 1, 4096]
    - [90, 56.59]
  - - [28672, 2624, 1, 4096]
    - [104, 56.54]
  - - [28672, 2688, 1, 4096]
    - [102, 58.0]
  - - [28672, 2752, 1, 4096]
    - [113, 57.75]
  - - [28672, 2816, 1, 4096]
    - [102, 57.01]
  - - [28672, 2880, 1, 4096]
    - [113, 58.65]
  - - [28672, 2944, 1, 4096]
    - [113, 58.0]
  - - [28672, 3008, 1, 4096]
    - [102, 56.96]
  - - [28672, 3072, 1, 4096]
    - [113, 58.45]
  - - [28672, 3136, 1, 4096]
    - [113, 54.19]
  - - [28672, 3200, 1, 4096]
    - [113, 54.55]
  - - [28672, 3264, 1, 4096]
    - [102, 55.9]
  - - [28672, 3328, 1, 4096]
    - [113, 56.18]
  - - [28672, 3392, 1, 4096]
    - [113, 56.34]
  - - [28672, 3456, 1, 4096]
    - [113, 57.98]
  - - [28672, 3520, 1, 4096]
    - [113, 57.06]
  - - [28672, 3584, 1, 4096]
    - [90, 56.75]
  - - [28672, 3648, 1, 4096]
    - [113, 57.93]
  - - [28672, 3712, 1, 4096]
    - [104, 56.69]
  - - [28672, 3776, 1, 4096]
    - [113, 57.46]
  - - [28672, 3840, 1, 4096]
    - [113, 57.22]
  - - [28672, 3904, 1, 4096]
    - [104, 56.34]
  - - [28672, 3968, 1, 4096]
    - [104, 56.27]
  - - [28672, 4032, 1, 4096]
    - [104, 55.79]
  - - [28672, 4096, 1, 4096]
    - [113, 55.76]
  - - [128256, 1, 1, 4096]
    - [75, 0.26]
  - - [128256, 64, 1, 4096]
    - [77, 15.54]
  - - [128256, 128, 1, 4096]
    - [71, 29.47]
  - - [128256, 192, 1, 4096]
    - [56, 39.89]
  - - [128256, 256, 1, 4096]
    - [109, 48.89]
  - - [4608, 1, 1, 3584]
    - [95, 0.32]
  - - [4608, 64, 1, 3584]
    - [96, 16.33]
  - - [4608, 128, 1, 3584]
    - [97, 26.77]
  - - [4608, 192, 1, 3584]
    - [98, 34.39]
  - - [4608, 256, 1, 3584]
    - [82, 39.54]
  - - [4608, 320, 1, 3584]
    - [92, 44.85]
  - - [4608, 384, 1, 3584]
    - [99, 45.23]
  - - [4608, 448, 1, 3584]
    - [100, 46.56]
  - - [4608, 512, 1, 3584]
    - [99, 50.52]
  - - [4608, 576, 1, 3584]
    - [101, 43.43]
  - - [4608, 640, 1, 3584]
    - [92, 48.06]
  - - [4608, 704, 1, 3584]
    - [102, 45.6]
  - - [4608, 768, 1, 3584]
    - [103, 49.15]
  - - [4608, 832, 1, 3584]
    - [99, 49.35]
  - - [4608, 896, 1, 3584]
    - [99, 53.25]
  - - [4608, 960, 1, 3584]
    - [92, 53.55]
  - - [4608, 1024, 1, 3584]
    - [99, 55.44]
  - - [4608, 1088, 1, 3584]
    - [99, 50.99]
  - - [4608, 1152, 1, 3584]
    - [104, 53.07]
  - - [4608, 1216, 1, 3584]
    - [102, 53.41]
  - - [4608, 1280, 1, 3584]
    - [90, 55.48]
  - - [4608, 1344, 1, 3584]
    - [92, 52.6]
  - - [4608, 1408, 1, 3584]
    - [99, 56.45]
  - - [4608, 1472, 1, 3584]
    - [92, 56.73]
  - - [4608, 1536, 1, 3584]
    - [92, 58.58]
  - - [4608, 1600, 1, 3584]
    - [92, 60.67]
  - - [4608, 1664, 1, 3584]
    - [99, 60.18]
  - - [4608, 1728, 1, 3584]
    - [105, 54.53]
  - - [4608, 1792, 1, 3584]
    - [106, 55.58]
  - - [4608, 1856, 1, 3584]
    - [92, 57.21]
  - - [4608, 1920, 1, 3584]
    - [92, 59.45]
  - - [4608, 1984, 1, 3584]
    - [92, 58.43]
  - - [4608, 2048, 1, 3584]
    - [92, 60.14]
  - - [4608, 2112, 1, 3584]
    - [107, 59.71]
  - - [4608, 2176, 1, 3584]
    - [99, 60.8]
  - - [4608, 2240, 1, 3584]
    - [106, 56.41]
  - - [4608, 2304, 1, 3584]
    - [99, 58.66]
  - - [4608, 2368, 1, 3584]
    - [92, 58.07]
  - - [4608, 2432, 1, 3584]
    - [107, 57.85]
  - - [4608, 2496, 1, 3584]
    - [107, 59.04]
  - - [4608, 2560, 1, 3584]
    - [92, 59.99]
  - - [4608, 2624, 1, 3584]
    - [99, 59.72]
  - - [4608, 2688, 1, 3584]
    - [99, 61.02]
  - - [4608, 2752, 1, 3584]
    - [99, 61.41]
  - - [4608, 2816, 1, 3584]
    - [99, 63.19]
  - - [4608, 2880, 1, 3584]
    - [92, 57.99]
  - - [4608, 2944, 1, 3584]
    - [99, 58.86]
  - - [4608, 3008, 1, 3584]
    - [92, 59.6]
  - - [4608, 3072, 1, 3584]
    - [92, 60.11]
  - - [4608, 3136, 1, 3584]
    - [92, 61.42]
  - - [4608, 3200, 1, 3584]
    - [92, 62.39]
  - - [4608, 3264, 1, 3584]
    - [99, 61.21]
  - - [4608, 3328, 1, 3584]
    - [99, 62.81]
  - - [4608, 3392, 1, 3584]
    - [104, 59.18]
  - - [4608, 3456, 1, 3584]
    - [99, 60.15]
  - - [4608, 3520, 1, 3584]
    - [107, 60.15]
  - - [4608, 3584, 1, 3584]
    - [99, 60.99]
  - - [4608, 3648, 1, 3584]
    - [92, 61.62]
  - - [4608, 3712, 1, 3584]
    - [99, 61.48]
  - - [4608, 3776, 1, 3584]
    - [99, 61.75]
  - - [4608, 3840, 1, 3584]
    - [99, 63.19]
  - - [4608, 3904, 1, 3584]
    - [99, 63.31]
  - - [4608, 3968, 1, 3584]
    - [99, 64.34]
  - - [4608, 4032, 1, 3584]
    - [92, 60.83]
  - - [4608, 4096, 1, 3584]
    - [92, 61.39]
  - - [37888, 1, 1, 3584]
    - [115, 0.2]
  - - [37888, 64, 1, 3584]
    - [116, 12.57]
  - - [37888, 128, 1, 3584]
    - [111, 23.87]
  - - [37888, 192, 1, 3584]
    - [117, 34.41]
  - - [37888, 256, 1, 3584]
    - [109, 44.86]
  - - [37888, 320, 1, 3584]
    - [92, 49.76]
  - - [37888, 384, 1, 3584]
    - [99, 54.68]
  - - [37888, 448, 1, 3584]
    - [92, 52.72]
  - - [37888, 512, 1, 3584]
    - [99, 58.48]
  - - [37888, 576, 1, 3584]
    - [87, 57.96]
  - - [37888, 640, 1, 3584]
    - [92, 60.28]
  - - [37888, 704, 1, 3584]
    - [106, 56.87]
  - - [37888, 768, 1, 3584]
    - [106, 61.85]
  - - [37888, 832, 1, 3584]
    - [99, 58.86]
  - - [37888, 896, 1, 3584]
    - [99, 62.87]
  - - [37888, 960, 1, 3584]
    - [92, 62.68]
  - - [37888, 1024, 1, 3584]
    - [106, 63.93]
  - - [37888, 1088, 1, 3584]
    - [92, 60.37]
  - - [37888, 1152, 1, 3584]
    - [87, 61.9]
  - - [37888, 1216, 1, 3584]
    - [106, 61.0]
  - - [37888, 1280, 1, 3584]
    - [106, 63.64]
  - - [37888, 1344, 1, 3584]
    - [87, 62.5]
  - - [37888, 1408, 1, 3584]
    - [99, 62.41]
  - - [37888, 1472, 1, 3584]
    - [106, 61.37]
  - - [37888, 1536, 1, 3584]
    - [99, 63.08]
  - - [37888, 1600, 1, 3584]
    - [99, 62.38]
  - - [37888, 1664, 1, 3584]
    - [99, 63.93]
  - - [37888, 1728, 1, 3584]
    - [92, 62.73]
  - - [37888, 1792, 1, 3584]
    - [99, 64.42]
  - - [37888, 1856, 1, 3584]
    - [99, 63.37]
  - - [37888, 1920, 1, 3584]
    - [99, 64.72]
  - - [37888, 1984, 1, 3584]
    - [99, 63.62]
  - - [37888, 2048, 1, 3584]
    - [99, 64.55]
  - - [37888, 2112, 1, 3584]
    - [87, 62.82]
  - - [37888, 2176, 1, 3584]
    - [92, 62.71]
  - - [37888, 2240, 1, 3584]
    - [92, 64.16]
  - - [37888, 2304, 1, 3584]
    - [87, 62.85]
  - - [37888, 2368, 1, 3584]
    - [92, 63.38]
  - - [37888, 2432, 1, 3584]
    - [99, 63.58]
  - - [37888, 2496, 1, 3584]
    - [99, 63.95]
  - - [37888, 2560, 1, 3584]
    - [99, 64.77]
  - - [37888, 2624, 1, 3584]
    - [99, 62.3]
  - - [37888, 2688, 1, 3584]
    - [99, 65.06]
  - - [37888, 2752, 1, 3584]
    - [99, 63.57]
  - - [37888, 2816, 1, 3584]
    - [99, 64.67]
  - - [37888, 2880, 1, 3584]
    - [99, 63.56]
  - - [37888, 2944, 1, 3584]
    - [99, 63.61]
  - - [37888, 3008, 1, 3584]
    - [92, 63.52]
  - - [37888, 3072, 1, 3584]
    - [99, 63.43]
  - - [37888, 3136, 1, 3584]
    - [92, 62.02]
  - - [37888, 3200, 1, 3584]
    - [92, 63.55]
  - - [37888, 3264, 1, 3584]
    - [106, 62.22]
  - - [37888, 3328, 1, 3584]
    - [92, 62.61]
  - - [37888, 3392, 1, 3584]
    - [104, 62.62]
  - - [37888, 3456, 1, 3584]
    - [99, 63.99]
  - - [37888, 3520, 1, 3584]
    - [92, 62.64]
  - - [37888, 3584, 1, 3584]
    - [99, 64.05]
  - - [37888, 3648, 1, 3584]
    - [99, 62.7]
  - - [37888, 3712, 1, 3584]
    - [104, 63.32]
  - - [37888, 3776, 1, 3584]
    - [99, 63.98]
  - - [37888, 3840, 1, 3584]
    - [99, 65.17]
  - - [37888, 3904, 1, 3584]
    - [99, 63.15]
  - - [37888, 3968, 1, 3584]
    - [104, 64.01]
  - - [37888, 4032, 1, 3584]
    - [104, 63.48]
  - - [37888, 4096, 1, 3584]
    - [99, 63.18]
  - - [3584, 1, 1, 3584]
    - [78, 0.27]
  - - [3584, 64, 1, 3584]
    - [118, 14.9]
  - - [3584, 128, 1, 3584]
    - [86, 24.02]
  - - [3584, 192, 1, 3584]
    - [102, 30.45]
  - - [3584, 256, 1, 3584]
    - [99, 34.96]
  - - [3584, 320, 1, 3584]
    - [119, 37.01]
  - - [3584, 384, 1, 3584]
    - [99, 41.41]
  - - [3584, 448, 1, 3584]
    - [99, 41.28]
  - - [3584, 512, 1, 3584]
    - [99, 46.72]
  - - [3584, 576, 1, 3584]
    - [114, 44.76]
  - - [3584, 640, 1, 3584]
    - [114, 49.41]
  - - [3584, 704, 1, 3584]
    - [120, 42.77]
  - - [3584, 768, 1, 3584]
    - [102, 45.54]
  - - [3584, 832, 1, 3584]
    - [102, 45.25]
  - - [3584, 896, 1, 3584]
    - [114, 46.43]
  - - [3584, 960, 1, 3584]
    - [92, 49.51]
  - - [3584, 1024, 1, 3584]
    - [102, 50.44]
  - - [3584, 1088, 1, 3584]
    - [103, 49.14]
  - - [3584, 1152, 1, 3584]
    - [103, 51.84]
  - - [3584, 1216, 1, 3584]
    - [92, 53.17]
  - - [3584, 1280, 1, 3584]
    - [114, 55.51]
  - - [3584, 1344, 1, 3584]
    - [99, 56.35]
  - - [3584, 1408, 1, 3584]
    - [99, 58.13]
  - - [3584, 1472, 1, 3584]
    - [102, 51.23]
  - - [3584, 1536, 1, 3584]
    - [102, 53.01]
  - - [3584, 1600, 1, 3584]
    - [102, 54.35]
  - - [3584, 1664, 1, 3584]
    - [99, 52.38]
  - - [3584, 1728, 1, 3584]
    - [107, 54.15]
  - - [3584, 1792, 1, 3584]
    - [107, 55.2]
  - - [3584, 1856, 1, 3584]
    - [92, 55.53]
  - - [3584, 1920, 1, 3584]
    - [114, 57.41]
  - - [3584, 1984, 1, 3584]
    - [99, 57.31]
  - - [3584, 2048, 1, 3584]
    - [99, 59.21]
  - - [3584, 2112, 1, 3584]
    - [99, 60.32]
  - - [3584, 2176, 1, 3584]
    - [99, 61.69]
  - - [3584, 2240, 1, 3584]
    - [114, 53.78]
  - - [3584, 2304, 1, 3584]
    - [99, 56.4]
  - - [3584, 2368, 1, 3584]
    - [92, 56.9]
  - - [3584, 2432, 1, 3584]
    - [99, 57.29]
  - - [3584, 2496, 1, 3584]
    - [92, 57.09]
  - - [3584, 2560, 1, 3584]
    - [92, 58.54]
  - - [3584, 2624, 1, 3584]
    - [99, 58.18]
  - - [3584, 2688, 1, 3584]
    - [99, 59.58]
  - - [3584, 2752, 1, 3584]
    - [99, 60.54]
  - - [3584, 2816, 1, 3584]
    - [99, 61.55]
  - - [3584, 2880, 1, 3584]
    - [99, 58.62]
  - - [3584, 2944, 1, 3584]
    - [104, 58.5]
  - - [3584, 3008, 1, 3584]
    - [92, 57.76]
  - - [3584, 3072, 1, 3584]
    - [99, 59.05]
  - - [3584, 3136, 1, 3584]
    - [99, 58.22]
  - - [3584, 3200, 1, 3584]
    - [92, 59.37]
  - - [3584, 3264, 1, 3584]
    - [92, 59.63]
  - - [3584, 3328, 1, 3584]
    - [92, 60.44]
  - - [3584, 3392, 1, 3584]
    - [99, 60.02]
  - - [3584, 3456, 1, 3584]
    - [99, 61.48]
  - - [3584, 3520, 1, 3584]
    - [99, 61.99]
  - - [3584, 3584, 1, 3584]
    - [99, 62.76]
  - - [3584, 3648, 1, 3584]
    - [104, 58.78]
  - - [3584, 3712, 1, 3584]
    - [99, 60.87]
  - - [3584, 3776, 1, 3584]
    - [92, 59.71]
  - - [3584, 3840, 1, 3584]
    - [87, 59.64]
  - - [3584, 3904, 1, 3584]
    - [92, 59.79]
  - - [3584, 3968, 1, 3584]
    - [92, 61.01]
  - - [3584, 4032, 1, 3584]
    - [99, 60.39]
  - - [3584, 4096, 1, 3584]
    - [104, 60.29]
  - - [3584, 1, 1, 18944]
    - [121, 0.19]
  - - [3584, 64, 1, 18944]
    - [122, 12.26]
  - - [3584, 128, 1, 18944]
    - [123, 24.11]
  - - [3584, 192, 1, 18944]
    - [102, 34.87]
  - - [3584, 256, 1, 18944]
    - [99, 44.81]
  - - [3584, 320, 1, 18944]
    - [119, 47.53]
  - - [3584, 384, 1, 18944]
    - [104, 52.45]
  - - [3584, 448, 1, 18944]
    - [99, 51.22]
  - - [3584, 512, 1, 18944]
    - [104, 57.76]
  - - [3584, 576, 1, 18944]
    - [120, 59.25]
  - - [3584, 640, 1, 18944]
    - [92, 60.62]
  - - [3584, 704, 1, 18944]
    - [100, 57.29]
  - - [3584, 768, 1, 18944]
    - [92, 50.26]
  - - [3584, 832, 1, 18944]
    - [124, 47.96]
  - - [3584, 896, 1, 18944]
    - [125, 51.26]
  - - [3584, 960, 1, 18944]
    - [91, 53.52]
  - - [3584, 1024, 1, 18944]
    - [90, 56.92]
  - - [3584, 1088, 1, 18944]
    - [114, 56.72]
  - - [3584, 1152, 1, 18944]
    - [126, 59.42]
  - - [3584, 1216, 1, 18944]
    - [114, 58.76]
  - - [3584, 1280, 1, 18944]
    - [92, 61.5]
  - - [3584, 1344, 1, 18944]
    - [104, 61.97]
  - - [3584, 1408, 1, 18944]
    - [99, 64.56]
  - - [3584, 1472, 1, 18944]
    - [91, 55.18]
  - - [3584, 1536, 1, 18944]
    - [102, 57.15]
  - - [3584, 1600, 1, 18944]
    - [102, 58.62]
  - - [3584, 1664, 1, 18944]
    - [107, 56.27]
  - - [3584, 1728, 1, 18944]
    - [107, 57.92]
  - - [3584, 1792, 1, 18944]
    - [107, 59.54]
  - - [3584, 1856, 1, 18944]
    - [114, 60.02]
  - - [3584, 1920, 1, 18944]
    - [92, 62.27]
  - - [3584, 1984, 1, 18944]
    - [127, 61.72]
  - - [3584, 2048, 1, 18944]
    - [99, 62.9]
  - - [3584, 2112, 1, 18944]
    - [99, 64.57]
  - - [3584, 2176, 1, 18944]
    - [99, 66.52]
  - - [3584, 2240, 1, 18944]
    - [99, 57.33]
  - - [3584, 2304, 1, 18944]
    - [99, 59.11]
  - - [3584, 2368, 1, 18944]
    - [107, 58.81]
  - - [3584, 2432, 1, 18944]
    - [107, 60.2]
  - - [3584, 2496, 1, 18944]
    - [107, 61.6]
  - - [3584, 2560, 1, 18944]
    - [92, 61.81]
  - - [3584, 2624, 1, 18944]
    - [88, 61.3]
  - - [3584, 2688, 1, 18944]
    - [99, 62.64]
  - - [3584, 2752, 1, 18944]
    - [99, 63.58]
  - - [3584, 2816, 1, 18944]
    - [99, 64.73]
  - - [3584, 2880, 1, 18944]
    - [99, 60.88]
  - - [3584, 2944, 1, 18944]
    - [99, 62.17]
  - - [3584, 3008, 1, 18944]
    - [92, 60.71]
  - - [3584, 3072, 1, 18944]
    - [107, 60.59]
  - - [3584, 3136, 1, 18944]
    - [107, 61.57]
  - - [3584, 3200, 1, 18944]
    - [87, 62.34]
  - - [3584, 3264, 1, 18944]
    - [87, 63.3]
  - - [3584, 3328, 1, 18944]
    - [92, 64.19]
  - - [3584, 3392, 1, 18944]
    - [99, 63.08]
  - - [3584, 3456, 1, 18944]
    - [99, 63.88]
  - - [3584, 3520, 1, 18944]
    - [99, 65.17]
  - - [3584, 3584, 1, 18944]
    - [99, 66.39]
  - - [3584, 3648, 1, 18944]
    - [92, 60.76]
  - - [3584, 3712, 1, 18944]
    - [99, 62.83]
  - - [3584, 3776, 1, 18944]
    - [107, 61.58]
  - - [3584, 3840, 1, 18944]
    - [87, 62.32]
  - - [3584, 3904, 1, 18944]
    - [92, 63.13]
  - - [3584, 3968, 1, 18944]
    - [92, 64.19]
  - - [3584, 4032, 1, 18944]
    - [99, 62.38]
  - - [3584, 4096, 1, 18944]
    - [104, 63.89]
  - - [2048, 1, 1, 1536]
    - [78, 0.09]
  - - [2048, 64, 1, 1536]
    - [108, 5.42]
  - - [2048, 128, 1, 1536]
    - [108, 9.7]
  - - [2048, 192, 1, 1536]
    - [128, 13.28]
  - - [2048, 256, 1, 1536]
    - [129, 17.28]
  - - [2048, 320, 1, 1536]
    - [83, 20.37]
  - - [2048, 384, 1, 1536]
    - [102, 22.26]
  - - [2048, 448, 1, 1536]
    - [130, 24.36]
  - - [2048, 512, 1, 1536]
    - [99, 26.61]
  - - [2048, 576, 1, 1536]
    - [102, 27.33]
  - - [2048, 640, 1, 1536]
    - [131, 28.71]
  - - [2048, 704, 1, 1536]
    - [99, 30.47]
  - - [2048, 768, 1, 1536]
    - [106, 33.42]
  - - [2048, 832, 1, 1536]
    - [106, 32.25]
  - - [2048, 896, 1, 1536]
    - [99, 34.62]
  - - [2048, 960, 1, 1536]
    - [113, 36.42]
  - - [2048, 1024, 1, 1536]
    - [99, 38.65]
  - - [2048, 1088, 1, 1536]
    - [99, 36.76]
  - - [2048, 1152, 1, 1536]
    - [120, 40.18]
  - - [2048, 1216, 1, 1536]
    - [99, 40.9]
  - - [2048, 1280, 1, 1536]
    - [99, 41.68]
  - - [2048, 1344, 1, 1536]
    - [91, 35.87]
  - - [2048, 1408, 1, 1536]
    - [83, 36.73]
  - - [2048, 1472, 1, 1536]
    - [102, 37.68]
  - - [2048, 1536, 1, 1536]
    - [102, 39.58]
  - - [2048, 1600, 1, 1536]
    - [132, 39.36]
  - - [2048, 1664, 1, 1536]
    - [102, 40.01]
  - - [2048, 1728, 1, 1536]
    - [102, 41.5]
  - - [2048, 1792, 1, 1536]
    - [102, 43.07]
  - - [2048, 1856, 1, 1536]
    - [102, 43.92]
  - - [2048, 1920, 1, 1536]
    - [102, 44.79]
  - - [2048, 1984, 1, 1536]
    - [120, 43.57]
  - - [2048, 2048, 1, 1536]
    - [99, 43.4]
  - - [2048, 2112, 1, 1536]
    - [120, 45.24]
  - - [2048, 2176, 1, 1536]
    - [99, 45.38]
  - - [2048, 2240, 1, 1536]
    - [99, 45.94]
  - - [2048, 2304, 1, 1536]
    - [99, 47.83]
  - - [2048, 2368, 1, 1536]
    - [99, 47.92]
  - - [2048, 2432, 1, 1536]
    - [99, 49.78]
  - - [2048, 2496, 1, 1536]
    - [99, 50.24]
  - - [2048, 2560, 1, 1536]
    - [99, 51.91]
  - - [2048, 2624, 1, 1536]
    - [120, 45.07]
  - - [2048, 2688, 1, 1536]
    - [102, 46.98]
  - - [2048, 2752, 1, 1536]
    - [102, 47.33]
  - - [2048, 2816, 1, 1536]
    - [102, 48.05]
  - - [2048, 2880, 1, 1536]
    - [102, 49.5]
  - - [2048, 2944, 1, 1536]
    - [99, 48.82]
  - - [2048, 3008, 1, 1536]
    - [99, 49.66]
  - - [2048, 3072, 1, 1536]
    - [99, 48.33]
  - - [2048, 3136, 1, 1536]
    - [99, 49.22]
  - - [2048, 3200, 1, 1536]
    - [99, 50.43]
  - - [2048, 3264, 1, 1536]
    - [99, 50.78]
  - - [2048, 3328, 1, 1536]
    - [120, 50.2]
  - - [2048, 3392, 1, 1536]
    - [120, 51.67]
  - - [2048, 3456, 1, 1536]
    - [120, 52.36]
  - - [2048, 3520, 1, 1536]
    - [99, 51.59]
  - - [2048, 3584, 1, 1536]
    - [99, 52.93]
  - - [2048, 3648, 1, 1536]
    - [99, 53.28]
  - - [2048, 3712, 1, 1536]
    - [99, 54.01]
  - - [2048, 3776, 1, 1536]
    - [99, 54.42]
  - - [2048, 3840, 1, 1536]
    - [99, 55.71]
  - - [2048, 3904, 1, 1536]
    - [99, 51.29]
  - - [2048, 3968, 1, 1536]
    - [99, 50.6]
  - - [2048, 4032, 1, 1536]
    - [120, 50.7]
  - - [2048, 4096, 1, 1536]
    - [99, 53.39]
  - - [17920, 1, 1, 1536]
    - [95, 0.42]
  - - [17920, 64, 1, 1536]
    - [129, 21.59]
  - - [17920, 128, 1, 1536]
    - [104, 33.99]
  - - [17920, 192, 1, 1536]
    - [87, 38.65]
  - - [17920, 256, 1, 1536]
    - [106, 44.18]
  - - [17920, 320, 1, 1536]
    - [92, 43.17]
  - - [17920, 384, 1, 1536]
    - [107, 48.65]
  - - [17920, 448, 1, 1536]
    - [92, 46.19]
  - - [17920, 512, 1, 1536]
    - [99, 50.67]
  - - [17920, 576, 1, 1536]
    - [87, 48.94]
  - - [17920, 640, 1, 1536]
    - [92, 51.51]
  - - [17920, 704, 1, 1536]
    - [87, 48.9]
  - - [17920, 768, 1, 1536]
    - [106, 52.2]
  - - [17920, 832, 1, 1536]
    - [106, 47.96]
  - - [17920, 896, 1, 1536]
    - [87, 51.32]
  - - [17920, 960, 1, 1536]
    - [87, 53.99]
  - - [17920, 1024, 1, 1536]
    - [106, 56.74]
  - - [17920, 1088, 1, 1536]
    - [92, 52.9]
  - - [17920, 1152, 1, 1536]
    - [87, 54.03]
  - - [17920, 1216, 1, 1536]
    - [106, 55.19]
  - - [17920, 1280, 1, 1536]
    - [106, 57.16]
  - - [17920, 1344, 1, 1536]
    - [87, 56.22]
  - - [17920, 1408, 1, 1536]
    - [106, 53.86]
  - - [17920, 1472, 1, 1536]
    - [106, 56.14]
  - - [17920, 1536, 1, 1536]
    - [106, 57.68]
  - - [17920, 1600, 1, 1536]
    - [92, 53.71]
  - - [17920, 1664, 1, 1536]
    - [106, 54.88]
  - - [17920, 1728, 1, 1536]
    - [106, 57.1]
  - - [17920, 1792, 1, 1536]
    - [106, 58.26]
  - - [17920, 1856, 1, 1536]
    - [92, 55.35]
  - - [17920, 1920, 1, 1536]
    - [92, 57.04]
  - - [17920, 1984, 1, 1536]
    - [106, 57.79]
  - - [17920, 2048, 1, 1536]
    - [106, 59.6]
  - - [17920, 2112, 1, 1536]
    - [87, 56.33]
  - - [17920, 2176, 1, 1536]
    - [99, 56.96]
  - - [17920, 2240, 1, 1536]
    - [92, 57.56]
  - - [17920, 2304, 1, 1536]
    - [87, 58.01]
  - - [17920, 2368, 1, 1536]
    - [92, 57.82]
  - - [17920, 2432, 1, 1536]
    - [99, 58.75]
  - - [17920, 2496, 1, 1536]
    - [87, 58.36]
  - - [17920, 2560, 1, 1536]
    - [106, 59.03]
  - - [17920, 2624, 1, 1536]
    - [87, 57.5]
  - - [17920, 2688, 1, 1536]
    - [99, 59.77]
  - - [17920, 2752, 1, 1536]
    - [106, 58.89]
  - - [17920, 2816, 1, 1536]
    - [99, 59.99]
  - - [17920, 2880, 1, 1536]
    - [99, 59.1]
  - - [17920, 2944, 1, 1536]
    - [99, 59.93]
  - - [17920, 3008, 1, 1536]
    - [106, 59.37]
  - - [17920, 3072, 1, 1536]
    - [106, 60.8]
  - - [17920, 3136, 1, 1536]
    - [99, 58.78]
  - - [17920, 3200, 1, 1536]
    - [92, 60.33]
  - - [17920, 3264, 1, 1536]
    - [106, 60.57]
  - - [17920, 3328, 1, 1536]
    - [92, 60.38]
  - - [17920, 3392, 1, 1536]
    - [99, 59.74]
  - - [17920, 3456, 1, 1536]
    - [99, 60.64]
  - - [17920, 3520, 1, 1536]
    - [99, 60.25]
  - - [17920, 3584, 1, 1536]
    - [99, 61.42]
  - - [17920, 3648, 1, 1536]
    - [92, 59.67]
  - - [17920, 3712, 1, 1536]
    - [99, 60.79]
  - - [17920, 3776, 1, 1536]
    - [106, 60.31]
  - - [17920, 3840, 1, 1536]
    - [99, 61.2]
  - - [17920, 3904, 1, 1536]
    - [99, 60.95]
  - - [17920, 3968, 1, 1536]
    - [99, 61.71]
  - - [17920, 4032, 1, 1536]
    - [99, 61.08]
  - - [17920, 4096, 1, 1536]
    - [99, 61.09]
  - - [1536, 1, 1, 8960]
    - [133, 0.26]
  - - [1536, 64, 1, 8960]
    - [134, 12.17]
  - - [1536, 128, 1, 8960]
    - [96, 19.32]
  - - [1536, 192, 1, 8960]
    - [135, 24.77]
  - - [1536, 256, 1, 8960]
    - [79, 31.66]
  - - [1536, 320, 1, 8960]
    - [129, 33.59]
  - - [1536, 384, 1, 8960]
    - [98, 40.14]
  - - [1536, 448, 1, 8960]
    - [91, 39.33]
  - - [1536, 512, 1, 8960]
    - [91, 45.05]
  - - [1536, 576, 1, 8960]
    - [135, 43.69]
  - - [1536, 640, 1, 8960]
    - [92, 48.53]
  - - [1536, 704, 1, 8960]
    - [102, 44.12]
  - - [1536, 768, 1, 8960]
    - [94, 48.02]
  - - [1536, 832, 1, 8960]
    - [127, 47.53]
  - - [1536, 896, 1, 8960]
    - [92, 51.21]
  - - [1536, 960, 1, 8960]
    - [92, 54.71]
  - - [1536, 1024, 1, 8960]
    - [105, 57.62]
  - - [1536, 1088, 1, 8960]
    - [92, 50.92]
  - - [1536, 1152, 1, 8960]
    - [114, 53.45]
  - - [1536, 1216, 1, 8960]
    - [92, 56.93]
  - - [1536, 1280, 1, 8960]
    - [92, 59.59]
  - - [1536, 1344, 1, 8960]
    - [120, 57.63]
  - - [1536, 1408, 1, 8960]
    - [92, 55.59]
  - - [1536, 1472, 1, 8960]
    - [92, 57.24]
  - - [1536, 1536, 1, 8960]
    - [92, 59.77]
  - - [1536, 1600, 1, 8960]
    - [92, 62.37]
  - - [1536, 1664, 1, 8960]
    - [99, 61.75]
  - - [1536, 1728, 1, 8960]
    - [101, 48.9]
  - - [1536, 1792, 1, 8960]
    - [82, 47.98]
  - - [1536, 1856, 1, 8960]
    - [99, 49.21]
  - - [1536, 1920, 1, 8960]
    - [83, 49.63]
  - - [1536, 1984, 1, 8960]
    - [92, 54.36]
  - - [1536, 2048, 1, 8960]
    - [92, 51.43]
  - - [1536, 2112, 1, 8960]
    - [102, 49.94]
  - - [1536, 2176, 1, 8960]
    - [91, 51.49]
  - - [1536, 2240, 1, 8960]
    - [91, 52.55]
  - - [1536, 2304, 1, 8960]
    - [91, 54.06]
  - - [1536, 2368, 1, 8960]
    - [91, 55.29]
  - - [1536, 2432, 1, 8960]
    - [91, 56.47]
  - - [1536, 2496, 1, 8960]
    - [102, 57.64]
  - - [1536, 2560, 1, 8960]
    - [91, 59.43]
  - - [1536, 2624, 1, 8960]
    - [107, 56.64]
  - - [1536, 2688, 1, 8960]
    - [87, 57.65]
  - - [1536, 2752, 1, 8960]
    - [92, 55.99]
  - - [1536, 2816, 1, 8960]
    - [92, 57.48]
  - - [1536, 2880, 1, 8960]
    - [92, 58.73]
  - - [1536, 2944, 1, 8960]
    - [92, 59.83]
  - - [1536, 3008, 1, 8960]
    - [92, 60.97]
  - - [1536, 3072, 1, 8960]
    - [92, 61.6]
  - - [1536, 3136, 1, 8960]
    - [92, 62.72]
  - - [1536, 3200, 1, 8960]
    - [92, 64.29]
  - - [1536, 3264, 1, 8960]
    - [99, 62.53]
  - - [1536, 3328, 1, 8960]
    - [99, 63.94]
  - - [1536, 3392, 1, 8960]
    - [99, 55.88]
  - - [1536, 3456, 1, 8960]
    - [99, 56.91]
  - - [1536, 3520, 1, 8960]
    - [92, 55.64]
  - - [1536, 3584, 1, 8960]
    - [91, 56.57]
  - - [1536, 3648, 1, 8960]
    - [102, 57.39]
  - - [1536, 3712, 1, 8960]
    - [91, 58.35]
  - - [1536, 3776, 1, 8960]
    - [91, 59.05]
  - - [1536, 3840, 1, 8960]
    - [91, 60.03]
  - - [1536, 3904, 1, 8960]
    - [92, 57.16]
  - - [1536, 3968, 1, 8960]
    - [92, 58.11]
  - - [1536, 4032, 1, 8960]
    - [107, 57.56]
  - - [1536, 4096, 1, 8960]
    - [92, 59.57]
  - - [1536, 1, 1, 1536]
    - [136, 0.07]
  - - [1536, 64, 1, 1536]
    - [137, 4.06]
  - - [1536, 128, 1, 1536]
    - [138, 7.52]
  - - [1536, 192, 1, 1536]
    - [139, 10.37]
  - - [1536, 256, 1, 1536]
    - [97, 13.62]
  - - [1536, 320, 1, 1536]
    - [140, 15.76]
  - - [1536, 384, 1, 1536]
    - [141, 18.39]
  - - [1536, 448, 1, 1536]
    - [142, 19.49]
  - - [1536, 512, 1, 1536]
    - [91, 22.71]
  - - [1536, 576, 1, 1536]
    - [143, 23.69]
  - - [1536, 640, 1, 1536]
    - [99, 25.97]
  - - [1536, 704, 1, 1536]
    - [135, 25.92]
  - - [1536, 768, 1, 1536]
    - [94, 27.83]
  - - [1536, 832, 1, 1536]
    - [106, 28.17]
  - - [1536, 896, 1, 1536]
    - [92, 30.59]
  - - [1536, 960, 1, 1536]
    - [92, 32.33]
  - - [1536, 1024, 1, 1536]
    - [106, 34.25]
  - - [1536, 1088, 1, 1536]
    - [127, 31.87]
  - - [1536, 1152, 1, 1536]
    - [92, 34.52]
  - - [1536, 1216, 1, 1536]
    - [92, 36.19]
  - - [1536, 1280, 1, 1536]
    - [92, 38.15]
  - - [1536, 1344, 1, 1536]
    - [92, 35.5]
  - - [1536, 1408, 1, 1536]
    - [92, 35.97]
  - - [1536, 1472, 1, 1536]
    - [92, 38.29]
  - - [1536, 1536, 1, 1536]
    - [92, 40.06]
  - - [1536, 1600, 1, 1536]
    - [92, 41.73]
  - - [1536, 1664, 1, 1536]
    - [99, 41.18]
  - - [1536, 1728, 1, 1536]
    - [144, 36.51]
  - - [1536, 1792, 1, 1536]
    - [104, 36.16]
  - - [1536, 1856, 1, 1536]
    - [92, 38.02]
  - - [1536, 1920, 1, 1536]
    - [92, 39.03]
  - - [1536, 1984, 1, 1536]
    - [127, 39.5]
  - - [1536, 2048, 1, 1536]
    - [91, 40.18]
  - - [1536, 2112, 1, 1536]
    - [102, 39.02]
  - - [1536, 2176, 1, 1536]
    - [91, 39.6]
  - - [1536, 2240, 1, 1536]
    - [127, 41.53]
  - - [1536, 2304, 1, 1536]
    - [91, 41.58]
  - - [1536, 2368, 1, 1536]
    - [142, 42.48]
  - - [1536, 2432, 1, 1536]
    - [91, 43.77]
  - - [1536, 2496, 1, 1536]
    - [91, 44.42]
  - - [1536, 2560, 1, 1536]
    - [91, 45.73]
  - - [1536, 2624, 1, 1536]
    - [92, 42.65]
  - - [1536, 2688, 1, 1536]
    - [99, 45.78]
  - - [1536, 2752, 1, 1536]
    - [92, 44.04]
  - - [1536, 2816, 1, 1536]
    - [92, 45.54]
  - - [1536, 2880, 1, 1536]
    - [92, 46.73]
  - - [1536, 2944, 1, 1536]
    - [92, 46.93]
  - - [1536, 3008, 1, 1536]
    - [92, 48.36]
  - - [1536, 3072, 1, 1536]
    - [92, 48.19]
  - - [1536, 3136, 1, 1536]
    - [92, 49.67]
  - - [1536, 3200, 1, 1536]
    - [92, 50.72]
  - - [1536, 3264, 1, 1536]
    - [99, 50.27]
  - - [1536, 3328, 1, 1536]
    - [99, 50.11]
  - - [1536, 3392, 1, 1536]
    - [120, 49.22]
  - - [1536, 3456, 1, 1536]
    - [102, 47.37]
  - - [1536, 3520, 1, 1536]
    - [127, 47.07]
  - - [1536, 3584, 1, 1536]
    - [92, 46.96]
  - - [1536, 3648, 1, 1536]
    - [99, 48.08]
  - - [1536, 3712, 1, 1536]
    - [91, 48.32]
  - - [1536, 3776, 1, 1536]
    - [92, 48.98]
  - - [1536, 3840, 1, 1536]
    - [91, 49.36]
  - - [1536, 3904, 1, 1536]
    - [92, 47.9]
  - - [1536, 3968, 1, 1536]
    - [92, 48.26]
  - - [1536, 4032, 1, 1536]
    - [92, 49.51]
  - - [1536, 4096, 1, 1536]
    - [92, 49.45]
  - - [152064, 1, 1, 3584]
    - [145, 0.21]
  - - [152064, 64, 1, 3584]
    - [145, 13.16]
  - - [152064, 128, 1, 3584]
    - [83, 25.43]
  - - [152064, 192, 1, 3584]
    - [143, 36.94]
  - - [152064, 256, 1, 3584]
    - [109, 47.8]
  - - [151936, 1, 1, 1536]
    - [146, 0.21]
  - - [151936, 64, 1, 1536]
    - [136, 12.5]
  - - [151936, 128, 1, 1536]
    - [147, 23.57]
  - - [151936, 192, 1, 1536]
    - [117, 33.45]
  - - [151936, 256, 1, 1536]
    - [89, 42.76]
  - - [76032, 1, 1, 5120]
    - [148, 0.21]
  - - [76032, 64, 1, 5120]
    - [149, 13.19]
  - - [76032, 128, 1, 5120]
    - [117, 25.45]
  - - [76032, 192, 1, 5120]
    - [117, 37.46]
  - - [76032, 256, 1, 5120]
    - [109, 48.45]
  - - [5120, 1, 1, 6912]
    - [150, 0.27]
  - - [5120, 64, 1, 6912]
    - [151, 15.0]
  - - [5120, 128, 1, 6912]
    - [118, 28.32]
  - - [5120, 192, 1, 6912]
    - [152, 39.07]
  - - [5120, 256, 1, 6912]
    - [107, 46.17]
  - - [5120, 320, 1, 6912]
    - [107, 47.19]
  - - [5120, 384, 1, 6912]
    - [107, 56.08]
  - - [5120, 448, 1, 6912]
    - [107, 53.97]
  - - [5120, 512, 1, 6912]
    - [99, 61.15]
  - - [5120, 576, 1, 6912]
    - [102, 48.0]
  - - [5120, 640, 1, 6912]
    - [114, 51.56]
  - - [5120, 704, 1, 6912]
    - [102, 53.2]
  - - [5120, 768, 1, 6912]
    - [102, 57.61]
  - - [5120, 832, 1, 6912]
    - [107, 54.0]
  - - [5120, 896, 1, 6912]
    - [107, 57.14]
  - - [5120, 960, 1, 6912]
    - [87, 61.0]
  - - [5120, 1024, 1, 6912]
    - [99, 64.09]
  - - [5120, 1088, 1, 6912]
    - [102, 55.4]
  - - [5120, 1152, 1, 6912]
    - [102, 58.48]
  - - [5120, 1216, 1, 6912]
    - [92, 54.28]
  - - [5120, 1280, 1, 6912]
    - [106, 57.66]
  - - [5120, 1344, 1, 6912]
    - [107, 61.03]
  - - [5120, 1408, 1, 6912]
    - [99, 60.14]
  - - [5120, 1472, 1, 6912]
    - [99, 62.05]
  - - [5120, 1536, 1, 6912]
    - [99, 64.42]
  - - [5120, 1600, 1, 6912]
    - [92, 56.24]
  - - [5120, 1664, 1, 6912]
    - [107, 57.01]
  - - [5120, 1728, 1, 6912]
    - [107, 59.07]
  - - [5120, 1792, 1, 6912]
    - [104, 59.28]
  - - [5120, 1856, 1, 6912]
    - [87, 60.23]
  - - [5120, 1920, 1, 6912]
    - [87, 62.04]
  - - [5120, 1984, 1, 6912]
    - [106, 62.65]
  - - [5120, 2048, 1, 6912]
    - [106, 63.96]
  - - [5120, 2112, 1, 6912]
    - [87, 58.12]
  - - [5120, 2176, 1, 6912]
    - [107, 58.78]
  - - [5120, 2240, 1, 6912]
    - [107, 59.86]
  - - [5120, 2304, 1, 6912]
    - [107, 61.66]
  - - [5120, 2368, 1, 6912]
    - [107, 61.36]
  - - [5120, 2432, 1, 6912]
    - [106, 61.95]
  - - [5120, 2496, 1, 6912]
    - [106, 62.99]
  - - [5120, 2560, 1, 6912]
    - [106, 64.67]
  - - [5120, 2624, 1, 6912]
    - [87, 59.57]
  - - [5120, 2688, 1, 6912]
    - [87, 61.08]
  - - [5120, 2752, 1, 6912]
    - [107, 61.43]
  - - [5120, 2816, 1, 6912]
    - [106, 61.77]
  - - [5120, 2880, 1, 6912]
    - [87, 62.33]
  - - [5120, 2944, 1, 6912]
    - [99, 62.67]
  - - [5120, 3008, 1, 6912]
    - [106, 63.7]
  - - [5120, 3072, 1, 6912]
    - [106, 64.52]
  - - [5120, 3136, 1, 6912]
    - [92, 59.96]
  - - [5120, 3200, 1, 6912]
    - [92, 62.27]
  - - [5120, 3264, 1, 6912]
    - [87, 62.39]
  - - [5120, 3328, 1, 6912]
    - [106, 62.63]
  - - [5120, 3392, 1, 6912]
    - [99, 62.49]
  - - [5120, 3456, 1, 6912]
    - [106, 62.83]
  - - [5120, 3520, 1, 6912]
    - [106, 63.8]
  - - [5120, 3584, 1, 6912]
    - [99, 64.68]
  - - [5120, 3648, 1, 6912]
    - [87, 61.44]
  - - [5120, 3712, 1, 6912]
    - [107, 61.56]
  - - [5120, 3776, 1, 6912]
    - [106, 61.99]
  - - [5120, 3840, 1, 6912]
    - [106, 63.06]
  - - [5120, 3904, 1, 6912]
    - [106, 62.15]
  - - [5120, 3968, 1, 6912]
    - [106, 63.29]
  - - [5120, 4032, 1, 6912]
    - [106, 63.97]
  - - [5120, 4096, 1, 6912]
    - [106, 64.99]
  - - [5120, 1, 1, 2560]
    - [153, 0.28]
  - - [5120, 64, 1, 2560]
    - [118, 14.71]
  - - [5120, 128, 1, 2560]
    - [124, 25.73]
  - - [5120, 192, 1, 2560]
    - [87, 32.3]
  - - [5120, 256, 1, 2560]
    - [106, 37.01]
  - - [5120, 320, 1, 2560]
    - [99, 38.25]
  - - [5120, 384, 1, 2560]
    - [107, 45.33]
  - - [5120, 448, 1, 2560]
    - [99, 44.92]
  - - [5120, 512, 1, 2560]
    - [99, 51.63]
  - - [5120, 576, 1, 2560]
    - [102, 41.92]
  - - [5120, 640, 1, 2560]
    - [92, 46.09]
  - - [5120, 704, 1, 2560]
    - [102, 46.31]
  - - [5120, 768, 1, 2560]
    - [102, 50.2]
  - - [5120, 832, 1, 2560]
    - [107, 48.2]
  - - [5120, 896, 1, 2560]
    - [99, 51.43]
  - - [5120, 960, 1, 2560]
    - [87, 54.47]
  - - [5120, 1024, 1, 2560]
    - [99, 57.07]
  - - [5120, 1088, 1, 2560]
    - [102, 50.44]
  - - [5120, 1152, 1, 2560]
    - [102, 52.93]
  - - [5120, 1216, 1, 2560]
    - [107, 52.27]
  - - [5120, 1280, 1, 2560]
    - [99, 54.26]
  - - [5120, 1344, 1, 2560]
    - [107, 54.58]
  - - [5120, 1408, 1, 2560]
    - [99, 56.42]
  - - [5120, 1472, 1, 2560]
    - [99, 57.31]
  - - [5120, 1536, 1, 2560]
    - [99, 60.04]
  - - [5120, 1600, 1, 2560]
    - [92, 54.08]
  - - [5120, 1664, 1, 2560]
    - [99, 54.0]
  - - [5120, 1728, 1, 2560]
    - [87, 56.25]
  - - [5120, 1792, 1, 2560]
    - [107, 57.57]
  - - [5120, 1856, 1, 2560]
    - [87, 57.77]
  - - [5120, 1920, 1, 2560]
    - [87, 59.09]
  - - [5120, 1984, 1, 2560]
    - [99, 59.57]
  - - [5120, 2048, 1, 2560]
    - [99, 61.78]
  - - [5120, 2112, 1, 2560]
    - [87, 56.34]
  - - [5120, 2176, 1, 2560]
    - [99, 58.35]
  - - [5120, 2240, 1, 2560]
    - [92, 58.15]
  - - [5120, 2304, 1, 2560]
    - [107, 59.73]
  - - [5120, 2368, 1, 2560]
    - [107, 59.13]
  - - [5120, 2432, 1, 2560]
    - [99, 60.12]
  - - [5120, 2496, 1, 2560]
    - [99, 60.94]
  - - [5120, 2560, 1, 2560]
    - [99, 62.43]
  - - [5120, 2624, 1, 2560]
    - [92, 57.56]
  - - [5120, 2688, 1, 2560]
    - [87, 58.86]
  - - [5120, 2752, 1, 2560]
    - [107, 58.19]
  - - [5120, 2816, 1, 2560]
    - [106, 59.46]
  - - [5120, 2880, 1, 2560]
    - [107, 60.2]
  - - [5120, 2944, 1, 2560]
    - [99, 60.51]
  - - [5120, 3008, 1, 2560]
    - [99, 61.4]
  - - [5120, 3072, 1, 2560]
    - [99, 62.48]
  - - [5120, 3136, 1, 2560]
    - [99, 59.21]
  - - [5120, 3200, 1, 2560]
    - [99, 59.62]
  - - [5120, 3264, 1, 2560]
    - [87, 59.49]
  - - [5120, 3328, 1, 2560]
    - [99, 60.09]
  - - [5120, 3392, 1, 2560]
    - [99, 60.43]
  - - [5120, 3456, 1, 2560]
    - [99, 61.93]
  - - [5120, 3520, 1, 2560]
    - [99, 61.74]
  - - [5120, 3584, 1, 2560]
    - [99, 63.13]
  - - [5120, 3648, 1, 2560]
    - [107, 60.11]
  - - [5120, 3712, 1, 2560]
    - [99, 60.24]
  - - [5120, 3776, 1, 2560]
    - [99, 60.23]
  - - [5120, 3840, 1, 2560]
    - [99, 60.96]
  - - [5120, 3904, 1, 2560]
    - [99, 61.75]
  - - [5120, 3968, 1, 2560]
    - [99, 62.25]
  - - [5120, 4032, 1, 2560]
    - [99, 62.64]
  - - [5120, 4096, 1, 2560]
    - [99, 63.36]
  - - [3584, 1, 1, 5120]
    - [153, 0.35]
  - - [3584, 64, 1, 5120]
    - [108, 17.69]
  - - [3584, 128, 1, 5120]
    - [86, 27.0]
  - - [3584, 192, 1, 5120]
    - [102, 34.58]
  - - [3584, 256, 1, 5120]
    - [99, 38.74]
  - - [3584, 320, 1, 5120]
    - [119, 41.33]
  - - [3584, 384, 1, 5120]
    - [126, 46.35]
  - - [3584, 448, 1, 5120]
    - [114, 44.15]
  - - [3584, 512, 1, 5120]
    - [99, 50.51]
  - - [3584, 576, 1, 5120]
    - [114, 48.27]
  - - [3584, 640, 1, 5120]
    - [114, 53.03]
  - - [3584, 704, 1, 5120]
    - [120, 44.45]
  - - [3584, 768, 1, 5120]
    - [92, 46.03]
  - - [3584, 832, 1, 5120]
    - [102, 44.67]
  - - [3584, 896, 1, 5120]
    - [125, 47.61]
  - - [3584, 960, 1, 5120]
    - [92, 52.68]
  - - [3584, 1024, 1, 5120]
    - [102, 52.96]
  - - [3584, 1088, 1, 5120]
    - [103, 50.95]
  - - [3584, 1152, 1, 5120]
    - [93, 53.77]
  - - [3584, 1216, 1, 5120]
    - [92, 54.86]
  - - [3584, 1280, 1, 5120]
    - [114, 57.68]
  - - [3584, 1344, 1, 5120]
    - [99, 58.5]
  - - [3584, 1408, 1, 5120]
    - [99, 60.82]
  - - [3584, 1472, 1, 5120]
    - [102, 52.72]
  - - [3584, 1536, 1, 5120]
    - [104, 55.09]
  - - [3584, 1600, 1, 5120]
    - [102, 56.27]
  - - [3584, 1664, 1, 5120]
    - [127, 53.87]
  - - [3584, 1728, 1, 5120]
    - [107, 55.61]
  - - [3584, 1792, 1, 5120]
    - [99, 57.06]
  - - [3584, 1856, 1, 5120]
    - [92, 57.04]
  - - [3584, 1920, 1, 5120]
    - [92, 59.03]
  - - [3584, 1984, 1, 5120]
    - [99, 58.77]
  - - [3584, 2048, 1, 5120]
    - [99, 60.36]
  - - [3584, 2112, 1, 5120]
    - [99, 61.57]
  - - [3584, 2176, 1, 5120]
    - [99, 63.22]
  - - [3584, 2240, 1, 5120]
    - [106, 55.0]
  - - [3584, 2304, 1, 5120]
    - [87, 55.85]
  - - [3584, 2368, 1, 5120]
    - [114, 57.53]
  - - [3584, 2432, 1, 5120]
    - [126, 57.35]
  - - [3584, 2496, 1, 5120]
    - [107, 59.03]
  - - [3584, 2560, 1, 5120]
    - [114, 59.18]
  - - [3584, 2624, 1, 5120]
    - [127, 59.36]
  - - [3584, 2688, 1, 5120]
    - [99, 60.55]
  - - [3584, 2752, 1, 5120]
    - [99, 60.98]
  - - [3584, 2816, 1, 5120]
    - [99, 62.24]
  - - [3584, 2880, 1, 5120]
    - [99, 58.99]
  - - [3584, 2944, 1, 5120]
    - [99, 59.73]
  - - [3584, 3008, 1, 5120]
    - [92, 58.72]
  - - [3584, 3072, 1, 5120]
    - [127, 58.96]
  - - [3584, 3136, 1, 5120]
    - [126, 59.37]
  - - [3584, 3200, 1, 5120]
    - [114, 59.5]
  - - [3584, 3264, 1, 5120]
    - [127, 60.31]
  - - [3584, 3328, 1, 5120]
    - [92, 61.44]
  - - [3584, 3392, 1, 5120]
    - [99, 61.03]
  - - [3584, 3456, 1, 5120]
    - [99, 62.26]
  - - [3584, 3520, 1, 5120]
    - [99, 62.75]
  - - [3584, 3584, 1, 5120]
    - [99, 63.57]
  - - [3584, 3648, 1, 5120]
    - [104, 59.65]
  - - [3584, 3712, 1, 5120]
    - [104, 61.03]
  - - [3584, 3776, 1, 5120]
    - [107, 59.75]
  - - [3584, 3840, 1, 5120]
    - [92, 60.71]
  - - [3584, 3904, 1, 5120]
    - [92, 60.84]
  - - [3584, 3968, 1, 5120]
    - [92, 61.67]
  - - [3584, 4032, 1, 5120]
    - [99, 60.79]
  - - [3584, 4096, 1, 5120]
    - [99, 61.86]
  - - [13824, 1, 1, 5120]
    - [154, 0.19]
  - - [13824, 64, 1, 5120]
    - [155, 11.99]
  - - [13824, 128, 1, 5120]
    - [156, 23.02]
  - - [13824, 192, 1, 5120]
    - [101, 33.53]
  - - [13824, 256, 1, 5120]
    - [157, 41.45]
  - - [13824, 320, 1, 5120]
    - [114, 43.22]
  - - [13824, 384, 1, 5120]
    - [99, 48.72]
  - - [13824, 448, 1, 5120]
    - [92, 49.39]
  - - [13824, 512, 1, 5120]
    - [106, 54.27]
  - - [13824, 576, 1, 5120]
    - [102, 51.45]
  - - [13824, 640, 1, 5120]
    - [99, 56.01]
  - - [13824, 704, 1, 5120]
    - [106, 53.42]
  - - [13824, 768, 1, 5120]
    - [106, 57.76]
  - - [13824, 832, 1, 5120]
    - [99, 55.63]
  - - [13824, 896, 1, 5120]
    - [99, 59.5]
  - - [13824, 960, 1, 5120]
    - [87, 57.74]
  - - [13824, 1024, 1, 5120]
    - [106, 59.03]
  - - [13824, 1088, 1, 5120]
    - [87, 56.35]
  - - [13824, 1152, 1, 5120]
    - [87, 58.94]
  - - [13824, 1216, 1, 5120]
    - [106, 59.88]
  - - [13824, 1280, 1, 5120]
    - [106, 61.91]
  - - [13824, 1344, 1, 5120]
    - [87, 60.13]
  - - [13824, 1408, 1, 5120]
    - [99, 58.65]
  - - [13824, 1472, 1, 5120]
    - [105, 59.24]
  - - [13824, 1536, 1, 5120]
    - [106, 61.09]
  - - [13824, 1600, 1, 5120]
    - [92, 60.47]
  - - [13824, 1664, 1, 5120]
    - [99, 62.3]
  - - [13824, 1728, 1, 5120]
    - [92, 60.85]
  - - [13824, 1792, 1, 5120]
    - [106, 62.77]
  - - [13824, 1856, 1, 5120]
    - [92, 60.4]
  - - [13824, 1920, 1, 5120]
    - [92, 62.34]
  - - [13824, 1984, 1, 5120]
    - [106, 62.2]
  - - [13824, 2048, 1, 5120]
    - [99, 63.36]
  - - [13824, 2112, 1, 5120]
    - [87, 61.66]
  - - [13824, 2176, 1, 5120]
    - [92, 60.49]
  - - [13824, 2240, 1, 5120]
    - [92, 62.11]
  - - [13824, 2304, 1, 5120]
    - [87, 62.56]
  - - [13824, 2368, 1, 5120]
    - [92, 61.75]
  - - [13824, 2432, 1, 5120]
    - [104, 63.13]
  - - [13824, 2496, 1, 5120]
    - [99, 61.38]
  - - [13824, 2560, 1, 5120]
    - [99, 62.92]
  - - [13824, 2624, 1, 5120]
    - [99, 61.61]
  - - [13824, 2688, 1, 5120]
    - [99, 62.82]
  - - [13824, 2752, 1, 5120]
    - [99, 62.8]
  - - [13824, 2816, 1, 5120]
    - [99, 63.94]
  - - [13824, 2880, 1, 5120]
    - [99, 62.33]
  - - [13824, 2944, 1, 5120]
    - [99, 63.52]
  - - [13824, 3008, 1, 5120]
    - [104, 61.93]
  - - [13824, 3072, 1, 5120]
    - [99, 63.88]
  - - [13824, 3136, 1, 5120]
    - [92, 63.41]
  - - [13824, 3200, 1, 5120]
    - [92, 64.05]
  - - [13824, 3264, 1, 5120]
    - [92, 62.51]
  - - [13824, 3328, 1, 5120]
    - [92, 63.64]
  - - [13824, 3392, 1, 5120]
    - [99, 62.07]
  - - [13824, 3456, 1, 5120]
    - [104, 63.43]
  - - [13824, 3520, 1, 5120]
    - [92, 64.11]
  - - [13824, 3584, 1, 5120]
    - [99, 64.79]
  - - [13824, 3648, 1, 5120]
    - [99, 63.55]
  - - [13824, 3712, 1, 5120]
    - [104, 64.29]
  - - [13824, 3776, 1, 5120]
    - [99, 63.24]
  - - [13824, 3840, 1, 5120]
    - [99, 64.23]
  - - [13824, 3904, 1, 5120]
    - [99, 64.25]
  - - [13824, 3968, 1, 5120]
    - [99, 65.17]
  - - [13824, 4032, 1, 5120]
    - [99, 63.85]
  - - [13824, 4096, 1, 5120]
    - [99, 64.83]
  - - [5120, 1, 1, 1280]
    - [158, 0.18]
  - - [5120, 64, 1, 1280]
    - [118, 9.7]
  - - [5120, 128, 1, 1280]
    - [109, 17.35]
  - - [5120, 192, 1, 1280]
    - [107, 22.64]
  - - [5120, 256, 1, 1280]
    - [106, 26.79]
  - - [5120, 320, 1, 1280]
    - [87, 28.65]
  - - [5120, 384, 1, 1280]
    - [107, 34.62]
  - - [5120, 448, 1, 1280]
    - [106, 35.45]
  - - [5120, 512, 1, 1280]
    - [99, 40.31]
  - - [5120, 576, 1, 1280]
    - [87, 35.01]
  - - [5120, 640, 1, 1280]
    - [99, 37.48]
  - - [5120, 704, 1, 1280]
    - [159, 38.73]
  - - [5120, 768, 1, 1280]
    - [159, 41.51]
  - - [5120, 832, 1, 1280]
    - [107, 40.56]
  - - [5120, 896, 1, 1280]
    - [87, 43.57]
  - - [5120, 960, 1, 1280]
    - [87, 45.9]
  - - [5120, 1024, 1, 1280]
    - [106, 48.12]
  - - [5120, 1088, 1, 1280]
    - [159, 43.47]
  - - [5120, 1152, 1, 1280]
    - [159, 45.8]
  - - [5120, 1216, 1, 1280]
    - [106, 45.29]
  - - [5120, 1280, 1, 1280]
    - [106, 47.16]
  - - [5120, 1344, 1, 1280]
    - [87, 47.54]
  - - [5120, 1408, 1, 1280]
    - [99, 49.23]
  - - [5120, 1472, 1, 1280]
    - [106, 50.31]
  - - [5120, 1536, 1, 1280]
    - [106, 51.91]
  - - [5120, 1600, 1, 1280]
    - [114, 48.24]
  - - [5120, 1664, 1, 1280]
    - [87, 49.16]
  - - [5120, 1728, 1, 1280]
    - [92, 49.71]
  - - [5120, 1792, 1, 1280]
    - [106, 52.56]
  - - [5120, 1856, 1, 1280]
    - [99, 50.88]
  - - [5120, 1920, 1, 1280]
    - [87, 53.44]
  - - [5120, 1984, 1, 1280]
    - [99, 53.58]
  - - [5120, 2048, 1, 1280]
    - [99, 55.01]
  - - [5120, 2112, 1, 1280]
    - [87, 52.55]
  - - [5120, 2176, 1, 1280]
    - [99, 53.73]
  - - [5120, 2240, 1, 1280]
    - [99, 52.79]
  - - [5120, 2304, 1, 1280]
    - [99, 54.21]
  - - [5120, 2368, 1, 1280]
    - [99, 53.61]
  - - [5120, 2432, 1, 1280]
    - [99, 55.83]
  - - [5120, 2496, 1, 1280]
    - [99, 55.37]
  - - [5120, 2560, 1, 1280]
    - [99, 56.92]
  - - [5120, 2624, 1, 1280]
    - [87, 53.2]
  - - [5120, 2688, 1, 1280]
    - [87, 54.59]
  - - [5120, 2752, 1, 1280]
    - [99, 54.76]
  - - [5120, 2816, 1, 1280]
    - [99, 54.81]
  - - [5120, 2880, 1, 1280]
    - [87, 55.97]
  - - [5120, 2944, 1, 1280]
    - [99, 57.31]
  - - [5120, 3008, 1, 1280]
    - [99, 56.83]
  - - [5120, 3072, 1, 1280]
    - [99, 58.29]
  - - [5120, 3136, 1, 1280]
    - [99, 55.33]
  - - [5120, 3200, 1, 1280]
    - [99, 56.09]
  - - [5120, 3264, 1, 1280]
    - [99, 56.56]
  - - [5120, 3328, 1, 1280]
    - [99, 57.41]
  - - [5120, 3392, 1, 1280]
    - [99, 57.13]
  - - [5120, 3456, 1, 1280]
    - [99, 58.32]
  - - [5120, 3520, 1, 1280]
    - [99, 57.99]
  - - [5120, 3584, 1, 1280]
    - [99, 59.74]
  - - [5120, 3648, 1, 1280]
    - [99, 56.6]
  - - [5120, 3712, 1, 1280]
    - [99, 58.07]
  - - [5120, 3776, 1, 1280]
    - [87, 56.75]
  - - [5120, 3840, 1, 1280]
    - [99, 59.05]
  - - [5120, 3904, 1, 1280]
    - [99, 59.04]
  - - [5120, 3968, 1, 1280]
    - [99, 59.24]
  - - [5120, 4032, 1, 1280]
    - [99, 59.17]
  - - [5120, 4096, 1, 1280]
    - [99, 60.24]
  - - [38016, 1, 1, 5120]
    - [148, 0.21]
  - - [38016, 64, 1, 5120]
    - [155, 12.85]
  - - [38016, 128, 1, 5120]
    - [111, 24.72]
  - - [38016, 192, 1, 5120]
    - [109, 36.01]
  - - [38016, 256, 1, 5120]
    - [109, 47.44]
  - - [1792, 1, 1, 5120]
    - [153, 0.2]
  - - [1792, 64, 1, 5120]
    - [137, 10.52]
  - - [1792, 128, 1, 5120]
    - [118, 18.34]
  - - [1792, 192, 1, 5120]
    - [160, 22.66]
  - - [1792, 256, 1, 5120]
    - [111, 26.92]
  - - [1792, 320, 1, 5120]
    - [83, 30.97]
  - - [1792, 384, 1, 5120]
    - [102, 34.71]
  - - [1792, 448, 1, 5120]
    - [94, 34.45]
  - - [1792, 512, 1, 5120]
    - [99, 38.92]
  - - [1792, 576, 1, 5120]
    - [120, 41.31]
  - - [1792, 640, 1, 5120]
    - [91, 41.97]
  - - [1792, 704, 1, 5120]
    - [107, 42.1]
  - - [1792, 768, 1, 5120]
    - [126, 45.58]
  - - [1792, 832, 1, 5120]
    - [120, 46.68]
  - - [1792, 896, 1, 5120]
    - [99, 44.3]
  - - [1792, 960, 1, 5120]
    - [99, 47.56]
  - - [1792, 1024, 1, 5120]
    - [99, 50.9]
  - - [1792, 1088, 1, 5120]
    - [99, 52.75]
  - - [1792, 1152, 1, 5120]
    - [104, 55.96]
  - - [1792, 1216, 1, 5120]
    - [114, 50.32]
  - - [1792, 1280, 1, 5120]
    - [114, 53.32]
  - - [1792, 1344, 1, 5120]
    - [99, 54.6]
  - - [1792, 1408, 1, 5120]
    - [99, 56.67]
  - - [1792, 1472, 1, 5120]
    - [104, 43.51]
  - - [1792, 1536, 1, 5120]
    - [99, 45.98]
  - - [1792, 1600, 1, 5120]
    - [114, 48.55]
  - - [1792, 1664, 1, 5120]
    - [91, 47.88]
  - - [1792, 1728, 1, 5120]
    - [159, 48.67]
  - - [1792, 1792, 1, 5120]
    - [132, 47.9]
  - - [1792, 1856, 1, 5120]
    - [102, 48.61]
  - - [1792, 1920, 1, 5120]
    - [91, 50.4]
  - - [1792, 1984, 1, 5120]
    - [102, 51.71]
  - - [1792, 2048, 1, 5120]
    - [102, 52.84]
  - - [1792, 2112, 1, 5120]
    - [102, 54.6]
  - - [1792, 2176, 1, 5120]
    - [87, 52.65]
  - - [1792, 2240, 1, 5120]
    - [92, 54.36]
  - - [1792, 2304, 1, 5120]
    - [99, 55.82]
  - - [1792, 2368, 1, 5120]
    - [114, 53.89]
  - - [1792, 2432, 1, 5120]
    - [114, 54.99]
  - - [1792, 2496, 1, 5120]
    - [114, 55.96]
  - - [1792, 2560, 1, 5120]
    - [92, 57.43]
  - - [1792, 2624, 1, 5120]
    - [99, 57.12]
  - - [1792, 2688, 1, 5120]
    - [99, 58.5]
  - - [1792, 2752, 1, 5120]
    - [99, 59.41]
  - - [1792, 2816, 1, 5120]
    - [99, 60.69]
  - - [1792, 2880, 1, 5120]
    - [99, 54.19]
  - - [1792, 2944, 1, 5120]
    - [99, 55.01]
  - - [1792, 3008, 1, 5120]
    - [159, 53.61]
  - - [1792, 3072, 1, 5120]
    - [104, 54.99]
  - - [1792, 3136, 1, 5120]
    - [102, 55.5]
  - - [1792, 3200, 1, 5120]
    - [91, 56.44]
  - - [1792, 3264, 1, 5120]
    - [102, 57.64]
  - - [1792, 3328, 1, 5120]
    - [92, 55.86]
  - - [1792, 3392, 1, 5120]
    - [104, 53.95]
  - - [1792, 3456, 1, 5120]
    - [99, 55.64]
  - - [1792, 3520, 1, 5120]
    - [92, 57.6]
  - - [1792, 3584, 1, 5120]
    - [93, 55.54]
  - - [1792, 3648, 1, 5120]
    - [99, 57.82]
  - - [1792, 3712, 1, 5120]
    - [99, 58.62]
  - - [1792, 3776, 1, 5120]
    - [92, 58.07]
  - - [1792, 3840, 1, 5120]
    - [106, 59.38]
  - - [1792, 3904, 1, 5120]
    - [114, 59.39]
  - - [1792, 3968, 1, 5120]
    - [92, 60.46]
  - - [1792, 4032, 1, 5120]
    - [99, 59.73]
  - - [1792, 4096, 1, 5120]
    - [99, 60.63]
- null
- null
- DeviceEfficiency
- GridBased
